,title,addr1,mapx,mapy,firstimage,overview,addr2
44,지리산정원,전라남도 구례군 광의면 온동2길 124,127.4388136,35.28722629,http://tong.visitkorea.or.kr/cms/resource/70/2737570_image2_1.jpeg,"지리산 정원은 2008년부터 구례군이 지리산 자락에 조성한 전국 최대 규모의 산림 휴양단지이다. 지리산 자락의 지초봉(해발 601m)을 중심으로 남서쪽에 있으며 야생화 테마랜드, 숲속 수목 가옥, 구례생태숲, 지리산 자생식물원, 숲속휴랜드, 유아 숲 체험원으로 구성되어 있다. 이외에도 압화 체험원, 음악 분수, 생태연못, 소나무 숲 등이 잘 조성된 수목원이다. 구례 시내가 한눈에 보이는 공기 좋은 곳에서 아이들과 함께 자연에서 쉬고, 배우는 색다른 즐거움을 만끽할 수 있는 곳이다.",구례군
45,지리산치즈랜드,전라남도 구례군 산동면 산업로 1590-62,127.4217653,35.27792149,http://tong.visitkorea.or.kr/cms/resource/88/2713788_image2_1.jpg,"1979년 젖소 두 마리로 착유를 시작했던 초원목장은 30여 년간의 경험을 바탕삼아 더 많은 사람에게 낙농산업과 우유를 알리기 위해 2012년 체험 목장 지리산치즈랜드를 건립하였다. 지리산치즈랜드에서는 수제 치즈와 요구르트를 유통하고 있으며, 체험장에서는 모차렐라 치즈 만들기, 송아지 우유 먹이기, 풀 썰매 타기 등의 체험을 할 수 있다. 푸른 초원목장에 130 여두의 젖소를 방목하고 있고, 호수가 인접해있어 아름다운 풍경을 자아낸다. 지리산치즈랜드의 특별함은 자연이라고 할 수 있다. 풍경, 꽃 그리고 초지가 어우러진 눈부신 푸르름과 향기가 그 특별함이다.",구례군
46,지리산호수공원,전라남도 구례군 산동면 산업로 1590-18,127.4183795,35.28078499,http://tong.visitkorea.or.kr/cms/resource/53/2676053_image2_1.jpg,"지리산 자락에 자리잡은 호수공원은 구례 구만제에 새롭게 조성된 농촌테마파크이다. 구만저수지를 여유롭게 감상할 수 있는 산책로가 마련되어 있으며, 호수 너머 오토캠핑장이 있어 가을산에 둘어쌓여 건강한 캠핑을 즐길 수 있다. 또한 근처에 지리산치즈랜드가 위치해 미리 예약하면 가축 풀 먹이기, 치즈만들기 등 다양한 체험을 즐길 수 있어 가족단위 여행객들에게 오감만족을 선사할 수 있는 곳이다. 인근에는 지리산치즈랜드, 지리산온천, 야생화테마랜드 등이 있다.",구례군
47,천개의향나무숲,전라남도 구례군 광의면 천변길 12,127.4603244,35.22676681,http://tong.visitkorea.or.kr/cms/resource/39/2740939_image2_1.jpg,"인위적인 조경에서 벗어나 숲이 주는 자연스러움을 강조한 천 개의 향나무 숲은 평온하고 안락한 느낌을 주는 곳이다. 
토종 향나무, 가이스카 향나무, 서양 향나무 등 천 여 그루의 향나무가 길게 뻗어 있는 숲길은 세상의 근심을 잊고 자연과 동화되어 마음이 정화되는 기분을 느끼게 해 준다.  향나무 숲길 뿐만 아니라 100년이 넘은 감나무 세 그루에서 느껴지는 세월의 깊이가 담긴 오색 정원, 게으름을 만끽하고 싶은 늘보 정원, 허브향 가득 한 향기 정원, 큰 돌에 앉아 사사로운 생각들을 머리 속에서 지워 주는 멍석 정원 등 한참을 느리고, 편안하게 다니다 보면 자연이 주는 아름다움 속에서 마음의 안정을 찾게 된다.",구례군
48,파도마을,전라남도 구례군 토지면 파도리,127.5442175,35.20514015,http://tong.visitkorea.or.kr/cms/resource/67/2790467_image2_1.jpg,"파도마을은 지리산 둘레길 송정?오미 구간에서 구례군 노인전문 요양원에서 포장도로를 따라 나오면 19번 국도를 만나는 곳에 있다. 지역명도 파도리인데 파도리는 배들이-바드리-파도리의 변한 말이다. 배들이는 섬진강물이 마을 앞까지 찰랑찰랑 넘쳐흘렀고 나룻배들이 이곳에 정박한 데서 유래되었다고 한다. 이후 행정구역개편을 하느라고 한자를 차음한 것이 파도리가 된 것이다. 비교적 주민들이 많은 파도마을은 지리산 노고단에서 왕시루봉으로 이어져 끝 봉에서 낭떠러지처럼 뚝 떨어진 명당 터에 자리 잡고 있다. 섬진강변이라 안개 낀 날이 많다. 구례 군청 소재지에서 7km, 면 소재지에서 동쪽으로 1km 지점이고 경남 하동군 화개면과는 8km에 이른다.",구례군
49,평도마을,전라남도 구례군 토지면 피아골로 660,127.5919428,35.24584195,http://tong.visitkorea.or.kr/cms/resource/24/2790624_image2_1.jpg,"피아골 계곡이 연곡사를 거쳐 내려오다 넓게 들을 만든다고 해서 평도라고 일컫는다. 오래전부터 여름 피서지로 유명해서 민박집이 많고, 옛적에는 목아재를 넘어 당재로 향하는 통상의 숙박 터이기도 하였다. 마을 위쪽 도로를 따라 올라가면 국립공원으로 들어가는 갈림길이 나온다. 그 위쪽 피아골로 30분쯤 걸으면 연곡사가 나온다. 연곡사는 신라 말, 고려 초기에 만들어진 것으로 보이는 동부도, 북부도 등의 국보와 수많은 보물을 볼 수 있으며 특히 동부도는 국내에서 가장 오래된 것으로 그 조각 솜씨가 세계적인 아름다움을 자랑한다. 마을 아래쪽에는 토지초등학교 연곡분교가 자리하고 있다. 원래는 토지동초등학교였으나 1997년 토지초등학교 연곡분교로 격하되었지만, 최근 환경 좋은 산촌학교로 이름이 많이 알려졌다. 인근에 피아골 단풍공원 야영장과 피아골 솔밭 야영장이 있다.",구례군
50,피아골계곡,전라남도 구례군 토지면 피아골로,127.5692478,35.23963392,http://tong.visitkorea.or.kr/cms/resource/68/644268_image2_1.jpg,"피아골은 노고단과 반야봉 사이에 자리잡은 계곡이다. 가을날의 피빛 단풍으로 지리산 10경의 반열에 든다. 기실 홍염에 불타는 단풍이 워낙 유명세를 타고 있어 그렇지 피아골은 사계절 내내 아름다운 곳이다. 봄날에 피어난 철쭉은 명경 같은 계곡에 얼굴을 비추고 여름날엔 한 올의 햇살도 허락치 않을만큼 녹음이 우거진다. 가을의 단풍은 두말할 나위 없고, 겨울엔 인적드문 호젓한 설국의 산길을 선사한다. 계곡초입에 지리산 제일의 거찰이었다는 연곡사와 국보급 문화재가 있어 찾는 이들이 많다. 피아골은 가을철을 제외하곤 찾는 이들이 많지 않아  지리산 등산로 중 호젓한 곳에 속한다.그러나 계곡 안에 들어서면 단번에 뛰어난 흥치에 압도당한다. 연주담, 삼홍소 등 속을 알 수 없는 심연과 집채만한 바위들이 어울려 풍치가 뛰어나다. 매표소부터 피아골산장까지 6km는 그런 계곡을 건너다니며 오르는 길이라 눈이 즐겁다. 계곡 또한 가파르지 않아 누구나 쉽게 갈 수 있다. 피아골 산장에서 임걸령까지 2km는 계곡에서 멀어져 가파른 산등을 올라가야하기 때문에 소금땀을 흘려야 한다. 여름철에 물놀이 하기에  좋은 곳은 연곡사에서 직전마을까지, 직전마을에서 피아골 산장까지다. 계곡입구부터 삼홍소까지가  특히 아름다운데, 가을이면 삼홍소란 이름에 걸맞게 온 골짜기를 붉게 물들인 단풍과 붉은 빛에 젖은 계곡물과 삼홍소바닥의 바위까지 붉어 장관을 이룬다.",구례군
51,하사마을,전라남도 구례군 마산면 하사3길 6,127.5064152,35.21005283,http://tong.visitkorea.or.kr/cms/resource/89/2800089_image2_1.jpg,"하사마을은 신라 흥덕왕 때부터 형성된 오래되고 큰 마을이다. 원래는 사도리로 불리던 것을 일제강점기 때 윗마을과 아랫마을을 구분해 상사리와 하사리가 되었다. 현재는 하사마을과 상사마을이 사도리를 구성하고 있다. 사도리란 이름을 글자 그대로 풀면 '모래 그림 마을'이다. 전설에 따르면 신라 말 도선국사가 이곳에서 머리를 식히고 있는데, 어디선가 도사 한 분이 나타나 모래벌판에 그림을 그려 우리나라의 풍수에 대해 알려주었다고 한다. 하사저수지를 품고 넓은 들을 바라보는 마을 정경이 아름답다. 초록 들판 너머 멀리 보이는 섬진강은 마치 한편의 그림을 보는듯하다.",구례군
52,화엄사,전라남도 구례군 마산면 화엄사로 539,127.4971648,35.25555865,http://tong.visitkorea.or.kr/cms/resource/94/2713794_image2_1.jpg,"화엄사는 구례읍에서 동쪽으로 5.4km 떨어진 곳, 민족의 영산인 지리산 자락에 위치하고 있는 천년 고찰로 544년(백제 성왕22년)에 연기조사가 창건하였다하여 절의 이름을 화엄경(華嚴經)의 화엄 두글자를 따서 붙였다고 한다.  처음에는 해회당과 대웅상적광전만  세워졌고 그후 643년(선덕여왕 12년) 자장율사에 의해 증축되었고 875년(신라 헌강왕1년)에 도선국사가 또 다시 증축하였다.  임진왜란 때 불타 없어진 것을 1630년(인조 8년)에 벽암선사가 절을 다시 세우기 시작하여 7년만인 인조 14년(1636년)에 완성하였다.사찰 내에는 각황전을 비롯하여 국보 4점, 보물 5점, 천연기념물 1점, 지방문화재 2점등 많은 문화재와 20여동의 부속 건물이 배치되어 있다.  특히 건물의 배치에 있어서는 일주문을 지나 약 30˚꺽어서 북동쪽으로 들어가면 금강역사, 문수, 보현의 상을 안치한 천왕문에 다다르는데 이 문은 금강문과는 서쪽 방향으로 빗겨 놓은 것이 독특한 특징이다. 이 천왕문을 지나 다시 올라가면 보제루에 이르고 보제루는 다른 절에서 그  밑을 통과하여 대웅전에 이르는 방법과는 다르게 누의 옆을 돌아가게 되어 있다. 절내에서는 동.서 두개의 탑이 사선 방향으로 보이며 동측탑의 윗부분보다 한단 높은 더위에 대웅전이 있고 서쪽탑의  윗부분에는 각황전이 위치하고 있다.경내 건물중 각황전은 국보로 지정된 매우 유명한 건물이며 현존하는 목조건물로는 국내 최대 규모로 그 웅장한 외양이 보는 이의 시선을 압도한다. 각황전 앞 뜰에 서있는 석등은 높이 6.3m, 직경 2.8m 로 국내 최대 규모이며, 통일 신라시대 불교 중흥기의 찬란한 조각예술을 보여주는 작품으로 국보 제 12호로 지정되어 있다.각황전 왼편 효대라는 언덕에 자리하고 있는 4사자 3층석탑은 화엄사를 창건한  연기조사가 어머니의 명복을 빌며 세운 탑으로 특이한 의장과 세련된 조각솜씨를 자랑하는 걸작으로 국보이다. 각황전 내부 후편에 위치하고 있는 영산회 괘불탱은 국보로 1997년도에 지정되었다.화엄사 경내 보물 가운데서도 대웅전 양편에 서있는 5층탑은 뛰어난 조형성과  섬세한 장식이 눈길을 끄는 신라시대 작품으로 보물로 지정돼 있다. 또한 이곳의 대웅전은(보물) 조선시대의 우수한 예술성이 잘 나타나 있으며, 국립공원인 지리산의 훌륭한 경관을 배경으로 곳곳에 명소와 절경이 산재해 있다. 한편 하동에서 화엄사에 이르는 19번국도변(약 35㎞) 에는 가로수로 벚꽃나무가 심어져  매년 4월 벚꽃이 만개할 때면 환상적인 드라이브 코스로 인근에는 섬진강매화마을, 고소성 군립공원, 지리산국립공원, 쌍계사등 많은 관광지가 있어 수많은 상춘객이 몰리는 곳이다.* 문화재화엄사 각황전 앞 석등(국보), 화엄사 4사자 3층석탑 (국보 ),화엄사 각황전(국보),화엄사 영산회괘불탱(국보),화엄사 동,서 5층석탑(보물),화엄사 대웅전(보물),화엄사 원통전 앞 사자탑(보물), 화엄사 화엄석경(보물),화엄사의 올벚나무(천연기념물), 화엄사 보제루(전라남도 유형문화재),화엄사 구층암 석등(전라남도 유형문화재)",구례군
53,화엄사계곡,전라남도 구례군 마산면 화엄사로 539,127.4977425,35.25731402,http://tong.visitkorea.or.kr/cms/resource/17/2720517_image2_1.jpg,"화엄사계곡은 일찍부터 지리산을 오르는 가장 대표적인 길로서, 특히 노고단을 찾는 등산객과 화엄사를 찾는 관광객들이 수시로 찾아드는 곳이다. 신라 진흥왕 5년(544년)에 연기조사가 창건한 화엄사에서 노고단까지 이어져 있는 길이 약 7km의 계곡으로, 오르는데 4시간 정도 소요된다. 계곡은 계류(시내)를 따라 오르므로 울창한 수림 아래 시원한 물소리를 마냥 들으며 갈 수 있다.  도중에 용소며 크고 작은 폭포가 어울려 멋진 광경을 자아낸다.",구례군
