,title,addr1,mapx,mapy,firstimage,overview,addr2
0,도리포,전라남도 무안군 해제면,126.3464691,35.15665868,http://tong.visitkorea.or.kr/cms/resource/91/824691_image2_1.jpg,"* 일몰과 일출을 동시에 만날 수 있는 곳, 도리포 *무안군과 영광군·함평군의 경계를 이루는 해제반도 북서쪽 끝 도리포에 있는 유원지이다. 모래사장이 길고 송림이 우거지며 해변이 넓어 해수욕에 적당하다. 백사장을 지나 조금 더 들어가면 도리포 포구가 나오는데, 바다 쪽으로 길게 나와 있어 일출을 볼 수 있고 포구 반대편 칠산바다 쪽으로는 일몰이 장관을 이루어 일출과 일몰을 함께 즐길 수 있는 곳이기도 하다. 도리포도 서해안의 여느 일출명소와 마찬가지로 겨울철에는 함평의 바다쪽에서 해가 뜨고, 여름철에는 영광의 산쪽에서 해가 뜬다. 1월 1일에는 이곳에서 일출 행사가 개최된다.",무안군
1,무안 감풀마을 [농촌전통테마],전라남도 무안군 현경면 석북길 91-66,126.406055,35.06133988,http://tong.visitkorea.or.kr/cms/resource/83/2515483_image2_1.jpg,"무안 감풀마을은 우리나라 서남단에 위치한 무안에서도 현경면에 위치하고 있다. 바다를 끼고 있는 우수한 경관을 바탕으로 마을이 아담하게 이루어져 있다. 들녘은 황토땅이며 황토 들판 옆으로 푸른 양파와 마늘밭이 대조를 이루고 있으며, 반농반어의 고장, 뭍이 끝나는 골짜기마다 자그마한 어촌들이 숨어 있다. 붉은 황토에서 생산되는 밤고구마를 비롯하여, 수박, 참깨, 쪽파, 양파 등이 생산되고 있으며, 끝없이 넓은 청정 갯벌에서는 낙지, 참고막, 조개 등이 생산되고 있다. 우수한 자연환경을 가지고 있어, 쪽파 종자 고르기, 참깨 수확, 고구마캐기 등의 농사 체험과 조개캐기, 게 잡기, 후리질 등 갯벌 체험을 할 수 있다.특히 갯벌보존지역의 중심부에 위치해 갯벌세발낙지, 굴, 바지락. 고동, 바다게 등 다양하고 풍부한 생물이 서식하여 전국 최초로 갯벌습지보호지역으로 지정관리 되고 있습니다.* 감풀마을의 유래마을의 끝인 월두는 달머리(月頭)같이 보인다해서 붙여졌으며, 2.5km의 넓고 긴백사장과 소당섬이 물이 빠지면 섬으로 변하여 경치가 한폭의 그림과 같은 아름다움을 간직하여 가족 단위 피크닉장, 월출감상지로 유명하다. 마을형성 당시 무더운 여름날 무서운 바람이 불더니 마을은 갑자기 도둑과 돌림병이 나돌아 하루 아침에 쑥대밭이 되었다. 마을주민들이 당산을 세우고 남신당에는 돌칼, 여신당에는 돌창을 세우니 그 뒤부터는 마을이 평온해지고 전염병도 퇴치되었다고 한다.",무안군
2,무안 도요지,전라남도 무안군 몽탄면 몽탄로 940-1,126.4995779,34.92389305,http://tong.visitkorea.or.kr/cms/resource/34/2516034_image2_1.jpg,"* 고려후기 청자를 굽던 곳, 무안도요지 *몽탄면 사천리와 몽강리에 위치한 도요지로 삼국시대부터 옹기와 질그릇 등을 만들어왔다. 양질의 고령토로 옹기, 질그릇만이 아니라 순수한 전통기법으로 백자, 분청사기 등을 재현하여 전국민속공예품경진대회에서 우수한 성적을 거두는 등 옛 명성을 회복하고 있다. 또한 관광객이 직접 참여하여 도자기와 더욱 친밀해질 수 있는 기회도 제공된다.* 무안도요지의 유물 및 가치 *이 도요지에서 출토된 유물은 주로 왕실 및 관청 소용의 상감청자들이다. 특히 청자상감연판문잔대, 청자팔각접시 등은 특이한 형태를 보이고 있다. 유물문양은 상감기법으로, 구름·봉황·국화·모란·연꽃·버들·여의두문(如意頭文) 등이며, 간략하면서도 생동감과 해학스러운 자유로움이 돋보인다. 또한 이곳의 유물은 실생활 용기로서 당시의 문화와 경제상을 살펴볼 수 있는 학술적 가치가 있으며, 고려 후기의 청자형태나 문양의 변천사 연구에도 귀중한 자료가 된다.",무안군
3,무안 박봉기 가옥,전라남도 무안군 무안읍 수양길 104-13,126.4513661,35.0143015,http://tong.visitkorea.or.kr/cms/resource/20/1608320_image2_1.jpg,"이 건물은 1927년에 세워진 것으로 추정되는 지방 부호의 전형적인 가옥으로, 안채와 사랑채가 건립 당시의 모습을 잘 간직하고 있다. 안채는 일자형 겹집으로 정면 5칸, 측면 2칸이며, 2고주 5량의 구조로, 이것은 당시 이 지방 부농주택의 일반형태이다.",무안군
4,무안 백련흑콩마을(두레미마을),전라남도 무안군 일로읍 백련로 365,126.5319822,34.85771216,http://tong.visitkorea.or.kr/cms/resource/43/2516043_image2_1.jpg,"두레미 마을은 천혜의 자원인 약 10여만 평을 자랑하는 회산백련지와 인접해 있다. 그리고 마을 바로 앞에 간척지가 드넓게 펼쳐져 있는데, 이곳에서는 친환경 농법으로 재배된 양질의 쌀과 논두렁에서 재배된 튼실한 무공해 청정 흑콩이 유명한 마을이다. 봄에는 진흙 속에 숨겨진 연근을 채취하여 즉석에서 맛볼 수 있고, 여름에는 마을 주변 어디에서나 볼 수 있는 백련의 순수하고 아름다운 자태와 그윽한 연꽃의 향기에 심취될 수 있으며, 연과 흑콩을 이용한 웰빙음식을 맛볼 수 있다. 가을에는 연잎을 이용한 향긋한 나만의 연잎차를 만들어 보고, 연밥을 채취하여 예쁜 공예품을 만들어 볼 수 있으며, 겨울에는 따뜻한 방안에 옹기종기 모여앉아 흑콩 두부와 흑콩전을 먹는 재미 또한 쏠쏠해서 시간 가는 줄 모른다.",무안군
5,무안 식영정,전라남도 무안군 몽탄면 호반로 562-15,126.5164763,34.92871501,http://tong.visitkorea.or.kr/cms/resource/08/189508_image2_1.jpg,"* 영산강 유역의 대표적 정자, 식영정(팽나무) *식영정은 한호(閑好) 임연(林煉, 1589~1648)선생이 1630년에 무안에 입향 이후 강학소요처로 지은 정자로 그의 호인 한호처럼 한가로움을 좋아한다는 취지로 그림자가 잠깐 쉬었다 가는 곳이라 하여 식영정으로 불렀다고 전해진다. 이곳은 영산강과 그 주변의 경관과 어울려 많은 시인묵객들이 찾았으며, 임연의 증손으로 동사회강을 지은 문인학자인 노촌 임상덕(林象德1683~1710)이 제현과 교류하는 등 무안 몽탄 이산리의 나주임씨 강학교류 공간이었다. 무안 이거와 경관, 정자 건립 등에 관해서는 1643년에 임연이 지은 복거록에 잘 나타나 있고 교류한 문인도 많다. 식영정은 창건주 임연의 증손인 노촌 임상덕 등 대를 이어가면서 교류공간으로 활용되었다.* 식영정의 구조 *식영정은 측면에서 보면 영산강 유역의 대표적 정자라 해도 손색이 없다. 그리고 정자의 입지나 주변의 경관도 뛰어나다. 현재의 건물은 1900년대 초반에 중건한 건물이며, 정면 3칸, 측면 3칸의 단층 건물로 팔작지붕이다. 시멘트로 마감되어 있어 그 원형을 알 수 없는 낮은 기단 위에 막돌초석을 놓고 그 위에 원통형의 원주(圓柱)를 세웠다.가구(架構) 형식은 2고주(高柱) 5량(樑) 구조로서, 종도리와 주심도리는 굴도리로, 중도리는 납도리로 되어 있고 마루대공은 판대공(板臺工)으로 되어 있다. 중앙의 마루방 3면에는 사분합문이 설치되어 들쇠에 매어달게 되어 있으며 후면 벽에는 다락이 있다.[문화재 정보]지정종목 : 문화재자료지정번호 : 전남문화재자료지정연도 : 2002년 4월 19일시대 : 조선종류 : 정자규모 : 건물 1동 - 정면 3칸, 측면 2칸, 팔짝 단층와가",무안군
6,무안 유교리고가,전라남도 무안군 삼향읍 유교길 53-5,126.4382824,34.84744788,http://tong.visitkorea.or.kr/cms/resource/86/189486_image2_1.jpg,"* 일제강점기의 대표적 부농저택, 무안 유교리고가(무안 나상열가옥) *나상열 전통가옥은 남해안 지역의 대표적인 부농주택으로 1912년 당시 전남지방의 천석꾼이었던 나종만에 의하여 건립되었다. 현재 국가 지정 중요민속자료로 지정 보호를 받고 있다. 건축 양식은 양옥의 건축기법으로 건립되었는데, 20세기 들어와서야 남도지방에서 채택한 구조법을 사용하였다. 전체적으로 임좌 방향으로 자리하고 있으며 비교적 경사가 급한 지형을 3단으로 잘 정지한 후에 건물들을 배치하였다. * 나상열가옥의 구조 *대문간에 들어서면 자연석으로 포장된 경사로가 나타나며, 그 끝부분에는 행랑채가 서향으로 자리하고 있다. 행랑채에 난 중간문을 통과하면 좌측에는 넓은 바깥마당이 있으며, 그 중앙 아래쪽으로는 곡간채가 큰 규모로 건축되어 있다. 안채는 지형의 정지상 바깥마당과는 2단으로 석축을 한 후에 맨 위쪽에 자리하고 있다. 현재는 안채와 곡간채, 그리고 행랑채, 대문간 등 4채 만이 남아 있으나 그 이전에는 당시 주택건축에는 거의 찾아보기 힘든 동재와 서재가 안채 뒤, 후원에 독립적으로 건축되어 있었으며 사당과 사랑채 등 많은 건물들이 세워져 있었다고 전해진다.* 구조 - 안채(목조기와), 사랑채 52.89m²(목조초가), 창고 69.4m²(목조와가), 대문칸 49.58m²(목조와가), 흑실 9.91m²(목조와가)",무안군
7,무안 하늘백련마을(백련지마을),전라남도 무안군 일로읍 백련로 339-2,126.5300823,34.85942027,http://tong.visitkorea.or.kr/cms/resource/65/2516665_image2_1.jpg,"연꽃으로 유명한 무안은 무안군 몽탄면 이산리에서 회산 백련지까지 영산강을 따라 걷다 보면 연꽃 가득한 백련마을에 도착한다.백련지는 원래 이름 없는 농업용 저수지였으나, 일제강점기에 만들어진 두 개의 저수지를 합치면서 ‘복용’이란 이름이 붙었다. 벼농사가 대부분이던 당시 논에 물을 대던 저수지가 반드시 필요했지만, 1981년 영산강 하굿둑이 완공되면서 영산강에서 바로 농업용수를 끌어왔고, 사용하지 않아 점차 수위가 낮아진 저수지는 연꽃만 무성하게 피어있는 ‘연방죽’이 되었다. ‘연방죽’인 백련지가 세상에 알려지기 시작한 것은 1997년 제1회 회산 백련지 연꽃축제’가 열리면서 둘레가 3km, 면적은 33만여㎡로 연꽃 자생지로는 동양 최대 규모인 백련지가 알려졌으며,이때부터 무안군 일로읍 복용리는 ‘연꽃마을’로 불렸다.이후 2004년 회산백련지가 관광지로 지정받았다.회산 연꽃 방죽은 원래는 모란꽃이 많이 있어서 모란 방죽이라고 불리었으나 연꽃이 많아지면서 연꽃방죽으로 이름을 바꾸어 부르게 되었다.마을에서는 연잎으로 만든 연 쌈밥, 연돈까스, 연수육, 연잎을 넣어 만든 연맥주 등 다양한 연 요리를 맛 볼 수 있으며, 해마다 회산백련지 일대에서 '무안연꽃축제'를 개최하고 있다.* 백련지의 유래 * 원래 저수지였던 이곳에 한 마을 주민이 저수지 가장자리에 백련 12주를 구해다 심었다. 그날 밤 꿈에 하늘에서 학 12마리가 내려와 앉았는데 그 모습이 백련이 피어있는 모습 같았다. 꿈을 꾼 뒤 지극정성으로 연을 보호하고 가꾸게 된 것이 지금에 이르렀다.",무안군
8,무안낙지골목,전라남도 무안군 성남1길 171 성경식당,126.4769339,34.98750772,http://tong.visitkorea.or.kr/cms/resource/90/2924890_image2_1.JPG,"무안의 청정 갯벌에서 자란 무안 낙지는 발이 길고 식감이 부드러워 이미 전국적으로 유명하다. 무안낙지골목은 뻘낙지로 유명한 무안의 명물이자, 관광 명소 중 하나로 자리매김하였다. 무안의 대표 수산물인 낙지의 고장답게 원산지 표시 의무를 철저히 준수하고 있으며, 이에 따라 믿고 먹을 수 있는 낙지 명소로 거듭나고 있다. 무안 버스터미널과 가까운 곳에 있어 방문하기 편리하며, 주차 타워가 마련되어 있어 차량을 갖고 방문하기도 편리하다. 식당과 시장 등이 공존하고 있어 낙지를 구입할 수도 있고, 낙지 요리를 먹을 수도 있다. 각종 매스컴에 소개된 만큼, 맛집으로 알려진 식당들이 즐비하다. 불무공원, 물맞이공원 등이 근처에 있어 연계 관광하기 수월하다.",무안군
9,무안망운면의곰솔,전라남도 무안군 망운면 두모길 35,126.3674792,35.00686485,http://tong.visitkorea.or.kr/cms/resource/36/2516036_image2_1.jpg,"곰솔은 해송.흑송.검솔이라고도 부르며, 소나무과에 딸린 사계절 푸른 나무다. 바닷바람과 염분에 강하여 바닷가의 바람을 막아주는 방풍림이나 방조림으로 많이 심는다. 무안군 망운면 송현리 두모마을 도로가에 2그루의 곰솔이 자라고 있다. 나이는 300년 정도로 추정된다.전설에 따르면, 400여 년 전에 김해 김씨가 이 곳에 정착하고 이 숲을 성황당숲으로 정했다고 한다. 이 후에 해마다 정초에 마을의 평화와 풍년을 기원하는 제를 올렸다. 그리고 이 곰솔을 신령스런 나무로 여겨  잘 보존하고 있으며, 오랜 세월동안 우리 조상들의 관심과 보살핌 가운데 살아온 나무로 생물학적·민속적 가치가 높아 기념물로 지정하여 보호하고 있다. 소나무 한그루의 높이는 18m, 둘레는 4.2m, 가지길이는 11m 정도이며, 또 한그루는 줄기가 땅에서부터 두 개로 갈라져 있는데 둘레가 각각 2.8m와 3m 정도이다.* 부지면적 850㎡ ",무안군
10,무안향교,전라남도 무안군 무안읍 향교길 20,126.4676235,34.98987675,http://tong.visitkorea.or.kr/cms/resource/44/1608344_image2_1.jpg,"1394년(태조 3) 현유(賢儒)의 위패를 봉안, 배향하고 지방민의 교육과 교화를 위하여 창건되었다. 처음에는 성의 남쪽에 있는 공수산(控壽山) 언덕에 설립하였는데 호랑이의 침해가 심하여 1470년(성종 1) 현재의 위치로 이건하였다. 임진왜란으로 황폐해진 것을 1689년(숙종 15) 대대적으로 중수하여 복원하였다. 그 뒤 1790년(정조 14)·1820년(순조 20)·1892년(고종 29)·1902년에 각각 보수하였고, 광복 후에도 네 차례에 걸쳐 복원하였다. 현존하는 건물로는 정면 4칸과 측면 4칸의 맞배지붕으로 된 대성전, 정면 3칸과 측면 3칸의 명륜당, 동재(東齋)·서재(西齋)·내삼문(內三門)·동별실(東別室)·제기고(祭器庫)·외삼문(外三門)·협문·고사(庫舍)·삼강문(三綱門) 등이 있다. 대성전에는 5성(五聖), 송조2현(宋朝二賢), 우리나라 18현(十八賢)의 위패가 봉안되어 있다. 조선시대는 국가로부터 토지와 전적·노비 등을 지급받아 교관이 교생을 가르쳤으나, 갑오개혁 이후 신학제 실시에 따라 교육적 기능은 없어지고, 봄·가을에 석전(釋奠)을 봉행하고, 초하루·보름에 분향을 하고 있다. 이 향교는 전라남도 유형문화재 제114호로 지정되어 있으며, 전교(典校) 1명과 장의(掌議) 수명이 운영을 담당하고 있다.",무안군
11,무안회산백련지,전라남도 무안군 일로읍 백련로 333,126.5299101,34.86012574,http://tong.visitkorea.or.kr/cms/resource/56/2399156_image2_1.jpg,"무안회산백련지는 전남 무안군 일로읍 복용리에  위치해 있다. 전체면적이 10만평쯤 되는 이 연못은 동양 최대의 백련(白蓮) 자생지로  널리 알려져 있다. 일제 때에 농업용수를 확보하기 위해 인근 마을의 주민들이 피와  땀으로써 축조했다고 한다. 그러나 이젠 영산강 종합개발계획으로 인해 농업용수를  공급하는 기능은 거의 상실했다. 그지없이 평범하던 이 연못이 우리나라 제일의 백련(白蓮)자생지로  탈바꿈한 것은 순전히 고(故) 정수동씨의 덕택이다. 정씨는 한국전쟁이 끝난 직후인  1955년 여름 어느 날, 아이들이 발견한 연뿌리 12주를 이 저수지의 가장자리에 심었다.  전날 밤 꿈에 하늘에서 열두 마리의 학이 저수지에 내려와 앉는 광경을 보았던 터라,  정씨는 열의와 정성을 다해 백련을 보호하고 가꾸었다고 한다. 작은 개인의 위대한  힘에 의해 한국 제일의 생태공원이 탄생한 셈이다. 
무안회산백련지의 백련꽃은 해마다 7월부터 9월에  걸쳐 피고 지기를 거듭한다. 그 석 달 가운데 가장 많은 꽃을 볼 수 있는 8월에는  연꽃축제가 열린다. 연꽃축제의 행사장으로 가는 길가에는 700평 규모의 수생식물  자연학습장도 조성돼 있다. 이곳에는 홍련을 비롯해 가시연, 왜연, 왜개연, 수련,  어리연, 노랑어리연, 순채, 물옥잠, 택사, 물양귀비, 물배추 등 우리나라에 자생하는  각종 수생식물 들을 볼 수 있다. 또한 최근에는 멸종위기식물인 가시연꽃이 군락하는  것으로 밝혀지기도 했다. 이곳에서는 희귀한 백련의 특성을 활용, 1997년부터 매년  10만평의 회산 백련지에서 무안 연꽃 대축제를 개최해 오고 있으며, 700평 규모의  수생식물 자연학습장도 조성돼 있다.
연꽃의 원산지는 인도이다. 우리나라에는 언제 어떤  경로로 들어왔는지는 모르지만, 아주 오래 전부터 재배되어 왔다. 하지만 붉은 꽃을  피우는 홍련(紅蓮)이 대부분을 차지하고 백련은 아주 드문 편이다. 더욱이 이곳처럼  온통 백련으로만 뒤덮인 곳은 달리 찾아보기 어렵다. 연꽃은 더러운 물 속에서 맑고  향기로운 꽃을 피운다. 불가(佛家)에서는 연꽃의 이런 특성이 불교의 근본적인 가르침과  같다고 해서 불교를 상징하는 꽃으로 여긴다. 연꽃을 만타라화 (曼陀羅花, 부처가  설법할 때 하늘에서 내려온다는 꽃)라 부르는 까닭도 거기에 있다.",무안군
12,밀리터리테마파크,전라남도 무안군 몽탄면 우명길 21,126.5152449,34.96543307,http://tong.visitkorea.or.kr/cms/resource/22/2754522_image2_1.jpg,"밀리터리 테마파크는 전 공군참모 총장을 역임한 옥만호 장군이 후세들의 교육자료 용으로 사재를 들여세운 호담항공전시관과 전시관 옆 폐교를 리모델링하여 확장시킨 공간이다. 직접 타보고 체험할 수 있는 수송기(C-123K), 항공 우주 지식을 폭넓게 이해할 수 있도록 사진, 모형 항공기와 부품을 연대별, 기능별로 나누어 전시한 호담항공 우주전시관, 육해공군의 다양한 군사 무기들이 전시되어 있는 밀리터리 테마파크 전시장이 있다. 실내 체험장에는 영상교육실, 영상홍보실, 서바이벌 게임을 즐길 수 있는 서바이벌 게임장, 군대에서 쓰였던 물품들을 볼 수 있는 적성 물자 전시실이 있다. 별도의 건물에 마련되어 있는 시뮬레이션 체험장은 모의 탱크 전투 체험과 비행 시뮬레이션을 해볼 수 있어, 아이들은 물론 어른들에게도 인기가 많다. 아이들에게는 꿈과 희망을 주고, 자라나는 청소년들에게는 호연지기를 키워줄 수 있는 체험학습장으로 널리 활용되고 있다.",무안군
13,송계 어촌체험마을,전라남도 무안군 해제면 만송로 916,126.3397476,35.15288122,http://tong.visitkorea.or.kr/cms/resource/56/2516256_image2_1.jpg,"무안군 송계어촌체험마을은 예로부터 마을에 소나무가 울창해서 소나무 ‘송(松)’ 자와 성계 동의 ‘계’자를 따서 송계라고 하였으며, 지금까지 송계어촌체험마을로 불리고 있다. 조용한 포구와 함평만 가득한 일출, 최고의 맛을 자랑하는 청정지역 도리포의 바다 생선은 송계어촌체험마을의 자랑이며 관광 안내소 주변에서 다양하게 이루어지는 갯벌체험도 즐길 수 있다. 송계어촌체험마을에서는 서해안에서 일출과 일몰을 동시에 볼 수 있으며, 3km에 이르는 백사장과 해송림이 어우러진 아름다운 경관을 배경으로 바지락, 소라, 고동 잡기 등 갯벌에서 펼쳐지는 다양한 체험을 할 수 있다.",무안군
14,송석마을,전라남도 무안군 해제면 송석리,126.3467135,35.15749192,http://tong.visitkorea.or.kr/cms/resource/70/2516270_image2_1.jpg,"송석 마을에 가면 전설이 얽힌 환선 바위가 있다. 어여쁜 처녀가 이웃 마을 총각과 사랑에 빠져 도리포 바닷가에서 결혼을 맹세했다. 그러나 총각이 고기잡이를 떠났다가 돌아오지 못했다. 처녀는 100여 일 동안 물 한 모금 먹지 않고 돌아오지 않는 총각의 생환을 기도하다가 끝내 지쳐 죽음을 맞이하게 되었다. 그때, 청천 하늘에 폭풍우와 뇌성이 몰아치더니 죽어간 처녀는 온데간데없고 환선 바위가 솟아났다고 한다. 또한 도리포항은 일출·일몰 명소로 유명하다.

[출처: 무안군청]",무안군
15,원갑사,전라남도 무안군 해제면 산길로 266-27,126.2622921,35.09055366,http://tong.visitkorea.or.kr/cms/resource/60/1608360_image2_1.jpg,"* 전남 3갑사 중 하나, 원갑사 *전남 영광의 불갑사, 영암의 도갑사와 더불어 3갑사라고 불린다.《문화유적총람》에 따르면 신라 제43대 해공왕(765~780년) 때 65대 의상대사가 건립하였다고 하나 정확한 근거를 찾기 어렵다. 원갑사에는 강산사에 대한 현판이 전해져 내려오고 있는데, 이 내용에 따르면 오래된 절이 무너지자 신도들이 중수하기 위해 돈을 모았는데 목우암의 신도들이 이야기를 듣고 도와 1908년에 다시 세웠다고 쓰여있다. 「무안군지」에 강산사가 있다고 기록 되어있고 「금성지」에도 원갑사가 강산에 있다고 쓰여진 것으로 볼때 이름이 강산사였다가 원갑사로 바뀐 것으로 추정된다.* 원갑사의 볼거리 *원갑사의 법당은 극락전으로 정면 3칸, 측면 1칸의 맞배지붕이며 전퇴를 두었다. 창문은 띠살문으로 아주 작은 규모의 건물이다. 법당 외에 요사채 1동과 1897년(고종 16)에 만들어진 탱화 1점이 보관되어 있다.[문화재 정보]지정종목 : 문화재자료지정번호 : 전남문화재자료지정연도 : 1984년 2월 29일종류 : 사찰",무안군
16,조금나루해변,전라남도 무안군 망운면 조금나루길 297,126.3348741,34.99484622,http://tong.visitkorea.or.kr/cms/resource/68/2796568_image2_1.jpg,"조금나루 해수욕장은 무안읍에서 남서쪽으로 12km 정도 떨어진 망운면 송현리에 자리 잡고 있다. 마을 끝에 툭 불거져 나온 4km가 넘는 긴 백사장에 주변을 둘러싼 울창한 송림까지 겸비한 천혜의 해변이다. 원래는 조금(조수(潮水)가 가장 낮을 때를 이르는 말)에 한 번씩 배를 타고 건너야 하는 섬이었으나 지금은 육지와 연결되어 아무 때나 통행이 가능하다. 조금나루해변 근해에 어류가 풍부해 선착장에서 낚시도 가능하고, 해변 근처에는 횟집이 많아 먹거리도 풍부하다. 해변 입구에 자리 잡은 조금나루 유원지에서는 넓은 캠핑장이 무료로 운영되고 있어 많은 캠핑족을 만날 수 있다.",무안군
17,조금나루해수욕장,전라남도 무안군 망운면 송현리 1070-3,126.3363628,34.99604611,http://tong.visitkorea.or.kr/cms/resource/49/194649_image2_1.jpg,"* 백사장과 송림이 아름다운 곳, 조금나루해수욕장 *조금나루 해수욕장은 무안읍에서 남서쪽으로 12km  정도 떨어진 망운면 송현리에 위치하고 있다. 마을 끝에 툭 불거져 나온 4km가  넘는 긴 백사장에 울창한 송림까지 겸비한 천혜의 해수욕장이다.  원래는 조금에 한 번씩 배를 타고 건너야 하는 섬이었으나  지금은 육지와 연결되어 놀이공간이 충분하여 여름 피서철에는 각종 단체나 모임에서  즐겨 찾는다. 또한 샤워장, 급수대, 화장실 등 편의시설이 잘 갖추어져 있어서, 하룻밤  야영하며 바닷가의 정취를 즐기기에 좋다.* 조금나루해수욕장의 또다른 재미인 바다낚시와 먹거리 *인근 주변에서 어획한 싱싱한 활어회와 산낙지 등을  맛볼 수 있어 미식가들이 즐겨 찾고 있으며 특히 이곳에서 바라보는 서해 바다의  낙조는 매우 황홀하며 인근의 횟집에서는 이 지역만의 별미인 기절낙지와 각종 생선회도  맛 볼 수 있다. 최근에는 해당화 자연 학습장이 조성되어 운치를 더해 주고 있다.",무안군
