,title,addr1,mapx,mapy,firstimage,overview,addr2
0,구례 관광특구,전라남도 구례군 마산면 화엄사로 539,127.4977425,35.25731402,http://tong.visitkorea.or.kr/cms/resource/83/1917883_image2_1.jpg,"구례 관광특구는 산악 지대를 중심으로 강과 평야가 두루 펼쳐지는 토지면과 마산면, 광의면, 산동면을 포함하는 대단위 관광 지구다. 구례군 구석구석이 관광특구라 할 만큼 볼거리가 다양하다. 예부터 기름진 평야로 이름 난 구례의 가장 큰 자연 자원은 국립공원 제1호인 지리산국립공원과 섬진강이다. ‘어머니의 품’이라 일컬어지며 해마다 많은 등산객들이 찾는 지리산국립공원은 깊고 너른 산세와 맑은 계곡 등 때 묻지 않은 자연 경관으로 사랑 받고 있다. 등산 코스도 여러 갈래이며 곳곳에 산장이 있어서 백패킹도 가능하다.지리산 언저리를 걸어서 도는 지리산 둘레길은 지리산 등반과는 또 다른 정취를 즐기는 트레킹 코스다. 산행과 트레킹을 즐기는 동안 봄에는 산수유 군락을, 가을에는 단풍에 물든 산과 계곡을 만날 수 있다.
지리산 온천 같은 레저 시설을 비롯해 한옥 민박, 게스트하우스 등 다양한 숙박 시설을 갖추고 있는 것도 장점이다. 화엄사, 연곡사, 천은사 등 유서 깊은 사찰과 역사적 유물들도 함께 자리하고 있어 역사 탐방에도 유익하다. 곡성에서 하동까지 길게 이어지는 섬진강의 물줄기는 고즈넉한 풍경을 자아낸다. 섬진강은 국내 제일의 청정 하천으로 손꼽히며 다슬기와 은어가  많이 나기로 유명하다. 섬진강을 끼고 달리는 섬진강변도로 역시 최고의 전망을 선사하는 드라이브 코스다. 계절에 따라 산수유꽃축제, 섬진강변벚꽃축제, 피아골단풍축제 등 다양한 축제가 열린다.
* 구례 관광특구 현황
1) 범위 / 전라남도 구례군 토지·마산·광의·산동면 지역
2) 면적 / 78,024,000㎡
3) 관광특구 지정일 / 1997년 1월 18일
* 구례 관광특구 시설 현황
지리산, 섬진강, 지리산 온천 관광지, 피아골 계곡, 산수유 시목지, 화엄사, 천은사, 연곡사, 한옥 마을 등",구례군
1,구례 산수유마을,전라남도 구례군 산동면 위안월계길 6-12,127.4849694,35.33598547,http://tong.visitkorea.or.kr/cms/resource/34/2616834_image2_1.jpg,"산수유마을의 유산은 척박한 땅에 농사짓기가 힘들어서 시작한 것이 효시가 되었지만 매년 봄의 전령사로서 지리산의 상춘객을 모으고 있다. 해발 400m에 위치한 구례군 산동면 위안월계 산수유마을은 매년 3월이면 노란 산수유로 만발한다. 백두대간 만복대의 물줄기 산동정수장은 2010년 전국 최우수 수질로 대통령상을 받았으며 생수공장, 게르마늄이 함유된 지리산 온천 암반수와 최고 수질의 물 고장이다. 이 곳에 나는 산수유는 전국의 70% 이상을 점유하며, 9월의 햇살과 일조 조건은 전국 최고 우량 산수유를 만들어내고 있다. 산촌생태마을인 산수유마을은 봄에는 산수유 축제, 여름에는 수락폭포, 가을에는 산수유 열매 축제가 있으며 겨울에는 만복대의 설경을 함께 갖춘 여행테라피에 최고의 휴식을 준다. 또한, 산수유 옛길 트레킹과 대동여지도 옛길 걷기 등 지리산 둘레길 7구간 인접구역이며 상위에서 묘봉치까지의 등산로, 당골에서 성삼재까지의 등산로, 지리산 온천에서의 휴식 등 다양한 건강과 휴식을 겸하는 웰빙여행이 될 수 있는 곳이다.",구례군
2,구례 석주관 칠의사묘,전라남도 구례군 토지면 송정리,127.564977,35.19714975,http://tong.visitkorea.or.kr/cms/resource/89/1117489_image2_1.jpg,"석주관 칠의사묘는 정유재란 때 구례지방으로 침입하여 왜구를 막기 위해 석주관성에서 적을 맞서 싸우다 장렬히 순절한 구례현감 이원춘을 비롯 왕득인, 이정익, 한호성, 양응록, 고정철, 오종 등의 정신을 기리기 위하여 가꾸어진 유적으로 사적 제106호로 지정되어 있다. 현재 석주관 칠의사단에는 높이 77㎝, 폭 29.5㎝, 두께 12㎝의 똑같은 규모의 칠의사 단비(壇?)가 세워져 있는데 왼쪽으로부터 이원춘, 왕득인, 왕의성, 이정익, 한호성, 양응록, 고정철, 오종의 순서로 모셔져 있다. 한편 석주관 칠의사 유적의 입구 우측에는 새로이 칠의사의 정신을 기리고자 기념관을 건립하였는데 사당으로 보이는 건물은 정면 3칸, 측면 2칸의 팔작와가로 되어있고 내삼문 밖에는 동·서재(東·西濟)의 건물로 정면 3칸, 측면 2칸의 규모인데 동재는 팔작지붕이고 서재는 맞배지붕이며 그외 외삼문 등이 갖추어져 있다.",구례군
3,구례 석주관성,전라남도 구례군 토지면 섬진강대로 4638-8,127.5661269,35.1973803,http://tong.visitkorea.or.kr/cms/resource/07/1609107_image2_1.jpg,"석주관은 전라도 경상도를 연결하는 지리산의 요새이다. 구례읍에서 섬진강을 따라 하동 쪽으로 10㎞쯤 가다 보면 구례군 토지면 송정리에 이르는데, 좌측으로 높이 약 10m의 낭떠러지가 나온다. 이곳이 석주관으로 사적으로 지정되어 있다. 이곳은 삼한시대에 마한과 진한의 경계였으며, 삼국시대에는 백제와 신라의 경계로 군사상 요충지였으며, 고려 때에는 남해에서 침입한 왜구를 막기 위해 성을 쌓은 곳이기도 하다. 이곳을 튼튼히 하기만 하면 전주에서 구례, 남원을 향해 넘어오는 왜적을 방어할 수 있는 호남의 전략적 요충지로, 고려말 왜구가 횡행함에 따라 진을 설치하여 운영하였으나, 조선이 개국하고 정국이 안정되어 감에 따라 진을 폐지하여 황폐되었는데, 1592(조선 선조 25년) 임진왜란이 발발하자 전라도 방어사 곽영이 성을 쌓고 구례 현감인 이원춘에게 석주관 방어를 담당하게 하였다.이는 현재 남아있는 성곽의 잔존부를 통해 쉽게 알 수 있으며, 임진왜란과 정유재란이 끝난 후 조정에서는 이곳 석주관에 고려말 때처럼 만호진을 설치하여 왜구에 대비하여야 한다는 논의가 있었지만, 활용되지 못하고 황폐해지고 현재에 이른다. 성벽의 전체길이는 약 750m이며, 높이 1∼1.5m, 아래폭 1.4∼1.5m 위폭 70∼90㎝ 정도로 대부분은 무너져 훼손된 상태로 근래에 들어 다시금 복원을 하고 있다. 면적 :  29,965㎡성벽 :  전체길이는 약 750m이며 높이 1∼1.5m, 아래 폭 1.4∼1.5m, 윗폭 70∼90cm 정도로서 대부분은 무너진 상태",구례군
4,구례 섬진강 벚꽃길,전라남도 구례군 문척면,127.4697387,35.17925845,http://tong.visitkorea.or.kr/cms/resource/90/2648990_image2_1.jpg,남한 5대강 중 오염되지 않은 최후의 청류로 꼽히는 섬진강변에는 구례를 대표하는 3km가량의 벚나무 가로수 길이 국도 17호선과 19호선을 따라 조성되어 있다. 1992년부터 조성된 이 벚꽃길은 섬진강변을 따라 조성되어 있어 봄의 향기를 느끼면서 멋진 드라이브를 경험할 수 있다. 교통량이 많지 않아 산책하기에도 좋으며 마라톤 코스로도 각광받고 있다. 섬진강 벚꽃길은 ‘한국에서 가장 아름다운 길 100선’에 선정되기도 하였다. 아울러 섬진강에는 은빛으로 반짝이는 은어를 비롯하여 참게 등 30여 종의 담수어가 서식하고 있다. 섬진강 주변의 식당에서는 은어회와 은어구이를 맛볼 수 있으며 참게의 시원한 맛을 곁들인 민물 매운탕은 섬진강을 찾는 많은 여행객의 사랑을 받고 있다.<출처 : 구례군청>,구례군
5,구례 운조루 고택,전라남도 구례군 토지면 운조루길 59,127.5154423,35.2061201,http://tong.visitkorea.or.kr/cms/resource/43/1606843_image2_1.jpg,"류이주는 그가 처음 이사와 살았던 구만들(九萬坪)의 지명을 따 호를 귀만(歸晩)이라 했으며 이 집을 귀만와 (歸晩窩)라고도 불렀다. 운조루라는 택호는 구름속의 새처럼 숨어사는 집이란 뜻과 함께 구름위를 나르는 새가 사는 빼어난 집이란 뜻도 지니고 있다.  그러나 본디 이집의 이름은 중국의 도연명(陶淵明)이 지은 귀거래혜사(歸去來兮辭)에서 따온 글이다. 구름은 무심히 산골짜기에 피어 오르고, 새들은 날기에 지쳐 둥우리로 돌아 오네의 문구에서 첫머리 두 글자를 취해  이름을 지었다고 전해진다. 구례 운조루 고택은 좌청룡 우백호의 산세와  함께 내수구(앞 도랑)와 외수구(섬진강)가 제대로 되어 있는 명당터에 자리잡고 있다. 집 앞의 오봉산은 신하들이  엎드려 절하는 형국이라고하며, 연당은 남쪽의 산세가 불의 형세를 하고 
있어  화재를 예방하기 위하여 조성한 것이라고 한다. 풍수지리설에 의하면 이 일대는 금귀몰니(金龜沒泥), 금환락지(金環落地), 오보교취(五寶交聚), 혹은 오봉귀소(五鳳歸巢)의 명당이 있는 곳이라고 하며, 이 집터에서 거북이의 형상을한 돌이 출토되었기에 금귀몰니의 명당으로서 남한의 3대 길지로 알려져 있다.구례 운조루 고택에는 바깥사랑채, 안사랑채, 아랫사랑채 등으로 각각 누마루가 있었으나 지금은 아쉽게도 안사랑채와 아랫사랑채의 누마루는 남아 있지 아니하다. 현재 이 집은 건평 426.45m²(129평)으로 一 자형 행랑채와 북동쪽의 사당채를 제외하고 T자형의 사랑채와 ㄷ자형의 안채, 안마당의 곡간채가 팔작지붕, 박공지붕, 모임지붕으로 연결되어 있는 일체형 구조를 보이고 있다. 이 집에 있는 목독(나무로된 쌀독의 마개에 <他人能解>라는 글귀를 써두었음)은 가난한 이웃 사람이 쌀을 꺼내 끼니를 이어나갈 수 있도록 허용함으로써  음덕을 베풀고 적선을 하는 것이 돈을 가진 자의 도리임을 보여 주었던 류씨 문중의 상징물이다.200년이 지나도록 망하지 아니하고 오늘날까지 가문이 번창한 것은 오로지 분수를 지키며 생활하고, 이웃을 돌보았던 마음이 전승되어 내려왔기 때문이라고 본다. 류이주의 5세손인 류제양(柳濟陽)은 일만여편의 시(詩)를 쓰고 손자 류형업(柳瀅業)에 이르기까지 80년간 하루도 빠지지않고 생활일기와 농가일기를 썼다는 점이다.  이러한 기록문화는 우리가 본받아야 할 위대한 선조들의 유업이라 아니할 수 없다. 구례에서 연고사, 쌍계사,  하동 방면으로  가는 버스를 타고 토지면 소재지에 내리면 이 일대가 금환락지의 들판이다. 구례 운조루 고택은 이곳 여러 마을 중 오미동에 있다.  창건주 유이주 무덤은 운조루 뒤편 베틀봉이라는 산등성이에 있고 시목나루는  구만리 들판과 섬진강 건너 문척면 회정리를 오고 가던 나루터다. 지금은 나루터의 흔적이 보이지 않고  강변에는 봉소대(鳳巢臺)라는 정자가 있다. 구례 운조루 고택과 함께 답사할 곳은 화엄사와 천은사, 장수마을 사도리, 매천사당 등이 있다.",구례군
6,구례목재문화체험장,전남 구례군 간전면 효곡리 366-1,127.5406334,35.13918363,http://tong.visitkorea.or.kr/cms/resource/42/2796442_image2_1.jpg,"우리 생활 속 목재의 쓰임새, 목재의 생산과정, 목재의 종류 등을 한눈에 알아볼 수 있는 목재체험관이다. 다양한 전시물과 함께 목재를 활용한 생활 공예품, 놀이기구, 학습도구 등  목재품을 직접 만지고, 느끼고, 만들어 볼 수 있는 체험이 있고 전문적, 체계적, 정기적인 목공 교육을 할 수 있는 공간의 장도 마련되어 있다.",구례군
7,구례편백나무숲,전라남도 구례군 산동면 계천리 산124-5,127.4376232,35.34789164,http://tong.visitkorea.or.kr/cms/resource/41/2800041_image2_1.jpg,"이곳의 편백나무 숲은 40여 년 전에 조성되었다. 해방과 한국전쟁을 거치면서 우리나라의 산은 헐벗은 상태가 되었고, 이후 조림은 국가의 중대한 역점사업이기도 했다. 당시는 헐벗은 산의 거름이 되도록 하기 위해 아궁이 불을 때기 위한 낙엽 채취조차 금지되었을 정도로 산림정책은 엄격했다. 이곳의 편백나무 숲은 70년대 우리나라 숲 가꾸기 역사의 자취를 고스란히 담고 있다. 편백나무 숲 바로 아래 계곡에는 산장이 있어 편백나무로 만든 찜질방에서 등산 후의 피곤을 달랠 수 있다.",구례군
8,구만마을,전라남도 구례군 토지면 구산길 81-4,127.528558,35.19906557,http://tong.visitkorea.or.kr/cms/resource/59/2800059_image2_1.jpg,"서시천이 상류에서부터 9번째로 굽이치는 곳에 위치했다고 구만리라 했다고 한다. 마을 뒤로 구만저수지가 만들어져 농업용수를 대고 있다. 최근 들어 구만저수지에 수상레저타운 시설이 들어왔다. 528,925㎡의 넓은 저수지가 주변 풍광과 어우러져 시원한 풍광을 연출한다. 서시천에는 매년 수천 마리의 철새들이 찾아온다. 비오리, 흰뺨검둥오리, 청둥오리, 큰고니 등이며 백로와 왜가리는 거의 매일 볼 수 있는 새이다. 서시천 좌우 둑방길이 있는데 이 길 좌우로 군에서 벚나무와 원추리를 심었다. 봄에는 섬진강 벚꽃 축제가 벌어지고 원추리 꽃이 피는 7, 8월이 되면 꽃길 걷기가 유행이다. 구례군에서는 매년 원추리 꽃길 건강 걷기 행사를 하고 있다. 약 3.5km 구간으로 원추리꽃이 피는 7월에 열린다.",구례군
9,국립공원공단 종복원기술원,전라남도 구례군 마산면 화엄사로 402-31,127.4904991,35.24237391,http://tong.visitkorea.or.kr/cms/resource/34/1198634_image2_1.jpg,"국립공원공단 종복원기술원은 우리 곁에서 사라져가는 야생동물을 보호하고 복원하는 전문기관으로 우리나라에서 처음으로 중대형 포유류인 반달가슴곰과 산양 복원 등을 진행하고 있다.국립공원공단 종복원기술원의 생태학습장은 복원 프로젝트 과정 중 지리산에 적응하지 못하여 회수된 개체를 증식하는 시설로 탐방객에게 반달가슴곰의 의미와 중요성을 전달하기 위한 시설이며 해설가의 설명을 들으면서, 반달가슴곰의 생태를 직접 관찰할 수 있다.",구례군
10,기촌마을,전라남도 구례군 토지면 피아골로 6,127.6023459,35.20089442,http://tong.visitkorea.or.kr/cms/resource/46/2787546_image2_1.jpg,"전남 구례읍 토지면의 기촌마을은 19번 국도에서 피아골 가는 입구에 있는 마을로 지리산 둘레길 가탄~송정 코스를 걷다 보면 만날 수 있다. 목아재에서 기촌마을로 향하는 3Km가 조금 넘는 산길은 지리산 둘레길 구례 구간 중 가장 걷기 좋은 길로 알려져 있다. 기촌마을로 내려가는 길 중간엔 엄청난 규모의 밤나무밭이 있고 둥굴레 나무와 녹차밭도 있다. 기촌마을은 약 40년 전까지 문 종이, 즉 한지를 만들었으나 지금은 거의 찾아볼 수 없고, 한봉(토종꿀)과 밤나무를 주 수입원으로 삼고 있다. 펜션단지가 있는 은어마을이 기촌마을 맞은편에 있다.",구례군
11,난동마을,전라남도 구례군 광의면 난동길 40,127.4464937,35.27862461,http://tong.visitkorea.or.kr/cms/resource/72/2800072_image2_1.jpg,"난동마을에는 할아버지 당산과 할머니 당산 등 두 개의 당산이 있다. 조탑 옆에 서 있는 당산나무가 할아버지 당산나무라면, 난동마을의 할머니 당산나무는 마을 안쪽에 자리를 잡고 마을의 안녕을 지켜주고 있다. 마을에서는 매년 정월 초하루 당산제를 지내는데, 할아버지 나무가 있는 윗 당산과 할머니 나무가 있는 아랫 당산 두 곳에서 당산제를 거행한다. 지리산 생태숲이 있는 지초봉 아래에 자리하고 있으며, 당동마을처럼 산 중턱에 자리해 들판 내려보는 전망이 좋다. 지리산 둘레길은 마을의 오른쪽으로 난 길을 따라간다. 그 길 끝에 마을의 역사만큼 오래 묵은 소나무 몇 그루가 어울려 자라고 있다. 솔숲 가운데는 제당을 꾸려놨는데, 정자도 있어 쉬어가기 좋다.",구례군
12,남산마을,전라남도 구례군 토지면 내서리,127.5733169,35.23953956,http://tong.visitkorea.or.kr/cms/resource/07/2790307_image2_1.jpg,"남산마을은 지리산 둘레길 가탄~송정 구간에 있는 마을로 피아골 둘레길 목아재-당재 구간과 합류하는 길에 있다. 내서천을 바라보고 선 남산마을은 경사가 심한 다랑논으로 삶의 터전이 형성되었고 마을 형세가 서울 남산과 비슷하여 남산마을이라 부른다고 한다. 또한, 이곳은 과거 여순사건과 6·25동란 때 반란군의 은신처를 없앤다고 하여 마을이 불탔으며 인민재판을 받아야 했던 아픔의 역사도 들어 있다. 하지만 내서리 계곡을 끼고 있으며 사시사철 수려한 경관을 즐길 수 있는 한적한 마을로 남산마을에서 내려다보는 지리산 피아골의 풍경은 장관이다.",구례군
13,내죽마을,전라남도 구례군 토지면 오미리,127.5162172,35.20683948,http://tong.visitkorea.or.kr/cms/resource/18/2790318_image2_1.jpg,"내죽마을은 대나무와 문수천의 시냇물을 따서 ‘대내’라 불렀다고도 한다. 또 대나무가 울창해서 대내라 했다고 하는데 대내 마을 중에 안쪽에 있다고 해서 안 대내, 내죽이라 불렀다고 한다. 내죽마을에 들어서면 평화로워 보이는 마을 풍경과 함께 저수지 아래쪽으로 새로 지은 집들도 속속 들어서고 있는 모습이 보인다. 노고단 아래쪽 문수골에서 발원한 토지천은 문수제 저수지에서 잠시 숨을 돌리며 이곳 사람들에게 풍부한 물을 제공하고 내죽교를 지나 섬진강에 이른다. 지리산 둘레길 송정-오미 구간에 있는 마을로 내죽마을에서 오미마을로 가는 길에는 마을 빨래터가 곳곳에 눈에 띈다.",구례군
14,농업기술센터 자연생태학습장,전라남도 구례군 구례읍 동산1길 32,127.4605057,35.19740346,http://tong.visitkorea.or.kr/cms/resource/66/608766_image2_1.jpg,"지리산은  우리나라 야생화의 30%인 1,323종을 보유한 야생화의 보고이다. 구례군 농업기술센터는 1988년부터 용담꽃을 시작으로 분화재배 기술, 노고단 향수, 구례소리 전통향, 캐릭터 상품 개발 등 야생화 관련 연구를 지속해 온 야생화의 메카로서 전국 유일의 야생화 압화 전시관, 잠자리 생태 전시관, 농경유물 전시관, 전통 작물 전시관, 야생화 자연학습원, 야생화 재배학습원 등으로 구성되어 있다.",구례군
15,농평마을,전라남도 구례군 토지면 내동리,127.5736438,35.26923899,http://tong.visitkorea.or.kr/cms/resource/27/2790327_image2_1.jpg,"농평은 도로가 갈 수 있는 가장 끝, 삼도봉에서 뻗은 능선과 10여 분 떨어진 산중의 산마을이다. 풍수지리설 ‘노호농골(老號弄骨)의 대지 근처에 평평한 곳’이라 해서 농평이라 부른다. 농평마을은 자연마을 단위로는 국내에서 손꼽히는 고산 동네로 바로 옆에 있는 지리산 능선을 타고 북쪽으로 올라서면 지리산 삼도봉에 닿고, 남쪽으로 내려서면 황장산을 지나 19번 국도까지 길이 이어진다. 2019년 폐쇄된 지리산둘레길 목아재~당재? 구간의 끝지점에 있다. 이곳에서부터 길이 끊어진다. 지금은 주로 황장산 산행을 즐기려는 등산객들이 찾고 있다.",구례군
16,당동마을 (구례예술인마을),전라남도 구례군 광의면 예술인길 38,127.4492324,35.27569444,http://tong.visitkorea.or.kr/cms/resource/25/2796425_image2_1.jpg,"지리산 남악 사당이 이 마을 북쪽에 있었다고 해서 당동 마을이란 이름을 얻었다. 이곳에는 구례 예술인마을이 있는데 화가, 도예가, 건축가 등 예술인 약 30호가 모인 마을이다. 현대적이고 아름다운 건축물이 멋스럽게 어우러져 있으며 갤러리, 게스트하우스, 카페, 주차장 등 편의 시설이 갖추어져 있다. 8만 5950㎡의 용지에 창작과 주거 기능을 갖춘 작업실들은 조각과 회화, 사진 등 장르의 성격에 맞게 화가들이 꾸밀 수 있고 별도의 전시실도 설치할 수 있도록 했다. 구례의 섬진강과 지리산, 풍부한 문화자원들은 상상력을 자극하고, 겨울에도 비교적 춥지 않아 예술가들에게는 작업하기에 매력적인 장소인데다가 완주순천간고속도로의 개통으로 서울까지 3시간이면 닿을 수 있는 최적의 입지조건을 갖추고 있다. 지리산 둘레길과 화엄사, 천은사 등의 문화유적과 연계되는 문화관광 벨트를 형성하고 있다.",구례군
17,당몰샘,전남 구례군 마산면 사도리,127.4994768,35.21518269,http://tong.visitkorea.or.kr/cms/resource/08/169508_image2_1.jpg,상사 마을은 구례군 간전면 양천 마을과 함께 전국 최장수 마을로 꼽힌다. 이곳 사람들은 장수의 비결로 심산유곡의 깨끗한 환경과 ‘당몰샘’을 꼽는다. 당몰샘은 “지리산 약초 뿌리 녹는 물이 다 흘러든다”라는 말을 할 정도로 효능이 뛰어나다. 1986년 고려대 예방 의학팀의 수질검사 결과 대장균이 한 마리도 없는 전국 최상의 물로 판명됐다. 이 마을 토박이 성씨인 의성 김씨 일가에 의하면 그 선조가 조선 말기에 명당을 찾아 전라도 고을을 헤매던 중 당몰샘을 저울로 달아보니 물 무게가 다른 곳보다 많이 나가고 수량도 풍부하여 이곳에 정착하였다고 한다.,구례군
18,당치마을,전라남도 구례군 토지면 내동리,127.5736438,35.26923899,http://tong.visitkorea.or.kr/cms/resource/35/2790335_image2_1.jpg,"당치마을은 지리산 둘레길 가탄~송정 구간 중간에 목아재에서 갈라지는 목아재~당재 구간?에 있다. 이 구간은 2019년 폐쇄되었지만, 피아골의 단풍, 계곡, 연곡사 등 지리산의 여러 모습을 만날 수 있어 황장산 등반객들이 많이 찾고 있다. 당치경로당 앞에 조망대 데크가 설치되어 있고 MBC TV 프로그램 ‘테마여행 길’에 소개된 닭구이 집이 있다. 화개 장터도 멀지 않고 신라 고찰 연곡사가 가까우며 당치마을에서 당재까지는 '당치 오솔길'도 조성되어 있다. 경상남도 하동군 화개면 목암마을과 경계하고 있으며 1.5km 위에 농평마을이 있다.",구례군
19,목아재,전라남도 구례군 토지면 외곡리,127.6014178,35.21643988,http://tong.visitkorea.or.kr/cms/resource/53/2790353_image2_1.jpg,"구례군 토지면 외곡리 하리에서 내서리 원기, 신촌을 넘는 큰 재로 과거에는 구례에서 화개면 범왕리로 통하는 큰길이었다. 지리산 둘레길 지선이 이곳에서 갈라져 나가 당재(농평마을)까지 이어졌지만 이 길은 2019년 폐쇄되었다. 지리산 둘레길 가탄∼송정 구간의 중간에 있는 높은 산마루로 목아재 왼편에는 송정에서 오는 산길이 있고 오른편에는 가탄으로 내려가는 길이 있다.",구례군
20,문수사 (구례),전남 구례군 토지면 문수리 74,127.5389168,35.2526847,http://tong.visitkorea.or.kr/cms/resource/53/2796453_image2_1.jpg,"문수사의 확실한 창건연대 기록이 전하지 않아 정확한 창건연대를 알 수 없지만 1973년에 극락실전 내에 안치된 금동여래좌상에서 발견된 발원문에서 고려 제29대 충목왕 2년(1346)이란 기록이 있어 고려 때 창건된 사찰로 추정된다. 한편 발원문 발견시에 생모시, 단수포, 쌀, 보리 등 600여 점이 함께 발견되기도 하였다. 조용한 산사분위기를 느낄 수 있으며 봄철에는 주위의 산과 목장에 벚꽃과 야생화가 어우러져 한 폭의 동양화를 연상케 한다.",구례군
21,밤재,전라남도 구례군 산동면 계천리 산12-1,127.4407096,35.32810781,http://tong.visitkorea.or.kr/cms/resource/03/2790603_image2_1.jpg,"지리산 서쪽 줄기로 동쪽으로 숙성치, 서쪽으로 견두산이 이어져 전라남북도의 경계를 이루는 곳이다. 밤재는 밤나무가 많아 생긴 지명이라고 하며, 한자로 율치(栗峙)라고도 하였다. 경상남도 구례군 산동면 밤재길은 이순신 장군에 얽힌 이야기가 전하는 곳이다. 이순신 장군은 백의종군의 명을 받아 권율 도원수가 있는 순천으로 가기 위해 남원을 거쳐 이곳 구례 밤재를 지났다 하여 백의종군길이라 부른다. 또한, 밤재는 구례에서 남원으로 향하는 왜군의 주요 침입 경로이기도 하다. 1998년 밤재터널이 준공되면서 밤재 옛길은 지리산 둘레길 산동-주천 간 22코스의 경로가 되고 있다. 2012년 5월 25일 밤재에서 지리산 둘레길 전구간 개통식과 함께 지리산 둘레길 생명평화비 제막식이 열린 바 있다.",구례군
