,title,addr1,mapx,mapy,firstimage,overview,addr2
18,초의선사 유적지,전라남도 무안군 삼향읍 초의길 30,126.4161203,34.85435785,http://tong.visitkorea.or.kr/cms/resource/55/1606955_image2_1.jpg,"* 초의 장의순 대선사를 기리는 곳, 초의선사 유적지 *초의(장의순) 대선사의 출생지인 삼향면 왕산리 봉수산 자락에 그 분의 높은 정신을 기리고 추모의 장을 마련하였다. 초의선사의 생가가 위치한 이곳에 생가복원, 추모각, 추모비, 유물전시관, 다도관 등을 건립하고 있다.* 초의선사 의순에 대하여 *초의선사는 조선 정조10년(1786) 에 우리군 삼향면 왕산리에서 태어나 15세에 출가한 후 해남 대둔사 일지암에서 40여 년간 수행하면서 선 사상과 차에 관한 저술에 몰두하여 큰 족적을 남기신 분이다. 특히 당시 침체된 불교계에 새로운 선풍을 일으킨 대선사이자 명맥만 유지해 오던 한국 다도를 중흥시킨 다성으로서 지금까지 추앙을 받고 있으며 시, 서, 화에 능통하여 5절이라 일컬어지고 있다. 초의선사는 다산 정약용선생과 추사 김정희 선생 등 당대 최고의 거유 석학들과 깊은 교류를 통하여 도교는 물론 유교 등 범서에도 능통한 분이었다. 1866년 80세에 입적하였으며, 저서로는 《초의집(草衣集)》《선문사변만어(禪門四辨漫語)》 《이선내의(二禪來義)》가 있다. 1828년 지리산 칠불암에 머물면서 지은 차서(茶書)인 《다신전(茶神傳)》이 있다. 다신전의 내용은 찻잎따기, 차만들기, 차의 식별법, 차의 보관, 물을 끓이는 법, 차를 끓이는 법, 차를 마시는 법, 차의 향기, 차의 색 등 20여 가지 목차로 상세하게 다룬 책이다.",무안군
19,톱머리 해수욕장,전라남도 무안군 망운면 톱머리길 66,126.3870256,34.96815843,http://tong.visitkorea.or.kr/cms/resource/87/194887_image2_1.jpg,"무안읍에서 서쪽으로 8㎞ 정도 떨어진 망운면 피서리에 위치한 톱머리 해수욕장은 조수간만의 차가 심하여 간조 때 펼쳐지는 끝없이 넓은 백사장과 보호림으로 지정된 해송 숲이 조화를 이루어 아름다운 경관을 자랑한다. 해수욕장 긴 백사장을 따라 횟집들이 자리 잡고 있어 해수욕과 함께 싱싱한 생선회도 즐길 수 있다. 백사장 길이 2㎞, 폭 100m이다. 교통편도 편리한 편으로 가족 단위 피서객이 많이 찾으며, 호젓하면서도 빼어난 경관과 인근 해안에는 돔, 숭어 등 어족이 풍부하여 낚시와 피서를 즐기는 사람들이 즐겨 찾는다. 또 이 지역에서는 선물용으로 인기가 좋은 단감이 많이 생산된다.
(출처: 무안관광홈페이지)",무안군
20,톱머리마을,전남 무안군 망운면 피서리,126.3823649,34.96955264,http://tong.visitkorea.or.kr/cms/resource/31/1971031_image2_1.jpg,"* 톱머리마을 *톱머리 마을은 무성한 노송과 모래사장이 조화를 이룬 뛰어난 경관을 보유하고 있으며 자연산 각종 어패류를 맛볼 수 있는 곳이다. 인근에 곰솔나무, 조금나루유원지, 홀통유원지, 바다낚시터, 윈드서핑장 등의 관광지가 있고, 특히 톱머리 단감은 당도와 빛깔에서 단연 으뜸이며 옛날 임금님 진상품으로 유명하다.* 톱머리마을, 피서리에 대하여 *1km의 백사장이 펼쳐진 해수욕장이 자리한 지역으로, 주변에 춘교저수지가 있다. 자연마을로는 조산, 정착, 톱머리마을이 있다. 조산마을은 마을이 형성될 당시에는 마을 가운데에 산이 있고 그 산 속에 절이 있어서 경관이 훌륭하다 하여 조산(造山)이라 하였다 한다. 정착마을은 일제강점기 때 비행장을 건설하다가 해방이 되자 황무지로 버려져 있던 곳을 1.4후퇴 후 1957년 피난민 입주지역으로 선정하여 난민들이 정착하게 되면서 '정착(定着)'이라 칭하게 되었다. 톱머리마을에서는 망운면의 특산물인 톱머리 단감 재배가 활발하다.",무안군
21,품바발상지,전라남도 무안군 일로읍 의산리,126.5049517,34.83998593,http://tong.visitkorea.or.kr/cms/resource/21/2689621_image2_1.jpg,"* 품바가 탄생한 옛터, 품바발상지 *일로읍 의산리에 소재한 천사촌은 우리 민족의 한과 울분의 역사를 마감하고 희망찬 새 시대의 도래를 염원하는 우리 모두의 소망을 담은 상황 연극의 효시인 ‘품바’가 탄생한 옛 터다. 품바는 1981년 당시 일로면 공회당에서 인의 예술회를 통해 문화활동을 해오던 시인이며 극작가인 이 고장 출신 고 김시라의 각색 ·연출과 정규수(1대 품바) 출연으로 초연한 이후 국내외 4000여 회 최장기 공연으로 최다 관객을 동원하는 기록을 수립하였다.* 품바발상지인 천사촌 *천사마을이라는 명칭보다는 1982년 12월에 초연되어  4천여 회 이상 국내외 공연한 향토극의 대표적인 작품, ‘작년에 왔던 각설이 죽지도 않고 또 왔네’라는 품바 일인극으로 더 유명한 곳. 어느 해인가 한 해가 들었는데 이곳 일로에만 유독 걸인들이 모여들어 주민대표들이 모여 어찌 한 해가 들었는데 이곳으로만 모여드느냐고 불평했더니, “타향에서 괄시 받고, 푸대접 받다가 이곳 일로에 오니 문전 박대 않고 한 끼니만 있어도 나누었는지라, 고향에 온 기분으로 떠나지 않고 눌러 앉았다.”라고 걸인들이 대답하니 주민들은 오히려 그들의 사정을 불쌍히 여겨 더욱더 도와준 후로 천사촌이 이루어졌다는 일화가 전해 내려오고 있다. 각설(覺設)이라는 뜻은 깨우칠 각(覺), 말씀 설(說)로 가진 것 하나 없고 조롱의 대상인 각설이가 그 상황을 뛰어넘어 이 세상을 살아가는 우리들에게 가르침을 준다는 뜻으로  5000년을 이어온 우리의 걸인패의 한 단면을 보여주는 그 대표적인 것이 품바이다.",무안군
22,홀통유원지·홀통해변,전라남도 무안군 현경면 오류리,126.3363612,35.06136651,http://tong.visitkorea.or.kr/cms/resource/05/194905_image2_1.jpg,"* 천혜의 자연발생적 유원지, 홀통유원지 *전라남도 영광군·무안군·함평군 3군에  둘러싸인 함평만에 있는 유원지이다. 천혜의 자연발생적 유원지로 울창한  해송과 긴 백사장이 장관을 이루고 있다. 해수욕, 야영, 바다낚시, 해수찜을 동시에 즐길 수 있는 곳으로 여름 피서지로 각광을 받고 있다.* 홀통유원지의 볼거리 및 즐길거리 *수심이 낮고 파도가 잔잔하여 해양 스포츠의 꽃이라  불리는 윈드서핑의 최적지로 널리 알려져 있으며 매년 전국단위 윈드서핑 대회를  개최하고 있다. 무안군 남쪽 목포시에 유달산조각공원·난공원·국립해양박물관·영안농업박물관  등 가볼 만한 곳이 많다.",무안군
