,title,addr1,mapx,mapy,firstimage,overview,addr2
0,경천저수지,전라북도 완주군 화산면 성북리,127.2395172,36.03814317,http://tong.visitkorea.or.kr/cms/resource/44/2784844_image2_1.png,"전북 완주군 화산면에 있는 저수지다. 둘레가 16km, 만수 면적이 319ha에 이르고 담수어가 많이 서식하고 있다. 저수지 제방 아래 피는 벚꽃은 아름다운 경관을 자랑하며 저수지 북쪽의 고성산성은 백제 시대 축조된 산성으로 화산면 일대를 한눈에 조망할 수 있다. 서쪽으로 호남고속도로가 지나고, 익산시 미륵사지를 중심으로 한 관광 명소에 인접해 있다. 경천저수지에서 잡히는 참붕어는 전국적으로 유명하다. 아름다운 풍경 속에서 캠핑을 즐길 수 있는 완주 자연쉼터빌리지가 있다. 


?",완주군
1,고산향교,전라북도 완주군 고산면 고산로 147-27,127.2144711,35.97616369,http://tong.visitkorea.or.kr/cms/resource/98/1604398_image2_1.jpg,"1397년(태조 7) 지방의 중등교육과 현유(賢儒)의 위패를 봉안, 배향하고 지방의 중등교육과 지방민의 교화를 위하여 창건되었다. 1399년(정종 1)에 소실되었다가 그 뒤 복원하였으며, 임진왜란 때 다시 소실되어 1601년(선조 34) 대성전을, 1604년 명륜당을 건립하였다. 1966년 대성전과 명륜당을 보수하였으며, 현존하는 건물로는 대성전·명륜당·동재·서재·삼문(三門)·교직사(校直舍)·기타 부속건물 등이 있다. 정면 3칸, 측면 3칸의 맞배지붕으로 된 대성전에는 5성(五聖), 송조4현(宋朝四賢), 우리나라 18현(十八賢)의 위패가 봉안되어 있으며, ‘대성지성문선왕(大成至聖文宣王)’이라 쓰인 공자(孔子)의 영정은 조선 중기 송영구(宋英耉)가 당나라의 화가 오도현(吳道玄)의 작품을 받아온 것이라 전한다. 조선시대에는 국가로부터 전답과 노비·전적 등을 지급받아 교관이 교생을 가르쳤으나, 현재는 교육적 기능은 없어지고 봄가을 석전(釋奠)을 봉행(奉行)하고 초하루와 보름에 분향을 하고 있으며, 전교(典校) 1명과 장의(掌議) 6∼7명이 운영을 담당하고 있다. 이 향교에는 효종 6년(1655)부터 영조 때까지의 역사를 기록한 서적 및 광해조 때부터 전해오는 족자 등이 있다. 이 향교의 대성전은 전라북도 유형문화재로 지정되어 있다.",완주군
2,고산향교대성전,전라북도 완주군 고산면 고산로 147-23,127.2137378,35.97611368,http://tong.visitkorea.or.kr/cms/resource/01/1604401_image2_1.jpg,"* 지방백성의 교육을 담당하던 곳 * 전라북도 유형문화재 제116호로 지정되었다. 조선시대의 지방 국립학교로 성현의 위패를 모시고 제사를 지내며, 지방 백성의 교육을 담당하기 위해 국가에서 세운 지방 교육기관이다.대성전은 정면 3칸, 측면 3칸의 맞배집 구조 이며, 처음 지어진 연대는 정확히 알 수 없으나 태조 7년(1398)에 지금의 위치에 세워진 것으로 추정된다. 정종 2년(1400)에 불타 없어진 것을 다시 지었는데, 당시의 건물들은 임진왜란 때 모두 불타 없어지고 1601년(선조 34)에 대성전이, 그리고 1604년에 명륜당이 재차 중건되어 오늘에 이른다. 현재 남아있는 건물은 대성전·명륜당·동재·서재·내삼문 등이 있다.경사지에 외삼문-명륜당-내삼문-대성전을 하나의 축선상에 배치하여 뚜렷한 수직적 위계를 보여준다. 현재 명륜당을 중심으로 동재(東齋)와 서재(西齋)가 명륜당 뒤편에 있으며, 동재와 서재 가운데에 마당이 있고, 이 마당 뒤편 중앙에 대성전으로 들어가는 내삼문(內三門)이 있다. 대성전은 1948년 전면을 보수하였는데, 정면 3칸 측면 3칸의 맞배지붕으로 되어 있다.* 18인의 위패를 모셔놓은 곳 대성전 * 대성전은 제사공간의 중심을 이루는 건물로 앞면 3칸·옆면 3칸이며, 지붕은 옆면이 사람 인(人)자 모양인 맞배지붕이다. 안에는‘대성지성문선왕’이라 쓴 공자의 위패를 중심으로 중국 성현을 모시고 있다. 공자의 영정은 조선 중기에 당나라 화가의 작품을 받아온 것이라 한다. 고산향교는 매년 봄, 가을로 두 차례 공자를 위시한 중국5성과 송조4현 및 우리나라의 유학자 설총, 최치원, 정몽주, 이황 등 18현의 위폐를 모셔놓고 제사를 지내고 있다.",완주군
3,구이 안덕 건강힐링체험마을,전라북도 완주군 구이면 장파길 72,127.099833,35.69559084,http://tong.visitkorea.or.kr/cms/resource/20/1814620_image2_1.jpg,"* 뜨끈한 힐링타임 완주 안덕마을 *‘자연과 함께하는 건강?힐링 체험’을 테마로 한 안덕마을은 완주의 모악산 자락의 계곡 주변에 위치하여 자연과 어우러져 아기자기한 주변 경치가 뛰어나다. 건강과 힐링을 추구하는 마을답게 한옥 황토펜션뿐만 아니라 황토한증막 등을 갖추고 있어 추운 겨울, 설경을 즐기며 뜨끈한 찜질을 즐길 수 있는 곳이다. 연중으로는 흔들다리 등으로 구성된 체육시설에서 아이들의 모험심을 기를 수 있는 미니어드벤처 프로그램을 진행하며 인근의 자연동굴 탐사도 기억에 남는 경험이 될 것이다.",완주군
4,농업회사법인 주식회사 공동체공간 수작,전라북도 완주군 단지길 37,127.2631954,35.94206287,http://tong.visitkorea.or.kr/cms/resource/48/2995148_image2_1.jpg,"공동체공간 수작은 스토리가 있고 근본을 찾는 지역특산주를 생산하는 양조장이다.장기간의 누룩의 법제를 통해 기존누룩이 가지고 있는 장점과 지역의 자연환경에 있는 자연효모를 채집하여 기존 누룩에서 발현하지 못하는 다양한 향관 맛을 만들어 내고 있다. 쌀과 누룩, 정제수만을 활용해서 지역특산주를 생산하고 있으며, 쌀이 가지고 있는 본연의 맛을 추구하고자 하며, 장기간의 저온 숙성과정을 거친후 제품을 생산하고 있다.자연환경과 농촌민박 및 튀르키예 전문 찻집을 활용한 지역 관광의 중심이 되게 하고자 노력 중이다.",완주군
5,달달구리(주식회사달달구리),전라북도 완주군 봉동동서로 134-4,127.1668457,35.93866991,http://tong.visitkorea.or.kr/cms/resource/32/2995132_image2_1.jpg,"달달구리는 완주 청년들이 지역 생태 관광의 중심지로 떠오르고 있는 만경강에 터를 잡아 지역 식음기념품을 개발하여 판매하는 청년 사업체이다. 베이킹, 플로리스트등 역량을 갖춘 청년들이 ‘달달구리 카페’를 거점으로 지역 농산물을 주재료로 삼는 식음 및 체험관광 서비스, 기념품 등을 만들고, 지역의 주요 관광 거점을 통해 지역을 찾는 관광객들에게 제공한다.",완주군
6,대둔산도립공원(전북),전라북도 완주군 운주면 산북리 611-34,127.3345288,36.11761078,http://tong.visitkorea.or.kr/cms/resource/77/2827477_image2_1.jpg,"노령산맥 줄기가 김제의 만경평야를 향하다 금산지역에서 독립된 산군을 이루며 절경을 이룬 곳이 대둔산이다. 호남의 소금강이라 불리는 이 산은 정상인 마천대(879.1m)를 비롯하여 사방으로 뻗은 여러 산줄기가 어우러져 칠성봉, 장군봉 등 멋진 암봉을 이루고, 삼선 바위, 용문골(장군봉, 칠성봉), 금강통문(동심암, 금강암, 약수터, 삼선암, 왕관암, 마천대) 등 사방으로 기암괴석과 수목이 한데 어우러져 산세가 수려하다. 마천대에서 북쪽 능선을 따라 낙조대에 이르는 구간은 특히 장관으로 이 낙조대에서 바라보는 일출, 일몰 광경이 일품이다. 1977년 도립공원으로 지정되어 관광객을 위해 케이블카, 금강 구름다리 등이 설치되어 새로운 명물이 되었다. 5분 정도 케이블카를 타고 내려서면 가파른 계단을 올라 금강구름다리인데 이는 임금바위와 입석대 사이를 가로질러 놓은 것으로 높이 81m, 길이 50m다. 이곳에는 또한 진산의 태고사, 운주의 안심사, 별곡의 신소운사 등의 유서 깊은 절도 남아 있다.",완주군
7,대둔산케이블카,전라북도 완주군 운주면 대둔산공원길 55,127.3294987,36.11669135,http://tong.visitkorea.or.kr/cms/resource/05/2707905_image2_1.jpg,"대둔산 케이블카는 1990년 11월 운행을 시작했으며, 선로길이 927m 경사 23도를 유지하며 2대가 서로 교행하는 왕복식 케이블카로 상부역사까지 최대 50명이 약 5분안에 도착할 수 있는 케이블카다. 케이블카에서 내려다 보이는 대둔산의 웅장한 산세와 기암괴석은 병풍처럼 펼처져 절경을 이루고 있으며, 호남의 소금강이라 불린다.",완주군
8,대아저수지(대아호),전라북도 완주군 동상면 대아리,127.2732437,35.97308173,http://tong.visitkorea.or.kr/cms/resource/01/287401_image2_1.jpg,"운암산과 동성산, 위봉산 등 아래 계곡을 막아 인공적으로 만들어진 대아 저수지는 주변 산세와 호수가 절묘하게 어우러져 아름다운 자태를 뽐내고 있는 완주 8경 가운데 하나이다.1920년~1922년 기간에 만들어진 댐이 노후 되어 기존 댐의 300m 하류지역에 새 댐을 건설하였다.새 댐은 1983년 착공하여 1990년에 완공되었으며 대아댐은 5,464ha/㎥이르는 방대한 저수량을 자랑한다. 대아저수지는 인공으로 만들어진 저수지답지 않게 자연스럽고 빼어난 경관을 자랑한다. 기암절벽이 병풍처럼 둘러있는 운암산 (해발 597m)과 우아하고 부드러운 산세의 동성산은 그 아래 잔잔하고 푸른 두 개의 호수를 곱게 물들인 치맛자락처럼 펼쳐놓았다.* 20km의 아름다운 호반도로 *대아저수지를 감돌아 동상저수지에 이르는 호반도로는 말끔히 포장되어 드라이브 코스의 운치를 만끽할 수 있다. 두 개의 저수지를 잇는 20km의 호반도로가 관통하는 주변경관은 사시사철 빼어난 경관을 자랑하고 있다.주변 운암산 기슭에는 대단위 자연휴양림이 조성되어 있으며, 연장 255m, 높이 55m의 댐에서 낙차 47m로 방류하는 모습은 장관을 이룬다.
완주군 대아·동상저수지 호반도로 주변을 돌아오는 드라이브 산책 코스는 권할만하다. 가족과 함께, 아니면 연인과 함께 대자연의 아늑함을 느끼면서 하루를 보낼 수 있는 이곳은 전국적으로도 유명한 드라이브 코스로 각광받고 있기 때문이다. 인근에는 미륵사(彌勒寺) 위봉산 위봉사, 위봉폭포가 있어 많은 관광 휴양객들이 찾아온다.",완주군
9,동상운장산계곡,전라북도 완주군 동상면 대아리,127.2860868,35.9783508,http://tong.visitkorea.or.kr/cms/resource/55/215355_image2_1.jpg,"전주에서 32Km 지점, 완주군의 최동단에 위치한 동상운장산계곡은 소양면 위봉산과 진안 운장산 사이에 위치한 우리나라 8대 오지중의 하나로 깊은 계곡이다. 대아댐을 지나 소양 쪽으로 732번 지방도를 따라 가다보면 첫 번째로 나타나는 계곡은 은천계곡이다. 이어 우암교를 지나 좀 더 가다보면 진안 주천으로 향하는 계곡이 나타난다. 이곳 신월교에서 부터 동상운장산계곡이 시작된다. 신월교에서 운장산에 이르는 9.2Km 계곡 길은 어느 것 하나 대수롭게 여길만한 것들이 하나도 없을 만큼 신비경으로 감탄사가 절로 난다. 여름이면 계곡마다 피서인파로 발디딜 틈이 없을 만큼 북새통을 이루고, 가을이면 주변경관과 어우러져 한 폭의 산수화를 연상하게 한다.",완주군
10,둔산공원,전라북도 완주군 봉동읍 둔산3로 94,127.1284208,35.96095836,http://tong.visitkorea.or.kr/cms/resource/43/2755843_image2_1.png,"둔산공원은 대둔산과 모악산이 있어 자연 속에서 살기 좋은 도시 완주를 대표하는 도시 근린공원이다. 아파트 단지 앞에 조성된 공원이라 아침저녁으로 운동하고, 산책하는 시민들이 많은 곳으로, 어르신들을 위한 게이트볼 장, 운동기구, 아이들을 위한 모래 놀이터, 자전거 타기, 축구 등을 할 수 있는 넓은 잔디밭, 공원 한편에는 공연장도 갖추고 있을 정도로 넓고 규모가 큰 공원이다. 데크로드를 따라 생태연못을 한 바퀴 돌아도 보고, 아이들과 놀이터의 미끄럼틀, 그네, 모래놀이도 하고, 반려견과 함께 산책을 즐기다 보면 일상에서 느낄 수 있는 편안함과 안락함이 가득한 곳이다.",완주군
11,만듦협동조합,전라북도 완주군 삼례나들목로 338-33 삼례중학교,127.0845924,35.92317302,http://tong.visitkorea.or.kr/cms/resource/86/2996386_image2_1.jpg,"만듦협동조합은 “같이 하며, 가치 있게”라는 모토로 친환경 제품 제작활동과 환경교육을 통해 함께 환경을 지키고자 노력한다. 특히 버려지는 커피찌꺼기는 환경보호와 재활용의 중요성을 강조하면서도 독특하고 유용한 제품들이다. 관광객들은 이러한 제품을 구매하거나 체험할 수 있으며, 동시에 환경에 대한 관심과 참여를 높일 수 있다. 커피의 매력과 재활용의 가치를 한데 모은 이 제품들은 지속가능한 소비와 환경보호를 위한 작은 노력의 일부분이 될 것이다.",완주군
12,말순농장,전라북도 완주군 비봉면 소농리 485,127.1416271,35.99436867,http://tong.visitkorea.or.kr/cms/resource/62/2815062_image2_1.jpeg,말순농장은 말과 함께 다양한 체험을 할 수 있는 체험농장이다. 동물과의 교감을 통해 마음을 치유받을 수 있다. 아이와 함께 하기에 좋은 자연체험농장이다.,완주군
13,모악산,전라북도 완주군 모악산길 91 모악산관리사무소,127.1098841,35.72950938,http://tong.visitkorea.or.kr/cms/resource/04/2720904_image2_1.jpg,"* 연경관이 빼어 난 호남사경 중 하나 * 
호남고속도로의 교차로에서 6Km 거리에 있는 모악산은 높이 795.2m로 김제평야의 동쪽에 우뚝 솟아있어 호남평야를 한눈에 내려다 볼 수 있다. 1971년 도립공원으로 지정되었으며 호남 4경의 하나로 꼽을 정도로 경관이 빼어나고 국보와 보물 등의 문화재가 많다. 특히 이곳에는 백제 법왕 원년(599년)에 세워지고 10여 점의 각종 주요 문화재를 갖고 있는 금산사가 자리하고 있어 찬란한 불교예술을 살펴볼 수 있다. 

모악산을 넘어서 동남쪽 중턱에 대원사, 수왕사 등의 사찰이 있고, 서쪽으로 귀신사가 있다. 불교의 미륵사상이 도입된 이래 호남지방에서 미륵사상은 모악산을 중심으로 펼쳐졌다. 예로부터 미륵신앙의 본거지로 여겨져 증산교와 더불어 30-40년대 각종 신흥종교 집단지로도 관심을 끌었으며 모악산 기슭에는 대원사, 귀신사, 수왕사 등의 사찰을 비롯해 무려 80여개의 암자가 있었다고 한다.

* 호남평야와 김제평야의 젖줄 *
모악산 정상에서 흐르는 물은 동으로 구이저수지, 서로 금평저수지, 남으로 안덕 저수지, 북으로 는 불선제, 중인제, 갈마제를 채우고 김제평야와 호남평야를 온통 적셔주는 젖줄의 역할을 하고 있다. 모악산의 봄 경관은 아름답다. 흔히 호남사경을 말 할 때 첫 번째가 금산사의 봄 경치이고, 다음이 변산반도의 여름풍경, 내장산의 가을단풍, 그리고 끝으로 백양사의 설경을 꼽는다.

* 진달래와 벚꽃이 만발한 곳 모악 춘경 *
4월이 되면 주차장에서 일주문에 이르기까지의 벚꽃 터널은 장관이다. 진달래가 만발해 꽃구경을 하면서 정상까지 오를 수 있다. 산 전체에 벚꽃이 만발하고 신록이 우거져 예로부터 모악춘경(母岳春景)이라 불리는 것 또한 이런 이유에서 이다. 여러 갈래로 나누어진 수많은 등산코스는 제각기 독특한 풍광과 민속신앙을 담은 암자가 하나씩 어우러진 신비감마저 불러일으킨다. 정상에 오르면 김제평야와 만경강이 시야에 들어오고 동으로 전주가 발아래 있고, 남으로는 내장산, 서쪽으로는 변산반도가 멀리 보인다.",완주군
14,물고기마을,전라북도 완주군 이서면 반교로 311,127.0306826,35.84430051,http://tong.visitkorea.or.kr/cms/resource/18/2740818_image2_1.png,"""단순히 기르는 어업에서 탈피하여 보고, 즐기고, 느끼는 체험관광형 공유문화공간이다.
물고기마을, 풋살장, 놀이방 시설, 실내 체험장 등의 시설을 구비하고 있다. 물고기 먹이주기, 물고기 만져보기, 물고기 잡기, 미니어항 만들기, 낚시 체험, 물고기 팽이 만들기 등 다양한 체험을 즐길 수 있다. 이외에도 동물 먹이주기, 새 모이주기, 동물그림 그리기 등의 다양한 프로그램이 있어 어린이들이 직접 다양한 체험을 하고, 새로운 경험을 함으로써 창의력을 증진시킬 수 있다. 더불어 가족과 함께 색다른 추억도 만들 수 있는 곳이다.""",완주군
15,봉서사(완주),전라북도 완주군 용진읍 봉서안길 313,127.2191391,35.90873256,http://tong.visitkorea.or.kr/cms/resource/77/2710677_image2_1.jpg," 종남산과 서대산 사이의 계곡에 있다. 서방산 정상에서면 김제평야가 한눈에 바라다보이고 맑은날에는 서해바다가 바라다 보인다.봉서사를 찾아가려면 전북 향토사단의 유격장을 지나야 한다. 유격장을 지나면 간중제가 위치해 있는데 주변 산과 어우러져 정겨운 한폭 그림을 연상케 한다.봉서사는 신라 성덕왕 26년(727년)에 창건되었으며 고려 공민왕때 나옹화상이, 조선시대 선조 때에는 진묵대사가 중창하고 이곳에 머물면서 중생을 교화하였던 유서 깊은 절이다. 1945년전까지는 지방 굴지의 대찰이었으나 6. 25때 대웅전을 비롯한 건물들이 완전히 소실되어 폐사되었다가 서호산 스님이 1963년에 대웅전과 요사채를 중건하고 1975년 삼성각을 신축하여 오늘에 이르고 있다.이 사찰에는 전라북도 유형 문화재  108호인 진묵대사 부도를 비롯 몇 기의 부도가 있다.이 절에는 진묵대사와 해인사 대장경에 얽힌 설화가 전해지고 있다. 이 절에서 수도하던 진묵은 자주 해인사를 내왕하면서 대장경을 모두 암송하였다 하며 하루는 제자를 데리고 급히 해인사로 갔는데, 그날밤 대장각 옆에서 불이 나 도저히 끌 수 없게 되었다. 이때 진묵대사가 솔잎에 물을 적셔 불길이 번지는 곳에 몇 번 뿌리자 갑자기 폭우가 내려 불길이  잡힘으로써 대장경판의 위기를 모면하였다는 일화가 전해진다. 또한, 진묵대사가 지팡이로 바위를 뚫어  발견했다는 약수터가 있는데 이곳을 찾는 사람들도 약수 맛에 끌려 자주 찾는다고 한다.",완주군
16,사부작 채집가,전라북도 완주군 봉동동서로 100,127.1635183,35.93741999,http://tong.visitkorea.or.kr/cms/resource/17/2815617_image2_1.jpg,"사부작 채집가는 몰입의 기쁨, 과정의 즐거움을 선물한다.  클래스 없이 홀로 온전히 재료를 탐구하고, 평가와 기준 없는 자유로운 그림 그리기에 몰입하고 즐길 수 있는 공간이다. 더불어 수채화, 오일파스텔, 유성 색연필등 여러 종류의 미술도구와, 다양한 나라의 종이로 구성된 백지 종이세트를 제공하며, 완주군에 여행 온 사람들을 위한 완주군 풍광 무료 도안을 준비되어 있다. 클래스 없는 화실 사부작 채집가는 100% 예약제로 운영되며, 예약 방문시 완주군 봉동 토종생강을 활용한 웰컴 드링크는 무료다. 
*예약은 네이버 예약을 통해 예약할 수 있고, 영업일과 예약시간을 확인 하실 수 있다.",완주군
17,산속등대 복합문화공간,전라북도 완주군 소양면 원암로 82,127.2520066,35.86934873,http://tong.visitkorea.or.kr/cms/resource/13/2638613_image2_1.jpg,"산속등대복합문화공간은 전라북도 완주군 소양면 해월리에 위치한다. 삼십 년 전만 해도 이곳은 제지산업의 요충지로 수백 명의 직원과 그에 따른 수천 명의 가족들의 생계를 책임 지던 삶의 터전이었다. 그러나 급격한 산업의 발달과 인근 지역민들로부터 유해시설로 인식돼 가동을 중단하게 되었고 제지공장은 역사의 뒤안길로 사라지게 되었다. 하지만 2016년 유) 제이와이프롭에 의해 지역 문화와 예술을 밝히는 등대의 기능으로 전환되며 새로운 국면을 맞이하게 되었고 제1 ? 2미술관, 체험관(어뮤즈월드), 아트플렛폼, 야외공연장, 모두의 테이블, 등대, 수생생태정원, 슨슨카페 등을 갖춘 가족 중심형 복합문화공간으로 재탄생하였다.",완주군
18,송광사(완주),전라북도 완주군 소양면 송광수만로 255-16,127.2417794,35.88427463,http://tong.visitkorea.or.kr/cms/resource/15/1605115_image2_1.jpg,"송광사는 전라북도 완주군 소양면에 위치한 천년 고찰이다. 대한불교 조계종 송광사는 신라 경문왕 7년 (867년)에 구산선문의 개산조인 보조체징선사가 개창하였다. 원래의 사명은 백련사였으며, 현재의 일주문이 3km밖 나들이라는 곳에 서 있던 대찰이었으나, 역사의 변천속에 거의 폐찰이 된 것을 순천 송광사의 보조국사 지눌스님이 중창을 발원하신 후 현재의 도량 전각들은 1600년대 보조 지눌국사의 법손들이 대대적인 불사를 추진한 것이다. 특히 병자호란으로 소현세자와 봉림대군 두 왕세자를 청나라에 볼모로 보낸 인조대왕이 두 왕세자의 무사환국과 국란의 아픔을 부처님의 가호로써 치유하고자 대대적으로 중창한 인조대왕의 호국원찰이다. 이렇듯 역사의 아픔을 치유하기 위한 호국원찰이어서인지 나라에 큰 일이 있을 때면 대웅전, 나한전, 지장전의 불상이 많은 땀과 눈물을 흘리곤 한다. 특히 대웅전의 불상은 KAL기 폭파사건, 12.12사건, 군산 훼리호 침몰사건, 강릉 잠수함 출몰, 그리고 97년 12월 2일부터 13일까지 엄청난 양의 땀과 눈물을 흘려 I.M.F한파를 예견하였다고 한다. 전국 4대 지당기도량답게 최대 크기의 지장전에 봉안되어 있는 지장보살상과 시왕상, 나한전의 석가여래와 500의 나한상은 대웅전과 함께 많은 이들의 참배처가 되고 있으며 평지가람으로 노약자가 편히 올수가 있으며, 대형버스 30대가 주차할 수 있는 대형주차장과 식당이 준비되어 있고, 봄철 송광사 벚꽃 터널의 아름다움은 탄성을 자아내게 한다. 대웅전, 삼세불상, 아(亞)자형 종각, 사천왕상 등 4점의 보물 문화재와 8점의 유형 문화재 등 역사의 숨결을 느낄수 있는 사찰이다.* 유물1) 금강문(전라북도 유형문화재)2) 목조삼전패(전라북도 유형문화재)3) 소조삼불상 및 복장유물(보물)4) 명부전 소조지장보살삼존상 및 권속상 일괄(전라북도 유형문화재)* 주요문화재1) 대웅전(보물) 1620년대 건축, 1857년 1층으로 개창 천정의 주악비천도 11점이 특이 2) 소조 3세불상(보물) 국내 최대 실내소조 좌불상 : 석가여래, 약사여래, 아미타 여래의 삼불 진묵대사 점안 (나라에 큰 일이 있을때 땀 흘림) 3) 십자각(보물) 국내 유일의 아(亞)자형 지붕 종각 4) 사천왕상(보물) 소조상으로 국내 최고의 조형미 구비",완주군
19,신흥계곡,전라북도 완주군 경천면,127.2915961,36.02940619,http://tong.visitkorea.or.kr/cms/resource/77/215377_image2_1.jpg,"봉동, 고산을 지나 경천소재지를 영유하여 운주방면으로 약 2㎞쯤 가다보면 용복주유소가 나타난다. 이 주유소를 끼고 오른쪽으로 돌아 2㎞쯤 가면 구제부락이 나타난다. 이 마을을 지나 남동쪽으로 2㎞쯤 가면 첩첩이 쌓인 짙푸른 산봉오리와 맑은 계곡이 눈앞에 펼쳐진다. 이곳이 신흥계곡이다. 물이 차지 않아 아이들과 함께 물놀이하기에 좋은 곳이다. 인근에는 화암사가 있어 또다른 볼거리를 제공한다.",완주군
