,title,addr1,mapx,mapy,firstimage,overview,addr2
0,가야산 소리길,경상남도 합천군 가야면 가야산로 1783,128.0909094,35.79111416,http://tong.visitkorea.or.kr/cms/resource/49/1963749_image2_1.jpg,"가야산소리길은 홍류동 옛길을 복원하고 다듬어서 홍류동 계곡을 따라 완만하게 걸을 수 있도록 조성한 저지대 수평 탐방로이다. 홍류동 계곡을 따라가는 가야산소리길에는 주요 문화자원인 농산정과 더불어 칠성대, 낙화담 등 가야산 19명소 중 16개 명소가 있으며 자연과 역사, 경관을 함께 보고 느끼며 남녀노소 누구나 쉽게 탐방(체험) 할 수 있는 길이다.",합천군
1,각사산촌행태체험마을,경상남도 합천군 가야면 야천로 101,128.1395944,35.77297821,http://tong.visitkorea.or.kr/cms/resource/70/2484270_image2_1.jpg,"합천해인사 인근에 위치한 자연부락으로서 천해의 자연조건과 수많은 문화유적지 그리고 가야산 국립공원이 있는 지역이다. 유래를 살펴보면 옛날 각사라는 절이 있었으므로 각사라고 불렀다. 절터의 흔적은 찾을 수가 없으며, 상세한 내용은 전해지지 않고 있다. 야천 2구를 웃각사, 건너편에 있는 황산 1구를 아랫각사라고 부르고 있는 것을 보면 양편에 절이 있었던 것으로 보이며, 뒷산의 전경이 아름답고 앞에는 가야천의 맑은 시냇물이 흐르고 있다.",합천군
2,고불암,경상남도 합천군 가야면 치인5길 194,128.0517958,35.80250383,http://tong.visitkorea.or.kr/cms/resource/80/2800280_image2_1.JPG,"해인사 고불암은 1200년 역사를 가진 해인사의 산내 암자로서 해인사 암자 중 가장 높은 해발 900m에 법당이 있으며, 전체적인 건축구조와 형상이 산내 암자 중 해인사와 가장 비슷하며 전통적인 목조건물과 현대적인 건축물이 조화를 이루고 있다. 전통사찰식 목조건물은 법당을 중심으로 양옆에 육화당, 벽안당이 있고 앞으로는 고불루가 있다.",합천군
3,내천못재,경상남도 합천군 율곡면 내천리,128.2343989,35.60938176,http://tong.visitkorea.or.kr/cms/resource/48/2484948_image2_1.jpg,"못재는 합천군 율곡면 내천리 서쪽 지산 정상에 있는 연못으로 면적이 약 4백여 평이고 화산이 폭발하여 생긴 화구호라고 하나, 자연함몰로 생긴 것으로 추정된다. ""순채""라는 식물이 자생하는데 예전에는 이 식물이 나병, 피부병, 황달병 등에 특효약이라 하여 많은 환자들이 병을 치료할 약재를 구하기 위해 찾아 왔으며, 주변 잔디밭에는 인근 주민들이 몰려와서 편을 갈라 민속놀이인 씨름경기로 친목을 다졌다고 한다. 또한 임진왜란 때에는 왜병이 진을 치고 맞은편 백마산성에 주둔한 우리 의병과 접전을 벌였던 곳이기도 하다. 주변 지산공원은 천지못 바로 북쪽에 위치한 면적 1000여평의 군민 편의시설로 팔각정이 있고, 잔디밭과 주변나무그늘이 좋아 인근 주민들이 소풍을 즐기는 공원이며, 천지못 정상 천지봉은 사방을 한눈에 볼 수 있는 절경으로 정월대보름에는 주민들이 달집을 태우며 그 해의 풍년과 무사태평을 기원하는 일명 달맞이봉이라고도 하는 등 주위경관은 물론 유래가 깊은 자연발생 유원지이다.",합천군
4,대기 농촌체험휴양마을,경상남도 합천군 가회면 대기2길 17-3,128.0018372,35.46215811,http://tong.visitkorea.or.kr/cms/resource/11/2485211_image2_1.jpg,"경남 합천군 가회면 중촌리에 위치한 ""대기 농촌체험휴양마을""은 모산재외 누룩덤이 병풍을 두루고 마을 앞 수백년이 된 소나무 숲에서는 사계절 푸르던 기운을 느낄 수 있다. 들판에는 옛선비들이 글을 읽고 학동들을 훈육한 서당 매양재의 흔적을 볼 수 있으며, 대기 저수지의 푸른 물에서는 강태공들이 낚시대를 드리우며 물속에 잠긴 모산재의 비경을 한껏 감상할 수 있는 곳이다. 청정 무공해 농산물을 비롯하여 주 특산품으로는 황매산 표고와 블루베리, 복분자 등이 생산되고 있다. 2005년부터 농색농촌 체험마을이 운영되고 있으며 각종 전통놀이 및 농사체험이 이루어지고 있다.",합천군
5,대기철쭉꽃산촌생태마을,경상남도 합천군 가회면 대기2길 17-3,128.0018399,35.46219977,http://tong.visitkorea.or.kr/cms/resource/32/2795232_image2_1.jpg,"우리나라에서 봄 여행지로 소문난 곳이 철쭉으로 유명한 황매산이다. 매년 철쭉이 만개할 때는 산 정상에서 축제가 열리는데 방문객들만도 수십만 명에 이른다. 대기 철쭉꽃 산촌생태마을은 바로 이 황매산 자락 해발 700m 고지대에 있다. 봄이 오면 대기마을에서는 철쭉꽃 향기를 맡으며 여러 가지 체험을 할 수 있다. 산나물과 고구마를 채집하고, 복분자와 블루베리를 직접 채집하는 체험을 할 수 있다. 이외에도 사계절 정신수양과 육체단련에 좋은 현무도를 수련할 수 있다. 마을 안 폐교를 활용해 녹색 체험관을 마련했고 방문객을 위한 통나무 펜션 3개 동도 별도로 갖추고 있다.",합천군
6,덕원서원,경상남도 합천군 청덕면 성태길 81,128.3189671,35.58565264,http://tong.visitkorea.or.kr/cms/resource/08/2740008_image2_1.jpg,"세조(재위 1455∼1468) 때 이시애의 난을 맞아 당시 선봉장으로 활약하다가 장렬히 전사한 강열공 차운력·문절공 차원부·문목공 차포온의 학문과 덕행을 추모하기 위해 세운 서원이다. 덕원서원은 숙종 18년(1692) 세웠는데, 처음에는 호남승평에 세워 오천서원이라 했다. 그 뒤 지방 유림이 순조 6년(1806)에 청덕면 성태리로 옮겨 지어 덕원서원이라 하였다. 고종 5년(1868) 대원군의 서원철폐령으로 자진 철폐하였고, 고종 39년(1902) 지방 유림이 복원하여 현재에 이르고 있다.",합천군
7,들꽃공방,경상남도 합천군 가야면 황산1길 71,128.1357839,35.76314036,http://tong.visitkorea.or.kr/cms/resource/25/2800725_image2_1.jpg,"가야산 해인사로 가는 들머리에 가야면 소재지가 있다. 주변에서 가장 큰 도시이자 대부분의 편의시설이 몰려있는 곳이다. 대장경테마파크도 이곳에 있다. 도심 중앙에 염색체험을 하는 들꽃공방이 있다. 일반 가정집을 체험장 겸 공방으로 사용하고 있는데, 작지만 꽤 알차게 준비가 되어 있다. 마당 한 편에는 쪽 풀까지 심어놓고, 빨랫줄에는 염색한 천들이 가지런히 걸려 있다. 손쉽게 해 볼 수 있는 염색은 스카프나 손수건이다. 만들고자 하는 문양을 생각한 다음, 고무줄로 천을 묶는다. 세로로 묶으면 세로 문양이 나오고, 네모나게 겹겹이 묶으면 마름모꼴이나 사각형 문양이 나온다. 염색 농도 차이로 문양을 만드는 과정이다. 접은 천을 염색액에 넣고 몇 번 담근 후 물에 헹궈 말리면 된다. 염색 체험뿐 아니라 들꽃공방에서는 공예가인 주인의 작품을 전시해 놓고, 소품들은 팔기도 한다. 가야산의 들꽃처럼 화려하진 않지만, 자연의 느낌이 나는 스카프와 손수건, 방석 등이 구비되어 있다.",합천군
8,미숭산관광지,경상남도 합천군 야로면 미숭산로 343,128.1916772,35.72606224,http://tong.visitkorea.or.kr/cms/resource/40/2486040_image2_1.jpg,"미숭산 주변에 조성된 관광지이다. 미숭산 정상에는 삼국시대에 돌로 쌓은 미숭산성(경남기념물)이 있다. 조선 건국에 반대하여 이미숭(李美崇)이 항거한 곳이라고 하며, 조선시대에는 봉수대를 설치하였던 곳이다. 산성 안에는 망향대와 갑검능·연병장·봉화대·사당·장군수·동문·서문·남문이 남아 있고, 관광지 안에는 경남학생종합유영장 등의 시설이 있다. 인근에 해인사·청량사·가야산국립공원 등의 관광지가 많다. 고령읍 쪽에는 능선 주위에 가야 고분군이 있고 등산로 입구에는 대가야 유물전시관이 있다. 또 산 일대에 삼림욕장과 체육공원이 자리하고 있다.",합천군
9,백련암(합천),경상남도 합천군 가야면 해인사길 118-116,128.106205,35.79801643,http://tong.visitkorea.or.kr/cms/resource/48/2687548_image2_1.jpg,"백련암은 산내 암자 가운데에서도 가장 높은 곳에 위치하여 한가할 뿐 아니라 경계 또한 탁 트여 시원하다. 특히 암자 주변에 우거진 노송과, 환적대, 절상대, 용각대,신선대와 같은 기암이 병풍처럼 에워싸고 있어 예부터 백련암터를 가야산의 으뜸가는 절승지로 일컬어 왔다. 백련암을 처음 창건한 연대는 잘 알 수 없고 다만 선조 38년 곧 서기 1605년에 서산대사의 문하였던 소암스님이 중건하였다는 기록이 남아 있을 뿐이다. 오래 전부터 고승들이 즐겨 수행처로 삼아 오던 이곳은 역대로 산중 어른들이 주석해 왔다. 몇해전 성철스님께서 입적하기 전까지 주석하였다.",합천군
10,신소양체육공원핑크뮬리,경상남도 합천군 합천읍 합천대로 2971,128.1702108,35.58079217,http://tong.visitkorea.or.kr/cms/resource/30/2746330_image2_1.JPG,"합천읍 황강나루길 수변공원에는 가을마다 진한 분홍색으로 물들어 사람들을 유혹하는 핑크뮬리 군락지가 조성되어 많은 관광객의 발길이 이어진다. 마치 핑크색 솜사탕이 가득 모여 있는 듯한 사랑스럽고 몽환적인 분위기를 자랑하는 핑크뮬리. 서양 억새의 한 종류로 감성적인 사진을 찍을 수 있어 핑크뮬리 군락지는 최고의 포토존으로 주목받고 있다. 특히 신소양체육공원 (황강나루길 수변공원)은 평지가 아닌 나선형으로 이루어진 완만한 산책로를 따라 식재되어 있어, 산책로 어디서나 핑크뮬리를 배경으로 멋진 인생 최고 장면을 찍을 수 있는 명소로 소문나있다.  핑크뮬리가 피는 계절에 구절초, 코스모스, 국화 등의 꽃이 함께 피어 가을 꽃축제를 즐기기에 부족함이 없는 곳이다.",합천군
11,씨파크,경상남도 합천군 합천호수로 525,128.0537943,35.54442752,http://tong.visitkorea.or.kr/cms/resource/58/2992058_image2_1.jpg,"합천 씨파크는 경남 합천군 대병면에 위치하고 있는 테마파크이다. 기존 ‘BMW 카페모토라드’는 남부지방에 꼭 들러야 하는 라이더들의 성지로 유명한 곳이며, 2023년 6월에는 몸만 오면 되는 캠프닉콤마도 개장하였다. ‘캠프닉콤마’는 개별 방갈로 하우스와 개별 수영장, 공용 수영장 등 가족,연인,친구끼리 방문해서 기본 집기부터 그릴, 바베큐 세트까지 제공하고 있다. 또한 실내 냉/난방 시스템과 개별 전자레인지,샤워실, 화장실, 개수대가 있으며 편의점이 붙어있어 필요한 물품을 추가 구매할 수 있다. 추후에는 다양한 음식을 맛볼 수 있고 다양한 축제가 펼쳐질 ‘컬쳐아고라’도 시공될 예정이다. 인근에는 합천영상테마파크와 황매산이 있어 합천의 코스 여행지로 자리매김할 예정이다.",합천군
12,오도산,경상남도 합천군 묘산면,128.075425,35.67376051,http://tong.visitkorea.or.kr/cms/resource/13/2716513_image2_1.jpg,"오도산은 도선국사가 깨달음을 얻었던 곳으로 오도산이라 한다. 가야산맥 중의 한 산으로 북동쪽에 두무산, 북쪽에 비계산, 서남쪽에 숙성산 등이 있어 가야산의 산각을 이룬다. 오도산의 원래 이름은 '하늘의 촛불' 이라는 뜻의 천촉산 또는 까마귀 머리처럼 산꼭대기가 검다고 해서 오두산이라 불렀다. 그러던 것을 한훤당 김굉필선생과 일두 정여창 선생이 오도산 산하 계곡을 소요하면서 우리나라 유도를 진작시킬 목적으로 유도는 우리의 道라는 뜻에서 오도산으로 이름을 바꾸었다고 한다. 오도산은 높이가 1,134m이며 주위에 두무산(1,038m), 숙성산(899m) 등이 솟아 있으며 1982년 한국통신이 오도산 정상에 중계소를 설치하면서 오도산 정상을 약 13m나 깍아내고 중계소를 건설하였고 그때 만든 도로를 이용 일반 승용차로 쉽게 접근할 수 있으며 8월~10월엔 전국에서 찿아오는 사진작가 분들로 일출(동쪽), 일몰(서쪽) 포인터는 발디딜틈 없이 인산 인해를 이루는 곳이기도 하다.",합천군
13,원당암,경상남도 합천군 가야면 해인사길 141-23,128.0927311,35.80109084,http://tong.visitkorea.or.kr/cms/resource/05/2800305_image2_1.JPG,원당암은 「해인사 1번지」 같은 상징적인 암자다. 해인사와 형제처럼 역사를 같이하고 있기 때문이다. 신라 애장왕(哀莊王)은 공주의 난치병이 낫자 부처의 가호(加護)로 여기고 해인사의 창건을 발원한 순응(順應) 대사를 몸소 크게 도와주었다고 한다. 왕은 서라벌을 떠나 가야산에 임시로 작은 집을 지어 절 공사를 독려하고 정사(政事)를 보기까지 하였는데 이것이 바로 오늘의 당암이라는 것이다. 암자가 다시 활기를 찾게 된 것은 혜암(慧菴) 스님이 머무른 이후부터였다고 한다. 혜암 스님은 해인사의 정신적 지주라고 할 수 있는 해인총림 방장('93년~'96년)스님을 지내시고 1999년 4월에 조계종 제10대 종정 스님으로 추대되었다. 또한 원당암에서는 스님들과 똑같이 일반인들도 여름과 겨울에 한 철씩 안거(安居)에 들어가 수행을 하는 국내 제일의 재가불자 참선도량으로 변모되었다. 법당 앞에 보물 518호로 지정받아 보호받고 있는 석탑과 석등에도 암자의 나이테가 새겨져 있다.,합천군
14,천불천탑,경상남도 합천군 가회면 산두길 191-41,128.0495906,35.4881838,http://tong.visitkorea.or.kr/cms/resource/38/2746338_image2_1.JPG,"합천 황매산 자락 허굴산에 위치한 천불천탑은 용탑스님이 선사·고대시대 기도한 용바위에서 관세음보살님을 친견한 후 천불천탑의 원력으로 불탑 건립을 하고 있는 소원성지이다.
처음 방문 시 한가지 소원을 색상별 소원리본에 적어서 부처님께 축원 올리는 것을 필수 의무로 하고 있다.
돌탑 속에 앉아서 부처님이 되어보는 부처돌탑, 허굴산 정상에 누워있는 와불부처, 허굴산을 온몸으로 하고 있는 선사·고대시대 기도한 신령스런 소원성취 용바위, 관세음보살님의 위신력으로 형상을 나툰 자연마애불, 천불천탑에서만 볼 수 있는 무수한 돌탑들이 있는 곳으로 가족이나 아이들과 함께, 단체, 관광 드라이브 여행 시 가볼 만한 곳이다.
소원바위인 용바위에 참배 후 용바위를 안고 소원을 염원하여 일주일 안으로 용바위 꿈을 꾸면 소원이 성취되거나, 시험이나 큰일을 앞둔 사람들에게는 마음을 안정시키는 강한 기운을 준다고 해서 많은 사람들이 소원성취 용바위를 찾고 있다.
관세음보살님의 위신력으로 형상을 나툰 자연마애불은 소원초 올려 기도하는 법당으로, 초공양을 올려 기도한 후 소원이 이루어질 것 같으면 기도한 사람들 각각에게 그 형상이 다르게 보여 불가사의한 신비로움을 갖게 한다.
천불천탑은 돌탑이 있는 곳곳마다 법당이고 소원성취 용바위와 자연마애불이 있는 야외법당이 주된 법당이다.",합천군
15,토광요,경상남도 합천군 가야면 구원2길 26-27,128.1289452,35.77970781,http://tong.visitkorea.or.kr/cms/resource/40/2800740_image2_1.jpg,"두 채의 한옥에 기와를 올린 담장이 아름답고, 담장 너머로 남산제일봉 능선들이 그림처럼 펼쳐져 장관을 이룬다, 봄가을에 안개가 피어오르면 선경이 따로 없다. 그 모습을 찍으러 사진작가들이 일부러 찾아오는 곳이다. 이런 풍경과 함께 도자기 공방이 자리하고 있다. 토광요에서는 황토방에서 하루 자면서 도자기도 만들고, 명상도 하고, 주변의 음식으로 건강식을 만들어 먹는 등, 하루를 오롯이 가야산과 함께 하는 체험프로그램으로 제공하고 있다.",합천군
16,합천 반야사지 원경왕사비,경상남도 합천군 가야면 해인사길 122,128.0985528,35.80158811,http://tong.visitkorea.or.kr/cms/resource/95/214095_image2_1.jpg,"* 해인사 반야사 원경왕사비 *원래 가야면 야천리(倻川里) 탑동(塔洞)마을 반야사지에 있던 것을 1968년 현재의 해인사로 옮기고 비각을 세워 보호하였다. 합천군 가야면 가야산(伽倻山:1,430m) 남서쪽에 있는 해인사는 대한불교조계종 제12교구 본사로 신라 애장왕(哀莊王:재위 800∼809) 때 세워졌다. 해인사에 있는 원경왕사비는 고려시대인 1125년(인종 3)에 건립하였다. 비의 높이는 2.3m, 너비는 1.2m이고, 재료는 화강석이다. 비는 귀부, 비신과 옥개형 비석으로 이루어져 있는데 각 부분은 평박하다. 비의 제액은 비신의 전면 상부에 녹서로 증교원경왕사비명이라고 쓰여있다.* 비문의 내용에 대하여 *비문에 의하면 원경왕사의 속성은 신씨고 고려 문종 4년(1050)에 태어나 영통사의 경덕국사와 대각국사에게 사사하였으며 대각국사를 따라 송에 갔다가 선종 3년(1086)에 귀국하여 숙종9년(1104)에 승통이 되었고, 예종 9년(1114)에 오공 통혜의 법호를 이어받았다. 왕사가 된 후 귀법사에 머물다 예종 14년(1119)에 70세로 입적하자 왕은 원경이라는 시호를 내렸다. 비문은 김부식이 짓고 글씨는 이원부가 썼다. 뒷면에는 문도들의 직명이 새겨져 있다. 이 비는 신라의 기본형태에서 벗어난 형태로 귀부의 중곽갑문과 아울러 생경한 문양표현, 옥개형으로 변한 개석 등 고려 중기의 특징을 잘 나타내는 작품이다.* 시대 - 고려시대(인종 3년, 1125년) [문화재 정보]지정종목 : 보물 지정현황 : 보물지정연도 : 1963년 1월 21일소장 : 해인사시대 : 고려 ?종류 : 석비크기 : 높이 2.3m, 너비 1.2m ",합천군
17,합천 백암리 석등,경상남도 합천군 대양면,128.2192724,35.50812903,http://tong.visitkorea.or.kr/cms/resource/86/2489686_image2_1.jpg,"* 8세기의 우수한 석등, 합천 백암리석등 *석등이 세워져 있는 곳은 백암사 또는 대동사터라고 전하여 오고 있지만 분명하지 않다. 이 석등도 무너져 흩어져 있던 것을 복원한 것으로 원래의 위치는 알 수 없다. 한국 기본형인 8각 석등이며 상륜부는 결실되었고 하대석의 하단부가 매몰되어 그 이하의 지대석은 알 수 없다. 하대석에는 단엽 팔판(八瓣)의 복련(覆蓮:꽃부리가 아래로 향한 연꽃)이 둘려졌고 각 판 내에는 중앙에 화사한 꽃무늬가 조식되었으며 정부(頂部)에는 2단의 받침을 조출(彫出)하여 간석을 받치고 있다. 화사석은 1석으로 되었고 4면에 화창(火窓)이 있으며 창구 둘레에는 창을 부착시켰던 못구멍이 남아 있다.* 백암리 석등의 형태 *여덟 장의 잎이 달린 연꽃을 조각한 둥근 아래 받침돌 위에 아무런 새김이 없는 8각의 긴 가운데 기둥을 세워 신라석등의 경쾌한 특징을 보이고 있다. 그 위로 꽃봉오리같은 윗받침돌은 안에 얕은 홈을 파서 불을 밝히는 화사석(火舍石)을 고정시키는 역할을 하도록 하였다. 화사석은 8각으로, 4면은 창을 내고 4면은 사천왕입상 (四天王立像)을 매우 뛰어난 수법으로 도드라지게 새겼다. 화사석은 불을 밝혀두던 공간으로 불빛이 있던 옛모습을 떠올리면 흥미롭다. 지붕돌은 밑면에 1단의 받침이 있으며, 그 안쪽으로는 홈을 파서 화사석을 끼워 고정시키도록 되어 있다. 지붕돌의 경사면은 얇지만 뚜렷하게 각을 지어 신라시대의 전형을 이루고 있다. 귀퉁이에는 꽃조각이 있었으나 지금은 모두 깨어져 그 흔적만 남아있다. 꼭대기에는 8잎의 연꽃 문양조각만이 남아 있을 뿐이다. 아래받침돌과 윗받침돌을 화사하게 장식하였고, 특히 화사석을 고정시키기 위한 홈과 사천왕상의 배치 등은 주목되는 수법이다. 전체적인 양식으로 보아 통일신라 중기인 8세기 후반의 우수한 석등이라 할 수 있다. [문화재 정보]시대 : 통일신라 크기 : 높이 2.53m간석 높이 111.8cm화사석 높이 61.5m 종류 : 석등",합천군
18,합천 영상테마파크,경상남도 합천군 합천읍 동서로 119,128.1658088,35.56665757,http://tong.visitkorea.or.kr/cms/resource/90/2625790_image2_1.jpg,"오늘은 나도 영화 속 주인공 !골목마다 독특한 분위기와 볼거리가 가득한 이곳은 1920년대에서 1980년대를 배경으로 하는 드라마, 영화, 뮤직비디오 등 190여 편의 촬영장이 되었다. 전차, 마차 등을 이용해 둘러 볼 수도 있고 보이는 곳마다 사진 찍기도 좋다. 영상테마파크 뒤편으로 150,000㎡ 규모의 전국 최고의 분재공원과 정원테마파크가 개장되었다. 메인건물인 청와대 촬영세트장과 함께 분재온실, 생태숲체험장, 목재 문화 체험장 등이 조성되어 있어 자연 속에서 어른, 아이 모두 즐길 수 있다.
청와대세트장 차량 출입 전면 통제(2019.9.1 이후)",합천군
19,합천 영암사지,경상남도 합천군 가회면,128.0024923,35.47418176,http://tong.visitkorea.or.kr/cms/resource/87/2625787_image2_1.jpg,"* 신라말 밀교의 형식을 보이는 곳, 합천 영암사지 *황매산의 남쪽 기슭에 있는 절터이다. 경남 서부의 가야산과 지리산을 연결하는 중간 지점의 황매산(黃梅山) 남쪽 기슭에 있으며, 영암사라는 절 이름도 주민들 사이에서 구전되어 오지만 자세한 연혁은 전하지 않는다. 다만 서울대학교 도서관에 탁본으로 남아 전하는 <적연국사자광탑비(寂然國師慈光塔碑)>(1023년 건립)의 비문을 통하여 고려시대 이곳에 영암사가 있었음을 알 수 있다. 처음 지어진 연대는 정확히 알 수 없으나, 고려 현종 5년(1014)에 적연선사가 이곳에서 83세에 입적했다는 기록이 있어, 그 이전에 세워진 것으로 추정된다. 또한 국립중앙박물관에 있는 홍각선사비의 조각 중에도 ‘영암사’라는 절의 이름이 보이는데, 홍각선사비가 886년에 세워졌다는 점에서 영암사의 연대를 짐작할 수 있다. * 영암사지의 특징과 가치 *발굴을 통해 조사해본 결과, 불상을 모셨던 금당·서금당·회랑터·기타 건물터가 확인되어 당시 절의 규모를 알 수 있고, 금당은 3차례에 걸쳐 다시 지어진 것으로 밝혀졌다. 절터에는 통일신라시대에 만든 쌍사자석등(보물)·삼층석탑·귀부·당시의 건물 받침돌·각종 기와조각들이 남아있다. 특히 금동여래입상은 8세기경의 것으로, 절의 창건 연대를 살피는데 중요하다. 영암사의 건물터는 일반 사찰 건물과 다른 몇 가지 특징이 있다. 금당이 있는 상단 축대의 중앙 돌출부 좌우에 계단이 있는 점, 금당지 연석에 얼굴모양이 조각되었고 후면을 제외한 3면에 동물상을 돋을새김한 점, 서남쪽 건물터의 기단 좌우에 계단이 있는 점이 특이하다. 이러한 특징과 더불어 절터 내에 흩어져 있는 석조물은 이색적인 느낌마저 준다. 조형의 특이함과 입지 조건, 서남쪽 건물의 구획안에서 많은 재가 나오는 점으로 보아 신라 말에 성행한 밀교의 수법으로 세워진 절로 보인다.[문화재 정보]지정번호 : 사적지정연도 : 1964년 6월 10일시대 : 9세기 중엽 창건크기 : 면적 3,812㎡종류 : 사찰터",합천군
20,합천 옥전 고분군,경상남도 합천군 쌍책면,128.2802317,35.58156351,http://tong.visitkorea.or.kr/cms/resource/68/657268_image2_1.jpg,"낙동강의 한 지류인 황강변 구릉에 있는 4세기에서 6세기 전반의 가야고분군이다. 고분은 1,000여 기에 이를 것으로 추정되며, 이 가운데 20∼30m의 지름을 가진 18기의 고분이 한 지역에 밀집되어 있다. 옥전고분군은 최고 수장급의 고분에서 발견되는 유물이 거의 망라되어 있는 가야 지배자의 무덤으로, 용봉환두대도나 철제갑옷, 금동장투구, 철제말투구에서 가야문화뿐만 아니라 우리나라 고분 문화의 정수를 보여주는 매우 귀중한 자료로 평가된다. 또한, 이들은 고구려문화와 밀접한 관계를 맺고 있어 삼국시대 정세와 일본을 비롯한 동아시아 문화를 연구하는데 중요한 자료로서 그 가치를 인정받고 있다.",합천군
