,title,addr1,mapx,mapy,firstimage,overview,addr2
18,연화산도립공원,경상남도 고성군 개천면 연화산1로 544,128.2629353,35.0867328,http://tong.visitkorea.or.kr/cms/resource/91/1611191_image2_1.jpg,"경남 고성읍 서북쪽 12km 거리에 있는 높이 524m의 산으로 옥녀봉, 선도봉, 망선봉의 세 봉우리로 이루어져 있다. 북쪽 기슭에는 유서깊은 옥천사와 백련암, 청연암, 연대암 등의 암자가 있으며 특산물로는 송이버섯과 산딸기 등이 유명하다.연화산은 도립공원이지만 산세와 자락이 예상보다 장엄하거나 넉넉한 편은 아니다. 수수하고 아기자기한 산이라는 표현이 걸맞다. 연화산 탐방의 의미는 옥천사 답사에 있다고 봐야 할 것이다. 연화산에 오르면 남쪽으로 당항포의 쪽빛 바다가 보이고 연봉 속에 파묻힌 옥천사의 전경도 눈에 들어온다. 옥천사 대웅전 뒤에 위치한 옥천샘은 사시사철 마르지 않고 항상 수량과 수온이 일정하며 이 샘의 물은 위장병, 피부병에 효험이 있다고 전해진다. 1948년 샘 위에 옥천각을 세워 보존하고 있다.* 주요문화재 - 보물 옥천사 「임자명 반자」",고성군
19,오두산 치유숲,경상남도 고성군 상리면 신촌리,128.1820998,35.01788353,http://tong.visitkorea.or.kr/cms/resource/67/2028967_image2_1.JPG,"오두산 치유숲은 자연의 특색을 그대로 보존하며 다양한 예술 작품이 어우러져 그 하나하나 마음을 열게 하는 다정다감 속삭임이 있다.1차 개방 코스인 치유숲 입구에서부터 자화상, 사랑의 거미줄, 명상 그림, 소망탑, 비상폭포까지 돌과 흙, 나무 어느 하나도 허투루 다루지 않은 사랑과 정성 그리고 그 속에 담긴 스토리텔링을 직접 느낄 수 있어 일상에 지쳐 새로움이 필요한 누군가에게 진정 치유에 대한 깊은 인상을 줄 수 있는 곳이다.",고성군
20,자란도,경상남도 고성군 하일면 송천리,128.2190878,34.92784706,http://tong.visitkorea.or.kr/cms/resource/73/1978573_image2_1.jpg,"자란도는 붉은 난초가 섬에 많이 자생하였다 하여 자란도(紫蘭島 : 붉은 난초섬) 또는 섬의 생긴 형세가 봉황이 알을 품고 있는 형상과 같다 하여 자란도(自卵島)라 하였다고 전하고 있으며 지금은 자란도(紫蘭島)로 쓰고 있다. 특산물은 수산물로서 어종은 멸치, 장어류, 조기류, 가자미류 및 갈치, 볼락, 돔, 농어, 방어류 등을 어획 생산하고 있다.",고성군
21,제전마을,경남 고성군 하이면 덕명리,128.1551133,34.91087005,http://tong.visitkorea.or.kr/cms/resource/97/1978597_image2_1.jpg,"수태산과 좌이산이 북쪽과 남쪽을 지키고 수태들, 학림들, 오방들, 춘암들 등 조붓한 계단식 다랭이 논이 자리한 제전마을 들머리는 의외로 소박하다. 그렇지만 이윽고 바다가 보이기 시작하면 넓게 펼쳐진 몽돌 해변과 켜켜이 층을 이룬 수성함  단애가 아련히 먼 시간 속으로 사람을 빨아들인다. 인근의 동화마을 일원은 자연환경 보전지역인 수산자원 보전지구이며, 인근에 지명도가 높은 상족암 군립공원과 공룡테마파크가 있어 유명관광지와의 연계성이 높다.",고성군
22,주식회사 로카,경상남도 고성군 상리면 신촌리,128.1815776,35.01817238,http://tong.visitkorea.or.kr/cms/resource/85/2986585_image2_1.jpg,"고성군의 청정생태환경을 기반하는 흥미롭고 유익한 생체테험으로 지속가능한 생태관광 활성화를 도모하기 위하여 설립된 주식회사 로카에서는 지역의 생태자원과 연계하여 특별하고 지역색있는 차별화된 생태 체험이 마련되어있다. 자연물을 활용한 관광상품과 친환경 체험교구를 제작, 판매하며 다양하고 특색있는 체험 교구와 장비를 통하여 일회성 체험이 아닌 지속가능한 프로젝트형 생태체험을 경험할 수 있다.[체험상품]- 숲속의 이상한 재판 : 자연물을 그대로 이용한 나무저울을 이용하여 산소칩과 탄소무게 달기- 갯벌체험 프로그램 : 갯벌에 살고 있는 다양한 생물들을 채집하여 관찰하는 시간",고성군
23,청광새들녘마을,경상남도 고성군 개천면 영회로 1296,128.3093666,35.11479437,http://tong.visitkorea.or.kr/cms/resource/07/2633007_image2_1.bmp,"마을이름에서 연상되는 파란 청쾌함은 곧바로 풍경으로 이어진다. 멀리 능선 아래로 넓게 펼쳐진 푸른 평야는 농약이나 비료사용을 전혀 하지 않는 오직 유기농법으로만 가꿔진 청정 논밭이다. 인기척이라도 날라치면 개구리, 미꾸라지, 메뚜기 등이 우수수 튀어오르는 이곳은 덕분에 천연기념물 독수리를 비롯한 산새와 들새들에게 풍성한 먹이를 제공하는 최고의 서식지이다. 매년 겨울이면 월동을 하러 찾아오는 독수리를 관찰할 수 있다. 마을에서는 자연의 신선함을 체험하러온 도시민들을 위해 최고의 프로그램으로 손님들을 맞이하고 있다.대표적인 체험인 인터넷방송체험은 옛 시골의 이미지를 현대적으로 탈바꿈시키기에 충분하다. 체험관에서 직접 짜보는 생들기름의 고소한 향내는 온 마을을 채우다 못해 들판으로 번져간다. 너른 들판에서 활쏘기와 연날리기를 하며 전통문화를 체험하다보면 전통과 현대를 오가는 타임머신을 탄 듯 하루가 감쪽같이 흐른다. 뿐만아니라 족구장, 당구장 등 다양한 스포츠를 즐길수 있는 체육시설이 마련되어 있어 심심할 틈이 없으며, 체험활동으로 땀흘린 후에는 꿀맛같은 시골밥상을 맛보며 행복한 식사를 할 수 있다.",고성군
24,해맞이공원,경상남도 고성군 동해면 조선특구로 2084,128.4790727,35.05966471,http://tong.visitkorea.or.kr/cms/resource/11/2753111_image2_1.jpg,"해맞이공원은 고성군의 일출 행사가 열리는 곳이다. 호수처럼 잔잔한 아침 바다를 뚫고 솟아오르는 붉은 태양을 감상하기 안성맞춤이다. 공원에는 트레이드마크인 대형 공룡 조형물과 아담한 정자, 유리 전망대 그리고 조그만 산책로가 조성되어 있다. 날씨가 좋으면 거제도와 부산 가덕도까지 보이는 전망대에는 카메라를 올려두고 360도로 회전해서 촬영할 수 있는 목재 거치대가 준비되어 있다. 오른쪽으로 커다란 크레인이 있는 조선소 풍경도 이색적이다. 시원한 바다를 끼고 아름다운 해안 도로를 만끽하는 바이커들의 자유로운 모습도 자주 눈에 띈다.",고성군
25,해지개다리,경상남도 고성군 고성읍 신월로 59,128.3293885,34.95550982,http://tong.visitkorea.or.kr/cms/resource/70/2755370_image2_1.jpg,"고성읍 신월리에 들어선 바다를 가로지르는 해지개다리는 “거대한 호수 같은 바다 절경에 해 지는 모습이 아름다워 그립거나 사랑하는 사람을 절로 생각나게 한다”는 의미를 담고 있어 연인들의 데이트 코스로 사랑받고 있다. 폭 3.5미터에 길이는 209미터 규모다. 또한 해지개 해안 둘레길은 남포항에서 남산오토캠핑장, 해상데크교, 구선창까지 연결되어 있는 편도 1.4㎞ 구간으로 야간 경관조명시설을 설치해 밤산책을 즐기는 사람들이 늘고 있다. 경관조명 점등시간은 일몰 후부터 11시까지다. 밤이 되면 반짝반짝 한층 더 아름다운 해지개다리를 걸으며 지쳐있는 몸과 마음을 치유해 보자.",고성군
