,title,addr1,mapx,mapy,firstimage,overview,addr2
0,각산,경상남도 사천시 수도골안길 24,128.0749417,34.93964041,http://tong.visitkorea.or.kr/cms/resource/78/2031478_image2_1.jpg,"각산산성과 각산봉수가 있고, 등산객들이 많이 찾는 편이며 삼천포 앞바다의 섬들이 한눈에 들어온다. 삼천포항 서쪽에 바다와 접하면서 실안동을 말발굽처럼 둘러싸고 있는 산이 각산(해발 398m)이다. 건너편 와룡산의 위세가 워낙 대단하여 일반에게 잘 알려져 있지 않지만 인근 주민들에게 사랑을 받고 있는 산이다. 산은 전형적인 육산으로 산세가 포근한 느낌을 주고 있다. 남릉에 위치한 각산산성과 봉화대가 이 산의 위치적 중요성을 더욱 일깨우고 있다.",사천시
1,거북선마을,경상남도 사천시 용현면 사천대교로 75-61,128.040621,34.99854986,http://tong.visitkorea.or.kr/cms/resource/98/2798498_image2_1.JPG,"경남 사천시 용현면 사천대교 아래의 사천 거북선 마을은 사천만을 끼고 있으면서 농업과 어업의 비율이 비슷한 반농반어의 시골 마을이다. 이곳은 임진왜란 당시(1592년) 이순신 장군이 최초로 거북선을 출전시켜 왜선을 격퇴한 사천해전이 펼쳐진 곳으로 영농조합 만들어 체험 마을로 거듭났다. 지역 특색을 살려 갯벌 체험, 최초 거북선 길 탐방, 거북선 열쇠고리 만들기 체험, 쑥 잡기 체험, 굴 체험, 농촌 체험 등 다양한 프로그램을 운영하며 해마다 ‘사천 거북선 마을 노을 축제’를 열고 있다. 또한, 다양한 시설을 갖추어 즐길 거리가 많다. 풋살장과 10면의 야영장도 준비돼 있어 바닷가에서의 캠핑을 즐길 수 있으며 사천만을 끼고 조성된 10㎞가량의 해안 산책로가 조성되어 있다. 또한 식당, 샤워장 등의 부대시설도 함께 갖추고 있는 어울림터에서는 각종 교육, 세미나, 실내 체험 활동이 가능하다. 이순신 장군의 승전지이며 넓은 갯벌과 아름다운 석양이 있는 힐링 명소로 농촌체험과 바다체험, 음식체험, 역사체험을 골고루 할 수 있는 공간이다.",사천시
2,구계서원,경상남도 사천시 사천읍 구암두문로 361-17,128.1253611,35.09116597,http://tong.visitkorea.or.kr/cms/resource/45/2739845_image2_1.jpg,"이 서원은 1606년(선조 39)에 세웠으며, 1611년(광해군 3) 사당인 구산사를 세웠다. 1676년(숙종 2)에 ‘구계’라는 현판을 나라에서 받아 사액서원으로 승격되었다. 1723년(경종 3)에는 김덕함(金德?의 위패를 추가로 모셨으며, 1868년(고종 5) 흥선대원군의 서원철폐령으로 폐쇄되었던 것을 1931년에 다시 세웠다.",사천시
3,남일대해수욕장,경상남도 사천시 남일대길 55,128.0963791,34.92670057,http://tong.visitkorea.or.kr/cms/resource/10/1611410_image2_1.jpg,"거대한 코끼리가 물을 먹고 있는 듯한 절묘한 코끼리바위는 사천시의 관광 명물이며, 이곳의 남일대 해수욕장은 맑고 깨끗한 바닷물, 부드러운 모래, 울창한 숲으로 어우러진 진널전망대와 낚시터가 주변에 있어 관광객이 상시 붐비고 있는 곳이다. 해수욕장 개장 기간에는 여름 해변 축제인 해변 가요제와 바다영화제가 열리고 있다. 인근 주변 명소로는 동양 최대의 다리인 창선. 삼천포대교와 한려해상국립공원을 둘러볼 수 있는 유람선 관광이 있다.",사천시
4,노산공원,경상남도 사천시 노산공원길 72,128.0744505,34.92486706,http://tong.visitkorea.or.kr/cms/resource/72/1998772_image2_1.jpg,"사천시는 1995년 5월 사천군과 삼천포시가 통합되어 탄생했으며 시내 중심부에 남해 바다인 사천만이 깊숙히 밀고 들어와 시내가 크게 둘로 나뉜다.  이처럼 사천시는 해안평야 지대인 만큼 청동기 시대의 유적, 그 가운데에서도 특히 고인돌이 많다. 노산공원은 사천시 시내 중심부인 서금동에 위치한 도시공원이다.바다를 향해 돌출한 언덕이며 언덕 위에는 잘 다듬어진 잔디밭과 시민의 산책로가 정비되어 있다. 노산공원의 맨위에서는 한려수도의 일부인 삼천포 앞바다를 한눈에 내려다 볼 수 있고, 공원 안에는 충혼탑과 판문점 자유의집 모양을 하고 있는 승공관(팔각정)이 있다.충무공 이순신장군의 동상도 늠름한 모습으로 삼천포 앞바다를 바라보고 있다.공원 아래에는 횟집들이 즐비하다.",사천시
5,늑도,경상남도 사천시 늑도길 53,128.0386759,34.9231444,http://tong.visitkorea.or.kr/cms/resource/38/2716338_image2_1.jpg,"늑도는 2개의 자그마한 구릉과 마을, 항구가 있는 어촌이다. 주변에는 마도, 초양도, 학섬 등 여러 유무인도들이 있다. 섬 내에는 선사시대 패총 유적이 볼만하고 특히 작은 방파제에서 감상하는 일출, 일몰이 일품이다. 또 1시간이면 섬을 둘러보는데 충분할 만큼 소소한 드라이브의 맛을 느낄 수 있는 섬이기도 하다. 

?일출&일몰&낚시&차박 캠핑 포인트: 
 - 늑도방파제(일출/일몰/낚시/차박 캠핑):사방이 바다로 둘러싸인 늑도방파제에서는 일출과 일몰 모두를 감상할 수 있다. 방파제 끄트머리에는 서로 마주하는 두 개의 등대가 있는데 하양 등대는 포토존으로, 빨강등대는 감성돔, 망상어 등을 잡을 수 있는 원투낚시터로 인기가 높으며 차박 캠핑도 가능하다.(시설: 주차장, 화장실)

?볼거리: 
 - 사천늑도유적:사천시 늑도동 47번지/청동기시대 말기~초기 철기시대의 무덤, 집단 단위의 집자리, 조개더미의 유적이 대규모로 형성되어 있다.",사천시
6,다맥 어촌체험마을,경상남도 사천시 서포면 다평로 2,127.9430745,34.97965304,http://tong.visitkorea.or.kr/cms/resource/66/2484966_image2_1.jpg,"사천시 서포면 다평리에 위치한 어촌체험마을이다. 바다와 섬, 갯벌이 어우러진 곳으로 경관이 수려하고 굴, 전어, 낙지 등이 유명하다. 어촌체험마을답게 바지락, 굴, 모시조개, 고둥 등 다양한 해산물을 직접 채취할 수 있어 아이들의 체험학습에도 좋으며, 낚시, 산악자전거 등 다채로운 체험을 즐길 수 있다. 마을 안에는 사천시 어촌체험 교육관이 있어 숙박시설로 이용할 수 있으며, 족구·배구·농구 등을 즐길 수 있는 체육시설과 주차장이 구비되어 있다.",사천시
7,다솔사(경남),경상남도 사천시 곤명면 다솔사길 417,127.9200793,35.08321879,http://tong.visitkorea.or.kr/cms/resource/56/2372756_image2_1.JPG,"다솔사는 신라 지증왕 때 범승 연기조사가 창건한 역사 깊은 고찰로, 임진왜란 때 소실되었는데 그로부터 10년이 지난 후인 숙종 12년(1686)에 승려들이 힘을 모아 10년 세월에 걸쳐 중창불사로 크게 중흥했다. 그러나 62년이 지난 후인 영조 24년(1748)에 큰 불로 말미암아 불행히도 큰 재앙을 겪었으며 같은 왕 34년(1758)에 여러 스님이 또 합심하여 명부전과 대양루 그리고 사왕문을 중건했다. 그런데 1914년 12월에 또 화재가 일어나 모든 전각이 불탔으나 다행히도 대양루는 소실되지 않았으며 그 이듬해부터 3년간 중건 끝에 현존하는 것이 이 건물이다.
* 주요 문화재 - 대양루, 극락전, 응진전, 보안암 석굴",사천시
8,다슬기 초량마을,경상남도 사천시 곤명면 초량길 27-3,127.9235979,35.10604406,http://tong.visitkorea.or.kr/cms/resource/71/2389971_image2_1.JPG,"경상남도 사천시 곤명면에 위치한 다슬기 초량마을은 조선조때 초량면의 소재지가 되었던 것을 연유하여 초량리라고 부르게 되었다. 과거 곤양군 초량면에 편입되어 있었으나 1914년 행정구역 정리에 따라 삼거리를 병합하여 초량리라 해서 현재는 사천군 곤명면에 편입되었다. 량마을 앞을 가로지르는?초량강(곤양천)이 있으며, 수질이 우수하고 다슬기와 민물고기가 많이 서식하고 있어 여름에는 관광객들이 많이 찾고 있다.",사천시
9,다자연 녹차단지,경상남도 사천시 곤명면 금성들길 55,127.9688708,35.14097426,http://tong.visitkorea.or.kr/cms/resource/63/2389963_image2_1.jpg,"흔히 녹차 하면 생각나는 보성과 하동이 아닌 경남 사천에 위치한 녹차 단지이다. 사천시 곤양면 금성리에 위치하여 있으며, 18만 1819㎡에 이르는 평지에서 재배되어 기계화가 가능하기 때문에 평당수확량이 월등히 차이나,  가격경쟁력이 뛰어난 것이 특징이다. 사천의 해양성 기후의 영향을 받아 여름에는 시원하고 겨울에는 온화한 환경에서 품질좋은 녹차가 재배되고 있으며, 공장옆에는 차를 시식하고, 다양한 체험을 할 수 있는 다자연문화센터를 갖추고 있다.  다자연 녹차단지에서는 직접 재배한 녹찻잎으로 만드는 녹차 제품은 물론, 녹차를 다양하게 활용하여 다기나 천연염색한 개량한복 등도 판매 중에 있다. ",사천시
10,대방마을,경남 사천시 동서동,128.0553798,34.92900237,http://tong.visitkorea.or.kr/cms/resource/69/1870669_image2_1.jpg,"경상남도 지정문화재 제93호인 대방진굴항이 위치하고 있다. 이 굴항은 고려시대 우리나라 연안을 빈번히 침범하던  왜구의 노략질을  방비하기 위해 설치한 구라량의 영이 있던 곳으로 수군 만호가 있었다. 구라량이 폐영되면서 소규모의 선진으로  남아 있다가 조선 말엽 재축조하여 1820년 경 완공되었다. 1910년 국권침탈과 함께 진영의 문서가 소각되었고, 현재는 복원하여 선착장으로 이용되고 있으며, 1995년 착공되어  삼천포항과 남해 창선면을 잇는 창선, 삼천포연륙교가 개통되어 사천시의 관광명소가 되고있다.",사천시
11,대방진굴항,경상남도 사천시 굴항길 99,128.0564575,34.9293829,http://tong.visitkorea.or.kr/cms/resource/71/2431671_image2_1.jpg,"대방진굴항은 사천시 대방동 바깥쪽 바닷가에 있는 2,099m²(635평)의 인공 항구이다. 고려시대 말 남해안에 자주 침입했던 왜구를 막기 위해 설치한 군항 시설의 하나로 임진왜란 때에는 충무공 이순신 장군이 수군 기지로 이용하였다 한다. 현재의 굴항은 조선 순조 때 진주병마절도사가 진주목 관하 73개 면의 백성을 동원하여 돌로 둑을 쌓아 만든 것으로, 1820년경에 완공하였다. 남해창선도의 적량첨사와 군사적 연락을 취하던 기지로, 당시에는 300여 명의 수군과 전함 2척이 주둔하고 있었다 한다.",사천시
12,망산공원,경상남도 사천시 망산동1길 41-15,128.072806,34.93250784,http://tong.visitkorea.or.kr/cms/resource/89/1903889_image2_1.jpg,"망산공원은 사천시 망산동에 위치한 근린휴식공원으로 왜구의 침입을 감시하는 망루가 있었던 망산에 위치해 사천 시가지와 삼천포항, 한려해상국립공원의 작은 섬들이 한눈에 들어오는 경치가 좋은 명소다. 또한 시민들을 위한 종합놀이대와 체력단련시설 등의 위락편의시설이 잘 구비되어 있어 많은 사랑을 받고 있는 공원이다.",사천시
13,모충공원,경상남도 사천시 송포동 1144-1,128.0481739,34.96656748,http://tong.visitkorea.or.kr/cms/resource/95/2715695_image2_1.jpg,"모충공원은 사천시 송포동 해안과 연접해있는 11만2천㎡의 천연지형을 이용한 자연공원으로 임진왜란 때 충무공 이순신 장군이 사천 선창에서 왜군을 물리치고 사천해전을 승리로 이끈 것을 기리고 시민들의 휴식 공간으로 활용하기 위해 만들어졌다. 모충공원은 숲이 울창하고 전망이 좋아서 바다 너머 멀리 모자랑포까지 한 눈에 조망할 수 있다. 모자랑포는 임진왜란이 발발한 1592년 5월 29일, 최초 출전한 거북선을 앞세운 이순신 함대가 적선 13척을 분멸하고 이동하여 밤을 샌 곳으로 난중일기에 기록되어 있는 역사의 현장이다. 공원에는 초석 110cm, 중대석 67cm, 비석 212cm 크기의 이순신 장군 추모기념비가 있으며, 기념비 바로 옆에는 이순신 장군 동상이 자리하고 있다. 또한 기념비에서 서북쪽으로는 강지바다를 한 눈에 관망할 수 있는 초소 역할을 했던 장좌곡이 있다. 주변에는 다양한 운동시설과 정자 등 휴식시설이 잘 갖추어져 있어 이 곳을 찾는 사람들이 편히 쉬어갈 수 있는 여유로움을 제공하고 있다. 또한 모충공원은 사천의 도보여행 코스 중 하나인 실안노을길의 시작점으로 여유가 된다면 모충공원을 둘러보고 사천만의 해안풍경과 전국 9대 노을 명소 중 하나인 실안낙조를 만날 수 있는 실안노을길 도보여행을 추천한다.",사천시
14,무지갯빛 해안도로,경상남도 사천시 용현면,128.0482506,35.01027368,http://tong.visitkorea.or.kr/cms/resource/47/2714847_image2_1.jpg,"사천 무지갯빛 해안도로는 용현면 송지리 부터 대포동 일원으로 펼쳐진 3km 드라이브 코스다. 알록달록한 경계석을 배경으로 사진을 찍기 위해 많은 관광객들이 방문하고 있다. 무지갯빛 해안도로는 시민들과 관광객들에게 색다른 볼거리를 제공하고, 거북선마을과 대포항 등 여러 관광지와 연계하여 관광하기에 매우 좋다.",사천시
15,백천사(사천),경상남도 사천시 백천길 326-2,128.0920304,34.99597051,http://tong.visitkorea.or.kr/cms/resource/71/2687571_image2_1.jpg,"1300년 전 신라 문무대왕 시절 의 선대사(의상 대사의 속세 형제)가 백천사를 처음 창건한 것으로 전해지고 있다. 몸속 법당 부처님을 모시게 된 백천사가 있는 와룡산에는 옛날의 절터가 많기로 유명하다. 구전(口傳) 되는 전설로 와룡산에는 팔만 구 암자(八萬九菴子)가 있었다고 전하는 것을 보면 꽤 많은 사찰(寺刹)이 이 산속에 들어앉아 있었음을 알 수 있다. 진양지(晋陽誌) 등에 나오는 백천사(白泉寺)의 기록에는 ''백천사는 와룡산의 서편에 있었다. 도솔암에서 흘러내리는 동쪽계곡은 양구택, 조황담, 백련폭이 그중 아름다운 곳이요. 선정암에서 흘러내리는 절의 서쪽 계곡은 세심정, 무금대 등의 좋은 경치가 있고 동서계곡의 상하에 물레방아 16개소가 있었는데 임진왜란 뒤에는 12개만 남았다. 묵계암도 백천사 북쪽 10리에 있었다.''하는 것으로 보아 대충 백천사의 위치를 가늠해 볼 수가 있을 뿐 아니라 백천계곡의 경관마저 짐작이 된다. 이 절터 부근에는 축을 쌓은 돌담이 부분적으로 남아 있을 뿐 아니라 석기(石器) 등 기왓장이 부서진 채 널려있는 것을 새롭게 재건축하여 구국 도량의 모습을 복원하기 위해 많은 노력을 하였다.",사천시
16,별주부전테마파크,경상남도 사천시 서포면 용궁로 132,127.9820991,34.96809392,http://tong.visitkorea.or.kr/cms/resource/18/2797618_image2_1.jpg,"아름다운 해안선을 따라 걷다 보면 나오는 별주부전테마파크는 별주부전을 테마로 한 공원답게 토끼, 거북이를 곳곳에서 볼 수 있다. 경남 사천에 위치한 비토섬은 토끼와 거북을 닮은 섬이 마주 보고 있어 별주부전의 고향으로 알려져 테마파크가 조성되었다. 벚꽃이 피는 시기에는 산책로에 벚꽃 터널이 형성되며 산책로 입구에 거대한 토끼 석상과 살아 움직이는 토끼들을 볼 수 있어 아이들과 함께 와도 좋다. 오르막을 살짝 오르면 멋진 바다 뷰도 볼 수 있고 전망대는 물론 아기자기한 조형물과 놀이터, 물놀이장, 캠핑장, 미로 숲 등이 있어 가족들과 함께 나들이하기 좋은 곳이다.",사천시
17,봉명산시립공원,경상남도 사천시 곤명면 용산리,127.9124021,35.08713488,http://tong.visitkorea.or.kr/cms/resource/01/2689601_image2_1.jpg,"봉명산(408m)은 시립공원으로 지정되어 있으며, 울창한 숲과 수려한 경치, 잘 조성된 산책로와 등산로 덕분에 삼림욕장으로 각광받고 있다. 신라 지증왕때 창건한 다솔사와, 보안암석굴, 이맹굴, 서봉사지 등이 있어 고고학계의 발길이 잦을 뿐 아니라 300여 미터인 봉암산, 천왕산 등을 연결하는 산책로는 등산코스로도 좋으며 정상에 서면 한려해상 국립공원인 다도해를 관망할 수 있어  많은 관광객과 등산객이 찾고 있다. 봉명산은 지도에는 ""이명산"", 현지 다솔사의 입구 입석에는 ""봉명산""이라 되어 있고, 시립공원으로 지정되어 있다. 정상에 오르면 남으로 금오산, 다도해, 서쪽으로 백운산, 서북으로 지리 능선, 웅석봉 등이 시야에 들어온다. 산행 기점은 봉명산 자락의 다솔사이다. 다솔사는 응진전, 극락전과 함께 문화재로 지정되어 있으며 샘물이 맛이 좋아 진주에서 많은 사람들이 물을 길러 오기도 한다. 다솔사에서 보안암으로 빠지는 고개를 통과해 20분이면 봉명산 정상이다. 정자에서 잠시 숨을 돌리고 북쪽으로 2m 정도 가면 잘 닦인 산책로가 나타나는데 보안암까지 20분 정도 걸린다. 보안암에서 좌우 능선으로 조그만 산길이 나 있다. 암자에서 뒤쪽 봉우리까지 10분이면 되고 서쪽 이명산을 오르는 깨사리고개까지는 10여분 더가면 된다. 깨사리고개에서 정상까지는 30여분 걸린다. 정상에는 원래 용지라는 못이 있었는데 지금은 없다. 정상에서 탁 트인 조망은 일품이다. 아래 등산로에 시루떡을 닮은 바위가 셋이 있는데 제일 위의 시루떡 바위에 불상이 새겨져있다. 정상에서 이곳으로 내려오면 서쪽으로 200m 오다 갈림길에서 남쪽의 보다 뚜렷한 산길을 택해야 한다. 마애불에서 곧장 능선 아래로 내려오면 작은 고개가 나타나는데 북쪽으로 뻗은 능선을 20분 오르면 계명산 정상이다. 정상에서 동북으로 20분 내려서면 계산마을이고 이 곳에서 북천역까지는 지척이다.",사천시
18,부잔교갯벌탐방로,경상남도 사천시 용현면 석양길 500,128.0473034,35.00941543,http://tong.visitkorea.or.kr/cms/resource/43/2714843_image2_1.jpg,실안 무지개 해안도로(무지갯빛 해안도로)를 따라 걷다 보면 부잔교갯벌탐방로를 만나볼 수 있다. 알록달록한 부잔교에는 형형색색의 바람개비와 함께 다리 위에서 남해의 갯벌과 바다 풍경을 바라볼 수 있다. 부잔교 갯벌탐방로에는 하트 포토존과 자전거 포토존이 위치하여 있어 남해안의 풍경과 함께 사진을 담을 수 있다.,사천시
19,비토섬,경상남도 사천시 서포면 비토안길 104-16,127.9728331,34.97497354,http://tong.visitkorea.or.kr/cms/resource/68/2371668_image2_1.jpg,"비토섬에는 월등도, 토끼섬, 거북섬, 목섬이 있고 이는 토끼와 거북이 용왕이 등장하는 별주부전의 전설이 서려있는 곳이며 육지와 바다사이에 두 번씩 나타났다가 사라졌다 하는 판이한 두 세계의 중간에 있는 갯벌은 육상과 해상의 생태계 완충작용과 연안 생태계유지물로서 훌륭하게 보존되어 자연생태 체험관광지로 각광받고있다. 또한 비토 동편 해안가는 스트로마토라이트를 비롯한 화석과 건열, 우점문 등 각종 지질 현상들을 관찰할 수 있다.",사천시
20,비토해양낚시공원,경상남도 사천시 서포면 비토리 산47-9,127.9717641,34.96207774,http://tong.visitkorea.or.kr/cms/resource/15/2798515_image2_1.JPG,"비토 해양낚시공원은 뛰어난 자연경관과 사계절 풍부한 해산물로 널리 알려진 비토섬에 있으며 비토어촌계가 위탁 운영하고 있다. 청정해역 수자원 보호구역에 위치한 낚시공원은 바다 위를 걷는 다리(보행교 228m), 산책로(보행 테크 316m), 부양식 낚시 잔교(낚시터 135m 2개소), 해상펜션 4동, 정자 시설(3동), 어린이 놀이터(2개소), 바다 생태체험장, 관리사무실 등으로 구성되어 있다. 특히 이곳은 전국에서 유일하게 ‘혼합밑밥 사용금지’로 환경과 수자원을 보호하고 있다. 계절에 따라 볼락, 도다리, 감성돔, 농어 등의 고급 어종들을 맛볼 수 있다.  주변에 사천 8경의 한곳인 비토섬 갯벌, 별주부전의 전설이 서려 있는 별주부전 테마파크, 비토 국민 여가 캠핑장 등이 있다.",사천시
21,사천 바리안마을,경상남도 사천시 사남면 우천길 47-12,128.117405,35.03390837,http://tong.visitkorea.or.kr/cms/resource/16/2486316_image2_1.jpg,"사남면사무소에서 동쪽으로 시,군도 1001호선이 포장된 도로를 따라 구룡 저수지의 끝자락에 마주한 우천리 우천마을로서 사천의 주산인 와룡산의 한 갈래가 뻗어내려 형성된 마을 뒷산이 솔개가 먹이를 포식하는 형상이고 우천(牛川)은 마을의 뒷산이 지리풍수설로 와우형(蝸右型)이라 소꼬리는 와룡산에 있고 소머리 부분이 마을에 위치하여 와룡산에서 맛있는 풀을 많이 뜯어 먹고 냇가에서 물을 먹은 다음 편안한 모양으로 편히 누워있는 형상이라는 풍수지리학적인 이름으로 우천이라 불리는 유래를 지니고 있다. 

마을에서 직접 삼을 재배하여 마을 사람들이 협동으로 삼을 심고 베고 삼곳에서 찌고 껍질을 벗기는 작업을 공동으로 하는 두레가 아직도 맥을 이어가고 있으며 바리안베는 아주 고운 베를 나타내는 말로서 이 마을의 특징을 이미지화하여 만들어진 것이다. 아침저녁 기온차가 크며, 맑고 깨끗한 환경으로서 친환경농산물과 농촌진흥청에서 지도하는 최고 품질의 미질을 자랑하는 쌀의 생산지이며 고운 색깔의 감과 대봉이 주렁주렁 달려있는 아름다운 마을이다.",사천시
22,사천 항공우주박물관,경상남도 사천시 사남면 공단1로 78,128.0629088,35.07145319,http://tong.visitkorea.or.kr/cms/resource/75/1611375_image2_1.jpg,"우리 꿈을 가장 높은 곳으로 사람은 언제부터 날기 시작했을까? 우린 어디까지 올라갈 수 있을까? 사천 항공우주박물관에서는 새가 되고 싶었던 인류의 꿈이 실현되는 과정을 볼 수 있다. 하늘과 우주를  보고, 비행기를 만지고, 직접 탑승하며 온몸을 저 우주로 날려보자. ",사천시
23,사천 흥사리 매향비,경상남도 사천시 곤양면 흥사리,128.0151626,35.08633956,http://tong.visitkorea.or.kr/cms/resource/62/2371662_image2_1.jpg,"매향비란 향나무를 땅에 묻고 그위에 비를 세우는 것을 말한다. 사천매향비는 고려 말 왜구의 극심한 횡포로 나라가 위태로워 지자우왕13년(1387)에 세운 것으로 승려 중심의 불교신자 4,100명이향계를 맺고 “나라가 태평하고 백성이 살기가 평안함을 미륵에게비옵니다” 라는 의미를 가진 204자를 매향비에 새겼다. 이를통해 건립목적과 건립연대를 확실히 알 수 있어 이 비석의 가치가더욱 높은 것이 특징이다.",사천시
24,사천고읍단감마을,경상남도 사천시 정동면 고읍길 223,128.0975947,35.06759034,http://tong.visitkorea.or.kr/cms/resource/66/2536566_image2_1.jpg,"사천고읍단감마을은 마을 주민의 80%가 단감 농사를 짓고 있으며, 특산품으로 단감을 비롯해 감식초, 감잎차가 있다. 사천시 정동면소재지로서 고려시대 이래 조선 초기까지 읍기(관청이 있는 곳)가 있던 곳이다. 그런데 세종 을축년(1445년) 봄에 사천읍성을 쌓고 읍기를 천도해 가면서 자연히 구읍, 읍촌, 고읍촌, 고읍동 따위로 불렸다. 1914년에는 읍동면이 되면서 면소재지가 되었고, 1931년에 지금의 정동면으로 이름이 바뀌었다. 1934년에는 면소재지를 지금의 대곡리숲으로 옮겨, 오늘과 같은 한적한 마을로 바뀌었다. 동쪽에는 널따란 들녘을 경계로 대곡리와 수청리, 남쪽은 사천강 건너 예수리, 서쪽은 국도 3호선 건너 사천읍 사주리, 북쪽에는 역시 사천읍과 본면 화암리가 자리 잡고 있다.",사천시
