,title,addr1,mapx,mapy,firstimage,overview,addr2
55,퇴로고가마을,경상남도 밀양시 부북면 퇴로로 233,128.7006512,35.54894708,http://tong.visitkorea.or.kr/cms/resource/61/2794261_image2_1.jpg,"밀양 부북면 퇴로리에 위치한 퇴로리 고가 마을은 조선 시대에 건립된 여주 이씨 종택을 비롯해 여러 채의 고택이 있어 문화재적 가치와 더불어 한적한 시골 마을의 전형을 그대로 느낄 수 있는 곳이다. 퇴로리 고가마을 골목을 걷다 보면 진흙을 발라 낮게 조성한 토담과 빛바랜 아청색의 기와가 흘러간 세월의 무게를 잘 느끼게 해주는 곳이다. 토담 사이로 난 길을 따라 어디든 걸어도  고요하면서 편안한 분위기를 잘 느낄 수 있다. 특히 여주 이씨 고가는 배우 강부자 주연의 영화 ‘오구' 촬영지로도 많이 알려졌으며, 봄이면 마당에 심어놓은 나무들이 꽃을 피우고, 가을이면 감나무에 감이 주렁주렁 매달려 있는 운치를 감상할 수 있는 곳이다. 또한, 전통 문화관에서는 떡 만들기, 고구마 캐기, 치즈 만들기, 아기소 우유 주기 등 다양한 체험을 즐길 수 있으며, 저렴한 가격으로 고택에서의 숙박 체험까지 가능해 가족 여행객들에게 시골 여행의 참맛을 알려준다. 또한 이곳은 고택체험, 농촌체험, 밀양 치즈 스쿨 등 가족과 함께 할 수 있는 다양한 체험 프로그램을 운영하고 있어 아이들에게는 우리 문화재의 소중함을, 어른들에게는 어린 시절 시골집에서 경험했던 소소한 추억을 선사하고 있다.		
*체험행사와 고가 펜션 숙박은 사전에 인터넷이나 전화 등을 통해 예약해야 하며, 선착순으로 이뤄진다.",밀양시
56,트윈터널,경상남도 밀양시 삼랑진읍 삼랑진로 537-11,128.8073457,35.40825932,http://tong.visitkorea.or.kr/cms/resource/05/2613105_image2_1.jpg,"빛과 캐릭터로 이루어진 테마파크이다. 경부선 폐터널을 재생사업한 공간으로 약 1억개의 led불빛으로 수놓아 포토존이 가득하다. 터널은 약 1km의 길이로 구성되어 크게 10가지의 테마로 꾸며져있다.

삼랑진 트윈터널은 조선시대 고종이 직접 명령하여 만든 철도 터널로, 실제로 열차가 달리던 터널이었지만 KTX의 개통으로 더 이상 사용하지 않게 된 곳이다.

일제 강점기부터 터널에서 도깨비불을 봤다거나 빛나는 돌을 주워 큰 행운을 얻었다는 등 많은 신비한 이야기가 전해오던 곳이다.
이런 신비한 빛에 관한 이야기들을 캐릭터와 접목시켜 테마파크로 만든 곳이 삼랑진 트윈터널이다.",밀양시
57,표충비,경상남도 밀양시 무안면 동부동안길 4,128.6514299,35.47183542,http://tong.visitkorea.or.kr/cms/resource/45/2589445_image2_1.bmp,"* 사명대사의 영검이 담겨있는 비, 표충비 *밀양시 무안면 홍제사 경내에 위치한 비각으로 사명당 송운대사를 일명 사명대사비라 부른다. 임진왜란 당시 의승병을 이끌어 왜군을 크게 무찌르고 일본에 전쟁포로로 끌려간 조선인 3,000명을 환국시킨 유정의 높은 뜻을 기리기 위해 세웠다. 즉 표충사의 동쪽인 이곳에 1742년(영조 18) 대사의 5대 법손 남붕이 경산에서 갖고 온 돌로 건립하였다. 비신과 화강암의 비개를 갖추었고, 경주석재인 빗돌은 까만 대리석이며 좌대석과 이수는 화강암으로 되어 있다. 뒷면에는 서산대사 휴정(休靜)과 기허(驥虛)대사의 행장(行狀)이 새겨져 있고 측면에는 표충사(表忠祠)에 대한 내력을 새겼다. 비문의 내용은 영중추부사 이의현이, 글씨는 홍문관 부제학 김진상이 쓰고 판중추부사 유척기가 전서하였다.* 땀 흘리는 비로 유명한 표충비 *표충비가 유명해진 이유는 나라에 큰 일이 있을 때마다 비신에서 땀이 흘렀다는 이야기 때문이다. 마치 구슬처럼 흐르는데 이것을 두고 이곳 사람들은 나라와 겨레를 존중하고 근심하는 사명대사의 영험이라 하여 신성시한다. 그래서 ‘땀흘리는 표충비’로 널리 알려져 있으며, 밀양 얼음골과 만어산어산불영경석과 함께 밀양의 3대 신비로 일컬어진다.",밀양시
58,표충사 우리아이 마음숲 놀이터,경상남도 밀양시 단장면 구천리,128.9461968,35.53258401,http://tong.visitkorea.or.kr/cms/resource/52/2685752_image2_1.JPG,"어린이들의 모험심을 길러주기 위해 총사업비 30억을 들여 조성하였으며, 경남지역 최대규모의 어린이 놀이기구 6종(더블돔 플레이, 스파이더 넷 타워, 나무집 놀이터, 스카이워크-우디, 개마 타워, 무지게 그네)을 주변 맑은 계곡과 표충사,시전마을 명품숲과 연계하여 여행하기에 좋다. 주변의 표충사관광지구에는 다양한 식당, 기념품점, 매점, 숙소가 있어서 이용이 편리하다. 자연친화적인 공간 등으로 인해 2020년 행정안전부 선정 우수어린이 놀이시설로 선정되었다.",밀양시
59,표충사(밀양),경상남도 밀양시 단장면 표충로 1338,128.9602095,35.53323697,http://tong.visitkorea.or.kr/cms/resource/52/2589452_image2_1.bmp,"경상남도기념물인 표충사는 임진왜란 때 공을 세운 사명대사(四溟大師)의 충혼을 기리기 위하여 국가에서 명명한 절이다.
1715년(숙종 41)에 중건한 사실이 있으나 1926년에 응진전(應眞殿)을 제외한 모든 건물이 화재로 소실된 것을 재건하여 오늘에 이르고 있다. 주요 문화재 및 건물로는 국보인 청동함은향완(靑銅含銀香)을 비롯하여 보물 삼층석탑이 있으며 석등(石燈) ·표충서원(表忠書院) ·대광전(大光殿) 등의 지방문화재와 25동의 건물, 사명대사의 유물 300여 점이 보존되어 있다.",밀양시
60,표충사계곡,경상남도 밀양시 단장면 표충로 1338,128.9593901,35.53320085,http://tong.visitkorea.or.kr/cms/resource/93/2799093_image2_1.JPG,"밀양에서 무더운 여름을 시원하게 즐길 수 있는 대표적인 계곡으로 꼽힌다. 신라 원효대사가 창건했다고 전해지는 표충사를 중심으로 왼쪽과 오른쪽에 각각 금강동천과 옥류동천 두 계곡물이 흘러 시전천에서 만나는데, 이 시전천이 단장면 일대를 가로지르는 단장천으로 이어진다. 금강동천은 사자봉에서, 옥류동천은 억새밭으로 잘 알려진 사자평과 수미봉에서 흘러내린다. 워낙 물이 맑고 차가워서 피서지로 큰 인기다. 우거진 나무들이 만들어내는 그늘도 한여름 땀방울을 식히기에 그만이다. 등산객들에겐 계곡을 따라 흑룡폭포와 층층폭포, 수미봉과 사자봉을 거쳐 한계암으로 오르는 코스도 인기다. 계곡 하류에는 캠핑장이 조성돼 가족 단위 여행객들이 즐겨 찾는다.",밀양시
61,표충서원,경상남도 밀양시 단장면 표충로 1338,128.9603567,35.53308144,http://tong.visitkorea.or.kr/cms/resource/79/2589479_image2_1.bmp,"표충서원(表忠書院)은 본래 표충사(表忠祠)라고 불렀는데, 임진왜란 때 의승장(義僧將)으로서 구국(救國)의 대공(大功)을 세운 서산(西山), 송운(松雲), 기허(騎虛) 등 대사(大師)를 향사(享祀)하는 곳으로서 본래는 1610년(광해군 2)에 창건하였다. 1669년(현종 10)에는 조정에서 사액하였다. 무안면 중산리 웅동(熊洞 : 현, 대법사(大法寺)자리)에 있던 것을 1839년(헌종 5)정월에 송운대사(松雲大師)의 8세(世) 법손(法孫)인 월파당(月坡堂) 천유(天有)가 당시 영정사(靈井寺 : 현재 표충사) 주지(住持)로 있을 때 밀양부사(密陽府使) 심의복(沈宜復)과 그의 아들인 순상(巡相) 심경택(沈敬澤)의 힘을 빌리고 예조(禮曹)의 승인을 얻어, 현 위치인 단장면 구천리 영정사(靈井寺) 경내로 옮기고 편액을 표충서원(表忠書院)이라 고쳐 걸고, 절의 이름도 표충사(表忠寺)로 고쳐 부르게 되었다. 1871년(고종 8년)에 흥선대원군(興宣大院君)에 의한 서원철폐령(書院撤廢令)에 따라 이 서원도 훼철(毁撤) 되었다가 1883년(고종 20년) 사림(士林)의 요청으로 복원(復院) 되었으며 근년에 현재의 자리로 옮겨지었다.",밀양시
62,하남체육공원,경상남도 밀양시 하남읍 수산제방길 29,128.7124689,35.37170891,http://tong.visitkorea.or.kr/cms/resource/72/2746272_image2_1.JPG,"하남읍 수산리는 낙동강변에 위치하여 부산, 김해, 창원에서의 접근이 용이하다. 풋살장, 축구장, 체력단련 기구가 마련되어 있어 인근 주민들의 스포츠 명소로 주목받고 있다. 특히 다른 지역과 연결되는 2~3개의 자전거 코스가 있어, 라이더들이 즐겨 찾는다. 강아지와 함께 산책하는 사람들도 쉽게 눈에 띈다. 계절별로 옷을 갈아입는 다양한 꽃들은 이곳을 찾는 이들의 눈을 즐겁게 한다. 작약꽃, 장미꽃, 금계국, 양귀비, 코스모스, 메밀꽃 등이 바로 그 주인공이다. 또한 8월이면 300m에 이르는 넝쿨 식물 터널에 땅콩 호박, 베레모 호박, 오렌지 국수, 십손이, 이색 칼라스푼 등 다양한 박들을 만나 볼 수 있다.",밀양시
63,홍제사(밀양),경상남도 밀양시 무안면 동부동안길 4,128.6520465,35.47151046,http://tong.visitkorea.or.kr/cms/resource/46/2606546_image2_1.bmp,"* 홍제사의 창건과 역사 *홍제사는 조선시대 승병장인 사명대사(四溟大師)의 표충사당과 표충비각을 보호하기 위해 지어진 사당 수호사찰이다. 그 연혁은 자세하지 않으나 이곳 무안에 표충비가 세워진 1742년(영조 18)에 사명의 뜻을 기리기 위해 세워진 사찰로 알려져 있다. 무안면은 사명대사의 출생지이기도 하며 사명대사가 창건한 백하암(白霞庵)이 있던 곳으로, 홍제사는 사명대사가 입적한 뒤 백하암에 세웠던 표충사(表忠祠)의 후신이다. 백화암은 병자호란으로 그 내부에 있던 사당이 퇴락하자 1710년(숙종 36) 밀양부사 김창석이 사명대사의 영정을 봉안하는 영당을 짓고 사당을 정비하였다. 이후 표충비각의 창건주로 사명대사의 5대 법손인 태허당(泰虛堂) 남붕선사(南鵬禪師)가 나라로부터 ‘表忠書院’이라는 사액을 받으면서, 현재의 터에 표충비각을 세우고 백화암에 있던 사당을 홍제사터에 건립한 것으로 보인다. 그 뒤 사당 수호사찰로 명맥을 유지다가 1838년(헌종 4)에 표충서원이 사명대사의 8대 법손인 천유대사(天有大師)의 주도로 재약산 아래 영정사(靈井寺)로 옮겨지면서, 비각을 독자적으로 보전하기 위한 자그마한 원당과 삼비문(三碑門)을 형성하여 현재의 가람을 형성한 것으로 보인다. 비각의 관리는 표충사 승려가 번갈아 파견되어 담당하다가일제 때에는 대처승이 허물어진 원당과 요사를 헐고 현대식 법당과 요사를 지어 포교당으로 삼고 비각을 보존하기도 하였다.광복 후에는 구연운(具蓮耘) 화상이 비각의 관리를 맡아 비각과 법당을 중수하였으며, 그뒤 거의 폐허가 된 표충비만이남게 되었다. 1977년에는 창건주 한월(漢月) 동조선사(東照禪師)가 홍제사라는 이름으로 재창건하여 국가의 지원으로 표충비각을 중수하면서 현재의 가람을 이룩하였다. 1978년에 표충비를 보호하는 보호각을 건립하고 그 주위로 담장ㆍ삼비문과 비각을 수호하는 인법당 등을 갖추게 되었다. 이후 연경장엽(蓮耕壯曄) 선사가 경충당을 건립하였고, 1981년에는 현재 요사로 쓰고 있는 인법당을 축대 아래로 내려 현재의 설법보전을 신축하였다.1981년부터 수년간 홍제사 2대 중창주인 정상(淨相) 스님이 현대그룹 정주영 회장의 도움으로, 주법당인 설법보전과 사적비ㆍ범종각ㆍ경충당ㆍ요사 등 현재 홍제사의 가람 기틀을 이룩한 것으로 보인다. 근래에는 표충비각의 수호사찰로 밀양시가 추진하고 있는 사명대사 성역화작업의 중심역할을 하고 있으며, 국가의 중대사나 위기 때마다 표충비에서 땀이 흘러 ‘땀 흘리는 비’를 지키는 사찰로 전국에 알려져 있기도 하다.",밀양시
