,title,addr1,mapx,mapy,firstimage,overview,addr2
0,구암저수지,충청북도 진천군 광혜원면 회죽리 409-2,127.4313382,36.97898317,http://tong.visitkorea.or.kr/cms/resource/62/2769762_image2_1.jpg,"구암저수지는 충북 진천군 광혜원면에 자리 잡고 있다. 이곳은 무수저수지라고도 불리며, 지역민들 사이에서는 댓골저수지로 불리기도 한다. 주변 풍광이 좋아 드라이브에 나섰다가 차를 잠시 세우고 쉬어가기에도 적합하고 산책로를 따라 걷다가 풍경을 감상하기에도 좋다. 저수지는 대소IC와 북진천IC에서 가까운 거리에 있다.",진천군
1,노은영당,충청북도 진천군 이월면 논실길 113-10,127.4160939,36.92353928,http://tong.visitkorea.or.kr/cms/resource/98/214498_image2_1.jpg,"노은영당은 진천군 이월면 노곡마을의 왜가리 번식지 부근에 있는 사당으로, 조선 선조 때의 문신인 신잡의 영정을 모신 곳이다.독송 신잡(1541∼1609)선생은 1584년 과거에 급제 한 후 이조참판·형조참판을 지냈다.임진란때 선조를 의주까지 호종한 공으로 호성공신 2등에 평천부원군으로 봉해졌으며 개성유수가 되었다.신잡영정(충청북도 유형문화재)은 조선 선조 37년(1604)에 공의 54세때 모습을 김이혁이 그렸다 하며 비단 바탕에 색을 넣어 그린 전신상의 초상화인데 크기는 가로 90cm,세로 167cm로 그림의 형태와 안면처리법 등이 조선중기 초상화의 전형적인 모습을 보여주고 있다. 노은영당 뒤쪽의 왜가리 번식지에는 매년 2~3월 1,000여 마리의 왜가리가 날아와 9~10월까지 서식하다 날아간다.",진천군
2,대흥사(진천),충청북도 진천군 진천읍 문진로 1300-80,127.4224818,36.84058228,http://tong.visitkorea.or.kr/cms/resource/91/1329791_image2_1.jpg,"진천은 삼국통일의 주역인 김유신 장군이 태어나고 자란 곳이다. 또한 맑은 물과 기름진 너른 벌판이 있어 하늘이 내린 곳이라고도 한다. 이러한 진천을 한눈에 굽어보고자하면 봉화산 중턱에 자리한 대흥사가 제격이다. 대흥사는 고려시대의 절터로서 조선후기에 참의 벼슬을 하던 조중우(趙重愚)가 창건하고 영은암이라 했던 것을 1907년에 다시 조창호(趙昌鎬)가 중건한 사찰이다. 그러나 우리나라에 흩어져 있는 대부분의 작은 사찰들이 그러하듯이 근래까지도 겨우 명맥을 이어오고 있었으나 2000년에 들어서면서부터 가람을 일신하고 있다. 옹색했던 터전은 넓직한 도량으로 변모를 했고, 겨우 비바람을 피할 정도의 법당과 당우(堂宇)는 아름다운 처마곡선을 뽐내고 있다.",진천군
3,만뢰산,충청북도 진천군 백곡면 대문리,127.3365364,36.85337649,http://tong.visitkorea.or.kr/cms/resource/71/1329871_image2_1.jpg,"이 이름은 고구려시대에 지명을 본떠서 그대로 붙인 이름으로 추측된다. 높이는 611m이다. 만노산·이흘산이라고도 불린다. 주능선은 충청북도와 충청남도를 가르는 경계선이다. 정상에는 화가 최양호가 제작한 장승이 세워져 있다. 이 장승은 한자 뫼 산(山)의 형태를 갖추고 있는데,  진천에서 가장 높은 산을 상징한다. 산행 제1코스는 백곡면 대문리 하수문에서 시작한다.  하수문에서 우측으로 들어가면 절골이 나오며 계곡 능선길을 따라 40분 정도 오르면 정상이다. 정상에는 헬기장이 있고 1984년에 세운 삼각점이 박혀 있다. 시야에 연곡저수지와 몽각산(403m)이 전망된다. 하산은 정상에서 동쪽으로 난 주능선을 따라 540봉을 거쳐 연곡리 쪽으로 내려가거나 남쪽 연곡지를 통하여 내려온다. 

연곡리 보련마을 쪽 하산은 남쪽으로 정상의 헬기장을 가로지른다. 완만한 능선을 따라 내려서면 보련마을에 도착하며, 이곳에는 진천 연곡리 석비(보물 404)와 보탑사 삼층목탑이 볼거리이다. 계속 내려가면 연곡지가 나온다. 연곡지는 겨울철 얼음낚시로 유명한 곳으로, 작은 길을 40분 정도 내려가면 김유신의 탄생지에 닿게 된다.  산행거리는 6.8㎞이고 약 3시간 20분이 소요된다. 제2코스는 연곡리 보련마을이 산행기점이 된다.  마을 왼쪽으로 올라가면 천수탑과 기도터를 지나며 주능선에서 오른쪽으로 따라가면 정상이다. 하산은 동북쪽으로 난 능선길을 따라 540봉을 거쳐 남동쪽 능선을 따라 내려가면 된다. 산행거리는 7.5㎞ 거리이며 약 2시간 40분이 소요된다. 백곡면 대문리와 성대리는 마을 전체가 안개꽃 단지이다. 이곳에는 진천 연곡리 석비(보물 404) 등 많은 유적들이 산재해 있다.",진천군
4,물안뜰체험관,충청북도 진천군 백곡면 백곡로 964,127.381476,36.8804214,http://tong.visitkorea.or.kr/cms/resource/68/2436468_image2_1.JPG,"충북 진천군에 위치한 물안뜰 마을은 아름다운 백곡저수지를 배경으로 넉넉한 마을인심과 따뜻한 정으로 마을을 찾는 관광객들을 맞이하고 있다.맑은 물과 좋은 토양 덕분에 예로부터 질좋은 쌀과 고추 등 특용작물, 각종 과수들이 넉넉하게 생산되고 있는 것이 물안뜰 마을의 자랑이며,물안뜰체험관과 건강체험관, 숯테마관 등?다양한 체험시설과 편의 시설을 갖추고 있어서 농촌 체험을 목적으로 방문하는 가족, 단체 관광객들이 찾기 좋은 마을이다.",진천군
5,백곡저수지,충북 진천군 진천읍 건송리,127.4004997,36.86592064,http://tong.visitkorea.or.kr/cms/resource/98/1329998_image2_1.jpg,"동양에서 유일하게 싸이폰식저수지(1949)였으나 80년대초 저수지 제방확장 축조사업으로 싸이폰시설은 수몰되었다. 저수지의 규모를 보면 진천군과 음성군 지역에 필요한 농업용수를 보급할 수 있도록 3089ha를 개발하고 총저수량 2,200만톤, 만수 면적 232ha, 제방높이 27m, 길이 410m, 수문식 물넘이 4련(連), 최대 홍수배제량 833m3/s이다.",진천군
6,생거진천 자연휴양림,충청북도 진천군 백곡면 명암길 435-135,127.3901879,36.92414986,http://tong.visitkorea.or.kr/cms/resource/90/2769790_image2_1.jpg,"생거진천 자연휴양림은 수려한 경관을 지닌 진천군 백곡면 명암리 무제산 일원에 자리 잡고 있다. 자연생태계를 유지 보전하면서 산에서 경험할 수 있는 건강한 휴양 활동을 제공한다. 산림이 가지고 있는 자원을 이용하여 다양한 휴식과체험 공간, 자연 학습과 산림 교육의 장소로 이용되고 있다. 휴양림에서는 숲 해설과 유아 숲체험 프로그램을 운영하고 있다.",진천군
7,성림사(진천),충청북도 진천군 덕산면 인화길 83,127.4889302,36.8815121,http://tong.visitkorea.or.kr/cms/resource/63/214063_image2_1.jpg,"성림사(成林寺)는 충청북도 진천군 덕산면에 자리한 한국불교 태고종 소속의 사찰이다. 오래전부터 성림사가 자리한 곳은 진천 제일의 명당으로 이름이나 있었다. 전하는 이야기에 의하면 1960년대 쯤 한 노인이 전국을 순회하는 어느 지관(地官)으로부터 고기록(古記錄)을 전수받았다고 한다. 이름을 알 수 없는 지관은 진천의 불처당(佛處堂)이라는 이곳을 다녀갔는데 바로 성림사 자리가 문무목상(文武牧相)이 날 곳이라는 이야기를 하며 적어주었다는 것이다. 이러한 일이 있은 뒤 1965년에 전해산(全海山) 스님이 고려시대 조성된 마애여래좌상만 덩그러니 남아있는 터에 새로 절을 창건하니 오늘날 성림사(成林寺)이다. 해산스님께서 지관의 계시(啓示) 때문에 누군가가 무덤을 쓰려는 것을 막고, 쓸쓸하게 폐허를 지키고 있는 부처님(마애여래좌상)을 공양하기 위해 창건이라는 원력(願力)을 세우신 것이며, 해산 스님의 창건이후 40여 년이 지난 지금 성림사는 혜묵스님에 이르러 다시 한 번 중창되었다.[진천산수리마애여래좌상] 충청북도 문화재자료 제20호(1998년 1월 9일 지정) 고려시대에 만들어진 것으로 추정되는 아미타불좌상으로 하반신을 조각하지 않은 특이한 형태의 불상이다. 양 팔뚝의 대의 옷 주름선, 화불의 모습이 특이하며 전체적으로 당당하면서도 매우 부드럽고 원만한 인상 등 진천지역 불교 조각의 일면을 잘 보여주는 불상이다.이 불상은 광배(光背)까지 하나의 돌로 만든 큰 불상이다. 진천지방에서 산견(散見) 되는 대부분의 석불이 큰 불상인 점에서 이 석불도 그러한 유행의 소작(所作)이라고 볼 수있다. 머리는 관모(冠帽)를 썼으며 얼굴은 살이 많이 쪘고 눈과 코의 일부는 마멸되었다. 귀는 크고 길게하여 어깨까지 가까이 닿게 하였으며 목에는 삼도(三道)가 뚜렷하고 넓은 어깨에 통견의(通絹衣)가 걸쳐 있고 법의(法衣)는 비교적 두껍게 표현되었다. 오른손과 왼손은 손가락을 접어 내장(內掌)하여 모두 가슴에 대고 있는 모습이고 광배는 배의 모양으로 되었으며 머리 위로 삼구(三軀)의 화불(化佛)을 연줄기 무늬위에 배치한 것이 특징이다.무릎 아래의 표현은 현재 사찰측이 목조로 예배단을 조성하여 알 수 없으나 사찰측의 설명으로는 좌상(坐像)으로 별다른 조각이 없다는 것이다. 불상의 형식과 성림사 주변에서 흔하게 눈에 띄는 기와 조각등으로 보아 고려중기 이후의 것으로 추정하고 있다. 이 불상의 실측치는 두고(頭高) 68㎝, 이장(耳長) 36㎝, 견폭(肩幅) 84㎝, 수장(手帳) 33㎝, 수폭(手幅) 29㎝, 화불고(化佛高) 25㎝, 두께 60㎝이다.* 시대 - 고려시대",진천군
8,안골관광농원,충청북도 진천군 백곡면 용암2길 108-36,127.3667442,36.87445516,http://tong.visitkorea.or.kr/cms/resource/58/1596958_image2_1.jpg,농원내에서 숙박이 가능하다. 자연호수와 숲과 골짜기가 뛰어난 경관을 자랑하는 안골관광농원은 시골의 텃밭같이 꾸민 정원 등이 형화로운 정취를 한껏 느끼게 해주는 곳이다. ,진천군
9,연곡계곡,충청북도 진천군 진천읍 연곡리,127.355796,36.8427725,http://tong.visitkorea.or.kr/cms/resource/87/1332387_image2_1.jpg,진천주둔부대가 있는 사석에서 약 10km 가량의 유서깊은 계곡이다. 상류의 만뢰산과 연곡저수지에서 흘러 내려오는 맑은 물과 숲이 우거져 여름이면 피서객들이 많이 찾아와 더위를 식히는 곳이다. 계곡을 따라 올라가보면 상계리에서 삼국 통일의 위업을 완수하신 김유신장군의 탄생지가 있으며 연곡리의 통일대탑 보탑사를 들러 마음을 정화시킬 수 있다. 더불어 진천의 고봉 만뢰산 등산도 해봄직하여 가을이면 수려한 주변 경관이 더욱 감탄을 자아낸다.,진천군
10,연곡저수지,충청북도 진천군 진천읍 연곡리,127.3609677,36.84450017,http://tong.visitkorea.or.kr/cms/resource/00/1332400_image2_1.jpg,"진천읍 상계리에 있는 김유신탄생지를 들러 구불구불한 도로를 따라 위쪽으로 올라가면 산속에 자리하고 있는 조용한 저수지를 만날 수 있는데 이곳이 연곡저수지이다. 연곡저수지는 총 저수량 920톤 정도의 그리 크지 않은 규모로 주변 자연환경이 아늑하고 고요하다.  또한, 연곡저수지를 지나 약 20분 정도 숲길을 걸어가면, 길이 끝나는 곳에 보탑사가 위치해 있는데 이곳에 못을 하나도 사용하지 않고 지었다는 3층 목탑 (통일대탑)이 있어 내부 계단을 통해 3층까지 올라가 주변 경관을 시원하게 둘러볼 수 있다.",진천군
11,연제 안승갑 고가,충청북도 진천군 진천읍 보련골길 46,127.3533462,36.84621095,http://tong.visitkorea.or.kr/cms/resource/32/1332432_image2_1.jpg,"연제 안승갑(1887~1951)고가는 진천의 진산 만뢰산 아래 연화부수형 보련마을의 중심자리에 위치한다. 조선시대 전통 가옥구조를 계승하여 1900년대 초에 건축한 'ㄱ字形' 돌기와 팔작지붕으로 정면 6칸 측면 2칸 반으로 부분적인 겹집형태로 본채의 구조는 좌측(서쪽) 으로부터 반 칸의 뒤주가 부엌에 이어져 있고 안방과 윗방, 대청이 있다. 대청마루는 널찍하고 매 칸마다 여닫이문을 설치하여 상당히 개방적이며, 부엌은 정면 2칸 측면 2칸의 크기로 전면 앞마당과는 쌍여닫이 판문으로 연결 되어있다.대문과 광은 본채와 직각으로 배치되어 정면 3칸 측면 1칸 크기로 각 칸을 사이벽으로 구획하고 간략한 토벽구조로 축조 되었으며, 본채와 아래채 사이에는 좌로부터 외양간, 변소, 잿간, 헛간으로 구성된 건물 1동이 자리 잡고 있다. 연제 안승갑 선생은 1934년부터 1942년까지 현 화랑문화학교 자리에 안중근의사의 재종질 등 민족혼이 투철한 선생을 초빙하여 한글, 우리역사, 민족사상등을 교육하던 만뢰학원을 사비로 설립.운영하였다.",진천군
12,용화사(진천),충청북도 진천군 진천읍 소강정1길 83,127.4512593,36.8552089,http://tong.visitkorea.or.kr/cms/resource/69/1332469_image2_1.jpg,"용화사(龍華寺)는 충청북도 진천군 진천읍에 자리한 대한불교 조계종 제5교구 본사인 법주사의 말사이다. 뽀얀 먼지를 휘날리며 수많은 왜적들이 진천을 향해 달려오고 있었다. 그런데 갑자기 왜적들의 눈에 엄청나게 큰 장수같이 보이는 형상이 눈에 들어왔다. 깜짝 놀란 왜적들은 순간 갈등을 하지 않을 수 없었다. 저렇게 큰 장수가 달려와서 칼을 휘두른다면 진영은 풍비박산이 날게 뻔했기 때문이다. 큰 장수와 싸움을 할 것인가 말 것인가를 고심하던 왜장은 마침내 퇴각하라는 명령을 내렸다. 그러자 수많은 왜적들은 혼비백산하여 물러가고 말았다. 이 이야기는 용화사 석불입상에 얽힌 전설로 진천의 옛 읍지인『상산지(常山誌)』 고적(古蹟)조에 전하는 것이다.전국토가 왜적의 총칼에 의해 초토화되고 있을 때 왜적들의 간담을 서늘하게 하여 진천을 지켜내었다는 석불입상의 이야기는 입에서 입으로 전해져 진천의 수호신으로까지 불리어지고 있다. 진천의 수호신이 머무르는 이 용화사는 안타깝게도 언제 누가 창건했고, 원래의 이름이 무엇이었는지, 또한 언제 폐사가 되었는지는 알 수가 없다. 그러나 예전의 역사는 알려지지 않았지만 용화사 경내에 우뚝 서 있는 석불입상은 왜적을 물리쳐 진천의 수호신으로 추앙받고 있다. 이러한 전설은 사람들에게 면면히 전해져 공양을 올리게 했고, 마침내 1946년 용화사라는 이름의 사찰이 창건되기에 이른 것이다.[진천용화사 석조보살입상] 유형문화재 (1984년 12월 31일 지정)이 미륵불은 화강암으로 된 불상으로 높이는 7.05m, 아래 부분의 폭이 1.7m나 된다. 불상의 목 부분에는 영락줄이 있으며 손에는 연꽃을 잡고 있는 것이 특징이다. 이 불상은 김유신장군의 위업을 기리기 위한 송덕불상이라 불리워지는데 고려시대에도 신라의 예를 따라 길상사의 제향을 국제로 하려면 표적이 있어야 하겠기에 고려 초기에 이 불상을 건립한 것이라고 추정된다.* 시대 - 고려시대 * 재질 - 석조 (화강암)* 규모 - 높이 7.05m , 폭 1.7m ",진천군
13,이상설생가,충청북도 진천군 진천읍 이상설안길 10,127.4800454,36.86216139,http://tong.visitkorea.or.kr/cms/resource/49/2733449_image2_1.jpg,"""독립운동가 이상설(1870∼1917) 선생이 태어난 생가로 목조초가집으로 안채와 헛간채로 구성되어 있다.선생은 현 가옥에서 학자이신 이행우의 아들로 태어나 1894년 문과에 급제한 뒤 성균관 교수, 한성 사범학교 교관 등을 역임하면서 영어, 프랑스어 등 7개국어를 구사하여 신학문을 깨우쳤다.1904년에는 보안회의 후신으로 대한협동회를 조직하여 민족 운동을 하였으며, 탁지부 재무관 법부협판을 거쳐 1905년에는 의정부 참찬에 발탁되었다.같은 해인 11월7일에 수옥헌에서 이또 주재하에 대신회의가 강제 개최되어 이완용 박제순등의 찬성을 조약체결을 선언하였는바 선생은 대신회의에 실무 책임자임에도 일본군의 방해로 참석하지 못하고 다음날 새벽에 알게되어 땅을 치며 통곡하였다. 1906년 4월에 국권회복운동에 앞장설 것을 결심하고 이동녕, 정순만과 같이 망명길에 올라 상해를 거쳐 북간도 용정으로 가서 서전서숙을 건립하고 자비로 항일 민족교육을 시켰으며 1907년 6∼7월 헤이그에서 개최하는 만국평화회의에 참석하라는 고종황제의 위임장을 받고 이준, 이위종과 함께 한국의 실권과 국권의 회복문제를 국제여론에 호소하려다 실패한 후 이준은 현지에서 순사하였다. 선생은 귀국하지않고 영국, 프랑스, 독일, 미국 등 여러나라로 다니면서 일본의 침략성을 폭로하고 한국의 독립이 동양평화의 열쇠라고 주장하였다. 1910년 한일합방이 되자 소련령으로 이주, 한흥동의 한인마을을 건설, 민족교육을 시키다 1917년 47세 때 병으로 세상을 떠나셨다.
""",진천군
14,진천 길상사,충청북도 진천군 진천읍 문진로 1411-38,127.4231841,36.85334749,http://tong.visitkorea.or.kr/cms/resource/97/2707297_image2_1.jpg,"길상사는 진천 도당산에 있는 삼국통일의 위업을 완수한 흥무대왕 김유신의 영정을 봉안한사당이다.신증동국여지승람 진천현 산천조와 사묘조에 ""신라진평왕시 만로군태수 김서현처만명 임신 20월생 자왈유신 장태어현15리 화위신 인위태령산 자신라시 치사우춘추강향축행제 고려잉지지 본조 태조 8년 시정지 영소재관치제""라하여 신라 때부터 장군의 태가 묻힌 태령산 아래 사당을 건립하고 국행제를 지내오다가 조선 태종 8년부터 관행제로 치제하였다. 그 뒤 임진 병자양란시 병화를 입어 폐허가 된 것을 철종 2년(1851) 백곡 가죽리에 죽계사자리에 계양묘를 건립하였으나 1926년에 도당산에 길상사를 재건하고 1959년에 개축하였는데 1975년에 정화하여 길상사를 전면 신축하였다.본전은 ""흥무전""으로 콘크리트조 와즙, 정면 5간, 측면 2간, 주심포 8작집인데 그 안에 영정을 모시고 있으며,  바깥 뜰에는 1957년 세운 ""흥무대왕신성비"" 이선근이 글을 만들고 김만희 씀와 안뜰에는 1976년에 세운 ""김유신장군사적비"" 이 은상 글 김충현 씀 그리고 입구에는 같은 해에 세운 ""길상사중건사적비""조건상 글 이상복 씀가 있다. 김유신은 만로군 태수 김서현의 아들로 진천에서 출생. 진평왕 31년에 화랑이 되고 낭비성 싸움에 공을 세워 압량주 군주가 되었다. 선덕여왕 때 상장군이 되었고 진덕여왕 때는 백제 12성을 함락하여 상주행군대총관에 오르고 무열왕 7년 상대등으로 당군과 연합하여 백제를 멸망시키고 나당 연합군의 대총관이 되어 고구려를 정벌하고 태대각간이 되었으며 한수 이북의 고구려 땅을 수복 삼국 통일의 위업을 완수하였고 흥덕왕 때에는 흥무대왕으로 추봉되었다.* 시대 - 통일신라시대 * 관리 - 진천군",진천군
15,진천 김유신 탄생지와 태실,충청북도 진천군 진천읍 김유신길 170-4,127.3757387,36.84057033,http://tong.visitkorea.or.kr/cms/resource/82/1329682_image2_1.jpg,"이곳은 흥무왕 김유신 장군이 탄생한 곳으로 가락국의 시조 김수로왕의 13세손이다. 김유신 장군은 만노군 태수(萬弩郡 太守,만노: 진천의 옛이름) 김서현(金舒玄) 장군의 아들로 진평왕 17년(595년) 진천읍 상계리 계양 마을에서 출생하였다. 나이 15세 되던 609년(진평왕 31년)에 화랑이 되고 낭비성 싸움에 공을 세워 압량주 군주가 되었다. 선덕여왕 때 상장군(上將軍),무열왕 7년(660년) 상대등(上大等)이 되어 당군(唐軍)과 연합하여 백제를 멸망시킨 후 나당연합군의 대총관(大摠管)이 되어 고구려를 정벌(668년)하고 태대각간(太大角干)이 되었으며 한강 이북의 고구려 땅을 다시 찾아 삼국 통일의 대업을 완수하여 흥무대왕으로 추봉되었다. 지금의 계양(桂陽) 마을 입구에 장군터(태수 관저가 있던 곳)라 불리워지는 곳에 1983년에 유허비(遺墟碑)를 건립하였으며, 이곳에서 북서 방향 2㎞ 지점에는 태수 관저에서 사용했다는 우물터 연보정(蓮寶井)이 현존하고 있으며, 무술 연습을 했다고 전해오는 투구바위와 치마대가 있다.* 시대 - 삼국시대",진천군
16,진천 노원리 왜가리 번식지,충청북도 진천군 이월면 논실길 113-12,127.4158467,36.92313099,http://tong.visitkorea.or.kr/cms/resource/83/212683_image2_1.jpg,"진천군 이월면 노원리 노곡마을 뒷편의 왜가리 번식지는 1970년까지 노원리 보호 지역내에서 자라고 있는 은행나무를 중심으로 수백 마리의 백로류 및 왜가리가 번식해왔다. 그러나 현재는 이 은행나무가 새들의 배설물에 의해 말라죽어가고 있으며, 5~6개 둥지의 중대백로만 남아있고, 왜가리와 백로들은 주변 숲으로 옮겨 살고 있다. 진천의 왜가리 번식지는 수질 오염으로 인해 왜가리의 먹이가 되는 개구리, 미꾸라지들이 줄어 수가 감소되었으나, 우리나라 왜가리 번식지를 대표하는 지역이므로 천연기념물로 지정하여 보호하고있다.",진천군
17,진천 농다리,충청북도 진천군 문백면 구곡리,127.4929536,36.82649073,http://tong.visitkorea.or.kr/cms/resource/74/2517874_image2_1.jpg,"사력 암질의 붉은 돌을 쌓아서 만들어진 다리로, 우리나라에서 가장 오래되고 긴 돌다리이다. 다리는 사력암질의 자석을 쌓아 놓은 다리로서, 28칸의 교각이다. 지방유형문화재로서 길이는 93.6m, 폭 3.6m, 교각 1.2m 정도이며, 교각 사이의 내폭은 80cm 내외이다.석회등을 바르지 않고 그대로 쌓았는데도  견고하며 장마가 져도 유실됨이 없이 원형을 유지하고 있다. 이 다리는 고려 초엽시대의 권신, 임장군이 놓았다는 돌다리로 규모도 크고 축조술도 특이하다. 정자, 산책로, 초평저수지까지 연결된 수변데크 등이 조성되어 새로운 관광명소로 자리잡았으며, 신비로운 다리모양과 주변풍경이 잘 어우러져 드라마 촬영지로도 등장한다.[농다리에 관한 전설]* 농다리임장군은 매일 아침 세금천에서 세수를 하였는데, 몹시 추운 겨울 어느날 세금천 건너편에 한 젊은 부인이 내를 건너려는 모습을 기이하게 여겨 여인에게 물으니 여인이 답하기를 아버지가 돌아가셔 친정으로 가는 길이라고 하니, 장군은 여인의 지극한 효심과 그 모습을 딱히 여겨 용마를 타고 돌을 실어 날라 다리를 만들었다고 한다, 이 때 용마는 너무 힘에 겨워 그 자리에서 쓰러져 죽었다고 하며, 용마의 바끈이 끊어져 떨어진 돌을 그대로 두었는데, 이것이 용바위(쌍바위)라고 전해지고 있다* 임연 오누이 힘내기 설화옛날 굴티 임씨네 집안에서 아들, 딸 남매를 두었는데 둘 다 훌륭한 장사라서 서로 죽고 사는 내기를 하였다. 아들(임장군)은 굽 높은 나무신을 신고 목매기 송아지를 끌고 서울로 갔다가 오기로 했고, 딸은 농다리를 놓기로 하여, 치마로 돌을 날라 다리를 놓기 시작했다. 그런데, 어머니가 가만히 보니 아들은 올 기미가 없고 딸은 거의 마무리가 다 되어갔다. 그래서 어머니는 아들을 살릴 묘책을 내어 딸에게는 뜨거운 팥죽 등 먹을 것을 해다주며 일을 늦추게 하였다. 결국 아들이 먼저 돌아온 것에 화가난 딸은 치마에 있던 돌을 내리쳤는데, 아직까지도 그 돌이 그대로 박혀있다. 약속대로 딸은 죽게 되었고, 딸이 마지막 한 칸을 놓지 못해서 나머지 한 칸은 일반인이 놓았다. 역사적으로 여장수가 놓은 다리는 그래도 있는데, 일반인이 놓은 다리는 장마가 지면 떠내려 간다고 한다.",진천군
