,title,addr1,mapx,mapy,firstimage,overview,addr2
18,진천 배티 성지,충청북도 진천군 백곡면 배티로 708,127.3281683,36.92997585,http://tong.visitkorea.or.kr/cms/resource/35/1329935_image2_1.jpg,"진천군 백곡면 양백리 노고산 아래 위치한 배티성지는 많은 순교자의 종교정신을 기리고 기도하는 장소와 피정의 집으로 활용되었으나 현재는 십자가와 묵주만이 남아 천주교 박해의 정도를 가늠케한다. 배티라는 말의 유래를 살피자면 동네어귀에 배나무가 많은 배나무 고개라서 이치란 말이 생겨났고 이것이 순수한 우리말로 배티라 불리게 되었다는 설이 있다. 다른 설로는 조선 영조때 이인좌가 난을 일으켰을 때 백곡을 지나다 이 마을 노인 이순곤이 이끄는 주민에게 패한 뒤 다시 안성쪽으로 향하다 오명황이 이끄는 관군에게 진압 패전하였다는 데서 패치라 불리웠고 훗날 바뀌었다는 설도 있다. 
1870년부터 다시 신앙이 싹 터 1884년에는 선교사들이 진천에 배티, 삼박골, 용진골, 새울, 굴티 등 5곳에 공소를 설정하게 되었으며 1890년에는 배티공소에 ""교리학교""가 세워지기도 했다. 그러나 일제강점기 때 신자들이 하나, 둘 떠나 현재 이곳 배티에는 신자들이 생업을 영위하던 옹기점과 무명순교자의 묘 만이 남아있다. 한편 배티성지에서는 배티성지개발 후원회를 조직 교회사연구소와 피정의 집을 계획하고있는 것으로 전해진다.",진천군
19,진천 산수리와 삼용리 요지,충청북도 진천군 이월면 삼용리,127.470634,36.90268989,http://tong.visitkorea.or.kr/cms/resource/71/1330171_image2_1.jpg,"* 진천 삼용리 백제요지 *금강의 지류인 미호천(美湖川)을 끼고 전개되어 있는 야산지대인 이곳 이월면 삼용리는 이웃 덕산면 산수리와 더불어 삼국시대 토기 성립과정을 알려 주는 가마터들이 널리 분포되어 있다. 이 진천 지역 토기 가마터들은 1986년에 중부고속도로 건설공사 일환으로 시행된 문화유적 조사 중 한남대학교 발굴단이 발견하여 연차적인 발굴조사를 통해 삼국시대 초기의 토기. 제작기술을 규명할 수 있는 많은 자료를 제공하였다. 일대에 흩어져 있는 가마터들은 한반도에서 기원전후부터 사용되기 시작한 타날문토기(打捺文土器)를 굽던 가마터가 중심으로, 이 타날문토기가 삼국시대 토기의 모태가 되었다.1990년도에 발굴된 이곳 삼용리 요지군에서도 서기 2~3세기경의 타날물 토기 가마터 6기(基)가 조사되었다.길이 2.4m에 불과한 소형부터 7.9m에 이르는 대형까지 크기는 다영하였으나 모두 바닥과 벽은 땅을 파 지하에 설치하고 천정은 지상에 나온 반지하식 등요였다. 이 가마터들의 가장 큰 특징은 연소실의 구조로, 아궁이의 바로 밑이 불을 때는 곳으로 되어 있다.이와 같은 수직식 연소실(垂直式燃燒室)의 등요는 중국 전국시대 토기요에서 유래된 것으로 우리나라 초기 삼국시대의 타날문토기, 중국의 전국시대 토기 제작기술에 받아들여 성립된 것임을 알려주고 있다.",진천군
20,진천 생거진천화랑촌,충청북도 진천군 진천읍 보련골길 40-4,127.3530434,36.84563323,http://tong.visitkorea.or.kr/cms/resource/24/1330224_image2_1.jpg,"예로부터 ‘생거진천(生居鎭川)’ 이라는 말이 있을 정도로 토지가 비옥하여 산물이 풍부하고, 인심이 후덕한 살기 좋은 고장, 진천에 위치한 우리 마을은 아름다운 연곡저수지와 계곡, 그리고 호두나무와 밤나무로 어우러져 있는 작은 마을로 효자효부가 많아 조선시대부터 효자마을로 지정되어 현재까지 불리고 있다. 마을 뒤편으로는 진천에서 제일 높고 경관이 수려한 만뢰산(611.7m)이 위치하고 있어 항상 등산객들로 붐비고 있으며 또한, 삼국통일의 위업을 이룩한 김유신 장군의 탄생지와 남북통일 기원탑인 보탑사가 마을 인근에 있어 화랑도의 정신이 살아 숨 쉬는 곳 그래서 더욱 유명한 마을이다.충·효·예의 화랑정신이 살아 숨 쉬는 아름다운 연곡 저수지와 계곡, 호두와 감나무로 어우러져 있는 작은 마을 화랑촌은 효자효부가 많아 조선시대부터 효자마을로 지정되어 현재까지 그 이름이 알려진 곳이다. 또한, 삼국통일의 위업을 이룩한 김유신 장군의 탄생지와 남북통일을 기원하는 동양 최고의 목조건물인 보탑사가 마을 인근에 있어 화랑도의 정신이 살아 숨 쉬는 마을이다. 마을 뒤로는 진천에서 제일 높아 서해바다가 보인다는 만뢰산(611.7m)이 위치하고 있어 항상 등산객들로 붐비고 참숯이 유명하여 숯 굽는 체험과 숯 생활용품을 만드는 체험을 할 수 있다. ",진천군
21,진천 신헌 고가,충청북도 진천군 이월면 논실안길 58-1,127.416455,36.92359206,http://tong.visitkorea.or.kr/cms/resource/92/2517892_image2_1.jpg,"신헌 1810(순조10)~1888(고종25) 무신외교가 자는 국빈, 호는 위당, 초명은 관호, 본관은 평산훈련대장 홍주의 손자, 의직의 아들, 금위영 대장이 되어 1849년 (철종즉위) 헌종이 위독할 때 사사로이 의사를 데리고 들어가 진찰한 죄로 섬에 위리 안치되었다.1854년 무주에 이배, 1857년 풀려 나왔다.1862년 통제사가 되고, 1864년에 형조,병조의 판서를 거쳐 공조판서를 지냈다.1866년 총융사로 병인양요때 강화의 염창을 수비, 난이 끝난 후 좌참찬겸 훈련대장을 지내고 수뢰포를 제작한 공으로 가자(加資)되었다.1868년 어영대장이 되고 행지삼군부사, 공조 판서를 역임. 1874년(고종 11) 진무사가 되어 강화연안에 포대를 구축했다. 1875년 운양호 사건이 일어나자 이듬해 판중추부사로서 전권대관이 되어 일본의 전권 변리대신 구로다와 강화에서 병자수호조약을, 1882년 경리통리기무아문사로 전권대관이 되어 미국의 슈펠트와 한미 수호조약을 각각 체결하고, 이 해 판삼군부사가 되었다. 글씨에 능하여 예서를 잘 썼으며, 문장에 뛰어났고, 묵란을 잘 그렸다. 시호는 장숙이다. 신헌고택 건립 당초에는 ㄱ자형으로된 사랑채와 행랑채, 안채, 중문 등이 있었으나, 사랑채,행랑채는 근년에 해체하여 진천읍내의 길상사를 중수하는데 사용하였다고 전해진다. ㄱ자형의 안채 주변에는 동남쪽으로 중문과 광채가 있고, 주위로는 막돌로 쌓은 담장이 장방형을 이루면서 이어져 있다. 안채는 가운데의 대청마루를 중심으로 양측에 온돌방을 배치하였으며, 마루 전면에는 4분합문을 달았다.",진천군
22,진천 연곡리 석비,충청북도 진천군 진천읍 김유신길 641,127.3402308,36.83976701,http://tong.visitkorea.or.kr/cms/resource/75/214175_image2_1.jpg,"연곡리 사지는 진천읍 연곡리 비립마을 바로 뒤에 있으며, 건립 당시의 절 이름이나 연대, 훼손년대 등을 알 수 없다. 현재는 삼층석탑이 남아 있고, 그 인근의 연곡리 석비(백비) 등을 통하여 고려 때 절터로 추측된다. 현재 이곳에는 삼선포교원의 보탑사가 있다.진천읍 연곡리 비립동에 있는 ""연곡리 석비""는 비석에 비문이 없어 일명 ""백비""라고도 하며 비문이 있었으나, 오랜 세월에 걸쳐 마멸되었을 것으로 추정된다. 따라서 그 건립연대는 알 수 없으나, 조형형식으로 보아 고려 초기 또는 중기에 만들어진 것으로 추측된다. 화강암으로 되어 있으며 좌대는 거북 모양이고 이수는 아홉 마리의 용이 여의주를 물려고 하는 모습인데, 그 조각솜씨가 뛰어나다. 높이는 212.5cm, 폭 111.8cm, 두께는 22.2cm이며, 1964년 9월 3일 보물로 지정되었다. 석비 옆에는 석불좌상과 사리탑으로 추측되는 삼층석탑이 남아 있다. 현재 이 앞에는 전통적인 공법으로 목탑을 재현하는 등 현대의 불교 유적이라고 할 수 있는 보탑사가 건립되어 많은 참배객을 불러모으고 있다.",진천군
23,진천 이영남 묘소,충청북도 진천군 덕산읍 기전리,127.5351288,36.88210454,http://tong.visitkorea.or.kr/cms/resource/50/1332550_image2_1.jpg,"이곳은 임진왜란시 7년 전쟁을 마무리 짖는 최후의 노량해전에서 충무공 이순신 장군과 함께 순국한 임란충신 가리포 첨사 겸 조방장 양성 이영남 장군이 잠드신 유서깊은 곳이다. 장군은 1566년 2월 13일 이곳 진천군 덕산면 기전리 159번지에서 태어나 12세 소년 시절에 부모상을 당하여 3년 시묘한 효자였다.이후 무예를 배우기 시작 19세(1584년)에 무과에 급제 선전관 훈련원첨정 도총부 경력을 거쳐 1592년 27세때 임진왜란이 일어날 시는 경상우수사 원균 휘하의 율포만호로 있었다. 원균이 첫 싸움에서 패하자 전라 좌수사로 있던 이순신 장군을 5,6차례 찾아가 청군 하였다.이후 소비포권관으로 옥포 당포 당항포 한산대첩등 10여 차례의 해전에서 충무공을 보좌하여 혁혁한 전과를 세웠다. 해전에서 승승장구한 장군은 1595년 임기를 마치고 태안군수 강계부판관 장흥부사를 역임하고 1597년 9울 16일 명량해전에서 대승리를 거두고 1598년 제56대 가리포첨사 겸 조방장으로 임명된 장군은 조수에 익숙한 완도 장정들을 고금진에 소집 훈련시켜 수군을 정비 1598년 11월 19일 최후의 노량해전에 출전하여 대승을 거두고 33세로 충무공과 함께 순국 하셨다.당시 줄곧 수행한 노복 일학이 영구를 뫼시고 돌아와 다음해(1599년) 봄에 이곳 갈현산 선영하에 안장 하였으며 소년 시절 무예를 닦을 때의 용마총도 묘옆에 있다. 순국후 선무운종공신 일등 병조판서로 추증 되었으며 전남 완도군 고금면 덕동리 충무사에는 위패와 영정이 충무공과 함께 배향 되어 있으며 진천읍 삼수초등학교 앞에 현충비가 세워져 있다.",진천군
24,진천 정송강사,충청북도 진천군 문백면 송강로 523,127.4106284,36.79845636,http://tong.visitkorea.or.kr/cms/resource/25/1332625_image2_1.jpg,"정송강사는 송강 정철선생(1536∼1593)의 위패를 봉안한 사당으로 지방기념물이다. 선생의 묘소는 원래 경기도 고양군 원당면 신원리에 있던 것을 현종 6년(1665)에 우암 송시열이 지금의 묘소로 자리를 정하고 그의 후손 정양이 이장하여 사우를 창건하였으나 규모가 작아 1979년에 전면 신축정화하였다. 사당은 목조19평 맞배지붕이고 유물전시관은 시멘트32평 팔작지붕으로 되어있다. 경내에는 송강묘소와 신도비가 있으며 송강선생의 은배, 옥배 그리고 연행일기 65일분과 친필편지 등이 보관, 전시되어 있다. 정송강사 왼쪽에는 마른 억새풀이 우거진 오솔길을 3백여m 타고 오르다보면 송강의 묘소가 나온다.* 시대 - 조선 현종 6년. 1979-1981년 중건* 규모 - 사당(19평), 유물전시관(32평)
* 재료 - 시멘트 및 목조",진천군
25,진천공예마을,충청북도 진천군 문백면 공예촌길 116-3,127.4568162,36.78987762,http://tong.visitkorea.or.kr/cms/resource/52/2671552_image2_1.jpg,"충북 진천군 문백면 공예촌길 일원에 도자기, 목공예, 천연 염색, 한지공예 등 각 분야 예술인들이 모여 사는 진천공예마을이 있다. 공예가들이 사는 마을답게 집 하나하나가 예술 작품처럼 특색 있다. 고가, 황토집, 서구식 가옥 등 개성 넘치는 집들이 모여 운치 있는 공예마을을 이룬다. 작가들의 작업실로 이용되는 공간에서 공예체험도 가능하다. 작가들과 함께 소통하며 체험을 할 수 있어 더 흥미롭다.",진천군
26,진천향교,충청북도 진천군 진천읍 문화5길 30,127.4350443,36.84970646,http://tong.visitkorea.or.kr/cms/resource/06/1332806_image2_1.jpg,"조선 태조 때에 현유(賢儒)의 위패를 봉안, 배향하고 지방민의 교육과 교화를 위하여 창건되었다. 1804년(순조 4)에 명륜당과 동재(東齋)·서재(西齋)를 중수하고 풍화루를 건립하였으며, 1816년에 대성전을 중수하였다. 그 뒤 1851년, 1873년, 1935년, 1942년, 1959년, 1966년, 1967년, 1972년에 각각 중수하였다. 대성전에는 5성(五聖), 송조 4 현(宋朝四賢)의 위패를, 동무·서무에는 우리나라 18 현(十八賢)의 위패를 봉안하고 있다. 조선시대에는 국가로부터 토지와 전적·노비 등을 지급받아 교관 1명이 정원 30명의 교생을 가르쳤으나, 갑오개혁 이후 신학제 실시에 따라 교육적 기능은 없어지고 봄·가을에 석전(釋奠)을 봉행(奉行) 하며, 초하루·보름에 분향을 하고 있다. 충청북도 유형문화재로 지정되어 있으며, 향교의 운영은 전교(典校) 1명과 장의(掌議) 수명이 담당하고 있다.",진천군
27,CJ 블로썸 캠퍼스 (CJ제일제당),충청북도 진천군 진천읍 씨제이로 110,127.4607939,36.87837029,http://tong.visitkorea.or.kr/cms/resource/36/2617336_image2_1.jpg,"CJ블로썸캠퍼스는 디지털 첨단 기술을 바탕으로 생산 및 물류를 아우르는 장소로 CJ제일제당의 브랜드를 오감으로 체험할 수 있는 투어를 진행한다. 먼저 ‘히스토리 씨어터’를 통해 역사와 브랜드의 끊임없는 노력의 발자취를 배울 수 있다. 그리고 CJ제일제당의 대표 상품인 ‘햇반’에 대해 알고 경험할 수 있는 뮤지엄 공간이 있는데 최첨단 햇반 생산 기술을 직접 눈으로 보며, 맛의 비밀을 생생하게 체험할 수 있는 공정 라인으로 구성되어 있다. 투어 프로그램의 마지막에는  CJ제일제당의 가정간편식으로 만든 맛있는 차림상을 경험할 수 있다.",진천군
