,title,addr1,mapx,mapy,firstimage,overview,addr2
40,청풍문화재단지,충청북도 제천시 청풍면 청풍호로 2048,128.1710682,37.00468267,http://tong.visitkorea.or.kr/cms/resource/66/2366266_image2_1.jpg,"청풍은 자연경관이 수려하고 문물이 번성했던 곳으로 많은 문화 유적을 갖고 있었으나 충주댐 건설로 청풍면 후산리, 황석리, 수산면 지곡리에 있던 마을이 문화재와 함께 수몰될 위기에 있었다. 충청북도청에서는 1983년부터 3년간 수몰 지역의 문화재를 원형대로 현재 위치에 이전, 복원해 단지를 조성했다.
단지에는 향교, 관아, 민가, 석물군 등 43점의 문화재를 옮겨 놓았는데 민가 4채 안에는 생활 유품 1,600여 점이 전시되어 있다. 고려 때 관아의 연회 장소로 건축된 청풍 한벽루(보물)와 청풍 석조여래입상(보물) 등 보물 2점과 청풍부를 드나들던 관문인 팔영루(충북유형문화재), 조선시대 청풍부 아문인 금남루(충북유형문화재), 응청각(충북유형문화재), 청풍향교(충북유형문화재) 등 건축물 및 옛 도호부 시대의 부사나 군수의 송덕비, 선정비, 열녀문, 공덕비 등이 세워져 있다. 한벽루에서 충주호가 한눈에 보이며 주변에 비봉산, 구담봉, 옥순봉, 능강구곡, 금수산, 단양팔경, 월악산국립공원, 수안보온천 등의 관광지가 있다.

* 제천 청풍 한벽루 (보물)
이 건물은 고려 충숙왕4년 (1317)에 청풍현이군으로 승격되자 이를 기념하기 위해 세운 관아의 부속건물이었다.1972년 대홍수로 무너진 것을 1975년 원래의 양식대로 복원하였다. 이 루는 석축토단의 자연석 주초석 위에 기둥이 배가 부른 엔타시스 수법을 쓴 층 아래기둥을 세우고 마루를 설치하였으며, 정면 4칸 측면 3칸으로 팔작지붕에 주심포계 양식이다. 누의 우측에는 정면 3칸, 측면 1칸의 맞배지붕으로 된 계단식 익랑 (대문간에 붙여 지은 방)을 달았다.

* 제천 청풍 응청각
이 건물의 용도는 알 수 없으나, 본래 한벽루의 좌측에 나란히 세워져 있었다. 처음 세운 시기는 알 수 없으나, 명종 초 이황 (1501~1570)이 단양군수로 있을때 '응청각'이라 이름하였다고 한다. 인조15년(1637)에 충청감사 정세규의 일기에 응청각에서 유숙한 기록이 있다. 고종37년(1900)에 부사 현인복이 중수하였다. 본래 청풍면 읍리 203-1번지에 있었으나 충주댐의 건설로 1983년 지금의 자리로 옮겨 복원하였다. 2층 누각으로 아래층은 토석축의 담으로 벽을 막고, 그 위에 정면 3칸, 측면 2칸의 팔작집이다. 건물 좌측에 목조 계단을 만들어 2층으로 오르내리게 하였다.

* 제천 청풍 금병헌 (충청북도 유형문화재)
이곳은 청풍부의 청사로 쓰였던 동헌건물이다. 청풍은 삼국시대에 사열이현이었으나, 신라 경덕왕때 청풍현이라 하였다. 고려 충숙왕 때 지군사가 되고, 조선 세조 때 군이 되었다. 현종 초에 도호부로 되었으며, 고종32년에 군이 되었다가 1914년 행정국역의 통폐합에 따라 청풍면이 되었다. 이 건물은 숙종7년(1681)에 부사 오도일이 처음 지었다. 그후 숙종 31년(1705)에 부사 이희조가 중건하고, 영조2년(1726)에 부사 박필문이 중수하고,권돈인이 편액을 써서 걸었다. 고종 37년(1900)에 부사 현인복이 전면 보수하였다. 본래 청풍면 읍리 203-1번지에 있었으나, 충주댐의 건설로 인하여 1983년에 지금의 자리로 옮겨 복원하였다. 정면 6칸, 측면3칸의 팔작집이다. 일명 명월정이라고도 하며, 내부에는 '청풍관'이란 현판이 걸려있다.

* 금남루 (충청북도 유형문화재)
이곳은 청풍부의 아문으로 '도호부절제아문'이란 현판이 걸려있다. 순조25년(1825)에 청풍부사 조길원이 처음 세우고 현판도 걸었다. 고종7년(1870)에 부사 이직현이, 동 37년(1900)에 부사 현인복이 각각 중수하고 1956년에도 보수하였다. 본래 청풍면 읍리 203-1번지에 있었으나, 충주댐의조성으로 인하여 1983년에 지금의 자리로 옮겨 복원하였다. 정면3칸, 측면 2칸의 팔각집으로 팔각의 높은 돌기둥 위에 세운 2층의 다락집이다.

* 자연학습원
꽃밭 - 구절초, 한라구절초, 해국, 쑥부쟁이, 빗자루국화
꽃길 - 조팝나무길, 백철쭉길, 산철쭉길, 영산홍길, 진달래길

* 제천 후산리 고가 (충청북도 유형문화재)
이 집은 본래 청풍면 후산리 105번지에 있었던 민가였다. 충주댐의 건설로 1985년에 지금의 자리로 옮겨 복원한 것이다. 조선말기에 지어진 ㄱ자형의 팔작 기와집이다. 대청마루를 기준으로 하여 동남을 향하고 있다. 대청의 우측에 2칸 크기의 건너방과, 툇마루를 높이 하고 그 밑에 함실 아궁이를 두고 있다. 대청은 좌측으로 웃방이 있고 웃방에서 동쪽으로 꺾어 대청의 좌측으로 후퇴를 후보하여 제사방으로 꾸미고있다. 전체적인 내부의 배치가 특이하다. 중부지방의 보편적인 민가유형이라고 할 수 있다.

* 제천 도화리 고가 (충청북도 유형문화재)
이 집은 본래 청풍면 도화리에 있었던 민가였다. 충주댐의 건설로 1985년에 지금의 자리로 옮겨 복원한 것이다. 조선 말기에 지어진ㄷ자형의 우진각 기와집이다. 중앙에는 3칸 크기의 대청을 이루고, 좌측 간살은 방, 부엌, 광으로, 우측 간살은 방2칸과 2칸 크기의 부엌으로 되어 있다. 둥근 통나무 굴뚝과 부엌 살자창옆의 관솔을 피워 어둠을 밝히는 시설은 태백산맥 일대의 산간지대 민가에서 볼 수 있는 특징적인 것이다. 본래 이전하기전의 흔적으로 보아 앞쪽에는 바깥채가 있었던 것으로 추정되는 튼 ㅁ자형의 배치를 한 것으로 보인다.

* 청풍 황석리 고가 (충청북도 유형문화재)
이 집은 본래 청풍면 황석리 164번지에 있었던 민가이다. 충주댐의 건설로 1985년 지금의 자리로옮겨 복원한것이다. 집의 구조는 안채와 문간채로 이루어져 있다. 안채는 정면 4칸, 측면 2칸의 팔작 겹머리 기와집이며, 조산말기의 건축물로 좌측(서쪽)으로부터 부엌, 안방, 웃방을 나란히하고 끝에 사랑방을 두었다. 아방과 웃방 앞에는 길게 툇마루를 두고, 사랑방 퇴는 부엌으로 구성하였다. 툇마루와 사랑부엌 사이의 퇴주(각주) 이름이 특이하다. 문간채는 정면 3칸, 측면 1칸의 초가집이다. 특히, 청풍문화재단지가 위치한 물태리에서 제천까지 약 10km 구간은 충주댐 건설로 인한 청풍호반 조성시 아름다운 금수산 5부 능선상으로 만들어진 구불구불한 도로로, 이 길을 달리면 한편에 는 금수산의 기암괴석이 보이고, 아래로는 청풍호반의 물이 드리워져 있어 주변 경관이 빼어난 환상의 드라이브 코스이다.
또한, 이거리는 청풍호 조성 후에 식재된 벚나무 들이 꽃을 피우기 시작해 벚꽃길 명소로 각광받고 있다. 벚꽃이 흐드러지게 피는 4월 중순, 청풍문화재단지와 청풍호주변에서 청풍호반 벚꽃축제가 개최된다. 청풍 호반벚꽃 축제 행사는 전야제로 연등행사와 용신제를 올리며, 본행사로는 식전, 식후행사로 구분하여 민속경기와 체육경기가 읍.면.동대항전으로 실시하여 시민의 화합의 장이 되며, 부대행사로는 벚꽃 사진 촬영대회가 있으며 향토음식 시식코너를 개설하여 이 지방의 별미를 맛볼 수 있는 자리도 마련된다.

* 연리지와 연리목
가까이 자라는 두 나무가 맞닿은 채로 오랜세월이 지나면 서로 합쳐져 한나무가 되는 현상을 연리라고 한다. 두몸이 한몸이 된다하여 남녀간의 애틋한 사랑과 흔히 비유하였다. 알기쉽게 '사랑나무' 라고도 부른다. 나무가지가 서로 이어지면 연리지, 줄기가 이어지면 연리목이다. 연리목은 가끔 볼 수 있으나 가지가 붙은 연리지는 매우 희귀하다. 가지는 다른 나무와 맞 닿을기회가 적을 뿐만 아니라 맞닿더라도 바람에 흔들려버려 좀처럼 붙기 어렵기 때문이다. 중국 전설상의 새와 나무인 비익조와 연리목에서 유래된 비익이라는 새는 암수의 눈과 날개가 각각 하나이기 때문에 항상 나란히 한몸이 되어서 난다하며, 연리라는 나무는 두 그루의 나무이지만 가지가 서로연결되어 나무결이 상통한다는데서 남녀간의 깊은 정분을 뜻한다. 당나라 시인 백거이는 당나라 6대 황제 현종과 양귀비의 비련을 그린 장한가에서 하늘에서는 비익조(비익조)가되고 땅에서는 연리지(연리지)가 되도다라고 읊었다.

* 제천 물태리 석조여래입상 (보물)
이 불상은 높이가 341cm이고, 전체적인 조각 양식으로 볼 때 통일신라 말기(10세기 경)의 작품으로 보인다. 불상의 얼굴 모양은 풍만하고 자비로운 상으로 두툼한 양볼에 인중(코와 입술 사이의 우묵한 곳)이 뚜렷하고 두 귀는 양어깨까지 드리워졌다. 목에는 삼도가 새겨져 있으며, 왼손은 땅을 가르키고 있다. 옷은 통견의 (양어깨를 덮은 법의)를 걸치고 안에 속내의를 받쳐입고 있으며, 배에서 매듭을 지어 V자형으로 겹겹이 대좌에까지 내려왔다. 충주댐건설로 수몰지인 청풍면읍리에서 1983년 이곳으로 옮겨 복원하였다.

* 제천 청풍 팔영루 (충청북도 유형문화재)
조선시대에 청풍부를 드나드는 관문이었던 누문이다. 아래는 문이고 위에는 누각의 형태로 되어 있다. 고종때의 부사 민치상이 청풍 8경을 노래한 팔영시로 인하여 팔영루라 불리게 되었다. 충주댐 건설로 1983년 지금 위치로 옮겨서 복원했다. 앞면 3칸, 옆면 2칸 규모이며 지붕은 팔작이다. 안에는 마루를 깔고 난간을 두르고 있다. 청풍문화재단지 내에는 팔영루 외에도 금남루와 응청각, 금병헌 등 다양한 관아건축물이 있다.",제천시
41,청풍호 관광모노레일,충청북도 제천시 청풍면 청풍명월로 879-17,128.1339604,37.00312382,http://tong.visitkorea.or.kr/cms/resource/46/2026146_image2_1.jpg,"청풍호 관광 모노레일은 제천시 청풍면 도곡리에서 비봉산(531m)을 연결하는 2.6㎞ 구간에 조성된 체험형 모노레일이다. 도곡리에서 걸어서 올라가면 비봉산 정상까지 1시간 정도 걸리지만, 모노레일을 이용하면 20분 만에 도착할 수 있다. 또한, 비봉산 정상까지 힘들이지 않고 오를 수가 있어 노약자나 몸이 불편한 사람도 산에 올라가 청풍호의 절경을 즐길 수 있어 많은 관광객들이 찾고 있다.",제천시
42,청풍호 유람선,충청북도 제천시 청풍면 청풍호로50길 6,128.1790672,37.01282077,http://tong.visitkorea.or.kr/cms/resource/84/2539384_image2_1.JPG,"선착장에는 엘리베이터가 설치되어 있어서, 거동이 불편하신 어르신이나 유아가 이용하기에 타 업체대비 편리하다. 전국 담수량 1위인 청풍호의 청명한 바람과 함께 단양팔경 중 2경인 옥순봉/구담봉의 절경을 즐기며 즐거운 추억을 남기길 바란다.",제천시
43,청풍호반케이블카,충청북도 제천시 청풍면 문화재길 166,128.166802,37.00131353,http://tong.visitkorea.or.kr/cms/resource/56/2639056_image2_1.jpg,"수도권역에서 1시간 30분, 전국 3시간대 거리에 위치한 내륙의 바다, 천혜의 환경과 치유와 회복을 지향하는 청풍명월 본향인 이곳 충북 제천 청풍에서 봉황의 날개를 타고 날아올라 청풍명월의 비경을 누비는 아름다운 여정을 시작한다. 청풍호반 케이블카는 청풍면 물태리에서 비봉산 정상까지 2.3km 구간을 왕복 운행하는 케이블카 시설로 오스트리아에 본사를 둔 도펠마이어社의 최신 기종인 D-Line 모델이다. 10인승 캐빈 43대가 운행되며 그중 10개의 캐빈은 바닥이 투명한 크리스탈 캐빈으로 구성되어 발아래의 아찔함을 느낄 수 있다. 평균 5m/s의 운행 속도로 2.3km의 거리를 약 10분 만에 비봉산 꼭대기에 도달하며, 케이블카 수송능력은 시간당 최대 1,500명, 일일 최대 15,000명까지 수송이 가능하다. 케이블카 상부 정차장인 비봉산은 봉황새가 알을 품고 있다가 먹이를 구하려고 비상하는 모습과 닮았다고 하여 붙여진 이름으로 청풍호 중앙에 위치한 해발 531m의 명산으로 정상에서 바라보는 풍경은 흡사 다도해를 보는 듯한 빼어난 풍광을 가지고 있으며, 국내 최초로 정상까지 케이블카가 운행되어 어린이나 노약자분들도 편안하게 케이블카를 타고 청풍호의 비경을 즐길 수 있다.",제천시
44,충북 제천 수산면 [슬로시티],충청북도 제천시 백운면 평동리,128.0572966,37.14452834,http://tong.visitkorea.or.kr/cms/resource/41/1727241_image2_1.jpg,"제천시는 산과 물이 어우러져 아름다움을 더하는 곳이다. 시내 중심에서 조금만 벗어나면 삼한의 역사를 간직한 '의림지'를 비롯한 지역의 전통문화와 산수경관이 잘 보존된 농촌 마을들을 만날 수 있는데, 그 중심에 바로 핵심콘텐츠 지역인 수산면이 있다. 수산면은 이름 그대로 청풍호의 물과 금수산 · 가은산 · 옥순봉 등의 산이 어우러져 아름다운 경관을 자랑한다. 1980년대 초, 충주댐 건설로 인해 인위적으로 만들어진 청풍호는 수몰 전의 아름다운 청풍강변이 호수 바닥으로 가라앉는 슬픔을 맞았지만 그 비련에 머물지 않고, 새로 생긴 호수와 주변 산이 어우러진 새로운 아름다움을 만들어냈다.주민들은 수산면의 많은 지역에 수몰되면서 삶의 터를 산 위로 옮겨야 하는 아픔이 있었음에도 불구하고, 마을의 안녕과 평화를 기원하는 동제 '오티별신제'의 전통을 400여 년 동안 이어오고 있으며, 청풍호반의 자연경관과 지역 특산물을 활용한 솟대 문화 및 약초 천연염색의 문화를 전승해오고 있다. 또한, 산이 70%, 호수가 12%를 차지하는 지역 특성상 약초와 산채, 잡곡, 민물어류를 재배 · 채집하고 이들을 활용한 산야초 비빔밥과 두부 요리, 민물어탕 등 지역 고유의 음식을 지켜오고 있으며 이웃과 어울려 농악과 밴드, 국궁과 등산 모임 등을 꾸려가며 느림과 쉼의 여유를 느끼며 살아가고 있다. 이렇듯 제천은 주민들이 직접 실천하는 슬로라이프와 잘 보존된 전통문화유산, 그리고 뛰어난 산수경관을 바탕으로 국제슬로시티로 지정되었다.<출처 : 슬로시티>",제천시
45,탁사정,충청북도 제천시 봉양읍 제원로 478,128.1062249,37.16667392,http://tong.visitkorea.or.kr/cms/resource/24/619524_image2_1.jpg,"제천시에서 원주시를 잇는 5번 국도변(제천시에서  원주방면 13km), 중앙선인 제천~원주간의 구학역에서 1km 지점에 위치한 탁사정은  백사장과 맑은 물, 노송이 어울린 아름다운 계곡으로 제천의 대표적인 여름 피서지이다. 제천 9경의 “탁사정”은 정자를 말하는 것이 아니라 정자 주위의 절경을 말하는 것이다.구한말 정운호가 제천의 절경 8곳을 노래한 곳 중 제8경 “대암”이 바로  이곳이다. 차령산맥과 태백산맥이 갈라져 남서로 달리는 남서쪽  골짜기에 자리잡은 탁사정유원지는 송림과 해묵은 잡목 속에 가리어 정자는 보이지  않지만 이 유원지는 서늘한 골바람과 크고 작은 바위가 맑은 물살에 씻기어 사방에  널려 있고,계곡과 짙푸른 물빛, 낮은 폭포가 어우러져 주위의 노송과 조화를 이루고 있다.여름철이면 정자 아래의 용소 주변에 넓은 모래밭에 야영과 물놀이를 즐기는  피서객으로 만원을 이룬다.
조선 선조 19년(1568) 제주 수사로 있던 임응룡이  고향에 돌아올 때 해송 여덟 그루를 가져와 심고 이곳을 팔송이라 명명하였고, 그  뒤 정자를 짓고 팔송정이라 하였다. 허물어진 팔송정을 후손 윤근이 다시 세웠고  원규상이 탁사정이라 하였다. 팔송은 모두 죽고 지금은 한 그루도 남아있지 않으나  1999년도 10월에 팔송마을 및 제방 둑에 20그루의 해송을 마을에서 심어 앞으로 해송을  구경할 수 있다.",제천시
46,티테라피체험장,충청북도 제천시 왕암동 992-1,128.1674699,37.14734118,http://tong.visitkorea.or.kr/cms/resource/65/2371965_image2_1.jpg,"2004년 유기농한약재로 시작한 기업을 모태로 한약재의 방대한 지식과 경험을 바탕으로 2013년 문화체육관광부 공모사업에서 선정된 지원사업으로 조성된 체험장이다. 유효성분이 높은 제천의 한약재를 기본으로 누구나 쉽게 접할 수 있는, 오감을 동원하여 체험하는 테라피프로그램을 운영하고 있다.",제천시
47,포레스트 리솜 해브나인 스파 (해브나인 힐링스파),충청북도 제천시 백운면 금봉로 365,128.0461583,37.15884593,http://tong.visitkorea.or.kr/cms/resource/29/2769529_image2_1.jpg,"포레스트 리솜 해브나인 스파는 충북 제천시 백운면에 자리 잡고 있다. 힐링 스파존에는 인체 경락 부위에 따라 다양한 수압 마사지를 즐길 수 있는 바데 풀을 비롯해 물에너지 스파, 사상체질 스파 등의 시설이 갖춰져 있다. 아쿠아 플레이존은 보호자와 아이들이 함께 즐길 수 있는 놀이 풀로 키즈 슬라이드와 유수 풀, 비치 풀로 구성되어 있다. 야외 스파존에는 숲을 바라보며 야외에서 즐기는 인피니티 풀 등 다양한 시설이 마련되어 있다.",제천시
48,한산사(제천),충청북도 제천시 용두천로8길 27,128.2132384,37.13456573,http://tong.visitkorea.or.kr/cms/resource/87/2021587_image2_1.jpg,"* 제천 중심부의 사찰, 한산사 *한산사(寒山寺)는 대한불교 조계종 제5교구 본사 법주사의 말사이다. 제천지역 중심부의 대표적인 사찰로서 창건은 역사적인 자료를 통해서 보면, 고려 명종 24년(1194년)에 조혜사(照慧寺)로 창건 되어 법등을 밝혀오다가 1934년에 사찰의 면모를 일신하는 과정에서 한산사로 개칭하였다.1984년 현해스님이 법당과 요사체를 중창했고, 2003년에 주지로 부임한 동범스님이 경내에 모셔 있는 마애석불 부처님을 2004년 10월 ‘제천 한산사 석조여래입상(提川 寒山寺 石造如來立像)’으로 충청북도 문화재 자료 제45호 지정 받았다. 또한, 큰법당 요사체 도량 등을 재정비 보수하고 전통사찰의 법등을 이어가기 위하여 2005년 12월에는 문화관광부로부터 전통사찰로 지정 되었다. 2007년 5월에는 큰법당 기와 보수불사를 마무리했다. 이러한 끊임없는 가람수호를 통하여 도심속의 전통사찰로서 수행과 포교의 중심도량으로 잘 가꾸어 나가고 있다.[제천 한산사 석조여래입상 - 충청북도 문화재자료 (2004년 10월 22일 지정)]고려 말기의 불상 양식이 남아 있는 조선시대의 불상이다. 석불은 높이 2.8m이며 벽돌로 만든 대좌 위에 세워져 있다. 대좌를 제외한 몸체는 하나의 돌로 이루어진 돌기둥형이다. 윗면보다 아랫면이 더 넓고 옆면은 넓적한 형태이다. 정면은 부조형으로 조각되어 있고 좌우 옆면과 뒷면은 아무것도 조각되어 있지 않다. 석불의 얼굴은 타원형으로 얼굴에 비해 코가 큰 편이다. 눈끝이 날카로우며 입은 살짝 벌린 채 미소를 띠고 있다. 불상의 전체적인 조각 수법은 선을 하나하나 조각한 수법이다.",제천시
