,title,addr1,mapx,mapy,firstimage,overview,addr2
15,신륵사(제천),충청북도 제천시 덕산면 월악산로4길 180,128.1297283,36.87933241,http://tong.visitkorea.or.kr/cms/resource/86/1598486_image2_1.jpg,"신륵사는 월악산(해발 1094m) 동쪽 기슭에 위치하고 있다. 행정구역 상으로는 충청북도 제천시 덕산면 월악리 803-5번지이다. 월악산(月岳山) 심곡(深谷)의 선원(禪院) 제천 신륵사는 대한불교조계종 제 05교구 본사 법주사의 말사이다. 충청북도 제천시 덕산면 월악리 803-5번지 월악산 깊은 계곡에 자리 잡고 있다. 창건에 대해서는 명확히 알려진 바 없다. 1960년에 법당인 극락전을 중수하면서 쓴 『월악산 신륵사 중수기』에 의하면 신라 진평왕 4년(582년)에 아도 화상이 창건하였다고 하나 확실하지 않다. 이후 신라 문무왕(재위 661~681년) 때 원효대사가 고쳐지었고, 고려 공민왕 때 무학대사가 다시 고쳐지었다고 한다. 또 조선 광해군(재위 1608~1623년) 때 사명대사가 다시 지어 오늘에 이르고 있다고 한다. 

이 기록과 함께 절에 남아있는 삼층석탑과 석재 및 극락전으로 미루어볼 때 신륵사는 신라 말 고려 초에는 창건되어 있었던 것으로 보인다. 그러나 이후 고려 시대에서 조선 전기에 걸친 연혁은 전혀 알 수 없다. 임진왜란 후 조선시대 후기에 중건되었는데, 창건 후 몇 차례의 중수가 있었을 것으로 보이나 중건되기 전까지 상당히 오랫동안 폐사로 남아있었던 것으로 보인다. 중건되었다고 하더라도 절터나 현존하는 건물로 보아 사세(寺勢)는 미약했던 것으로 보인다. 전하는 말에 의하면 지금으로부터 약 60년 전부터 선원(禪院)으로 사용되었다고 한다. 1960년에 한국전쟁으로 퇴락한 극락전을 중수한 바 있고, 1981년에 삼층석탑을 해체하여 보수한 바 있다. 이후 근래에 들어와 2001년에 산신각을 창건한 것을 비롯해 약 사당과 요사를 신축하여 현재의 모습을 갖추었다. 현재 신륵사에는 지정문화재로 극락전(시도유형문화재)과 삼층석탑(보물)이 있다.

[제천 신륵사 극락전]
신륵사 극락전은 아미타불을 모시는 건물이다. 앞면 3칸, 옆면 3칸으로 맞배지붕집이다. 공포 양식은 다포계 양식의 건물이다. 건물의 바깥쪽 벽에는 여래상을 그려 장엄하게 하였으며 내부에는 천장 좌우에 문수보살과 보현보살의 불화가 있다. 중앙에는 용 등으로 장식하여 내부를 세련미와 우아미를 강조했다. 이곳에 모시고 있는 목조 아미타불좌상은 조선 후기 작품으로 추정하고 있다.

[제천 신륵사 삼층석탑]
이 석탑은 신륵사에 세워져 있는 탑으로 2단의 기단 위에 3층의 탑신을 올린 모습이다. 통일신라의 석탑 양식을 잘 계승하고 있는 고려 전기의 탑으로 탑의 윗부분, 머리장식의 보존 상태가 좋은 편이다. 이렇게 머리장식이 잘 남아있는 예는 드문 편으로 각 부재를 만든 솜씨도 정교하고 세련미가 돋보인다. 1981년 탑을 해체하여 복원할 때 기단 내부에서 흙으로 빚은 소형 탑 108개와 사리함 조각이 발견되기도 했다.",제천시
16,옥순봉생태공원,충청북도 제천시 수산면 수산리 25-1,128.2039534,36.93289986,http://tong.visitkorea.or.kr/cms/resource/03/2792203_image2_1.jpg,"제천 수산면 일대는 슬로시티로 지정될 만큼 아름다운 자연과 생활문화가 잘 보존된 지역이다. 희고 푸른 여러 개의 봉우리가 마치 대나무 싹과 같다고 하여 이름 붙은 옥순봉도 이곳 수산면에 속한다. 옥순봉에서 자동차로 5분여 거리에 조성된 생태공원은 푸른 자연과 다양한 체험이 어우러진 공간이다. 특히 측백나무를 활용한 체험이 눈에 띄는데 측백 오일을 활용한 족욕체험부터 비누 만들기, 화장품 만들기, 우드버닝, 반려식물 가꾸기 등이 예약제로 운영된다. 예부터 신선이 되는 나무로 귀하게 대접받았던 측백나무는 피톤치드를 많이 배출하기로 손에 꼽힌다. 공원에서 이어지는 산책로를 따라 측백나무 숲을 거닐며 산림욕을 즐겨봐도 좋겠다. 공원 한쪽에선 우리나라 전통 궁술인 국궁 체험도 가능하다.",제천시
17,용추폭포 유리전망대,충청북도 제천시 의림지로 33,128.2080794,37.1741833,http://tong.visitkorea.or.kr/cms/resource/13/2676113_image2_1.jpg,"용추폭포 위에 설치한 유리전망대는 인도교로 바닥 부분에 투명 유리와 불투명 유리가 섞여 있는데, 철제 기둥에 설치된 센서를 지나면 불투명 유리가 투명 유리로 바뀌어 폭포가 내려다보인다. 발아래 쏟아지는 시원한 물을 지켜보며 걸을 수 있어 마치 폭포 위를 산책하는 듯한 아찔함과 시원스레 쏟아지는 물을 바라보며 스트레스를 해소 할 수 있는 곳이다. 폭포는 아래에서 바라보는 경우가 일반적이라, 발아래 떨어지는 물줄기를 보는 느낌이 색다르다.",제천시
18,용하구곡,충북 제천시 덕산면 억수리,128.1527098,36.87125876,http://tong.visitkorea.or.kr/cms/resource/50/1598450_image2_1.jpg,"다양한 아름다움을 간직하고 있는 계곡, 용하구곡 월악산 주봉인 월악영봉의 남쪽에 있는 만수봉과  동남쪽 문수봉 사이에 있는 계곡이 용하구곡이다. 용하수는 경북 문경시와 경계를  이루는 대미산에서 발원되어 강서대, 활래담, 수룡담, 선미대, 청벽대, 수렴선대,  관폭대를 이루어 내고, 만수봉에서 발원되는 계류에서 수문동 폭포, 수곡용담 등  명소를 차례로 빚어내니 이름하여 “용하구곡”. 천연림과 이끼가 끼지 않는 맑은 물과 바위가 잘  어우러져 절경을 이루고, 여름에 계곡에 들면 시원함이 뼈속까지 스미고, 가을엔  온몸이 단풍으로 물들어 신선이 된 듯하다. 대미산, 문수봉, 하설산, 매주막 등 1,000~1,100m  급 준봉들이 호위하듯 둘러서 있는 용하구곡은 송계계곡과 달리 개발이 되지 않아  자연 그대로를 만끽할 수 있고, 충주호 수상관광으로 단양 팔경을 연계 관광할 수  있으며, 40분 거리에는 수안보온천도 있어 쉬어가기에 좋다.

아름다움을 뽐내는 용하구곡 제1곡은 수문동폭포로 수곡용담을 지나 깊은 골짜기로  접어들면 높이 35m 길이 100m 가량되는 폭포가 깊은 산의 정적을 뒤흔들어 놓으면서  천연동굴 위로 쏟아져 내린다. 제2곡 수곡용담은 맑은 물이 포말을 이루어 물접이가  마치 용이 꼬리를 튼 모양을 이루고 있는데 묘하게 계단을 이룬 바위도 주위 경관에  어울려 볼만한 곳이다. 제3곡 관폭대는 큰 산이 지켜주는 아늑한 골짜기엔  맑디 맑은 물이 고여 깊은 정적에 쌓여 흐르고, 하얗게 닦여진 바위가 돌마루처럼  깔려 있다. 제4곡 청벽대는 맑은 물이 굽이 돌아 소를 이룬 절경이다. 구한말 박의당  선생의 시록엔 청벽대의 아름다운 풍경이 많이 담겨져 있으며 둘러보면 첩첩이 산이고  빠끔이 하늘만 열렸는데,차로변이면서도 세상과는 단절된 느낌을 준다. 5곡 선미대는 우거진 숲속에 물이 돌며 흐르고  커다란 청벽이 그 모양을 내려다보고 있다. 특히 주변 숲속에 송이버섯과 독사가  많기로 유명하며, 제6곡 수룡담은 물이 거울처럼 맑아 부녀자가 많이 찾아와 몸을  청결히 하는 곳이다. 제7곡 활래담은 큰 폭포가 하늘에 매달린 듯 세찬 기세로 흘러  떨어지고 아래로 떨어진 물은 소를 이루어 주위바위들과 조화되어 일대 장관을 이루며,  제8곡 강서대는 용하구곡 중에서 가장 길고 높은 지대이면서도 바위가 이상스럽게  편편하고 넓으며 뒤켠으로는 벽을 이루듯 둘러서 있어서 옛 선비들이 글을 읽고 쓰던  유서깊은 곳이다. 마지막으로 제9곡 수렴선대는 월악산 영봉에서 발원하며, 월악산  영봉을 등산하다보면 골짜기에 넓은 바위 위로 물이 흘러 까마득한 아래로 떨어져  내리며 멋진 폭포를 이룬다.",제천시
19,원각사(충북),충청북도 제천시 의병대로 118,128.2136939,37.13475183,http://tong.visitkorea.or.kr/cms/resource/00/2021600_image2_1.jpg,"* 깨달음을 찾을 수 있는 사찰, 원각사 *원각사(圓覺寺)는 충청북도 제천시 남천동에 자리한 한국불교태고종 사찰이다. 원각사는 사찰의 이름처럼 깨달음을 찾는 곳이다. 불교의 불모지인 제천지역에 불심의 꽃이 피어난 곳. 제천지역 시내가에 자리하고 있어 누구나 쉽게 찾아 갈수 있으며, 무한한 자비를 가지며 한없이 우리를 품어주는 관음보살의 미소가 깃든 곳이 바로 원각사이다.대로변에 위치하지만 높은 축대가 더없는 가람의 테두리가 되며, 아래로 보이는 독송정산과 교동시가지는 관음보살의 자비를 받으려는 중생들의 터전이 된다. 불교의 불모지와 다름없는 제천지역에 이처럼 관음의 터전이 생긴 것은 지암당 영지스님의 불심이 컸던 결과이다.지금도 그리고 미래에도 스님이 이룩한 제천지역의 불심은 관음전에 모셔진 나옹의 원불 - 관음보살의 미소처럼 한없이 피어날 것이다. 바쁜 일상이지만 시장의 하루를 마감할 때 항상 원각사를 찾는다는 나이든 보살의 이야기는 현대인들에게 사찰이 멀리 산사에만 있지 않음을 보여주는 것 같다.보살의 이야기처럼 멀리서 법을 구하지 않아도 바로 자기가 사는 곳, 그리고 그 생활터에서 항상 관음보살을 독송하면 그곳이 관음보살의 가피처가 된다는 보살의 이야기를 되새기며, 사찰을 찾을때 어렵게 힘들게 찾아가는 기복의 사찰보다는 생활처 부근에 있는 포근한 사찰이 참다운 우리들의 보금자리가 아닐까 생각한다. 항상 일과를 마칠 때 불자들이 안녕과 가피를 위해 기복의 진언처럼 외우는'관세음보살'의 명호처럼 오늘하루도 무한한 관음의 자비를 내가 서있는 자리에서 기원해 본다. * 원각사의 창건 배경 및 걸어온 길 *원각사는 1936년에 영하(永河)스님에 의해 창건되었다. 남천동의 전통사찰로 터를 마련하였으며, 곧 이어서 혜봉스님이 주지로 상주하며 가람을 정비하였다. 그 뒤 1965년부터 지암 영지스님이 주석하면서, 1988년 적할 때까지 30여년 동안 가람을 확장하였는데, 현재도 1960년대 건립한 관음전을 비롯해서 승방, 그리고 일주문 등이 전해진다.또, 1960년대 원각사에 오신 영지스님은 주지로 취임할 당시까지만 하더라도 불교세가 그리 활발하지 못했던 제천지방에서 고전을 면치 못했으나, 제천불교연합회는 물론 제천불교대학을 결성하여 포교에 앞장서고, 또한 태고종 총무원장으로서도 활발한 활동과 사회사업을 일으켜 원각사를 중심으로 제천지역 불교 포교의 중심도량으로 가람을 일으켰다.",제천시
20,원호 유허비 및 관란정,충청북도 제천시 송학면 장곡리,128.326548,37.21679172,http://tong.visitkorea.or.kr/cms/resource/27/176527_image2_1.jpg,"관란정은 송학면 장곡리에 위치한 영월 서강(西江)가 벼랑 위에 있는 정자이다. 단종이 노산군(魯山君)으로 강봉되어 영월에 안치되었을 때 생육신 중 한 명인 관란(觀瀾) 원호(元虜)가 단종을 추모하며 이곳에서 조석으로 눈물을 흘리며 망배(望排)하였다고 한다. 원호가 죽은 뒤, 후손들과 유림들이 원호의 충의를 길이 앙모하기 위하여 헌종11년(1845) 그 자리에 정자를 세우고 원호의 호를 따라 관란정이라 하고 유허비를 세웠으며, 1941년 개축하였다.건물 구조는 전면 2칸, 측면 2칸의 목조 기와집의 팔작지붕인데, 축대가 헐고 마루판이 파괴되어 1971년에 보수하여 오늘에 이르러 지방사적으로 지정받은 곳이기도 하다.* 원호와 단종의 애절한 이야기 *원호의 충의에 찬 애절한 사연은 글로 적어 표현할 길이 없었다고 전한다. 주위의 산과실과 산나물을 채취해 글월과 함께 함지박에 넣어 강물에 흘려보내면 단종이 받아보고 빈 표주박이 다시 강물을 거슬러 올라와 원호가 받았다고 한다. 낡은 비각안 목판에 붓으로 쓴 다음과 같은 애절한 싯귀가 있다. 간밤에 우던 여울, 슬피울어 지나가다. 이제와 생각하니, 님이 울어 보내도다. 저물이 거슬러 흐르고져, 나도 울어 보내도다.그는 왕께 향한 충절을 어찌할 길 없어 서강 기슭으로 거닐며, 님 그리는 단성을 강물에 흘러 보내며 울었다고 한다. 그 후손들은 이 충절이 자랑스러워 관란정 중수 약기(重修略記)에 “내 선조 관란선생은 단종조의 생육신 중의 한분이신데 오직 선생만, 두려울 때 있었으면서도 신하의 도리를 다한 특별한 충절은 넉넉히 혜성으로 우주를 비추었다” 라는 기록을 남겼다.",제천시
21,의림지솔밭공원,충청북도 제천시 의림지로 33,128.2080794,37.1741833,http://tong.visitkorea.or.kr/cms/resource/42/2751942_image2_1.jpg,"의림지솔밭공원은 제천 제1경인 '의림지'에서 용두산 쪽으로 도로를 따라 올라가 제2의림지인 비룡담저수지 둑 아래에 소나무 숲이 우거진 공원이다. 이리저리 휘며 자란 소나무들의 독특한 아름다움이 빼어난 공원으로, 숲속에 인공 물길을 만들어 물소리와 새소리를 정겹게 감상하면서 휴식할 수 있는 공간이다. 1980년대 제천시 승격 이후, 제천 의용소방대에 의해 아카시아와 돌밭의 척박한 환경에서 자라난 소나무를 의림지와 연계해서 제천의 명물로 탄생시킨 공원이다. 잔디마당을 비롯한 솔숲에 물길을 만들어 솔숲 길을 산책하기 좋아지도록 하여 시민들의 휴식처 및 각 학교(어린이집 등)들의 소풍 장소 등으로 활용되고 있다. 2020년 솔숲 내 자연형 인공수로를 만들어 여름철 물놀이를 즐길 수 있도록 하였다.",제천시
22,장락사(제천),충청북도 제천시 탑안로8길 24,128.2309392,37.14792564,http://tong.visitkorea.or.kr/cms/resource/19/2021619_image2_1.jpg,"* 예전의 대찰로 끊임없이 발전하는 사찰, 장락사(장락선원) *제천에 가면 제천외곽으로 뻗어진 대로변에 1000여 년을 지켜온 탑이 있다. 장락동 칠층모전석탑 또는 마을 사람들에게 장수탑이라 불리는 고탑으로 드넓게 펼쳐진 장락동 벌판 한켠에 서있다. 선덕여왕이 세웠다는 창락사에 세워졌던 고탑이 1000여 년의 세월을 버티며 그 자리에 그 모습 그대로 장수하고 있는 것이다.제천에서 교동고개를 건너 영월로 가는 대로와 태백선 철도가 나란히 달리는 곳에 서 있는 장락사는 정거랭이 벌판 사방 오리가 절터였다는 구전이 전해진다. 이 절들의 규모가 얼마가 컸던지 오보마다 석등이요, 십보마다 불상이고, 백보마다 가람이었다고 하니, 이 탑 역시 정거랭이에 있었던 이름모를 가람의 탑이였는지 모른다.현재 그 유구가 정확히 발견되진 않았지만 본당에서 절골까지 5리 사이엔 회랑이 연하여 승려들이 눈비를 안맞고도 수도했다 하며, 사월초파일과 칠월 칠석날이면 3,000여 명의 승려가 목탁과 바라를 치고 법요식을 거행했다고 하니 정말 통일신라대 불교에 대한 불심은 대단하였음을 짐작할 수 있다. 현재는 이런 이름모를 고탑 뒤에 70년대 노승 법해스님이 모전석탑을 보호하기 위해 세운 장락사라는 사찰이 고탑의 모습을 지키며 그 명맥을 이어가고 있으며, 끊임없이 옛 대찰의 모습을 알리려는 발굴과 더불어 장락사는 유명세를 타고 있다.* 장락사의 유래와 걸어온 길 *장락사의 우측 넓은 벌판은 옛날 통일신라시대 선덕여왕이 세웠다는 창락사가 있었던 곳으로, 이곳을 지나 태백선철도를 건너면 높이 9.1m의 칠층모전석탑과 만나게 된다. 이곳에 장락리 옛 절터가 한창 발굴 중에 있으며, 칠층모전석탑 뒤로 장락사가 있다.현재 장락사가 자리한 곳은 옛 문헌에 보이는 정거랭이 벌판으로 정거랭이 사방 오리가 옛날 창락사(昌樂寺)가 있었던 절터라고 하니 이곳에 큰 사찰이 자리하고 있었음이 틀림없다. 또 장락동 칠층모전석탑과 그 주변에서 금동불상, 금동편, 그리고 백자편이 발견되어 그 심증을 확인해 주고 있다. 하지만 모전석탑이 세워졌던 절이나 모전석탑 자체에 대한 문헌기록은 전하는 바가 없어 사찰이 언제 창건되었고 언제 폐사되었는지 그 유래를 알 수 없다.현재의 장락사는 송학산 강천사에서 수도하던 수도승 법해(法海)스님이 1964년부터 상주하면서 불사를 일으켜 창건한 것으로, 탑 뒤에 초막을 짓고 주석한 후인 7년 후에 법당을 신축하여 지금의 장락사를 창건하였다고 한다. 이후 법해스님은 탑 주변을 정비하고 꾸준히 불사하였으나 노쇠하여 1973년 2월 9일에 열반하자, 그해에 성원(聖元)스님이 주석하면서 관음전을 신축하고 석조관음보살입상을 봉안하여 지금의 가람을 이룩하였다.",제천시
23,정방사,충청북도 제천시 수산면 옥순봉로12길 165,128.2066429,36.99917563,http://tong.visitkorea.or.kr/cms/resource/28/1812428_image2_1.jpg,"* 금수산 자락의 고찰, 정방사 *정방사는 금수산(1,016m) 산자락인 신선봉(845m)에서 청풍방면 도화리로 가지를 뻗어 내린 능선 상에 위치한 사찰이다. 신라 문무왕 2년(662)에 의상대사가 세운 절로, 현재는 속리산 법주사의 말사이며 기도처로 유명하다. 《동국여지승람》에는 산방사로 소개되어 있으며, 의상이 도를 얻은 후 절을 짓기 위하여 지팡이를 던지자 이곳에 날아가 꽂혀서 절을 세웠다는 전설이 있다. 사전(寺傳)에 1825년 지금의 불당을 보수했다는 기록도 있다. 주변경관이 빼어나고 특히 법당 앞에서 바라다 보이는 청풍호는 세인의 삼라만상을 모두 잊게 할 정도로 전망이 좋다. 또한 법당 지붕의 3분의 1을 뒤덮은 암벽이 있는데, 그 웅장함과 기묘한 모습은 자연의 위대함을 느끼게 한다. * 정방사의 구조와 볼거리 *정방사 경내에는 법당과 요사, 현혜문 등이 있다. 1825년에 세워진 법당은 12칸, 요사는 5칸 규모의 목조 기와집이다. 현혜문은 절의 정문으로 일주문이라고도 하고,1칸 규모의 목조문이다. 법당 안에는 주존불인 높이 60cm, 어깨 너비 30cm의 관음보살상이 있으며, 불상 뒤로 후불탱화가 그려져 있다. 최근 법당 안에 신중탱화, 산신탱화, 독성탱화 등을 그려 넣었다.* 제천 정방사 목조관음보살좌상 및 복장유물 *제천의 정방사 법당에 모셔져 있는 나무로 만든 관음보살좌상과 그 안에서 나온 유물들이다. 정방사는 충주호가 한 눈에 들어오는 금수산 정상 가까운 곳의 거대한 암벽 아래 자리잡은 사찰이다. 신라 때 의상대사가 창건했다고 전해진다.이 목조관음보살좌상은 정방사의 법당에 주불로 모셔져 있다. 비교적 작은 규모이나 전형적인 조선 중기 보살상의 특징을 잘 보여주고 있다. 얼굴은 몸에 비해 작은 편이며, 머리 정면에 작은 부처가 새겨져 있는 높은 보관을 쓰고 있다. 신체는 비례가 알맞으며 옷은 오른쪽 어깨를 반달형으로 덮은 형식을 보인다. 손은 왼손을 들고 오른손을 내리고 있는데 아미타삼존불의 좌협시보살로서 만든 것을 알 수 있다.",제천시
24,제3한방명의촌 한방자연치유센터,충청북도 제천시 청풍면 학현소야로 324,128.2194526,37.00990241,http://tong.visitkorea.or.kr/cms/resource/66/2353466_image2_1.jpg,"한방자연치유센터는 각종 성인병 및 스트레스 관련 질환, 마음병을 위주로 치유하고 있다. 이를 위해 한방자연치유센터에서는 ‘한방힐링스테이’라는 프로그램이 상시 운영되고 있다. 수려한 자연 속에서 즐기는 명상과 힐링 트래킹, 그리고 다양한 감정정화 요법, 한방 기체조, 한방 심성계발 강좌, 침과 한약 등의 한방 의료 서비스를 통해 자연치유력을 극대화하여 질병의 근원치료에 힘쓰고 있다.",제천시
25,제천 덕주산성,충청북도 제천시 한수면 송계리,128.0874687,36.86085875,http://tong.visitkorea.or.kr/cms/resource/05/489505_image2_1.jpg,"월악산 남쪽 자락 일대는 남과 북을 잇는 도로의 길목으로 예로부터 전략적, 군사적 요충지였다. 신라 경순왕의 제 1공주 덕주공주가 이곳 월악산에 머물면서 지세를 이용하여 이 산에 성을 쌓고 훗날을 기약하였다. 그 후 이 성을 덕주공주가 쌓은 성이라 하여 덕주산성이라고 부르게 되었다. 덕주골로 들어가서 처음 만나는 성벽이 외성이고 하덕주사에서 마애불을 향해 올라가다가 도중에 보이는 성벽이 내성이다.이 산성은 고려 때 몽고의 침입과 조선조 임진왜란, 병자호란으로 인해 수차례 파괴되어 현재는 홍문관만 남아있다. 누각이 없어진 석문에는 담쟁이넝쿨이 둘러져 있는데 조국을 지키고 나라에 충성을 다한 옛조상의 얼과 넋이 고이 잠들어 있는 듯하다. 제천시에서는 문화재 복원사업으로 성곽 2,560m, 초루 3동을 복원하였다.
성의 유구는 윗 덕주사를 에워싼 내성(內城), 그 바깥의 하성(下城)과 조선시대에 쌓은 남문, 동문, 북문 등 아치형의 성문 3개소만 남아 있다.남문은 경상북도 문경에서 하늘재[寒暄嶺]를 넘어 미륵리에서 발원하여 월악산 남쪽 기슭의 월천을 막는 차단성 역할을 하는 문이다. 동창에서 문경으로 통하는 도로에 홍예문으로 되어 있고 좌우를 막는 석축은 내외겹축으로 길이가 100간이다. 축성법은 선단석을 3개씩 쌓아올린 뒤 종석(宗石) 1개와 12개의 기석(基石)을 쓰는 방식을 사용하였다. 동문은 덕주골 입구에 있는데 좌우를 가로막은 축성법을 사용하였고 문의 홍예 양식은 남문과 비슷하다. 북문은 송계리 1구 새터말 민가 가운데 있는데, 당초 계곡을 막았을 차단성의 성벽과 수구(水口)는 남아 있지 않다. 내외홍예를 갖춘 성문으로 초루(성 위에 세운 누각)와 여장(女墻:성 위에 활과 조총을 쏘는 구멍이나 사이를 띄어 쌓은 작은 성벽) 등 대부분의 석재가 유실되었으나 1997년 복원되었다. 홍예마루돌에는 태극모형이 조각되어 있다. 이 성은 안팎으로 5겹의 성벽이 남아 있는데 그 축조연대가 각각 달라, 성을 축조하는 방법에 관한 귀중한 자료이다.[문화재 정보]지정종목 : 시도기념물지정번호 : 충북기념물지정연도 : 1983년 3월 30일종류 : 성지 크기 : 면적",제천시
26,제천 사자빈신사지 사사자 구층석탑,충청북도 제천시 한수면 송계리 1002-1,128.0833775,36.85731741,http://tong.visitkorea.or.kr/cms/resource/29/1598429_image2_1.jpg,"빈신사터에 세워져 있는 높이 4.5m의 고려시대 탑으로 1963년 1월 21일 보물로 지정되었다. 탑의 보존상태는 양호한 편이며, 상·하 2단으로 된 기단 위에 4층의 지붕돌을 얹은 모습이다.아래기단은 글이 새겨져 있어 탑의 조성 경위를 알 수 있으며 위기단은 사자 4마리를 배치하여 탑신을 받치고 있는 특이한 모습이다. 네 모서리에 한 마리씩 배치한 사자의 안쪽 공간에 비로자나불상을 모셔 두었다. 앉은 모습의 비로자나불상은 특이하게도 두건을 쓰고 있으며 표정이 매우 흥미롭다. 이러한 양식은 통일신라시대의 화엄사사사자삼층석탑(국보)을 모방한 것으로 이 밖에도 몇 기의 탑이 더 전해지고 있다. 현재 탑신에는 지붕돌이 4층까지 남아 있는데, 아래기단에 있는 글을 통해 원래는 9층이었음이 확인되었다. 고려 현종 13년(1022)에 만들어진 이 탑은 연대가 확실하여 각 부의 구조와 양식, 조각수법 등 다른 석탑의 조성연대를 추정하는데 기준이 되는 중요한 탑이다.[문화재 정보]지정종목 : 보물지정연도 : 1963년 1월 21일시대 : 고려종류 : 석탑크기 : 높이4.5m",제천시
