,title,addr1,mapx,mapy,firstimage,overview,addr2
0,공전자연학교,충청북도 제천시 봉양읍 의암로 345,128.0799649,37.1142267,http://tong.visitkorea.or.kr/cms/resource/44/1940944_image2_1.jpg,"작문화예술협동조합은 폐교인 공전학교와 폐역인 공전역을 새롭게 단장하여 효소를 중심으로 한 공전자연학교와 힐링 편백나무로 조각을 체험하는 우드트레인을 운영하고 있다. 오미자 오가피 과일 매실, 각종약초 등 갖가지 효소체험과 효소로 반찬으로 한 효소자연밥상으로 유명하다. 효소는 수년간 효소를 연구한 안영숙 교장선생님이 직접 효소를 담그고 보관하는 방법을 강의해 준다.",제천시
1,김세균판서고가,충청북도 제천시 한수면 미륵송계로 1588-1,128.0802965,36.88199785,http://tong.visitkorea.or.kr/cms/resource/01/2793701_image2_1.jpg,"충청북도 유형문화재인 이 가옥은 조선 후기 이조판서를 지낸 김세균의 소실이 살던 집으로 전해지고 있다. 충주댐이 건설되면서 1983년 이곳으로 옮겼으며, 현재 충청북도 유형문화재로 지정이 되어있다. 원래는 안채와 사랑채로 나뉘어 있었으나 안채는 무릉리에 옮겨 짓고 지금은 사랑채만 남아 있다. ㄱ 자형 구조로 가옥의 규모나 양식으로 보면 조선시대 사대부가의 생활을 살펴볼 수 있다. 덕주산을 배경으로 높은 축대에 자리해 있어 돌계단을 올라 일각문을 지나면 멋진 자태를 들여다볼 수 있다.",제천시
2,"능강계곡, 얼음골",충청북도 제천시 수산면 옥순봉로 1185,128.1970775,36.9867241,http://tong.visitkorea.or.kr/cms/resource/39/176439_image2_1.jpg,"* 여름에 얼음이 어는 곳, 능강계곡,얼음골 *
얼음골에서 청풍면으로 향하면 넓고 시원한 청풍호반을  만나게 된다. 청풍문화재단지에 이르기 전인 청풍호반의 청풍대교를 건너지 않고  좌회전하여 청풍호를 오른편에 끼고 산중턱의 포장도로를 10여분쯤 달리면 ES리조트(콘도)를  만나고 이곳을 지나 정방사라고 알리는 이정표식과 함께 왼쪽으로 금수산에서 발원하는  능강계곡을 만나게 된다. 능강계곡의 발원지는 수산면과 단양군 적성면의 경계에 서 있는 금수산(1,016m)의 서북사면 8부쯤으로 이곳에는 삼복염천에만 얼음이 나는 빙혈이 있다. 울창한 소나무숲 사이로 맑은 물이 굽이치고 깎아 세운 것 같은 절벽과 바닥까지 비치는 맑은 담(潭), 쏟아지는 폭포수 등이 어우러져 절경을 이룬다. 이곳은 지대가 높고 남북을 가로막아 종일 햇볕이 드는 시간이 짧아 겨울철에 바위가 차가워지고 물이 얼어 삼복지경에도 얼음이 나는 곳이라 하여 얼음골 또는 한양지라  한다. 초복에 얼음이 제일 많고, 중복에는 바위틈에 있으며, 말복에는 바위를 들어내고 캐내어야 하며 이곳의 얼음을 먹으면 만병통치라하여 많은 피서객이 모여든다. 이곳 한양지에서 발원하여 능강계곡을 흐르는 물길은 청솔로  우거진 숲 사이로 차고 맑은 계류가 굽이쳐 돌아 흐르면서 계곡의 양쪽에 병풍을 두른 듯한 곳이 있는가 하면 꿈속을 노니는 것 같은 곳도 있다. 이십리 물길을 흘러 청풍호로 흘러든다. 계곡의 왼쪽 능선에는 신라 문무왕 의상대사가 창건한 정방사가 있어 산사아래 청풍호를 내려다볼 수 있다. 

* 얼음골의 특이한 기상현상의 이유는? *
얼음골과 같은 곳의 특이한 기상현상은 기상관광의  대상이 되는데, 지질학상 이러한 지형을 애추(崖錐,talus 혹은 scree)라고 한다. 단애면으로부터 중력에 의해 떨어지는 풍화 산물이 단애 밑에 쌓여 만들어진 지형을  애추라고 한다. 얼음골에서 냉기가 나오는 곳은 이 애추 사면인데 주로 주빙하 기후 하에서 풍화작용에 의해 발달한 화석지형으로서, 구성물질이 모난 바위덩어리로 되어 있다. 여름철에 이 애추사면에 산사태가 발생하여 도로의 교통을 방해하기도 한다. 이와 같이 결빙현상이 계절과 정반대인 이유는 암석 속에 틈이 많이 생기기 때문이다.",제천시
3,덕동계곡,충청북도 제천시 백운면 화당로2길 19,127.9878465,37.17213498,http://tong.visitkorea.or.kr/cms/resource/35/176535_image2_1.jpg,"덕동리의 덕동계곡은 백운산(1,087m)과 십자봉(984.8m)에서 발원하여 원덕동까지 5㎞에 걸쳐 흐르는 계곡이다. 주변의 용하구곡이나 송계계곡에 비하면 규모도 작고 알려지지 않았지만 아름다운 기암과 울창한 숲, 차고 깨끗한 물은 그 어느 곳에 못지않다. 그렇기 때문에 제천 사람들이 꼭꼭 숨겨놓고 한 여름철이면 찾는 피서지이다. 이 계곡에서는 주민들에 의해 일체의 어로 행위를 금지하고 있다. 덕동계곡은 군데군데 이동 화장실과 작은 주차공간이 마련되어 피서객들의 편의를 돕고 있다. 계곡은 주민들의 보호 활동으로 맑은 물을 유지하고 있다.",제천시
4,덕주사(제천),충청북도 제천시 한수면 미륵송계로2길 87,128.0986788,36.86196161,http://tong.visitkorea.or.kr/cms/resource/94/2550994_image2_1.bmp,"대한불교 조계종 제5교구 본사인 법주사(法住寺)의 말사이다. 구전으로 587년(진평왕 9)에 세워졌다고 전해진다. 더불어 신라의 마지막 공주인 덕주공주(德周公主)가 마의태자(麻衣太子) 일행과 이곳에 들렀을 때 이 절을 세워 절 이름을 덕주사라 하고, 골짜기 이름을 덕주골이라고 하였다는 전설도 전해지고 있다. 그러나 정확한 역사적 자료가 남아있지 않아 창건자와 창건 연대는 미상이다. 그때 지은 사찰은 보물 덕주사 마애불 앞에 세워졌었는데, 6 ·25전쟁 때 훼손되었다. 현재의 건물은 원래의 사지에서 1.7km쯤 떨어진 곳에 1970년에 중창된 것이다.",제천시
5,무암사,충청북도 제천시 금성면 청풍호로39길 285,128.2055421,37.03070254,http://tong.visitkorea.or.kr/cms/resource/54/176554_image2_1.jpg,"제천에서 82번 지방도를 따라 청풍방면으로 18km를 가면 좌측의 도로변에 금성면 성내리 마을이 나타난다. 마을에서 동쪽으로 난 계곡을 따라 오르면 마치 상쾌한 풍광을 느끼며 계곡의 좌편으로 까치성산이, 우편으로 동산이 길게 능선을 드리우고 있는 깊은 품 안에 무암사가 자리하고 있다. 정확한 창건 연대와 창건자는 알 수 없으며, 조선 시대 이전에 건립된 것으로 알려져 있다. 절에서 서남쪽 위치에 암봉이 하나 있는데 늙은 스님을 닮았다 하여 노장암(老丈巖)이라 불린다. 이 암봉이 안개가 드리워졌을 때에만 보인다 하여 무암사라고 한다. 풍수설에 따르면 절 입구에 중의 형상을 한 바위가 있으면 그 절의 사맥(寺脈)이 끊기지 않고 식량도 넉넉하다고 한다.사찰 지붕의 망와(望瓦)를 살펴보면 조선시대인 1740년(영조 16)에 중창했다는 사실을 알 수 있다. 현존하는 당우로는 극락전, 칠성각, 산신각, 요사채, 객실, 수호실 등이 있으며, 극락전에는 목조아미타불좌상과 후불탱화(後佛幀畵), 지장탱화(地藏幀畵)가 보존되어 있다. 부도 4기와 불기류, 촉대와 위패 등이 문화재로 지정되어 있고, 4기의 부도 중 수월당(水月堂) 부도는 조선시대의 것으로 1959년에 발견되었다. 특히 우부도(牛浮屠)는 창건 당시 목재와 기와 등을 운반하던 소가 죽자 그 사리를 모아 세운 사리탑으로 이 주변을 소부도골이라 한다.또한, 대웅전 전면의 기둥은 수령 1,200년을 넘는 싸리나무의 기둥이라 하여 보존 가치가 높다. 절 건너편에는 큰 암석이 있는데 청명한 날씨에는 산과 암석이 일체로 보여 바위의 모습이 보이지 않으나 운무가 산을 덮으면 암석이 뚜렷하게 보일 뿐 아니라 노승이 팔짱을 끼고 서 있는 모습과 같다 하여 무암사라 칭하였다고 한다.* 죽은 소에서 나온 사리를 보관하고 있는 부도 *무암사에는 2개의 부도가 있는데, 그 중 한 개가 소의 부도로 죽은 소에서 나온 사리를 보관하고 있어 유명하다. 또한 부도에는 의상대사와 소에 대한 전설이 전해 내려오고 있다. 의상대사가 무림사를 세우려고 아름드리 나무를 잘라 다듬어 힘겹게 나르고 있을 때 어디선가 소 한 마리가 나타나 목재를 운반하여 주었다. 그 덕에 손쉽게 절을 세울 수 있었다. 이 소를 극진히 위해 주었으나 얼마 뒤 소가 죽었다, 이를 안타깝게 여겨 화장을 하였더니 여러 개의 사리가 나왔다. 소의 불심에 감동한 대사는 사리탑을 세우고 사람들은 무림사를 우암사(牛岩寺)라 부르게 되었다 한다.",제천시
6,박달재,충청북도 제천시봉양읍 원박리,128.0572966,37.14452834,http://tong.visitkorea.or.kr/cms/resource/52/2639052_image2_1.jpg,"제천시 봉양읍과 백운면을 갈라 놓은 험한 고개를 박달재라 한다. 그 옛날 박달도령과 금봉낭자의 애절한 사랑 이야기가 전설로 전해져 내려오는 고개로써 제천시 에서는 박달도령과 금봉낭자를 캐릭터화하여 ""박다리와 금봉이""로 명명하여 각종 캐릭터 상품 개발 및 홍보에 심혈을 기울이고 있으며 고개 입구에 일주문을 건립하여 찾는 이들에게 볼거리를 제공하였고 박달재 명소화 사업도 추진하여 누구나 찾아오면 추억을 남길 수 있는 명승지로 조성하였다. ",제천시
7,박달재목각공원,충청북도 제천시 백운면 박달로 231,128.05623,37.14508937,http://tong.visitkorea.or.kr/cms/resource/48/2639048_image2_1.jpg,"박달이와 금봉이의 한풀이를 위해 박달재에 두 인물 중심의 목각 공원이 조성되어 있다. 아기를 목마태운 박달이와 금봉이가 환생한 듯 다정히 숲길을 거닐기도 하며, 성각스님의 손끝을 통해 과거에 못다한 사랑을 현대에서 실현하는 모습을 볼 수 있다. 조각들은 기다림과 그리움에 해학적으로 목이 길게 빠지거나 눈이 튀어나온 모습으로 그들의 마음이 직관적으로 전달된다. 공원 한쪽에는 수백 년 된 느티나무에 불상을 조각한 목굴암과 오백나한상 전시관이 있다.",제천시
8,박달재자연휴양림,충청북도 제천시 백운면 금봉로 223,0.0,13371919.0,http://tong.visitkorea.or.kr/cms/resource/60/176560_image2_1.jpg,"박달재자연휴양림은 150년내외의 소나무와 잡목이 공존하는 울창한숲이 기암괴석과 조화를 이르고 있다. 박달재 고개마루에는 팔각정과 옹달샘, 휴게소, 다양한 모습을한 목각공원이 조성되어 있으며, 휴양림의 산정상에서는 멀리 소백산과 월악산, 감악산을 한눈에 전망할수 있다.",제천시
9,박약재,충청북도 제천시 중말16길 5-4,128.2646226,37.13656646,http://tong.visitkorea.or.kr/cms/resource/07/1596807_image2_1.jpg,"제천 시내에 있는 전통가옥으로 진주강씨 문중에서 자녀 교육을 목적으로 조선 중기에 세운 이다. 정묘호란 때 척화를 상소한 상곡 강유(1597~1668)가 수학한 곳이다.  정면 3칸, 측면 2칸 규모의 팔작지붕집이다. 중앙은 대청마루가 있고 왼쪽에 방 2개, 오른쪽에 방 1개, 그리고 툇마루를 두고 있다. 현판문은 조선 후기의 학자 유인석의 친필이다. 1907년 강순조, 박정수, 이화중 등이 호서의병장 운강 이강년의 전투사인 《운강창의일록》을 이곳에서 편찬했다. 오랜 역사를 가진 건물이지만 보존상태가 좋은 편이다. 근처에 가볼만한 곳으로는 제천의병전시관과 자양영당, 박달재 등이 있다.",제천시
10,배론성지,충청북도 제천시 봉양읍 배론성지길 296,128.0837937,37.1612158,http://tong.visitkorea.or.kr/cms/resource/63/1822963_image2_1.jpg,"제천, 원주간의 국도변에 위치한 배론성지는 한국 천주교 전파의 진원지로 천주 교회사의 중요한 의미를 지니고 있다. 이곳은 한국 초대교회의 신자들이 박해를 피해 숨어 들어와 화전과 옹기를 구워서 생계를 유지하며 신앙을 키워 나간 교우촌이다. 배론성지는 지리적으로 치악산 동남기슭에 우뚝 솟은 구학산과 백운산의 연봉이 둘러싼 험준한 산악지대로 외부와 차단된 산골이면서도 산길로 10리만 가면 박달재 마루턱에 오르고, 이어 충주, 청주를 거쳐 전라도와 통하고, 제천에서 죽령을 넘으면 경상도와 통하며 원주를 거쳐서 강원도와도 통할 수 있는 교통의 길목으로 배론이란 지명은 이 마을이 재한 산골짝 지형이 배 밑바닥 모양이기 때문에 유래한 것으로 한자 새김으로 주론(舟論) 또는 음대로 배론(徘論)이라고도 한다.* 배론성지의 유래와 걸어온 길 *조선시대의 행정지명으로 제천현 근우면 팔송정리 도점촌으로 옹기를 굽던 곳이다. 배론에 천주교신자들이 본격적으로 모여들기 시작한 것은 1791년에(정조15) 일어난 신해박해 이후로 추정되는데 탄압을 피하기 위하여 숨어든 교우들의 은신처가 되었다.1801년 신유박해 때 황사영이 당시의 박해상황과 신앙의 자유와 교회의 재건을 요청하는 백서를 토굴 속에 숨어 집필한 지역이며, 1855년(철종6년)에서 1866년(고종3년)까지 우리나라 최초의 근대식 교육기관인 배론 신학교가 소재했던 지역이다. 또한 1861년 별세한 우리나라 최초의 유학생이며 김대건 신부에 이어 두 번째 신부가 된 최양업의 분묘가 소재한 지역인 동시에 1866년 병인박해의 순교자인 남종삼의 생가가 있는 지역(산넘어 묘재)이다. 배론성지는 1911년 경성교구에 속해 있다가 1968년 원주교구에 속하였으며 1970년대 들어 개발되어 오늘에 이른다.",제천시
11,별새꽃돌 자연탐사과학관,충청북도 제천시 봉양읍 옥전4길 45,128.058323,37.18637354,http://tong.visitkorea.or.kr/cms/resource/54/2366254_image2_1.jpg,"자연탐사과학관은 도심 생활에 찌든 현대인과 청소년들이 자연생태를 체험할 수 있는 공간으로 조성되었다. 체험을 통해 도시생활로 피폐해진 인성을 회복하는 것을 목표로 하는 이곳은 별, 새, 꽃, 돌의 네 가지를 자연세계의 대표 주제로 선정하고 있다. 현장체험 프로그램, 숙박 프로그램, 하루탐사 프로그램, 야간 천체탐사 프로그램, 찾아가는 천문 이동대 프로그램이 진행되는데, 모든 교육프로그램은 예약을 해야 한다.* 별새꽃돌 탐사의 세계로 빠져보자! *별을 주제로 하는 구학산천문대에서는 지붕을 열어 밤하늘의 별을 관찰 할 수 있다. 이곳에는 20m슬라이딩 돔과 다양한 천체망원경이 있는데, 참가자들이 직접 조작해 볼 수 있다. 천문대의 자랑은 주망원경인 152mm 굴절망원경이다. 컴퓨터를 이용한 정밀자동 추적장치가 부착된 이 천체망원경으로 달의 운석구뿐만 아니라, 토성의 고리와 목성의 띠를 또렷하게 관측할 수 있다. 더 멀고 깊은 천체인 은하와 성운 성단을 관측할 때는 14인치 대구경 반사굴절망원경을 사용한다. 고성능 망원경 외에 80미리 중, 소형 망원경으로는 학생들이 직접 망원경을 조작해서 북두칠성의 이중성을 찾아보기도 한다.새를 주제로 하는 과학관에서는 쌍안경과 조류탐조용 망원경을 이용해 야생조류를 관찰할 수 있다. 해가 뜨면, 이른 아침 지저귀는 산새소리가 정겹기만 하다. 요사이는 어린 새끼에게 먹이를 날라주는 어미새의 분주한 모습을 관찰할 수 있다. 꽃을 주제로 하는 식물생태학습원에는 150여 종의 야생화와 30여 종의 허브, 65종의 나무가 있으며, 고배율확대경을 통해 이들을 관찰할 수 있다. 고배율확대경으로 앙증맞은 야생화의 꽃잎을 들여다보고 있노라면 누구나 예쁘고 아기자기한 우리 꽃에 그만 반하고 만다. 돌을 주제로 하는 화석전시실에는 200여 점의 화석이, 암석광물교육실에는 100여 점의 광물 원석이 전시되어 있다. 편광현미경으로 다양한 암석과 광물의 아름다움에 취해본다. 굳이 보석이 아니더라도 평범한 돌이 가지는 화려한 무늬와 색상에 감탄사를 연발하게 된다.",제천시
12,복천사(제천),충청북도 제천시 독순로21길 14,128.2176934,37.13876533,http://tong.visitkorea.or.kr/cms/resource/73/2021573_image2_1.jpg,"복천사(福泉寺)는 충청북도 제천시 독송정산(獨松頂山) 자락에 자리한 재단법인 대한 불교 육주회 사찰이다. 독송정산(獨松頂山). 복천사가 있는 남산의 이름이다. 이곳은 조선시대 향교가 있던 향교골로 독순봉, 또는 독심정(獨深頂)이라고도 불리는 곳이다. 제천의 명동 한복판에 있으며, 제천 사람들은 이곳에서 먼 옛날 전설 속의 인물들을 만난다. 생육신의 한사람 원호, 그리고 학다리 처녀. 조선 초 생육신의 한 사람인 원호(元昊)는 단종이 폐위되어 영월에 유배되었다는 소식을 듣고 제천현 동헌 앞산인 이곳에서 청량포를 향해 망배하며 통곡하였다. 그로 인해 이름 지어진 독심정. 우린 독심정이란 이름에서 망부석처럼 한 임금을 위해 절개를 굳힌 생육신의 절개에 탄복한다.또, 향교골 한 선비의 딸에 대한 사랑이 드리워진 곳. 딸이 항상 나들이가 즐겼던 자리에 딸의 시신을 묻어주려는 아버지의 마음은 죽은 딸에 대한 절절한 사랑을 느낄 수 있다. 산신에 대한 두려움과 마을 주민들의 방해로 결국 딸의 시신을 독송정산에 묻진 못했지만, 아름다운 학의 모습으로 승천하여 그 흔적을 남겼다. 학다리. 이곳이 바로 그곳으로 수많은 이들이 복천사를 찾을 때 전설 속 두 주인공의 이야기를 쫓는다. 지금은 그 옛날 독송정의 모습은 남아 있지 않지만 힘들게 올라선 언덕에 자리한 자그마한 절에서 원호의 영혼과 학다리 처자의 숨결을 느낄 수 있다. 사찰과 함께 100여 년의 넘게 독송정에 홀로선 소나무가 바로 그들의 영혼이 아닐까? 홀로선 소나무라는 산 이름처럼, 복천사에 가면 산신각을 둘러싼 송림숲이 사찰을 찾는 이들을 반긴다. 지금 그곳에서 독송정의 산신은 찾을 수 없지만 항상 제천의 시가지를 바라보며 제천의 안위를 기원하는 스님의 염불소리는 언제까지도 산신의 가피처럼 제천 시가지에 울려 퍼질 것이다.",제천시
13,비봉산(제천),충청북도 제천시 청풍면 도곡리,128.1428678,37.00869001,http://tong.visitkorea.or.kr/cms/resource/33/1727233_image2_1.jpg,"충북 제천에 있는 비봉산은 청풍호수에 둘러싸인 높이 531m의 산이다. '새가 비상하는 모습'이라는 뜻을 가졌으며, 매가 날아가는 것처럼 보여 ‘매봉산’이라고도 한다.산 정상에 오르면 ‘내륙의 바다’로 불리는 짙푸른 청풍호의 그림 같은 풍광이 눈앞에 펼쳐진다. 청풍호 물길이 만들어낸 반도들이 마치 다도해를 보는 듯하고, 퇴계 이황이 극찬했던 금수산을 비롯해 적성산, 용두산, 월악산, 충주호는 물론 멀리 소백산 비로봉까지 아스라이 보인다. 이곳에는 패러글라이딩 활공장이 갖춰져 있어 패러글라이딩 체험을 하면 더욱 멋진 경치를 감상할 수 있다. 산 길이 험하지 않아 둘레길 걸어가듯이 올라가다 보면 정상에 도착할 수 있다. 관광모노레일을 이용해 쉽게 올라갈 수도 있어 가족여행으로도 제격이다.",제천시
14,송계계곡,충청북도 제천시 한수면 미륵송계로 1360-1,128.0743245,36.89321035,http://tong.visitkorea.or.kr/cms/resource/60/489560_image2_1.jpg,"* 월악산의 대표적인 계곡, 송계계곡 *송계계곡은 월악산 국립공원 내에 위치한 계곡으로 제천의 대표적인 계곡 관광지라 할 수 있다. 송계계곡은 월악산(1,094m) 자락이 병풍처럼 둘러싸고 있어 가히 여름 더위를 잊을 만하다. 특히 계곡에서 흐르는 맑은 물은 얼음처럼 차가워 여름철에는 더위를 식히려는 많은 피서객들이 찾고 있다. 여름철에는 울창한 수림과 깊은 계곡 속에 더위를 피하려는 사람들에게 인기가 있으며 가을에는 충주호와 연계한 단풍 관광지로 각광받고 있다. 월악산 일대는 1984년 12월 31일에 국립공원으로 지정되었다. 또한 천연기념물인 망개나무, 덕주사, 미륵리사지 등의 관광명소가 흩어져 있어 등산객들의 발길을 멈추게 한다.* 송계계곡의 명물, 송계팔경 *계곡 주변에 있는 월광폭포(月光瀑布), 학소대(鶴巢臺), 자연대(自然臺), 청벽대(靑壁臺), 와룡대(臥龍臺), 팔랑소(八娘沼), 망폭대(望瀑臺), 수경대(水鏡臺) 등은 송계팔경(松界八景)으로 이름이 알려져 있다. 자연대는 송계계곡 첫 입구에 소재 한 곳으로 맑은 계곡물과 넓은 암반, 깊은 소가 인상적인 곳이다. 월광폭포는 30여m의 3단폭포이며, 수경대는 신라시대부터 월악신사를 설치하고 제천하던 곳이다. 학소대는 한 쌍의 학이 월악산을 오가며 살았다는 곳이며, 망폭대는 덕주산성 남문과 한쪽맥이 이어져 있는 곳으로 기암줄바위와 고무서리계곡을 굽이도는 맑은 물과 어울린 절벽이다. 와룡대는 용이 승천하였다고 전하는 수심 5m의 깊은 웅덩이이며, 팔랑소는 200여 평의 화강암 반석위로 맑은 물이 흐르고 있는 곳으로 옛날 하늘나라 공주가 하강하여 목욕을 했다고 전해지는 곳이다.* 팔랑소 *미륵사지 앞으로 흐르는 계곡으로 월악산국립공원내에 있는 송계계곡에 속한다. 팔랑소는 송계팔경의 한 곳으로 넓은 화강암 반석위로 맑은 물이 흐르는 모습이 장관을 이루는 곳이다. 오랜 세월 다듬어진 매끄러운 화강암과 숲, 맑은 물이 어우러져서 절경을 자아낸다. 여름철 많은 피서객들이 찾고 있다. 신라시대 8공주가 이곳에서 목욕을 했다는 이야기가 전해오고 있다.",제천시
