,title,addr1,mapx,mapy,firstimage,overview,addr2
38,평해향교,경상북도 울진군 평해읍 평해로 82-28,129.4418465,36.7287079,http://tong.visitkorea.or.kr/cms/resource/21/183321_image2_1.jpg,"고려 공민왕 때 현유(賢儒)의 위패를 봉안, 배향하고 지방민의 교육과 교화를 위하여 창건되었다. 1407년(태종 7) 군수 김한철(金漢徹)과 향중유림이 협의하여 송릉(松陵)으로 이전하였다가 1612년(광해군 4) 현재의 위치로 이건하였다. 1976년 대성전을 보수하였으며, 1977년 전교(典校) 김이두(金利斗)의 사재(私財)와 국고보조로 태화루(太和樓)를 복원하고 명륜당을 중수하였다. 현존하는 건물로는 8칸의 대성전, 동재(東齋)와 서재(西齋), 삼문(三門), 7칸의 명륜당, 8칸의 태화루 등이 있다. 대성전에는 5성(五聖), 송조2현(宋朝二賢), 우리 나라 18현(十八賢)의 위패가 봉안되어 있다. 조선시대에는 국가로부터 토지와 전적·노비 등을 지급받아 교관 1명이 정원 30명의 교생을 가르쳤으나, 갑오개혁 이후 신학제 실시에 따라 교육적 기능은 없어지고 봄·가을에 석전(釋奠)을 봉행하며 초하루·보름에 분향을 하고 있다.",울진군
39,폭풍속으로 촬영지,경상북도 울진군 죽변면 등대길 74-14,129.4285432,37.059106,http://tong.visitkorea.or.kr/cms/resource/14/2393714_image2_1.jpg,"SBS 드라마 <폭풍 속으로>는 고기잡이 아버지 밑에서 자란 두 아들에게 다가온 운명적인 사랑과 파란만장한 삶을 그린 드라마로 울진 죽변리 일대에서 촬영이 이루어졌다. 동해안의 한적한 마을이었던 죽변면은 드라마 <폭풍 속으로>의 촬영지로 알려지면서 관광객들이 찾는 관광명소로 자리 잡았다. 이곳 드라마 세트장은 자연과 어우러진 경관이 아름다워 드라마를 알지 못하는 사람들도 아름다운 풍경을 보기 위해 이곳을 찾는다. 촬영지 내에는 동해와 어우러진 빼어난 비경을 보여주는 주인공의 집을 포함하여 교회, 용의꿈길(해안데크), 전망대 등이 있다. 근처에 있는 대나무 숲과 죽변 등대, 넓게 탁 트인 동해바다와 어우러진 한 폭의 그림 같은 주인공의 집은 이곳의 최고의 비경이라 할 수 있다.",울진군
40,하트해변,경상북도 울진군 죽변면 등대길 74-14,129.4285432,37.059106,http://tong.visitkorea.or.kr/cms/resource/32/2754232_image2_1.png,"하트해변은 죽변등대 인근에 자리 잡고 있다. 울진 앞바다의 절경을 감상할 수 있어서 많은 사람이 찾는다. 전망대에 서면 울진 앞바다의 풍경을 한눈에 조망할 수 있다. 풍경이 멋져서 기념사진을 남기는 사람이 많다. 이곳은 2004년 SBS에서 주말 특별기획 드라마로 방영된 '폭풍 속으로' 촬영지이기도 하다. 드라마에는 김석훈, 송윤아, 김민준, 엄지원, 이덕화 등이 출연했다. 드라마의 세트장 뒤에 하트 모양의 해변이 있다.",울진군
41,한화리조트 백암온천,경상북도 울진군 온정면 온천로 129-13,129.338203,36.72300376,http://tong.visitkorea.or.kr/cms/resource/92/1885392_image2_1.jpg,"천연알칼리성 라듐성분을 함유한 국내 유일의 유황온천으로 1979년 12월 31일 관광특구로 지정되었다. 무색무취하며 사람 몸에 적당한 53도를 유지하고 있어 온천욕을 즐기기에 적당할 뿐만 아니라 신경통, 만성관절염, 중풍, 신경마비 등에 효험이 있다.  동해안의 대표적인 온천으로 손꼽히며 전국에서 온천객과 휴양객들이 줄지어 찾는 곳이다. 또한, 이 곳은 당구장, 탁구장, 온천학습관, 오락실 등 다양한 부대시설을 갖추고 있어 가족단위의 휴식공간으로 더할 나위 없다. 주위에는 동해해수욕장과 백암산의 절경이 있어 해수욕과 등산도 곁들일 수 있다.* 백암산 온정면과 수비면에 걸쳐있는 백암산(1,004m)은 온정리의 백암온천을 기점으로 서쪽으로 둘러있다. 구술령 고갯길이 열려 영양과 봉화를 거쳐 내륙으로 이어지는 관문이 되기도 한다. 짙은 소나무 숲이 드리운 깊은 산세는 정상 북쪽계곡에도 선시골(일명 신선골) 등 용이 살았다는 늪을 비롯 수십 개의 담과 계곡물이 사방으로 이어지고 고모산성과 할매산성, 백암산성 등 유적지도 안고 있다.",울진군
42,후정해수욕장,경상북도 울진군 죽변면 후정2길 72,129.4159495,37.07018226,http://tong.visitkorea.or.kr/cms/resource/26/183326_image2_1.jpg,후정해수욕장은 해안선을 따라 펼쳐진 백사장과 소나무 숲이 어우러져 시원함을 느끼게 하는 해수욕장이다. 또한 파도가 심하게 일지 않아 아이들과 함께 해수욕을 즐기기에 안성맞춤이다. 바다 밑의 경사가 완만하고 방갈로와 야영장 시설이 잘되어 있다. 근처에 덕구온천이 있어 온천욕도 함께 즐길 수 있어서 좋다. 또한 죽변항이 가까이에 있어 싱싱한 해물을 즉석에서 즐길 수 있다.,울진군
43,후포 등대,경상북도 울진군 후포면 등기산길 29,129.4622572,36.68078876,http://tong.visitkorea.or.kr/cms/resource/27/576727_image2_1.jpg,"동해의 푸른바다와 산야를 끼고 아름다운 해변의 풍광을 자랑하는 후포항은 울진군의 가장 남쪽에 자리한 항구로서 동해안 항로중간에 위치하여 동해중부해역에서 조업하는 선박의 어업전진기지이다. 후포항 끝자락에서 북동쪽 해안선을 따라가면 해발 64m의 풍광이 아름다운 
 등기산 꼭대기에 올라 등대로 들어서는 입구에 “포항지방해양수산청 후포항로표지관리소”라 씌어진 입간판이 눈에 들어오는데 이곳이 바로 후포등대이다. 등대가 위치한 등기산은 옛날부터 부근을 지나는 선박의 지표역할을 하기 위하여 주간에는 흰 깃발을 꽂아 위치를 알리고 야간에는 봉화 불을 피웠다고 하여 붙여진 이름이다. 후포등대는 1968년 1월 최초점등을 하였으며, 불빛은 35km에 이르러 후포앞바다를 운항하는 선박들의 길잡이 역할을 할 뿐 아니라 후포항과 동해바다를 관망하는 전망대 역할도 한다. 후포항 방파제는 동해에서 이름 난 낚시터로써 사철 낚시꾼들이 몰려 들어 감생어, 흑도미, 학꽁치 등을 잡을 수 있으며, 후포등대 정상에는 어린이 놀이시설과 점 전망대가 있어서 관광객들이 쉬어가기에 좋은 곳이다.* 최초점등일 - 1968년 1월 24일* 구조 - 백8각형콘크리트조(11m)* 등질 - 섬백광 10초 1섬광(FlW 10s)* 특징 - 옛날부터 깃발과 봉화로 선박의 지표역할을 하던 등기산(燈基山)에 등대가 위치하며 울릉도와 제일 가까운 등대로서 연안표지역할을 한다.",울진군
44,후포근린공원,경상북도 울진군 등기산길 40,129.4621738,36.6817692,http://tong.visitkorea.or.kr/cms/resource/93/2912293_image2_1.jpg,후포근린공원은 경상북도 울진군 후포면 후포리에 있다. 매년 1월 1일에 해맞이 행사가 열리는 곳이다. 계단을 올라 망사정이란 명칭을 지닌 정자에 닿으면 울진 앞바다의 수려한 풍광이 눈 앞에 펼쳐진다. 등기산 보행교를 건너 스카이워크에 닿으면 발아래 아찔한 바다의 풍경도 감상할 수 있다. 주변에 후포리 벽화마을과 후포 해변이 있어 연계 여행에 나서기 수월하다.,울진군
45,후포해수욕장,경상북도 울진군 후포면 삼율리,129.4420092,36.67504457,http://tong.visitkorea.or.kr/cms/resource/24/187424_image2_1.jpg,"경상북도 울진군 후포면 삼률리(三栗里)에 있는 후포해수욕장의 백사장 길이는 250m이다. 1992년 해수욕장으로 지정되었으며, 후포면에서 가장 남쪽에 있는 해수욕장으로, 영덕군과 울진군의 경계지점에서 북쪽으로 1.5㎞ 정도 떨어져 있다. 후포항 바로 아래쪽에 있으며, 깨끗하고 고운 모래톱이 특히 인상적인 해수욕장이다. 넓은 백사장과 동해의 쪽빛 물결이 어우러져 빚어내는 환상적인 풍광으로 인해 성수기인 여름철에는 해수욕을 즐기는 사람들로 북새통을 이룬다. 반대로 겨울에는 사람들의 발길이 거의 닿지 않아, 한적하고 쓸쓸한 겨울 바다를 찾는 이들에게 안성맞춤인 곳이다.해수욕 외에 위쪽의 후포항도 볼 만하다. 후포항은 꽁치·오징어·붉은대게 등 동해에서 나는 모든 어족의 집산지이다. 이른 아침에는  고깃배에서 부리는 각종 어패류와 어시장 풍경을 구경할 수 있고, 싼 값에 싱싱한 회를 맛볼 수 있다. 해수욕장 북쪽 야트막한 언덕에는 후포등대가 우뚝 서 있는데, 이곳에서는 끝없이 펼쳐진 동해와 울진 일원의 경치를 한눈에 볼 수 있다. 항구와 등대를  한꺼번에 볼 수 있는 몇 안 되는 해수욕장 가운데서도 풍광이 손꼽히는 해수욕장으로 알려져 있다.",울진군
