,title,addr1,mapx,mapy,firstimage,overview,addr2
21,왕피천 (경북 동해안 국가지질공원),경상북도 울진군 근남면 구산리,129.3825645,36.94955097,http://tong.visitkorea.or.kr/cms/resource/30/2614530_image2_1.bmp,"사람의 접근이 어려운 왕피천 일대는 원시 자연환경을 그대로 간직하고 있어 멸종 위기종과 희귀 야생동물이 서식하고 있는 뛰어난 생태관광 명소이다. 이러한 왕피천의 우수한 자연생태계와 동물들의 서식지 보전을 위해 왕피천 일대는 국내 최대 규모의 생태경관보전지역(총 면적 103km2)으로 지정되었다. 이 일대는 지하 깊은 곳에서 강한 압력으로 만들어진 화강편마암으로 이루어져 있다. 동해로 흘러나가는 왕피천은 화강편마암으로 된 강바닥을 활발하게 깎아 깊은 계곡을 만들었으며, 북동 방향으로 흐르는 강을 가로질러 많이 발달한 갈라진 틈(절리)은 하천의 모양을 구불구불하게 만들었다. 또한 이곳에서는 물이 흐르는 길의 방향이 변하면서 이전에 물이 흐르던 곳이 흔적으로 남아 있는 구하도를 잘 볼 수 있다. 구하도는 지형의 변화와 주변의 자연환경을 유추할 수 있는 정보를 가지고 있다. 또한, 왕피천에서는 암석의 갈라진 틈을 따라 암석 조각들이 떨어져 나가면서 만들어진 학소대와 거북바위, 왕피천 계곡의 물살을 따라 움직이는 자갈이 주변 암석을 접시 모양으로 깎아 만든 용소와 용머리 바위 등의 지질명소도 찾아볼 수 있다.
* 화강편마암: 화강암이 열과 압력을 받아 만들어진 암석",울진군
22,왕피천 관광농원,경상북도 울진군 근남면 왕피천로 534-1,129.3464378,36.92862488,http://tong.visitkorea.or.kr/cms/resource/25/1979225_image2_1.jpg,"왕피천계곡 절경지에 자리 잡고 있다. 농원부지가 계곡에 접해있어 자연낚시터 및 하천 수영장이 자연스럽게 이뤄져 더욱 각광을 받는다.농원반경 0.5km 이내에 3층석탑, 청암정, 학바위, 이심못, 자라못, 호천수 등 왕피천의 명소가 곳곳으로  이어지고 있고 2km 이내에도 오뉘바위, 용소가 있어 주민들은 불영 계곡보다 더 절경이라고 이야기하며 등산코스(임도)가 개발되어 있다.",울진군
23,왕피천계곡,경상북도 울진군 금강송면 왕피길,129.2829161,36.91326985,http://tong.visitkorea.or.kr/cms/resource/88/1331188_image2_1.jpg,"왕피천은 주변에 높은 산과 절벽으로 둘러싸여 접근이 어려우므로 오랜 세월 때 묻지 않은 자연경관을 간직하고 있으며, 각종 희귀야생동식물들이 서식하고 있어 환경청으로부터 생태환경보전지역으로 지정되어 보호되고 있다. 보호구역 안에서는 야영, 취사 등의 행위가 금지되어 있으며, 때묻지 않은 야생 그대로의 지역으로 울진의 일부 구간을 제외하면 대부분이 오지로 남아있다.",울진군
24,운암서원(울진),경상북도 울진군 기성면 기성로 77,129.4648132,36.74971984,http://tong.visitkorea.or.kr/cms/resource/51/187351_image2_1.jpg,"이 서원은 조선 순조(純朝) 26년 1826) 온정면 반암동에 창건하여 백암(白岩) 김제(金濟), 물제(勿薺) 손순효(孫舜孝) 양현(兩賢)을 봉향하다가, 순조 33년(1833) 향토인들의 주도로 온정면 노은동에 이건하였다. 그 후 고종5년(1868)에 서원이 철원되어,고종 15년(1878) 본원 유생들의 주창으로 현 구산리에 이건하고 백계 김희(金喜) 선생을 추배하여 배향하고 있다. 향사는 매년 음력 2월 중정일에 행한다.서원내 소재한 해단은 백암 김제선생 치제단으로 조선 정조 13년(1789) 평해 유림에서 제단을 설치하여 선생의 불사이군의 정신을 기리며 매년 음력 9월 24일 지체하고 있다.* 김제 선생의 호는 백암, 시호는 충개이며 선산인이다. 고려말 평해군수 재직시 고려의 망국을 통분히 생각하고 시 한수를 써서 벽에  걸어둔 채 동해로 행방을 감춘  고려의 충신이며, 두문동칠십이현 중의 한 분이다.* 손순효 선생의 호는 물제, 시호는 문정공이다. 조선 세조 3년 (1475) 문과중시에 급제,성종때 전한 겸 집의, 형조참의를 거쳐 상호군, 도승지 등을 지냈다. 선생은 성리학의대가였으며 문장이 뛰어나고 화죽에 능하였다.* 김희(金喜) 선생의 호는 백계이다. 임진왜란에 비안현 의병장으로 출정하여 상주 단밑전투에서 순절하니 호조정랑에 증직 받았다.",울진군
25,울진 봉평리 신라비,경상북도 울진군 죽변면,129.4093009,37.04392125,http://tong.visitkorea.or.kr/cms/resource/53/202053_image2_1.jpg,"울진 봉평신라비(蔚珍 鳳坪新羅碑)는 1988년 마을 주민이 밭갈이를 하다가 발견되었으며 오랜 세월동안 땅속에 묻혀 있었던 까닭으로 비문(碑文)의 일부가 마멸되어 정확한 판독이 어려우나 신라 법흥왕 11년(524)에 건립된 것으로 추정된다. 1988년 11월4일 국보 제242호로 지정되었으며 크기는 길이가 204㎝, 글자가 새겨진 부분의 위폭 32㎝, 아래폭 54.5㎝이다. 비는 자연돌을 다듬지 않고 그대로 사용하였으며, 전체적인 모양은 사다리꼴에 가깝다. 비문은 한쪽면에만 새겨져 있는데, 글자수는 400자 정도이다. 글씨는 중국 남북조시대에 북조의 영향을 받은 해서체이나, 예서체의 모습도 보인다. 내용은 전형적인 한문이 아니라 신라식의 독특한 한문체를 사용하여 파악이 어렵지만 전체적인 윤곽은 짐작할 만하다. 기본 줄거리는 울진 지방이 신라의 영토로 들어감에 따라 주민들의 항쟁이 일어나자, 신라에서는 육부회의를 열고 대인을 보내어 벌을 주고, 다시 대항하지 않도록 하기 위해 비를 세웠다는 내용이다. 신라가 동북 방면으로 진출하면서 건립한 비로, 법흥왕 11년(524)에 세워진 것으로 추정되며 신라 사회 전반에 걸치는 여러 면들을 새롭게 검토해 볼 수 있는 중요한 역사적 자료이다. 또한 법흥왕 때의 율령반포와 육부제의 실시, 왕권의 실태 등을 파악할 수 있는 실마리를 제공하고 있다.",울진군
26,울진 왕피천 공원,경상북도 울진군 울진읍 울진중앙로 121,129.4004255,36.99313522,http://tong.visitkorea.or.kr/cms/resource/78/202178_image2_1.jpg,"울진 왕피천 공원은 자연생태계의 보고인 왕피천을 끼고, 관동팔경의 하나인 망양정이 굽어보는 동해 바다가 이웃하는, 강과 바다가 만든 대진의에 한국 자연을 축소하여 옮겨놓은 듯한 아름다운 공원으로서, 계절 따라 특색있는 꽃들이 가득하다. 도시민과 군민의 휴식공간은 물론, 우리나라 친환경 농업의 중심지! 말 그대로 청정낙원 엑스포 공원이다. 또 공원 안에는 유전자 보호림으로 지정된 200년 이상의 소나무 1,000그루가 자생하고 있는 우리나라에서 보기드문 생태공원으로서, 사람들의 아름다운 손길이 보태져 자연을 찾아가는 현대인의 휴식처로서도 그 역할에 더함이 없는 공원이다.",울진군
27,울진 평해황씨 해월종택,경상북도 울진군 기성면 해월헌길 70,129.4399741,36.82999631,http://tong.visitkorea.or.kr/cms/resource/31/576631_image2_1.jpg,"이곳은 정침 1동, 사당 1동, 정자 1동 등 모두 3동의 건물이 ‘울진 평해황씨 해월종택(蔚珍 平海黃氏 海月宗宅)’이라는 명칭으로 문화재 지정되어 있다. 해월종택의 건물배치는 뒤편의 야산을 등지고 정침, 정자,   사당, 방앗간 등이 남향으로 배치되어 있다. 배치구성은 1993년 복원된 대문간채를 들어서면 넓은 마당을 사이에 두고 정침과 정자가 나란히 배치되어 있으며, 그 뒤에는 사당이 자리 잡고 있다. 이 지역의 상류주택 특성을 잘 보여준다. 안채(정침)은 정면 7칸 × 측면 6.5칸 규모의 □자형 건물로 홑처마 맞배기와집이며, 전면 양측으로 1칸씩 돌출되어 양날개집의 형상을 하고 있다. 안채의 동쪽에 사랑채가 붙어있는데, 홑처마 팔작지붕이다. 중문을 들어서면 안마당 뒤로 3칸 규모의 대청을 두었다. 대청 좌우에는 안방과 상방을 두었으며, 안방과 상방의 전면에는 익사가 연접되어 있다. 
정자(海月軒)는 황여일의 별구(別構)로 규모는 정면 4칸 × 측면 1.5칸의 홑처마 팔작기와집으로 전면에는 루마루처럼 꾸민 툇마루를 두고 난간을 돌렸다. 평면은 가운데 2칸 대청을 중심으로 양 측칸에 온돌방을 둔 중당협실형이다. 이 정자는 원래 1588년(조선 선조 21) 기성면 사동리 마악산 기슭에 건립되어 있었으나, 1847년(조선 헌종 13) 후손들이 현 종택 내로 이축하였다. 사당은 정자 뒤편에 있으며, 정면 3칸 × 측면 1.5칸으로 홑처마 맞배기와집이며, 해월 황여일의 신위를 모시고 있어서 '불천묘'로 불리고 있다.  
황여일(黃汝一 ; 1556～1622)의 자는 회원(會元), 호는 해월(海月) 또는 해월헌(海月軒), 본관은 평해이다. 어려서부터 문장으로 이름났고, 1576년(조선 선조 9) 사마시를 거쳐 1585년 별시문과에 을과(乙科)로 급제한 후, 1592년(조선 선조 25) 임진왜란이 일어나자 도원수 권율의 종사관으로 공을 세우고 1594년 형조정랑을 거쳤으며, 1598년 명나라에 서장관으로 갔다 왔고, 광해군 때 동래부사, 공조참의를 지냈으며, 사후 가선대부 이조참판에 증직되었다.   그동안 '해월헌(海月軒)'이라는 명칭으로 지정되어 오다가 2012년 6월 14일 '울진 평해황씨 해월종택(蔚珍 平海黃氏 海月宗宅)'으로 변경되었다.
(출처: 문화재청)",울진군
28,울진 해안도로,경상북도 울진군 근남면 망양정로 971,129.4143834,36.9642388,http://tong.visitkorea.or.kr/cms/resource/65/2393665_image2_1.jpg,"울진 해안도로는 근남면 망양정에서 매화면 덕신리까지 연결되는 길이 약 17~18km 정도의 왕복 2차선 도로로 아름다운 동해바다와 빛나는 일출을 보며 달릴 수 있는 최적의 드라이브 코스이다.차를 타고 해안도로를 달리면 아름다운 풍경을 자랑하는 망양정과 망양해수욕장, 촛대바위, 거북바위, 각양각색의 기암괴석을 볼 수 있고, 해안선을 따라 갯바위와 산책로도 마련되어 있어 낚시를 즐길 수도 있다. 특히, 이곳에서 바라보는 해안 절경과 일출이 아름다워 많은 관광객이 아름다운 자연의 풍경을 감상하기 위해 이곳을 찾고 있다.",울진군
29,울진 후포항,경상북도 울진군 후포면 등기산길 29,129.4572633,36.67873612,http://tong.visitkorea.or.kr/cms/resource/30/183330_image2_1.jpg,"경북 울진의 산세는 경상도의 여느 곳과 달리 우람하고 육중하다. 골이 깊어 이제는 찾아보기 어려운 심심산골 오지마을도 간간이 남아있다. 한 때 강원도 땅이었다는 것이 자랑인지 한탄인지는 몰라도 그 만큼 심산유곡에 빼어난 아름다움을 갖추고 있다는 말로 비유되기도 한다. 동해바다 푸른 절경을 끼고 7번 국도를 따라 올라오다 보면 영덕 고래불, 백석해수욕장을 지나 울진으로 들어선다. 울진군의 가장 남쪽에 자리한 항구는 후포항이고, 그 바로 아래에는 고운 백사가 깔린 후포해수욕장이 있다. 여름철에는 동해안 다른 해변들처럼 들끓는 해수욕 인파로 북새통을 이루기도 하지만,  손꼽히는 해수욕장이고 겨울은 겨울대로 너무나 한적하고 쓸쓸해 서럽기까지 할 만큼 해변을 거니는 맛이 각별하다는 곳이다.  이처럼 동해안의 둘째 가라면 서러워할 정도로 아름다운 해변 풍광을 자랑한다. 

후포 백사장을 걷다가 갈매기떼가 몰려드는 곳을 향해 눈을 돌리면 그건 틀림없이 후포항으로 입항하는 어선의 기우뚱거리는 모습이고, 배가 닿는 곳이 후포항이다.  생선냄새, 사람냄새가 나서 더욱 정감이 간다는 후포항은 동해바다 어족들이 없는것 없이 나고, 여름 성수기와 명절때는 울릉도행 여객선이 1일 1~2회 뜨기도 한다. 눈에 보이지는 않지만 멀리 수평선 너머 울릉도 뱃길도 가늠해 본다. 또 후포해수욕장에서 북쪽으로 바라다보이는 야트막한 언덕에는 후포등대가 서있다. 후포항 뒷편의 일명 등기산(해발 64m) 작은 언덕위에 세워진 후포등대는 울진바다를 운항하는 배들의 길잡이 역할 뿐 아니라 차를 타고 가더라도 멀리서 후포등대가 보이면 후포에 다왔구나 하는 인식이 들만큼 그 모습이 인상적이다.
                                      
또 후포등대는 후포항과 동해바다를 관망하는 전망대 역할도 한다.  후포항 부두끝자락에서 동북쪽으로 난 해안길을 조금 따라가다가 ""포항지방해양수산청 후포항로표지관리소(500m)""라는 이정표가 있는 왼쪽 콘크리트길로 들어서면 별로 어렵지 않게 오른다.  정상에는 어린이놀이시설과 휴게매점이 있고, 등대관리소 담벽을 돌아 남쪽언덕에 서면 후포, 울진일원의 경치를 한눈에 조망할 수 있다. 한쪽은 오로지 파란 바닷물 너머 아득히 수평선만 보이고, 좌우로 들쭉날쭉 이어진 울진 바다의 해안절경이 발아래 후포항 전경과 여객선 터미널, 그리고 후포해수욕장과 멀리 영덕강구 해안까지 이어지며 눈길을 이끌어간다.
 그와 반대로 뒤를 돌아보면 백두대간의 낙동정맥 굵은 산줄기가 장벽처럼 막아서는데, 특히 한겨울 하얗게 눈덮인 울진 백암산 (1,004m) 의 웅장한 모습과 대조적으로 파란 바다풍경이 어우러진 모습은 다른 곳에서는 좀체로 찾아보기 어려운 풍광이라고 자랑할 만하다.

이른아침 때를 잘 맞추면 후포항 부둣가에서 고깃배에서 부려지는 각종 어패류와 어시장 풍경을 구경할 수도 있고 싱싱한 횟감이나 어패류를 저렴하게 구입할 수도 있다.  즐비하게 늘어서 후포항 횟집촌도 동해안에 손꼽는 규모를 자랑한다. 주변 볼거리로 최남단 관동팔경인 평해 월송정과 구산해변, 북쪽의 기성 망양바닷가, 그리고 동해안 제일을 자랑하는 백암온천 등이 이어져 해안드라이브와 함께 많은 볼거리와  추억거리를 담을 수 있다.",울진군
30,울진과학체험관,경상북도 울진군 울진읍 연지길 30,129.4088385,36.99646001,http://tong.visitkorea.or.kr/cms/resource/05/2754205_image2_1.jpg,"울진과학체험관은 울진 군민들의 휴식처인 연호정 호숫가에 있다. 이곳은 정기적으로 관내 미취학 아동 및 초·중·고등학생 중심의 과학 체험 교실을 개설한다. 이를 통해 과학 원리 이해와 창의력 계발, 과학 실험, 로봇 제작 등을 진행한다. 주요 체험 프로그램으로는 자이로포크, 가상현실 낚시게임, 유아용 놀이시설, 4D/VR 영상관, 미러룸, 에임즈룸, 증강현실피팅룸 등이 있다.",울진군
31,울진은어다리,경상북도 울진군 근남면 수산리,129.406531,36.97744825,http://tong.visitkorea.or.kr/cms/resource/98/2995798_image2_1.jpg,"2015년 건설된 길이 243m, 폭3m의 '울진 은어다리'는 동해 울진 앞 바다와 만나는 남대천 하구에 위치해 있다.
이곳은 우리나라 최대의 은어 서식지로 산란철이면 바다에서 강으로 회귀하는 반짝이는 은어떼를 볼 수 있는 곳으로 이 다리의 이름과 모양도 은어에서 따왔다.
다리 위에는 반짝이는 은어 두 마리 형상이 서로 마주보고 있는데 이 커다란 조형물 안으로 걸어 들어가도록 제작되었고 다리 가운데에 여유로운 공간이 있어 남대천 수생식물과 울진항의 풍경을 조망할 수 있다.
'은어다리'는 낮에는 햇볕을 받아 은빛으로 반짝이고, 밤에는 화려한 경관 조명으로 또 다른 장관을 연출하기에 산책과 울진지역 사진 명소로도 추천한다. 초입에는 공연을 할 수 있는 나무데크가 있고 인근 울진 왕피천공원과 울진 염전해변, 망양정이 있다.",울진군
32,울진향교,경상북도 울진군 울진읍 향교로 34-13,129.3986117,36.99440171,http://tong.visitkorea.or.kr/cms/resource/88/183288_image2_1.jpg,"1484년(성종 15)에 현유(賢儒)의 위패를 봉안, 배향하고 지방민의 교육과 교화를 위하여 월변동(月邊洞)에 창건되었다. 1697년(숙종 23) 고성리 성저동으로 이건하였다가, 1872년(고종 9)에 현재의 위치로 이건하였다. 1878년에 군수 최형직(崔炯稷)과 유림의 노력으로 대성전을 중수하였다. 1950년 6·25동란으로 대성전과 동재(東齋)를 제외한 명륜당·서재(西齋) 등 부속건물이 모두 소실되었으며, 1970년과 1976년에 담장과 주사(?舍)를 보수하고 1980년 명륜당을 중창하였다. 현존하는 건물로는 8칸의 대성전, 7칸의 명륜당, 5칸의 동재, 3칸의 주사, 2칸의 제기고(祭器庫), 내삼문(內三門) 등이 있다. 대성전에는 5성(五聖), 송조4현(宋朝四賢), 우리 나라 18현(十八賢)의 위패가 봉안되어 있다. 조선시대에는 국가로부터 토지와 전적·노비 등을 지급받아 교관 1명이 정원 30명의 교생을 가르쳤으나, 갑오개혁 이후 신학제 실시에 따라 교육적 기능은 없어지고 봄·가을에 석전(釋奠)을 봉행하며 초하루·보름에 분향을 하고 있다. 현재 이 향교의 대성전은 경상북도 문화재자료 제159호로 지정되어 있으며, 운영은 전교(典校) 1명과 장의(掌議) 수명이 담당하고 있다.",울진군
33,월송정,경상북도 울진군 평해읍 월송정로 517,129.4691102,36.74429832,http://tong.visitkorea.or.kr/cms/resource/22/2716522_image2_1.jpg,"사적지 관동팔경의 하나인 월송정은 고려시대에 창건되었고, 조선 중기 때 관찰사 박원종이 중건하였으나, 낡고 무너져서 유적만 남았던 곳을 1933년 향인 황만영 등이 다시 중건하였다.그 후 일제 말기 월송 주둔 해군이 적기 내습의 목표가 된다 하여 철거하였다.1964년 4월 재일교포로 구성된 금강회가 철근콘크리트 정자를 신축하였으나 옛 모습을 살필 길 없어 1979년에 헐어 버리고, 1980년에 고려시대의 양식을 본떠서 지금의 건물을 세웠다. 월송정은 신라의 영랑, 술랑, 남속, 안양이라는  네 화랑이 울창한 소나무 숲에서 달을 즐겼다 해서 월송정이라고도 하고,  월국에서 송묘를 가져다 심었다 하여 월송이라고도 한다. 정자 주변에는 해송이 숲을 이루고 있으며, 푸른 동해 바다를 바라보면 금방 가슴이 확트이는 기분을 느낄 수 있는 곳이다. 특히, 월송정의 소나무와 푸른 바다를 배경으로 솟아오르는 일출 광경은 널리 알려져서 관광객과 사진작가들이 많이 찾는 곳으로 인근에 있는 망양정과 함께 우리나라 동해안에서 몇 안 되는 일출 명소로 유명한 곳이다.",울진군
34,응봉산(울진),경상북도 울진군 북면 덕구리,129.2536362,37.069032,http://tong.visitkorea.or.kr/cms/resource/70/1434070_image2_1.jpg,"백두대간 낙동정맥으로 동해를 굽어보며 우뚝 솟아 있어 산세가 험준하고 변화스럽다. 전설에 의하면 옛날조씨(趙氏)가 매사냥을 하다가 매를 잃어버렸는데 산봉우리에서 매를 쫓아 이곳을 응봉(鷹峯)이라 부르고 그래서 속칭 매봉산이라 부른다. 높이는 999.7 이며, 산맥이 남서쪽 통고산으로 흐르고, 동쪽 기슭에는 덕구계곡이 있고 그 너머 남동쪽에는 구수곡계곡이 있어 맑은 물이 항상 흐르고 있다. 특히 덕구 및 구수곡계곡의 상단부에는 울진금강송 천연림이 있으며 동남쪽 계곡절벽 등에는 천년기념물인 산양이 서식한다. 서북쪽은 강원도 삼척시 원덕읍 가곡리에 면해 있다. 응봉산 정상에서 동해바다가 보이며 등산로가 있어 등산을 즐길 수 있고 주변 관광지로 덕구계곡, 덕구온천, 구수곡자연휴양림이 있으며 가까운 거리에 죽변항구가 있어 산림욕, 온천욕, 해수욕을 고루 즐길 수 있는 천혜의 웰빙 관광지이다.",울진군
35,죽변 등대,경상북도 울진군 죽변면 등대길 52,129.4290487,37.05812279,http://tong.visitkorea.or.kr/cms/resource/02/656602_image2_1.jpg,"호미곶을 제외하고 동해안에서 바다로 가장 많이 뻗어 있는 곳이 죽변곶이다. 파도소리와 울창한 대나무 숲으로 둘러싸인 이 곳에 죽변 등대가 우뚝 솟아있다. 죽변은 대나무가 많이 자생한다고 붙여진 지명이다. 특히 이 곳에 자생하는 소죽(小竹)은 화살을 만드는 재료로 사용되어 조선시대에는 국가에서 보호하였다고 전한다. 이 등대는 1910년 11월 24일 건립되었으며, 구내에는 1911년 일본국 수로부에서 설치한 수로측량 원표가 남아있다. 죽변은 우리나라 동해안 항로의 중간 지점에 위치하고, 울릉도와는 직선거리상 가장 가까운 곳이다.
등탑의 높이는 16m로 백색의 8각형 콘크리트구조로 되어 있으며, 불빛은 20초에 한번 반짝이며 약 37㎞까지 불빛이 전달된다. 등탑은 2005년 9월 경상북도 지방기념물 제154호로 지정되어있다. 현재 등탑 내부 천정에는 태극문양이 새겨져 있는데, 원래는 대한제국 황실의 상징인 오얏꽃 문양이 새겨져 있었다고 전한다. 등대 주변풍광 또한 아름다워 2004년 이곳을 배경으로 SBS 드라마 ‘폭풍 속으로'를 촬영하였다.
* 최초점등일 - 1910년 11월 24일
* 구조 - 백8각콘크리트(16m)
* 등질 - 섬백광 20초 1섬광(FlW 20s)
* 특징 - 죽변만은 국토의 중간지점으로 용의 꼬리 형상의 용추곶에 등대가 위치하여 연안표지을 역할을 하고 있다.",울진군
36,죽변항,경상북도 울진군 죽변면,129.422977,37.05811989,http://tong.visitkorea.or.kr/cms/resource/09/2393709_image2_1.jpg,"죽변항은 울진 북단에 있는 어항으로 높이가 15.6m인 울진 등대가 서 있는 곳으로도 이름난 동해안에 손꼽는 어업전진기지이다. 다양한 어획량 만큼이나 어항 주변에는 크고 작은 수산물 가공 공장들이 줄지어  있어,어항의 규모를 대변해주고 있다. 오징어와 고등어, 꽁치, 대게 등이 특히 많이 잡히고 특산물로 미역이 유명하다. 죽변항은 주변에 거느린 명소들도 많다. 덕천리 백사장으로부터 후정리와 죽변등대 남쪽의 봉평리, 그리고 온양리까지 이어지는 드넓은 백사장은 통틀어 봉평 해수욕장으로 부르기도 하는데,  그 길이가 무려 10km에 이른다. 동해의 파란 물과 깨끗한 모래는 해수욕장으로 더할 나위 없다. 죽변항 부근으로 이어지는 드라이브 코스로는 죽변에서 온양리에 이르는 4.4km 구간이 중간에 봉평 신라비도와 봉평휴게소 등이 있어 잠시 차를 세우고 동해를 감상할 수도 있어 좋다.SBS 드라마 ""폭풍 속으로""의 촬영지로 알려진 죽변항에는 드라마 당시의 세트장이 그대로 남아있어 또 하나의 볼거리가 되고 있다.",울진군
37,죽변해안스카이레일,경상북도 울진군 죽변면 죽변중앙로 235-8,129.4280989,37.05577859,http://tong.visitkorea.or.kr/cms/resource/83/2736183_image2_1.jpg,"죽변해안스카이레일은 죽변 승하차장과 봉수항을 오가는 2.8km의 코스로 이루어져 있으며, 자동으로 움직이는 모노레일로 여유롭게 멋진 자연경관을 관람할 수 있다.
또한 푸른 산과 마음이 뻥 뚫리는 동해 바다를 한눈에 볼 수 있어 마음의 평온을 찾을 수 있다. 사계절 색다른 풍경과 절경이 펼쳐지는 죽변해안스카이레일에서 잊지 못할 추억과 낭만을 만들어보자.",울진군
