,title,addr1,mapx,mapy,firstimage,overview,addr2
46,양양 탁장사마을,강원특별자치도 양양군 현북면 어성전길 256,128.6657929,37.94019236,http://tong.visitkorea.or.kr/cms/resource/15/2494915_image2_1.jpg,"탁장사마을은 오염되지 않은 청정계곡인 어성전계곡에 위치한 마을이다. 탁장사마을은 어성전의 빼어난 자연환경과 이 고장의 민속놀이인 탁장사놀이를 접목시켜 만들어진 전통테마마을이다. 계곡의 맑은 물, 천연림이 조화를 이루고 있고 마을을 휘돌아 감는 어성전천은 아름다운 자연의 극치를 이루고 여기에서 서식하는 어류는 물반 고기반으로 은어, 연어, 메기 등 풍부한 어족자원은 수많은 강태공들을 유혹하고 있는 자연의 보고라 할 수 있으며 물고기의 노는 모습이 아름다워 내천유어(奈川遊漁)라 하였다고 전해지고 있다.",양양군
47,양양동해신묘지,강원특별자치도 양양군 동해신묘길 34,128.6376846,38.10967768,http://tong.visitkorea.or.kr/cms/resource/86/738186_image2_1.jpg,동해신묘는 동해의 용왕신에게 나라의 태평성대와 풍농.풍어를 기원하기 위해 제사를 지냈던 유서깊은 유적지이다. 신라때부터 동해용 왕신에게 제사를 지낸 제단으로 고려 공민왕 19년(1370) 강릉 안인포에 설치되었다가 성종21년(1490) 현재의 위치로 옮겨졌으며 조선초기에 중사(中祀:국가적제사로 대.중소 사의 규모 중 중간)로 제정되었다. 동해신묘는 서해의 풍천.남해의 나주지방과 함께 바다신에게 매년 2월과 8월에 안녕과 풍년을 기원했던 곳이며 나라에서는 제사에 사용할 향과 축문을 내려 보냈다. 이 곳 동해신묘는 조선경종2년(1722)과 영조28년(1752)에 양양부사 채팽윤과 이성억에 의해 건물이 다시 지어졌고 정조24년(1800) 어사 권준과 강원도 관찰사 남공철의 요청으로 재차 중수되었다. 그러나 순종2년(1908)일제의 문화말살정책으로 인해 비석이 잘리고 건물이 철폐되었다가 1993년부터 양양군에 의해 복원사업이 추진되었다. 현재 동해신묘 옛터에는 남공철에 의해 1800년에 세워진 동해신묘중수 기사비가 남아있다.,양양군
48,양양선림원지,강원특별자치도 양양군 서면 서림리,128.5160424,37.94477782,http://tong.visitkorea.or.kr/cms/resource/81/2739181_image2_1.jpg,"강원도 양양군 서면 미천골 자연휴양림 초입에 자리한 선림원지는 통일신라 시대의 절터다. 선림원은 해인사를 창건했던 순응법사가 지은 절로, 절터에서 연대가 804년으로 적힌 범종이 나오면서 창건연대를 알 수 있게 됐다. 9세기 말, 홍각선사가 중창하며 선종의 대표적인 절집이 됐다. 전성기에는 공양을 할 때 쌀 씻은 물이 계곡을 하얗게 할 정도로 수도승이 많았고, 이로 인해 계곡 이름도 ‘미천(米川)골’이 되었다 한다. 10세기를 전후한 시기에 큰 홍수로 산사태가 나며 매몰된 것으로 추정된다. 오늘날 절터에는 정면 3칸, 측면 4칸 금당 건물의 주춧돌이 남아 있어 예전 모습을 추측할 수 있다. 양양 선림원지 삼층석탑(보물)을 비롯하여 양양 선림원지 석등(보물), 양양 선림원지 홍각선사탑비(보물), 양양 선림원지 승탑(보물) 등 몇몇 문화재도 남아 있다. 양양 선림원지 삼층석탑은 2단 기단 위에 3층의 탑신을 올린 전형적인 신라 석탑이다. 양양 선림원지 승탑은 일제강점기에 파손되었던 것을 현재의 자리에 복원한 것으로 기단부만이 남아 있다.",양양군
49,양양송이조각공원,강원특별자치도 양양군 양양읍 송암리,128.635055,38.08673308,http://tong.visitkorea.or.kr/cms/resource/90/2915990_image2_1.JPG,"남대천 수변에 조성된 어린이놀이공원이다. 바로 아래에 연어생태공원이 있어 함께 둘러보기 좋다. 우선 강변에 넓게 잔디밭이 조성되어 있고, 잔디밭 옆에 초등학생들이 즐길 수 있는 십여 가지의 놀이시설이 갖춰져 있다. 공원에 들어서면 가장 먼저 송이조각공원의 자음과 모음을 일렬로 나열하고 무지개색으로 칠해놓은 조형물이 눈에 띄는데 포토존으로 인기다. 놀이시설들은 미끄럼틀, 시소, 작은 집라인, 그물타기, 나무 징검다리 건너기 등이 있는데, 전부 나무와 흙, 모래를 가지고 놀 수 있게 되어 있어 자연 친화적이다.",양양군
50,양양하조대스카이워크,강원특별자치도 양양군 현북면 하륜길 54,128.7283735,38.02186743,http://tong.visitkorea.or.kr/cms/resource/36/2773936_image2_1.jpg,"양양 하조대 스카이워크는 하조대해변을 배경으로 인생샷을 남길 수 있는 사진 명소다. 투명한 유리 바닥 아래로는 깎아지른 듯 웅장한 절벽과 짙푸른 바다가 훤히 내려다보여 아찔함을 선사한다. 하지만 길이가 짧은 편이라 남녀노소 누구든 부담 없이 오를 만하다. 스카이워크는 하조대해변을 따라 조성된 해안 산책로와 연결된다. 동해의 투명한 물빛과 우거진 소나무숲을 함께 즐길 수 있는 산책코스다. 둘레길을 따라 느긋하게 걷다 보면 양양을 대표하는 명승지인 하조대를 만날 수 있다. 옥빛 바다와 기암절벽, 그 위에 우뚝 솟은 노송이  한 폭의 동양화처럼 어우러진다. 특히 정자에 올라 바라보는 풍광이 눈과 마음을 사로잡을 만하다. 하조대에서 울창한 소나무가 줄지어 있는 구름다리를 건너면 동심을 자극하는 하얀 등대가 운치를 더한다.",양양군
51,양양향교,강원특별자치도 양양군 양양읍 거마천로 52-20,128.6060967,38.07861401,http://tong.visitkorea.or.kr/cms/resource/19/738219_image2_1.jpg,"고려 충혜왕때 현유(賢儒)의 위패를 봉안, 배향하고 지방민의 교육과 교화를 위하여 창건되었다. 당시 존무사(存撫使) 안축(安軸)이 양양부 구교리(舊校里)에 설립하였다 하며, 조선시대에 와서 여러 차례의 중수를 거쳐 1682년(숙종 8)에 부사 최상익(崔商翼)이 현재의 위치로 이건하였다. 6·25사변 때 소실되었다가 1952년부터 대성전·명륜당·동재(東齋)·서재(西齋) 등이 신축되어 지금에 이르고 있다. 1954년에는 향교재단으로 명륜중학교를 설립, 양양군의 중등교육에 힘썼다. 이 학교는 1970년 기술학교로 개편되었다가 1975년 폐교되었다. 현존하는 건물로는 대성전·명륜당·동재·서재 등이 있으며, 대성전에는 5성(五聖)·10철(十哲)·송조6현(宋朝六賢)의 위폐가, 동무·서무에는 우리나라 18현(十八賢)의 위패가 봉안되어 있다.조선시대에는 국가로부터 토지와 전적·노비 등을 지급받아 교관이 정원 70명의 교생을 가르쳤으나, 갑오경장 이후 신학제 실시에 따라 교육적 기능은 없어지고 봄·가을에 석전(釋奠)을 봉행하며 초하루·보름에 분향을 하고 있다. 강원도 문화재자료 제105호로 지정되어 있으며, 전교(典校) 1명과 장의(掌議) 수명이 운영을 담당하고 있다. 칠서(七書)를 비롯하여 많은 전적과 국보급 서화(書?) 및 유물 등이 있었으나, 6·25사변 때 대부분 소실되고 현재는『거접록(居接錄)』 1책, 『청금록(靑襟錄)』1책,『학부수록(學府隨錄)』1책, 『양양기구록(襄陽耆舊錄)』1책 등이 있다.",양양군
52,어성전계곡,강원특별자치도 양양군 현북면 어성전길 93-98,128.6724948,37.94895536,http://tong.visitkorea.or.kr/cms/resource/80/565880_image2_1.jpg,"오대산국립공원에서 발원한 계곡물은 강릉시 부연동과 양양군 법수치리를 지난 다음 어성전리로 모인다. 이 물은 남대천의 상류로서 양양읍내를 거쳐 동해로 흘러든다. 아름다운 산, 아름다운 경치, 깨끗한 물을 구비한 어성전계곡은 한여름에도 발을 담그면 뼈 속까지 시릴 정도. 시내물과 계곡을 타고 오르면 양편으로 칡과 다래넝쿨이 한데 어우러진 자연을 만끽할 수 있다.",양양군
53,영혈사,강원특별자치도 양양군 양양읍 불당골길 346,128.5465151,38.10806499,http://tong.visitkorea.or.kr/cms/resource/87/2794587_image2_1.jpg,설악산 자락에 있는 불교사찰이다. 영혈사는 대한불교조계종인 신흥사의 말사로 2015년 강원도의 문화재자료 제166호로 지정되었다가 2019년에 강원도 유형문화재 제180호로 재지정 되었다. 689년에 불교계의 큰 승려였던 원효대사가 창건한 절이라고 알려져 있다. 지금도 영혈사 극락보전에 가면 그림으로나마 원효대사를 만날 수 있다.,양양군
54,오산해수욕장,강원특별자치도 양양군 손양면 선사유적로 708-21,128.6635634,38.09050542,http://tong.visitkorea.or.kr/cms/resource/40/2745240_image2_1.jpg,"강원도 양양군 손양면 오산리에 있는 해수욕장이다. 송전해수욕장이라고도 불린다. 고운 모래사장이 길이 900m, 너비 80m로 펼쳐져 있는데 양양 해수욕장 중 낙산해수욕장 다음으로 모래사장이 길다. 물도 깨끗해 바다에서 조개잡이도 가능하다. 수심은 1m 정도로 성인 물놀이에 알맞다. 해수욕장 개장은 매년 7월부터 8월 사이에 한다. 아직 잘 알려지지 않아 사람이 붐비는 휴가철에도 여유롭게 쉴 수 있다. 모래사장 뒤로는 소나무 숲이 울창하며 해수욕장 뒤로 양양오토캠핑장이 있다. 백사장에 텐트를 치고 야영을 해도 된다. 샤워장, 탈의장, 식수대, 공용화장실, 주자장 등 편의시설이 고루 갖추고 있어 야영하기 좋다. 사륜자동차를 타고 달리는 레저스포츠 체험장도 있다.",양양군
55,오색령(한계령),강원특별자치도 양양군 서면 대청봉길 1,128.4603975,38.12090905,http://tong.visitkorea.or.kr/cms/resource/79/2746879_image2_1.jpg,"강원도 양양군 서면과 인제군 북면·기린면 경계에 있는 1,004m 높이의 고개다. 내설악과 남설악의 경계에 있는 고개는 양양에서는 오색령, 인제에서는 한계령으로 불린다. 조선 후기 실학자 이중환은 <택리지>에서 강원도의 이름난 여섯 고개를 꼽았는데, 그중 오색령을 최고라 칭했다. 오색령은 예로부터 양양(영동)에서 인제(영서)로 생필품을 운반하던 고갯길이자 양양 사람들이 서울로 갈 때 넘어야 했던 험한 산길이었다. 오색령을 소재로 한 대중가요 <한계령>에 길을 오갔던 사람들의 애환이 녹아 있다. 1981년에 도로 확장 공사를 해 양양과 인제를 잇는 한계령 도로가 개통되었다. 오늘날 44번 국도 오색령 고갯길은 강원도 최고의 드라이브 코스이자 설악산의 수려한 경관을 감상할 수 있는 관광명소로 통한다. 설악산 최고봉인 대청봉까지 오르는 최단 코스 등산로가 시작되는 곳이며, 점봉산 정상으로 갈 수 있는 등산로도 이곳에서 시작된다.[주요시설&부대시설]한계령, 한계령 휴게소[체험 프로그램]등산",양양군
56,오색약수골전통장,강원특별자치도 양양군 서면 백암길 66-1,128.5063058,38.07980639,http://tong.visitkorea.or.kr/cms/resource/48/2494948_image2_1.jpg,"오색약수골전통장은 전통 된장, 청국장, 송이고추장을 만드는 곳으로서 가마솥에 장작불로 콩을 삶아 띄우는 청국장을 사철 견학할 수 있으며, 양양의 특산품인 양양송이를 넣은 송이고추장과 송이간장 선물세트의 구입이 가능하다.1~2시간 내외가 소요되는 백암폭포까지 산행이 가능하여 가족여행시 들러볼만한 곳이다.",양양군
57,오색약수터,강원특별자치도 양양군 서면 오색리,128.4455502,38.07722218,http://tong.visitkorea.or.kr/cms/resource/88/2365188_image2_1.jpg,"양양에서 서쪽으로 20km, 한계령에서 동남쪽으로 7.5km가면 개울가 암반 세 곳에서 철분과 탄산수의 성분을 가진 약수가 솟아 오르는 오색 약수터가 있다. 다량의 철분을 함유한 약수의 하루 분출량이 1,500리터에 달하며, 약수터까지의 경관과 설악산 정상에 이르는 길목이라는 위치 때문에 더욱 유명해진 약수터이다.",양양군
58,오색주전골,강원특별자치도 양양군 서면 약수길,128.4264575,38.07964653,http://tong.visitkorea.or.kr/cms/resource/91/2746891_image2_1.jpg,"설악산국립공원 내에 있는 계곡으로, 오색약수가 있는 강원도 양양군 오색리에서 오색령(한계령) 방면으로 가는 길에 자리한다. 오색 주전골은 설악산의 대표 단풍 코스이자 계곡과 기암괴석이 어우러진 절경으로 유명하다. 조선 시대 때 외지고 골이 깊은 이곳에서 승려로 위장한 도둑들이 위조 엽전을 만들어 ‘주전골’이라는 지명이 생겼다고 전해진다. ‘오색(五色)’은 주전골 암반이 다섯 가지 빛을 내고 옛 오색석사에 봄이면 다섯 가지 색의 꽃이 피는 나무가 있었다고 하여 생긴 이름이다. 3.2km의 탐방로는 계곡 양옆으로 기암이 우뚝 솟은 길로, 오색약수터탐방지원센터에서 성국사와 선녀탕을 거쳐 용소폭포탐방지원센터에 이른다. 편도 1시간 코스는 평탄한 나무 덱 구간이 많고 길이 험하지 않아 남녀노소 편하게 걸을 수 있다. 탐방로 초입에서 탄산과 철분이 들어가 톡 쏘는 맛이 나는 오색약수를 맛볼 수 있다. 걷는 내내 고래바위, 상투바위, 부부바위 등 각종 기암괴석이 나타나고, 선녀탕, 금강문, 용소폭포 등 남설악의 각종 명소가 가득하다.[주요시설&부대시설]
오색 주전골 자연관찰로, 오색약수 산채음식촌[체험 프로그램]등산, 트레킹[지정현황]양양8경(제4경)",양양군
59,오색허브농원,강원특별자치도 양양군 서면 송어길 38,128.5387198,38.07007203,http://tong.visitkorea.or.kr/cms/resource/54/2790754_image2_1.jpg,"세상의 모든 향기가 다 모여 있다고 자랑할 정도로 잘 가꾼 정원이 실내에도 실외에도 향기를 뽐내며 방문객들의 시선을 기다리고 있다. 향기의 여왕 라벤더, 젊음을 주는 로즈마리, 머리를 맑게 하는 캐모마일, 시원한 페퍼민트와 달콤한 사과향 번지는 세이지가 허브식물원과 야외식물원을 가득 채우고 있다. 오색허브농원에서는 실내외 식물원을 통해 허브의 생태를 관찰할 수 있을 뿐만 아니라 허브 기르기부터 공예, 음식, 차 만들기 등 허브를 활용한 체험도 즐길 수 있다. 또 허브제품을 구매할 수 있는 허브샵이 함께 있어 일상에서 아로마 테라피를 할 수 있는 허브 입욕제와 방향제, 화장품 등을 구입할 수 있다. 농원에서 운영하는 펜션형 민박과 야영장은 혼자만 누리고 싶은 아늑한 나만의 여행지로 제격이다. 농원 앞으로 흐르는 오색천은 농원에 머무는 민박객들의 훌륭한 물놀이장이 되어주고, 농장 한켠에 당나귀체험장이 있어 어린이들의 호기심을 자극한다. 다양한 놀이시설과 함께 바비큐장, 식당 등 부대시설이 완비되어 있어 가족 단위 여행객들이 편리하게 이용하기 좋다.",양양군
60,인구해수욕장,강원특별자치도 양양군 현남면 인구항길 12,128.7619443,37.97031295,http://tong.visitkorea.or.kr/cms/resource/08/2738608_image2_1.jpg,"강원도 양양군 현남면 인구리에 있는 해수욕장이다. 대나무가 울창한 섬, 죽도를 사이에 두고 북쪽이 죽도해수욕장이고, 남쪽이 인구해수욕장이다. 백사장이 넓고 조용한 편이다. 수심이 얕아 안전하게 해수욕을 즐길 수 있어 가족 단위 피서객이 많다. 얕은 수심 때문에 초보 서퍼들이 즐겨 찾는 서핑 명소가 됐다. 숙소와 서핑숍 등 서퍼를 위한 인프라가 잘 조성돼 있다. 모래사장에서 야영도 할 수 있어 서핑과 캠핑을 동시에 즐길 수 있다. 해변으로 스킨스쿠버 장소로도 각광받고 있다. 해안 도로가 생기면서 주변으로 카페와 맛집, 편의 시설들이 들어섰다. 인근에 죽도정 전망대와 인구항 등의 볼거리가 있고, 동산항에서는 바다낚시를 할 수 있다.[주요시설&부대시설]인구 해변[체험프로그램]서핑/수영",양양군
61,잔교리해수욕장,강원특별자치도 양양군 현북면 동해대로 1080,128.7430981,37.99253779,http://tong.visitkorea.or.kr/cms/resource/04/2745304_image2_1.jpg,"강원도 양양군 현북면 잔교리에 위치한 해수욕장이다. 7번 국도를 따라 38해수욕장과 북분리 해수욕장 사이에 자리하며 잔교해수욕장이라고도 한다. 동해안의 다른 해수욕장과는 달리 잘 알려지지 않아 매우 한적하게 바다를 즐길 수 있다. 샤워실과 탈의실, 화장실, 급수대, 매점, 파라솔 대여 등의 편의시설이 잘 갖춰져 있다. 매년 여름이면 해변축제가 열려 활기를 더한다. 조개 잡기 체험과 조개 보물 찾기, 해변 줄다리기, 바나나보트 시승 등 온 가족이 참여할 수 있는 행사들이 다채롭게 열린다. 해송 숲 사이에는 야영장이 있어 캠핑족을 반긴다. 해수욕장 양옆으로는 어린이 교통공원과 해난어업인 위령탑 공원 등이 있다. 주차장은 무료로 개방한다. 인근에 기사문항과 하조대 무인 등대 등의 볼거리가 있다.",양양군
62,전진항,강원특별자치도 양양군 강현면 낙산사로 54-26,128.632829,38.12387594,http://tong.visitkorea.or.kr/cms/resource/95/2495095_image2_1.jpg,"양양의 대표적인 해수욕장인 낙산해수욕장 인근에 위치한 전진항은 작은 어선들이 옹기종기 모여있는 작은 항구로 조용하고 작은 어촌의 분위기가 물씬 풍기는 곳이다. 어선들이 매일 드나들기 때문에 활어 난전이 열려 싱싱한 횟감을 싼값에 구할 수 있고 직접 배를 타고 가자미 낚시를 즐길 수도 있으며 방파제에서 낚시도 할 수 있어 낙산해수욕장을 찾아온 관광객들이 해수욕을 즐기며 함께 둘러보며 찾는 곳이다. 잘 알려진 유명한 항구인 대포항에 비해서는 규모가 작아 인적이 드물기 때문에 조용한 분위기에서 넓은 바다를 감상하며 싱싱한 횟감을 맛 볼 수 있다는 것이 최대 장점이다. 매년 새해마다 이 부근에서 해맞이 축제가 열려 많은 사람들이 일출을 감상하기 위해 찾는 명소이기도 하다. 가까운 주변관광지로는 낙산에서 양양, 한계령길로 가는길에 선녀탕, 망경대, 주전골 등의 계곡들을 감상하는 코스가 있다.",양양군
63,정암해수욕장,강원특별자치도 양양군 강현면 정암리 3,128.6082251,38.14165673,http://tong.visitkorea.or.kr/cms/resource/18/2745218_image2_1.jpg,"강원도 양양군 강현면 정암1리의 정암해수욕장은 7번 국도변에 자리한다. 해변을 따라 산책로와 자전거 전용도로가 조성돼 있다. 해변은 자갈이 간간이 섞인 부드러운 모래로 이뤄져 있으며, 물이 깨끗하고 경사도가 심하지 않아 가족단위 여행객이 주로 찾는다. 해변 바로 앞으로 바다가 바라다 보이는 전망 좋은 카페들이 있다. 모래사장 뒤로 소나무 숲이 우거져 있는데 솔밭 캠핑도 가능하다. 해수욕장은 매년 7월 15일부터 8월 22일까지 개장하며, 매년 8월 첫째 주 토요일에는 조개잡이 축제가 열린다. 여름 피서철에는 해변 한쪽으로 마을 부녀회에서 운영하는 향토 먹거리 식당과 농특산물 판매장이 들어선다. 부녀회 식당에서는 토종닭, 감자부침, 도토리묵 등을 맛볼 수 있다. 인근에 낙산사, 후진항, 물치항 등이 있다.[주요시설&부대시설]정암해변[체험프로그램]해변 산책. 물놀이",양양군
64,조규승가옥,강원특별자치도 양양군 현남면 개매길 215-5,128.7653421,37.94419938,http://tong.visitkorea.or.kr/cms/resource/81/2793381_image2_1.jpg,"백로와 왜가리의 집단 서식지인 포매리마을에 위치한 가옥이다. 조규승 가옥은 1985년에 강원도 문화재 제80호로 지정되었다. 담이 없고 집 주변으로 대나무와 소나무가 집을 감싸고 있어 오는 사람을 반기는 듯한 모습이다. 이 고택은 현 소유자의 10대조가 세운 집으로 300년 전쯤 건립한 것으로 추정되는데, 안채는 앞면 5칸에 옆면이 2칸이고, 지붕은 한자 여덟 팔자(八) 모양을 한 팔작지붕입니다. 조규승 가옥에는 현재 후손이 살고 있어 집안이 늘 공개되지는 않지만, 전체적으로 한옥의 형태를 둘러보고, 바로 앞 북카페에 들러 책 한 권과 커피 한 잔의 여유를 누려보는 것도 좋겠다.",양양군
65,죽도정&죽도 전망대,강원특별자치도 양양군 현남면 인구리 1-1,128.7635358,37.97167116,http://tong.visitkorea.or.kr/cms/resource/12/2746912_image2_1.jpg,"강원도 양양군 현남면에 위치한 둘레 1km, 높이 53m의 작은 섬, 죽도의 정상에 있는 정자다. 정자에서 바라보는 풍광이 아름다워 양양8경에 이름을 올렸다. 송죽(소나무와 대나무)과 해안가의 기암괴석, 에메랄드빛 동해가 어우러진 경치가 수려하고, 일출 명소로도 유명하다.
죽도정은 정면 3칸, 옆면 2칸의 정자로 1965년 현남면 부호들이 자발적으로 모금을 하고 행정 지원을 받아 지었다. 죽도정에서 100m 거리에 위치한 약 20m 높이의 죽도 전망대는 섬 풍광을 한눈에 둘러볼 수 있는 또 다른 명소다. 섬의 상징인 대나무가 연상되도록 전망대 골조에 대나무 공예의 격자무늬를 접목했다. 사시사철 송죽이 울창한 죽도는 옛날에는 섬이었으나 지금은 육지와 연결되어 있다. 섬 둘레를 따라 산책로가 조성되어 있어 해안 풍경을 조망하면서 삼림욕을 즐길 수 있다. 죽도정 북쪽에 죽도해수욕장, 남쪽에 인구해수욕장이 자리한다.",양양군
66,죽도해수욕장,강원특별자치도 양양군 현남면 인구중앙길,128.7595861,37.97235156,http://tong.visitkorea.or.kr/cms/resource/07/2738607_image2_1.jpg,"강원도 양양군 현남면 인구리에 있는 해수욕장이다. 인구해수욕장과 동산포해수욕장 사이에 위치한다. 대나무가 빼곡한 섬 ‘죽도’와 연결되어 있는데, 이 섬 이름을 따 죽도해수욕장이라 부른다. 해변에는 2km의 아름다운 모래사장이 길게 펼쳐져 있다. 모래사장 뒤로는 울창한 소나무 숲이 자리한다. 수심이 낮고 경사가 완만한 편이라 어린이가 있는 가족 단위 피서객에게 사랑받는다. 주변에 크고 작은 바위가 많아 바다낚시꾼들이 주로 찾는다. 바다에서 서핑도 가능한데, 주변에 서핑 강습과 장비 대여를 하는 서핑숍이 여럿이다. 걸어서 오를 수 있는 죽도봉 정상에 서면, 넘실대는 동해의 풍광이 파노라마로 펼쳐진다. 주변에 둘러볼 만한 관광지로는 지어진 지 200년 된 김택준 가옥과 죽도암, 인구항 등이 있다.[주요시설&부대시설]죽도해수욕장[체험프로그램]수영/서핑",양양군
67,중광정해수욕장,강원특별자치도 양양군 현북면 하조대해안길 119,128.7175466,38.02780819,http://tong.visitkorea.or.kr/cms/resource/62/2745262_image2_1.jpg,"강원도 양양군 현북면 중광정리에 있는 해수욕장이다. 하조대와 붙어 있는 해변이지만 60년간 군사보호구역으로 민간인 출입이 금지되었던 해변이다. 하조대와 동호해수욕장 사이 작고 한산한 해변이었으나 우리나라 최초의 서핑 전용 해변인 서피비치가 생기면서 달라졌다. 서핑 매니아들과 관광객의 방문이 해마다 늘고 있다. 오랫동안 인간의 출입이 없던 탓에 물이 유독 맑고 깨끗한 게 특징이다. 해수욕을 즐기다 보면 눈앞으로 휙휙 지나가는 물고기를 발견하곤 한다. 조개류도 잡을 수 있는데 한계선 근처에 특히 많다. 모래사장 북쪽 솔밭 습지와 생태습지는 군사시설로 출입이 불가능하다. 해수욕장인 여름 휴가철인 7~8월 사이에만 한시적으로 개방한다. 인근에 수산항, 하조대, 하조대 전망대 등이 있다.[주요시설&부대시설]서피비치[체험프로그램]서핑",양양군
