,title,addr1,mapx,mapy,firstimage,overview,addr2
0,감성마을 이외수 문학관,강원특별자치도 화천군 상서면 감성마을길 157,127.5162822,38.16657749,http://tong.visitkorea.or.kr/cms/resource/93/2566293_image2_1.jpg,"작가 이외수의 작업실은 문하생들과 독자들, 여행객들이 다녀가는 곳으로 일찍부터 유명했다. 화천을 경유하던 이들은 반드시 그의 집에 들러 밥 한 그릇을 청하곤 했다. 그래서 아예 그를 촌장으로 한 감성테마 문학공원을 만들어 보다 많은 이들이 이곳을 찾게 했으니 그게 바로 감성테마 문학공원이다. 화천군 상서면 다목리에 위치하고 있는 이곳은 작가의 집필실과 방문객들을 만나는 자리인 모월당, 모월교, 생태주차장 등으로 구성되어 있다.",화천군
1,곡운구곡 (강원평화지역 국가지질공원),강원특별자치도 화천군 사내면 용담리,127.5387169,38.05326058,http://tong.visitkorea.or.kr/cms/resource/01/2566301_image2_1.jpg,"곡운구곡(谷雲九曲)은 북한강의 지류하천인 지촌천의 일부구간에 해당된다. 이 곳은 단단한 화강암으로 이루어진 강바닥을 따라 다채로운 하천지형이 발달하고 있으며, 선캠브리아기 변성암의 습곡 및 단층구조를 관찰할 수 있는 중요한 지질명소에 해당된다.곡운구곡은 조선시대의 성리학자인 김수증(金壽增, 1624~1701)의 호 ‘곡운’을 딴 것으로, 그가 1670년부터 화천군 사내면 영당동에 거주하며너 지촌천의 물굽이 9개에 각각 이름[방화계(榜花溪), 청옥협(靑玉峽), 신녀협(神女峽), 백운담(白雲), 명옥뢰(鳴玉瀨), 와룡담(臥龍潭), 명월계(明月溪), 융의연(隆義淵), 첩석대(疊石坮)]을 지어 곡운구곡이라 칭한 데서 유래하고 있다.이는 속세를 떠나심산유곡으로 몰입해 은둔과 안닉을 통해 학문을 정진하고자 하는 성리학의 이상을 구현하기 위한 것이다.곡운구곡 일대는 하천의 규모가 작은 편에 속하고 일부 남아있던 지형이 도로 개설 과정에서 소실되었지만 전체적으로 화강암을 기반으로 한 수려한 암석 경관, 청정함 등으로 인해 구곡문화의 측면뿐만 아니라 지형경관지원 측면에서도 손색이 없는 우수한 자원으로 손꼽히고 있다. 전체 9곡 중에서 가장 경관이 뛰어난 곳은 화강암 지대에 위치한 제3곡인 신녀협과 제4곡인 백운담이다. 한편, 제1곡과 제3곡 사이의 변성암(호상편마암)지대에서는 변성작용 중에 일어난 습곡과 단층 구조를 관찰할 수 있다.<출처 : 강원평화지역 국가지질공원>",화천군
2,광덕계곡,강원특별자치도 화천군 사내면 포화로 582,127.4817103,38.07631517,http://tong.visitkorea.or.kr/cms/resource/95/172295_image2_1.jpg,"광덕계곡은 백운산과 광덕산 사이에 위치하며 자연경관이 수려하고 오염되지 않은 작은 폭포, 작은 소 등 깨끗한 물이 일품이다. 가을에는 주위의 백운산, 광덕산, 무학봉,  번암산,감투봉, 상해봉 등의 단풍이 장관이며, 여름에는 계곡피서가 적합하다. 민박 마을내에서는 산나물, 토종꿀 등 무공해 식품을 구입할 수 있고 숙박 시설이 마련되어 있어 여름 피서지로서 안성맞춤이다.",화천군
3,광덕산(화천),강원특별자치도 화천군 사내면,127.4394352,38.11500709,http://tong.visitkorea.or.kr/cms/resource/17/2566317_image2_1.jpg,"강원 화천군과 철원군, 경기 포천군의 군계(郡界)를 이루는 산으로 높이는 1,046m이며 복주산(伏主山)·석룡산(石龍山)·가리산(加里山) 등과 함께 태백산맥에서 갈라지는 광주산맥의 일부를 구성하며, 산용(山容)이 웅장하다. 북한강 수계와 한탄강 수계의 분수계에 위치하여 양 하천의 지류들이 발원한다. 광덕산은 주로 규암석으로 이루어져 있고 가을이면 단풍, 겨울이면 설경이 아름답다. 상해봉은 정상을 이룬 바위지대가 마치 망망대해에 떠 있는 암초와 같다 해서 붙여진 이름이다. 대체적으로 능선이 암벽으로 이어져 스릴을 주며 광덕재에서의 광덕산 그리고 백운산에 이르는 능선에는 억새밭이 펼쳐져 있다. 광덕산은 산 높이가 1,000m가 넘지만, 해발 620m 되는 광덕동에서 산행을 시작하므로 쉽게 오를 수 있다. 정상까지 2시간이면 오를 수 있고, 정상은 광장처럼 넓고 사방이 탁 트여 조망이 좋다. 하산은 올라온 길로 되돌아 내려가거나 상해봉을 거쳐 하산할 수 있다.",화천군
4,낭천산림욕장,강원특별자치도 화천군 화천읍 중리 221,127.7129937,38.10957115,http://tong.visitkorea.or.kr/cms/resource/18/172318_image2_1.jpg,"화천 시가지를 조망할 수 있는 절산을 이용하여 등산로, 팔각정, 평상, 이정표 등과 산림자원 등 학습자료 시설들을 설치하여 가족 및 연인들이 함께 산림욕을 즐길 수 있는 산 교육장이다. 화천읍 칠성루와 더불어 화천읍 시가지를 한눈에 조망할 수 있는 산림욕장으로 산림욕을 즐기면서 등반을 겸할 수 있을뿐더러 화천 읍내에서 5분 거리에 위치하고 있어 이동하는데도 수월하여 경로자 및 심신 허약자, 어린이에게 부담 없는 코스이다.",화천군
5,대성산지구 전적비,강원특별자치도 화천군 상서면 다목리 산1-1,127.5405936,38.17751556,http://tong.visitkorea.or.kr/cms/resource/23/2566323_image2_1.jpg,"6.25 전쟁 때 일어났던 대성산지구 전투 장병들의 영웅적인 전공을 높이 찬양하고 조국 수호를 위해 목숨을 바친 호국영령들의 넋을 추모하면서 그 위훈을 자손만대에 길이 전하고자 세운 비(碑). 1983년 10월 1일에 화천군에 있는 육군 제8305부대에서 건립했으며, 보병 제15사단(6685부대)에서 관리하고 있다.대성산지구 전투는 1951년 6월 9일 국군 2사단 2, 3대대가 1041고지에서 활동 중인 중공군 제20군 58사단 177연대의 적군 병력을 섬멸하기 위해 벌였던 전투다. 당시 국군은 선제공격을 개시해 1041고지와 신월동 및 865고지를 탈취했다.",화천군
6,동구래마을,강원특별자치도 화천군 하남면 호수길 329,127.6638864,38.04102267,http://tong.visitkorea.or.kr/cms/resource/31/2566331_image2_1.jpg,"동구래마을은 '동그란'에서 유래되어 모든 사물의 시작인 씨앗과 꽃을 상징하며 마을의 주인이 꽃이라 할 만큼 꽃들이 아름답게 피어있다. 약 1,000평 정도 되는 규모에 복수초, 금낭화, 매발톱꽃, 초롱꽃 등 50여 종에 달하는 토종야생화를 볼 수 있는 야생화단지로 우리 토종야생화 종자를 보존하고 증식하는 데 큰 역할을 하고 있다.",화천군
7,딴산,강원특별자치도 화천군 화천읍 대이리,127.7609195,38.12235667,http://tong.visitkorea.or.kr/cms/resource/09/2020509_image2_1.jpg,"화천읍에서 약 4㎞ 떨어진 딴산은 파로호와 평화의댐 진입로에 위치하고 있으며, 산이라기 보다는 섬같이 물가에 떠 있는 조그만 동산이다.구전에 의하면 옛날에 바위가 울산에서 금강산으로 가던 중 금강산 일만이천봉이 다 채워졌다하여 이 곳을 지나가다 머물렀다 한다. 물가에 홀로 섬처럼 두둥실 떠 있는 딴산의 모습도 이채롭지만 일대의 산 그늘과 강물이시원해 쉼터로 부각되고 있다.",화천군
8,딴산유원지,강원특별자치도 화천군 화천읍 대이리 산1-1,127.7588419,38.12320376,http://tong.visitkorea.or.kr/cms/resource/73/2785673_image2_1.JPG,"화천 읍내에서 평화의 댐 쪽으로 4km 정도 가면 딴산 유원지가 있다. 딴산은 산이라기보다는 물가에 자리하는 조그만 동산이다. 마치 섬처럼 두둥실 떠 있는 모습이 인상적이다. 앞으로 잔잔한 풍산천이 흐르고 있어, 낚시나 물놀이가 가능하고, 피크닉이나 캠핑을 하려 찾는 사람들이 많다. 인공 폭포가 있어 주말이나 휴가철에는 시원한 폭포를 감상할 수 있다.",화천군
9,만산동계곡,강원특별자치도 화천군 상서면 만산동로 406-38,127.5603456,38.14312272,http://tong.visitkorea.or.kr/cms/resource/23/1583823_image2_1.jpg,"만산동계곡은 화천읍에서 5km 떨어진 곳에 위치하고 있으며, 높이 100m, 폭 150m의 기암괴석을 한 만산동계곡과 조화를 이루고 있으며, 계곡변의 빼어난 경치가 마치 한폭의 그림을 상상케 한다.이 계곡은 여름 피서지로 적합하며, 마을내에서는 산나물, 토종꿀 등 무공해 식품을 값싸게 구입할 수 있어 매년 계곡을 찾는 관광객이 증가함에 따라  1992년부터 마을관리휴양지로 지정하여 위탁관리하고 있다.",화천군
10,병풍산,강원특별자치도 화천군 간동면 방천리,127.8167298,38.07470772,http://tong.visitkorea.or.kr/cms/resource/45/2566345_image2_1.jpg,화천군 간동면 도송리와 오음리에 걸쳐 있는 병풍산(796m)은 ‘고진감래(苦盡甘來)’라는 옛말을 체험하게 만드는 산이다. 처음 산 오름길이 비교적 험하고 힘들지만 일단 능선에 오르고부터는 자연이 만들어낸 귀한 선물을 받게 된다. 병풍산은 하루코스 산행지로 안성맞춤으로 산 맨 아래에서 출발해도 넉넉히 잡고 3시간이면 정상에 오를 수 있으며 하산까지 4시간이면 충분하다.,화천군
11,붕어섬,강원특별자치도 화천군 화천읍 강변로 2-54,127.6970121,38.10073855,http://tong.visitkorea.or.kr/cms/resource/81/172381_image2_1.jpg,"춘천댐 담수로 인하여 생긴섬으로, 섬내 환경보존이 잘되어있고, 축구장(잔디구장), 족구장, 테니스장, 다목적구장, 풋살장 및 수변산책로, 상설무대공연장, 화장실, 급수시설 등 레포츠와 자연휴양을 고루 즐길 수 있도록 조성된 휴양지로서 섬내에 많은 수목이 자연스럽게 밀집되어 있어 드라마,영화 등의 촬영 배경이 되고 있는 명소이다.붕어섬휴양지는 자연친화적인 요소를 최대한 가미한 4계절 녹색체험휴양지로서 관광객에게 인기가 높다. 붕어섬 주변에는 다량의 민물어종이 서식하고 있으며, 특히, 배스낚시터로 유명하다. 붕어섬에 진입하는 방법도 승용차를 이용해 바로 붕어섬까지 진입할 수 있게 되어 있어 시간도 절약하는 효과가 있다.",화천군
12,비래암 (강원평화지역 국가지질공원),강원특별자치도 화천군 상서면 구운리,127.5801103,38.14651436,http://tong.visitkorea.or.kr/cms/resource/08/2616508_image2_1.bmp,"비래암(650m)은 만산동계곡의 정상부에 위치한 높이 100m, 폭 500m의 관입암체로 주위를 둘러쳐 있어 병풍바위라고도 한다. 커다란 바위가 홀로 솟아 있어 금강산에서 바위가 날아와 이곳에 앉았다는 전설에서 유래되었다. 비래암을 이루는 석영반암은 입자의 크기가 작고 치밀 견고하여 풍화에 강하므로 수직의 경사를 갖는 높은 절벽을 형성하거나 산사면에 테일러스를 형성하는 것이 특징이다.",화천군
13,비수구미마을(비수구미계곡),강원특별자치도 화천군 화천읍 비수구미길 470,127.8479181,38.18287069,http://tong.visitkorea.or.kr/cms/resource/19/2675219_image2_1.jpg,"환경오염 없는 맑고 깨끗한 계곡으로 유명한 비수구미마을. 특히, 자연원시림과 넓은 바위가 계곡을 따라 밀집되어 있다. 파로호와 함께 가족단위 관광객들을 위한 가을 명소이다.
",화천군
14,산속호수마을,강원특별자치도 화천군 화천읍 호음로 806,127.7900418,38.12645952,http://tong.visitkorea.or.kr/cms/resource/14/2494614_image2_1.jpg,"화천에서 깊은 산속으로 굽이굽이 돌아가는 도로를 힘겹게 넘어서면 저 멀리 파로호의 멋진 풍경을 품어 안고 있는 동촌마을이 나타난다. 마을 어디를 가도 파로호의 탁 트인 넓고 시원한 모습이 언제나 눈에 들어오는 정겹고 고요한 호수의 마을이다. 동촌마을은 앞에는 파로호가 있고 마을 뒤로는 호랑이가 출현했다는 산세 깊은 산이 자리 잡고 있는 좋은 조건의 관광지이자, 동시에 맑은 민물고기가 잡히고 산을 뒤덮은 산나물들이 가득해 다양한 농촌체험이 가능한 팜스테이 마을이다. 동촌마을 뒷산에는 체험 가족이 직접 만들어 토종 흑돼지를 구워 먹을 수 있는 숯가마 체험관이 있다. 산 중턱 깊숙이 두 채의 황토 방과 함께 위치한 숯가마 체험관은 숯이 만들어지는 과정을 직접 확인해 볼 수 있을 뿐만 아니라 산속에서 아침을 맞이할 수 있는 몇 안 되는 산속 숙박시설이다.

또 녹색농촌 체험관에서는 막국수 만들기의 모든 과정을 직접 해볼 수 있는데 시설과 재료들이 갖춰져 있어 가족과 단체 관광객에게 좋은 체험의 기회가 될 것이다. 이 밖에도 파로호를 시원하게 조망할 수 있는 펜션과 민박집이 많고, 장승 공원과 호숫가에 위치한 드넓은 운동장은 단체로 혹은 가족끼리 찾아온 이들에게 좋은 쉼터와 휴식공간을 제공한다. 또 호수에서 망중한을 즐기며 하는 낚시와 표고버섯 채취, 오디 따먹기, 두부와 막국수 만들기, 산나물 채취, 옥수수 따기, 느릅나무 채취, 산메기와 개구리 잡기 등 계절과 밤낮으로 다양한 체험거리가 넘쳐나는 곳이다.

산세가 험준하고 인적이 드문 등촌마을은 얼마 전 호랑이가 출현했다는 마을로 또한 유명한 곳이다. 이에 착안해 매년 가을에는 동촌리 호음 고개에서 호랑이 고개 축제를 개최하고 있다. 호랑이 고개 축제는 멸종돼 가는 호랑이 등 한국의 야생동물들을 보호하고 마을의 역사와 문화를 지켜가자는 취지에서 매년 개최하고 있는데, 주요 행사로는 호랑이 조각 만들기, 호랑이 옷 갈아입히기, 호랑이 페이스 페인팅, 호랑이 사진전 등이 열리고 있다.",화천군
15,산천어시네마,강원특별자치도 화천군 화천읍 상승로2길 25-10,127.7028781,38.10614914,http://tong.visitkorea.or.kr/cms/resource/62/2566362_image2_1.jpg,산천어가 유명한 화천에 있는 영화관이 산천어시네마다.  최신영화를 상영함으로써 대도시 주민과 문화적으로 문화격차를 줄이고 지역주민 및 군 장병들의 다양한 문화욕구를 충족시키고 있는 공간이다.,화천군
16,산천어커피박물관,강원특별자치도 화천군 화천읍 상승로2길 21,127.7037225,38.10596307,http://tong.visitkorea.or.kr/cms/resource/71/2566371_image2_1.jpg,"산천어 커피 박물관은 ＂제임스 리＂가 30여 년간 세계 각국에서 모은 약 1000여 점의 유물을 기증한 커피 역사와 문화의 박물관이다. 에티오피아 커피 전시 등 커피 관련 전시가 상설로 열리기도 하는 등 세계 각국의 독특한 커피의 역사와 문화를 전합니다. 마시는 커피를 넘어 커피를 제대로 이해하고, 소통하고, 체험할 수 있다.",화천군
17,산타우체국,강원특별자치도 화천군 화천읍 산수화로 10,127.706,38.10714908,http://tong.visitkorea.or.kr/cms/resource/81/2566381_image2_1.jpg,"화천 산타클로스 우체국에서 산타할아버지께 편지를 써보세요! 산타클로스우체국 대한민국 본점에서 편지를 보내면 핀란드 산타마을에서 답장을 받는 놀라운 일이 생긴다. 365일 ""산타에게 보내는 편지"" 접수 가능! 소소한 행사들이 있고, 산타클로스옷을 입고 사진도 찍을 수 있어 주말여행으로 좋다.",화천군
18,삼일계곡,강원특별자치도 화천군 사내면 삼일리 196,127.5298426,38.05553515,http://tong.visitkorea.or.kr/cms/resource/51/2797051_image2_1.jpg,화악산 골짜기를 흐르는 맑은 계곡이다. 계곡 이름보다 강원도 기념물인 조선시대 ‘화음동정사지’가 있는 곳으로 더 많이 알려져 있다. 화천의 여느 계곡과 마찬가지로 이곳의 물 또한 깨끗하며 차다. 계곡을 따라 크고 작은 화강암들이 즐비하고 넓고 평평한 너럭바위와 울창한 숲으로 그늘이 우거져 피서객들이 휴식을 취하기 좋다. 화천의 다른 계곡들보다 비교적 덜 알려진 편이며 주차시설이 없다.,화천군
19,세계 평화의종 공원,강원특별자치도 화천군 화천읍 평화로 3481-18,127.8520836,38.21023425,http://tong.visitkorea.or.kr/cms/resource/57/1139957_image2_1.jpg,"평화의 댐 상부 1,000여 평의 부지에 '세계 평화의 종’공원이 있다.  평화의 종은 분쟁의 역사를 겪었거나 분쟁중인 국가 60여 개국의 탄피 1만관(37.5t)을 수거해 높이5ｍ,폭3m 규모로 제작, 설치되고 주변 야외전시장 등엔 세계 각국에서 보내온 종들이 전시된다. 이 같은 계획에 공감한 세계각국의 인사들이 평화의 의미를 담고있는 종들을 보내오고 있는 상태다. 이미 이탈리아 칼리시 도메니코 파피시장이 성 산타키리아 수도원에서 세계평화를 위한 기도시간을 알리는데 사용하던 동종을, 노벨평화상 후보에 올랐던 태국의 평화운동가 술락 시바락사 박사(74)는 방콕의 한 불교사원에서 사용하던 종을 각각 보내 왔다. 근처 평화의댐으로 향하는 길목엔 원시림이 계곡인 광바위계곡을 비롯, 붕어섬, 파로호안보관, 호랑이 발자국과 배설물이 발견됐던 해산전망대 등 관광지가 산재해 있어 여행지로도 으뜸이다.",화천군
20,신읍리 동지화 마을,강원특별자치도 화천군 화천읍 신읍리,127.6991887,38.13442355,http://tong.visitkorea.or.kr/cms/resource/91/2566391_image2_1.jpg,"화천군 화천읍 신읍리에 자리한 동지화마을은 동짓날에도 배꽃이 피는 따뜻한 마을이라는 뜻으로 ＂동지화 마을＂이란 이름이 생겨났다. 화천군에서 약초 재배를 기획적으로 시범 조성한 마을로, 와룡담, 용수, 산 약초 재배, 물푸레나무 등이 대표 관광요소라 할 수 있다. 동 지호부터 사구까지 자연마을이 약 16km에 걸쳐 어우러져 있으며, 용신, 동지화, 신촌, 남벌원, 율대, 솔골 등이 있다.  
(출처: 숲나들e)",화천군
21,양의대 하천습지 (강원평화지역 국가지질공원),강원특별자치도 화천군 화천읍 풍산리,127.8032005,38.25766667,http://tong.visitkorea.or.kr/cms/resource/25/2616525_image2_1.bmp,"평화의 댐(남한)과 임남댐(북한) 건설로 인한 수량번화로 인해 형성된 습지로 극류화천이 습지로 변한 곳으로 인위적인 영향을 받은 지형이다. 휴전 이후 민간인의 출입이 엄격히 통제되어 왓기 때문에 하천습지의 보존상태가 매우 우수한 것으로 알려져 있다. 또한 하천과 습지, 야산 등 다양한 서식처가 유기적으로 연결되어 있어 동식물의 서식처로서의 생태적 역할이 중요한 지형을 이루고 있다.",화천군
22,에어링화천,강원특별자치도 화천군 화천읍 강변로 2-54,127.6970121,38.10073855,http://tong.visitkorea.or.kr/cms/resource/04/2566404_image2_1.jpg,"에어링(Airing) 화천. 사람에게 가장 필요한 공기. 맑은 공기와 물이 살아있는 화천에서의 산책이란 뜻이다. 사계절을 즐길 수 있는 체험들이 기다리고있다. 산천어축제, 쪽배축제, 토마토축제 등 특히 수상자전거, 카약 등 가족이 함께 즐기기 쉬운 레포츠가 각광을 받고 있다.",화천군
23,연꽃단지,강원특별자치도 화천군 하남면 건넌들길 97,127.6542983,38.04170019,http://tong.visitkorea.or.kr/cms/resource/78/2785678_image2_1.jpg,"화천군 하남면 서오지리에 위치한 연꽃 생태공원으로 온 가족이 함께 즐길 수 있는 공간이다. 건넌들이라고 불리던 늪지대에 2005년부터 조성하기 시작했으며 수련, 백련, 순채, 가시연, 어리연꽃 등 400여 종에 달하는 연꽃들이 계절에 따라 꽃을 피워 사진작가들과 여행객들에게 인기 있는 관광명소다. 원래 이곳은 쓰레기와 오물이 넘쳐나는 오염지대였으나 주민들이 힘을 합쳐 생태계를 살려 나가기 위해 연을 심기 시작했다고 한다. 덕분에 이곳을 떠났던 물고기들이 돌아와 수중 생태환경도 되살아나고 있다.",화천군
24,용담계곡,강원특별자치도 화천군 사내면 물안골길,127.5454719,38.05188309,http://tong.visitkorea.or.kr/cms/resource/15/2566415_image2_1.jpg,"용이 머물다 승천했다는 천년전설을 고이 간직한 용담계곡은 대부분 암반위로 흐르는 물이 깨끗하고 암석으로 둘러쌓여 있을 뿐만 아니라 도처에 기묘한 폭포나 소, 그리고 암석들이 다양한 계곡을 형성하고 있다. 계곡 가운데는 가메소라 부르는 용소및 백운담 (곡운영당), 개똥소이 등이 있다.",화천군
25,용화산 (강원평화지역 국가지질공원),강원특별자치도 화천군 하남면 삼화리,127.7437761,38.04829276,http://tong.visitkorea.or.kr/cms/resource/16/1140216_image2_1.jpg,"화강암은 지하 깊은 곳에서 마그마가 굳어져 생성된 심성암(深成岩, plutonic rock)이다. 이와 같이 지하 깊은 곳의 고온·고압 상태에서 형성된 암석은 지표 근처로 상승하면 온도와 압력이 낮아져 쉽게 파괴되는 ‘풍화작용’을 겪게 된다. 특히, 풍화작용은 암석이 지하에서 수분과 접촉할 경우 활발하게 일어난다. 이는 화학적 풍화작용(암석을 구성하는 광물들의 결합이 풀려 부스러지는 현상)의 일종으로 지하에서 일어난다고 하여 심층풍화(또는 화학적 심층풍화)라고 부른다.이처럼 심층풍화작용이 가속화되면 단단한 바위도 사람 손의 힘으로도 쉽게 부서질 만큼 약한 상태가 되며, 이로 인하여 생성되는 물질은 새프롤라이트(saprolite)라고 부른다. 그러나 풍화를 적게 받거나 거의 받지 않은 화강암이 지면 위로 드러나게 되면 수분과 접촉하는 시간이 짧기 때문에 더 이상의 심층풍화를 받지 않으므로 규모가 큰 석산을 이루게 된다. 즉, 용화산은 심층풍화 이후 풍화를 받아 약해진 물질(saprolite)이 씻겨 내려간 후 균열구조가 적은 돔 형태의 큰 바위덩어리가 지표에 노출되어 현재와 같은 바위산을 이룬 것이다.<출처 : 강원평화지역 국가지질공원>",화천군
26,"월남 파병용사 만남의 장 (구, 베트남 참전용사 만남의 장)",강원특별자치도 화천군 간동면 죽엽산길 81-68,127.8340677,38.05442985,http://tong.visitkorea.or.kr/cms/resource/64/1138864_image2_1.jpg,"'월남 파병용사 만남의 장'은 월남 파병용사들에게 만남의 기회를 제공하며 국가적 공헌에 대한 자긍심 고취와 향수를 느끼도록 하고자 당시 훈련장이었던 화천군 간동면 오음리 바람버뎅이에 39,788㎡의 규모로 조성되었다. 월남 파병용사들의 피와 땀이 배어있는 이곳 옛 훈련장이 통일 애국교육의 장으로 다시 태어났다. 2008년 10월부터 본격적인 개장을 시작한 이곳에는 기념관(전시관), 훈련체험장, 피크닉장, 구찌터널, 전투장비전시, 월남전통가옥, 중대전술기지, 내부반, 식당 등 많은 볼거리와 편의시설을 갖추고 관광객을 기다리고 있다. 주변의 주요 관광자원으로는 ‘파로호 선착장’, ‘평화의 댐’, ‘세계평화의 종 공원’ 등이 있다.",화천군
27,위라리칠층석탑,강원특별자치도 화천군 하남면 위라리,127.7086445,38.09756414,http://tong.visitkorea.or.kr/cms/resource/90/1140290_image2_1.jpg,"고려시대의 옛 절터에 남아 있는 7층 석탑이다. 기단부재, 탑몸돌, 지붕돌 등이 사방에 흩어져 있던 것을 수습하여 다시 세운 것으로, 지붕돌과 탑신의 1 ·2 ·3층의 몸돌은 원래의 것이고 4층 이상의 몸돌은 1975년 복원할 때 보충한 것이다. 탑의 형태는 커다란 바닥돌 위에 7층의 탑신(塔身)을 올린 모습이다. 탑신의 몸돌은 각 모서리마다 기둥모양을 새겨놓았고, 2층에서 1층에 비해 큰 폭으로 높이가 줄어들다가 그 이후부터는 아주 조금씩 줄어들었다. 지붕돌은 밑면의 받침이 3단씩이며, 처마는 수평을 이루다 네 귀퉁이에서 살짝 치켜 올라갔다. 꼭대기에는 머리장식이 모두 없어지고 둥근 돌 하나만 남아 있다.규모만 작을 뿐, 탑신의 몸돌에 기둥을 조각한 것이나 지붕돌받침이 3단인 점 등이 남계원칠층석탑(국보)과 매우 비슷한 양식과 수법을 보이고 있어 두 탑의 제작연대가 비슷한 시기일 것으로 보인다.",화천군
