,title,addr1,mapx,mapy,firstimage,overview,addr2
68,지경리해변,강원특별자치도 양양군 현남면 동해대로 62,128.8032172,37.92046398,http://tong.visitkorea.or.kr/cms/resource/31/1830431_image2_1.jpg,"강릉시와 경계지점에 있으며 인근에 남애항이 있어 신선한 해산물과 활어회를 즐길 수 있는 곳이다. 해변 뒤편으로 송림이 울창하고 백사장이 넓고 깨끗하다. 설악권의 최남단 해변. 양양군 남쪽에 위치하고 있으며, 여름에만 한시적으로 지경리 마을에서 운영, 개방하는 간이해수욕장이다. 지경리해변의 최고 장점은 해수욕장 뒤편에 울창하게 드리운 3만 평 정도의 송림. 이 송림에서 텐트를 치고 야영도 할 수 있다. 해변에서는 파라솔이 필요 없을 정도이다. 더구나 다른 간이해수욕장과 달리 충분한 방갈로 시설이 갖추어져 있어 단체 수련 등에 많이 이용되고 있다. 해안선 길이는 700m 정도로 길게 뻗어 있고, 수심도 1m 정도의 얕은 편. 해마다 여름이면 기업 단체 연수가 줄을 잇는다.",양양군
69,진전사,강원특별자치도 양양군 강현면 화채봉길 368,128.5454259,38.1231771,http://tong.visitkorea.or.kr/cms/resource/75/2739175_image2_1.jpg,"강원도 양양군 강현면에 위치한 절은 통일신라시대인 8세기 후반에 도의선사가 창건했다. 도의선사는 신라에 선종(개인 수양을 중시하는 불교 종파)을 처음 들여온 인물이다. 당나라 유학 후 고국에 돌아와 선종을 소개했으나, 교종(교리를 중시하는 불교 종파)을 중시하는 분위기에 뜻을 펼치지 못하고 이곳에서 수도하다가 입적했다. 진전사는 <삼국유사>를 쓴 일연스님이 14살 때 출가한 절로도 유명하다. 그 뒤 절이 없어진 시기는 알 수 없고 폐사지로 남아 있다가 2005년 복원불사 후 2009년 전통사찰로 지정됐다. 오늘날 진전사가 자리한 양양진전사지(강원도 기념물)에는 두 개의 문화재가 남아 있다. 양양 진전사지 삼층석탑(국보)은 통일신라시대의 대표적인 석탑으로, 기단의 조각과 1층 몸돌의 불상 조각이 섬세하면서도 아름답다. 절 동쪽 언덕에 자리한 양양 진전사지 도의선사탑(보물)은 절을 세운 도의선사의 승탑이다. 3m 높이 화강암 탑은 9세기 중반쯤 세워진 것으로 보이며, 한국 석조 승탑의 출발점이라고 할 수 있다.",양양군
70,탁장사고을,강원특별자치도 양양군 현북면 어성전길 258,128.6638241,37.92307486,http://tong.visitkorea.or.kr/cms/resource/18/2494918_image2_1.jpg,"아름다운 산, 아름다운 경치, 깨끗한 물이 어우러져 빼어난 경관을 자랑한다. 시냇물은 한여름에도 발을 담그면 뼈 속까지 시리다. 칡과 다래넝쿨이 계곡 양편을 타고 오르고 있어 마을 신선들이 살고 있을 것 같은 자연경관을 조성한다. 무더운 여름날엔 수정같이 맑은 개울가에서 물고기와 가재를 잡을 수 있다. 산바람이 시원한 가을에는 소나무들이  빼곡하게 들어찬 숲에서  탁장사 마을의 별미인 송이 버섯을 직접 맛 볼 수도 있다.  눈오는 겨울철에는 눈썰매를 타며 어린시절로  되돌아 갈 수 있는 마을이다.  ‘탁장사’라는 마을 이름은, 내기시합에서 나무를 옮기는 데 성공한 마을 출신 장사 탁구삼씨의 성에서 유래되었다고 한다.",양양군
71,포매리 백로와 왜가리 번식지,강원특별자치도 양양군 현남면 개매길 215-33,128.7644282,37.94554643,http://tong.visitkorea.or.kr/cms/resource/47/2793447_image2_1.jpg,"현남면 포매리에 가면 백로와 왜가리가 소나무 위에서 유유히 날개짓 하는 모습을 볼 수 있다. 포매리는 동해안에서 대표적인 백로와 왜가리의 번식지로 유명하다. 백로와 왜가리는 주로 논과 하천, 해안과 갯벌에서 살면서 개구리와 뱀, 물고기 등을 잡아먹는데, 때문에 1990년에 포매호도 함께 보호구역으로 지정되었다. 포매리 번식지는 해안으로부터 700m 떨어진 구릉 위에 적송림이 울창하게 숲을 이룬 곳이다. 이 소나무 숲에서 백로와 왜가리가 번식하는데 소나무 약 500주 가운데 반 정도인 250주에서 살아가고 있다.",양양군
72,하조대,강원특별자치도 양양군 현북면 하조대해안길 29,128.7246739,38.02274503,http://tong.visitkorea.or.kr/cms/resource/11/2746911_image2_1.jpg,"강원도 양양군 현북면에 있는 암석해안으로 양양8경 중 하나다. 135,000㎡에 이르는 암석해안은 짙푸른 동해에 솟은 기암괴석과 바위섬으로 이루어져 있고, 주변 송림과 어우러져 경관이 빼어나다. 조선의 개국공신인 하륜과 조준이 고려 말, 이곳에서 은둔하며 혁명을 도모하여 두 사람의 성을 따 ‘하조대’라는 이름을 지었다고 전해진다. 해안절벽 위에 같은 이름의 정자가 자리한다. 조선 정종 때 처음 건립한 것을 시작으로 여러 번 중수를 거듭했고, 지금의 정자는 1998년에 양양군이 굴도리 양식의 육각정으로 복원한 것이다. 정자에서 바라보는 풍광은 아름답기로 유명하다. 특히 기암절벽 위 우뚝 솟은 노송은 과거 애국가 방송에 등장해 ‘애국송’이라고도 불린다. 하조대 정자에서 내려와 덱을 따라가면 흰색 무인 등대에 갈 수 있고, 인근의 하조대 둘레길과 하조대 전망대를 연계 관광할 수 있다. 하조대에서 북서쪽으로 1km 떨어진 거리에 하조대 해수욕장이 조성되어 있다. 수심이 1.5m 내외로 얕은 해수욕장이라 어린아이가 있는 가족이 물놀이를 하기에 좋다.[주요시설&부대시설]하조대[체험 프로그램]산책, 드라이브",양양군
73,하조대 무인등대,강원특별자치도 양양군 현북면 조준길 99,128.7348758,38.02110931,http://tong.visitkorea.or.kr/cms/resource/54/217454_image2_1.jpg,"해안에 우뚝 솟은 기암 절벽에 오래된 소나무와 함께 세워져 있어 이곳에 서면 동해안의 넓고 넓은 바다가 한눈에 다 들어온다. 조선의 개국공신 ‘하륜’과 ‘조준’이 잠시 머물다 간 곳으로 두 사람의 성을 따서 하조대라 이름지어졌다는 전설이 내려오고 있다. 이곳은 태조 왕건의 촬영지로도 유명하다. 하조대에서 바닷 바람을 쐬고 난 후 바로 옆 구름다리를 건너 10여m 쯤 절벽을 따라 들어가면 새하얀 등대가 자리 잡고 있다. 하조대에서 맞는 일출은 아름답고 장엄하기로 유명하여 일출을 보기위해 많은 관광객들이 찾는 곳이다. 또한, 해가 지고 어둠이 내리면 바다를 비추는 등대 불빛을 보러 오는 관광객도  많다.",양양군
74,하조대전망대,강원특별자치도 양양군 현북면 하륜길 54,128.7285402,38.02199242,http://tong.visitkorea.or.kr/cms/resource/00/2922200_image2_1.jpg,하조대해수욕장 우측에 위치한 양양의 바다가 한눈에 내려다보이는 전망대입니다.,양양군
75,하조대해수욕장,강원특별자치도 양양군 현북면 하조대해안길 35,128.7242655,38.02298944,http://tong.visitkorea.or.kr/cms/resource/73/2745273_image2_1.jpg,"강원도 양양군 현북면 하광정리에 위치한 해수욕장이다. 옥빛 바다와 부드럽게 펼쳐진 백사장, 주변의 등대 풍광, 기암괴석과 바위섬 등이 어우러져 빼어난 절경을 자랑한다. 동해 해수욕장에서도 아름답기로 손꼽히며 가족 피서객에게 사랑을 받는다. 모래사장 길이가 1.5km, 폭이 100m에 달하고, 수심은 1.5m 내외다. 주변에 광정천과 상운천 등의 하천에서 담수가 유입돼 수온이 여느 해수욕장에 비해 높다. 피서철 모래사장에는 유료로 텐트를 치고 야영을 할 수 있다. 해수욕장 뒤편의 송림에도 유료 야영장이 있다. 주변에 주차장, 샤워장, 식수대, 화장실 등이 편의시설이 있다. 매년 7~8월 사이 약 50일 정도 개장한다. 피서철에는 하조대 어부체험행사, 하조대 썸머페스티벌, 맨손 오징어잡기, 오징어 시식회 등의 행사가 개최된다. 해수욕장 남쪽으로 ‘양양8경’ 중 하나인 하조대와 바다를 조망하는 아찔한 전망대 스카이워크가 있다.[주요시설&부대시설]하조대 육각정[체험프로그램]수영",양양군
76,해담마을,강원특별자치도 양양군 서면 구룡령로 2110-17,128.5324285,37.98788979,http://tong.visitkorea.or.kr/cms/resource/79/2633079_image2_1.bmp,"구룡령중턱에 위치한 해담마을은 시원한 계곡주변에 마을야영장을 조성하여 민박형 방갈로, 샤워시설, 체육시설, 세미나실등 사계절 미니휴양지 시설이 되어있는 마을이다. 체험프로그램으로는 수륙양용차체험, ATV, 활쏘기, 뗏목타기등 다양하게 준비되어 있다. 먹거리로는 표고버섯 생산으로 해담표고버섯 너비아니를 생산판매하고 우렁이쌀, 인진쑥엿,인진쑥환, 송이, 장뇌삼 등이 있다. 계곡 주변에는 송림이 우거져 있어 더운여름에 시원하게 쉴 수 있다.",양양군
77,현산공원,강원특별자치도 양양군 양양읍 군청길 1,128.6171764,38.07467024,http://tong.visitkorea.or.kr/cms/resource/99/2495299_image2_1.jpg,"연어가 회귀하는 고장, 한때 강원도를 대표하던 강릉과 원주가 격하될 때는 도를 대표하던 고을, 최근에는 국제공항이 들어선 곳 양양. 속초시와 인제군, 강릉시에 둘러싸여 있으면서 고산과 바다를 동시에 갖고 있어 무공해 여행지가 많다. 지명의 유래를 보면 양양은 중국 원나라 시대의 양양과 지형이 비슷하다 하여 그런 이름이 지어졌다.현산이란 지명 역시 중국 양양의 산 이름을 따서 현산이라 하였다.  현재 공원 내에는 행정수복기념탑, 충효탑, 필승탑, 3.1운동 기념비 등이 있고 봄철에는 동해안에서는 드물게 벚꽃이 활짝 피어 장관을 이룬다.",양양군
78,휴휴암(강원),강원특별자치도 양양군 현남면 광진2길 3-16,128.767883,37.96124746,http://tong.visitkorea.or.kr/cms/resource/68/2739168_image2_1.jpg,"강원도 양양군 현남면 바닷가에 자리한 암자다. 휴휴암은 일상의 번뇌를 내려놓고 쉬고 또 쉬라는 의미에서 지어졌다. 1997년 홍법스님이 창건한 이곳은 묘적전이라는 법당 하나로 시작되었으나 1999년, 바닷가에 누운 관세음보살 형상의 바위가 발견되면서 기도처로 유명해졌다. 묘적전 아래 바닷가에는 활짝 핀 연꽃을 닮아 연화대라고 이름 지어진 너른 바위가 있다. 연화대에서 관세음보살 바위와 거북이 형상의 바위를 찾아볼 수 있어 사시사철 관광객의 발길이 끊이지 않는다. 그밖에 발가락 바위, 발바닥 바위, 주먹바위 등 기이한 모습의 기암괴석이 신비감을 더한다. 때로는 해변으로 먹이를 찾아오는 황어 떼도 만날 수 있다. 휴휴암에는 묘적전, 다라니 굴법당, 관음범종, 지혜관세음보살상 등이 자리한다. 바닷가 언덕 위의 지혜관세음보살상은 휴휴암의 또 다른 명물이다. 동해용왕상과 남순동자상을 양쪽에 둔 지혜관음보살상은 뒤에 푸른 동해를 두르고 있어 경치가 빼어나다.[주요시설&부대시설]휴휴암[체험 프로그램]물고기 밥주기",양양군
79,38선휴게소,강원특별자치도 양양군 현북면 동해대로 1242,128.7321043,38.00466117,http://tong.visitkorea.or.kr/cms/resource/36/2793236_image2_1.jpg,"분단의 상징인 38선에 위치한 휴게소이다. 휴게소 바로 위에는 기사문해변이 있는데, 한국전쟁 당시 양양 지역에서 최초로 38선을 돌파하면서 이곳에 기념 표지판을 세웠다. 덕분에 현재 동쪽의 휴전선은 38선보다 훨씬 더 위에 그어지게 되었다. 바다를 바라보는 언덕에 세워진 휴게소의 전망은 38선의 의미와는 다르게 무척 아름답고, 또 휴게소에선 휴식을 취하며, 간식도 사 먹을 수도 있습니다. 휴게소 옆에는 양양군 38선 미니 주제 체험관이 있는데요, 전시관에선 민족분단의 아픔을 간직한 38선의 역사와 한국전쟁 관련 자료를, 영상물과 사진 전시로 만나볼 수 있다.",양양군
