,title,addr1,mapx,mapy,firstimage,overview,addr2
0,갈천약수터,강원특별자치도 양양군 서면 구룡령로 1103-66,128.5029086,37.90589319,http://tong.visitkorea.or.kr/cms/resource/82/738182_image2_1.jpg,"갈천약수터는 양양군 갈천리 서쪽 약 11km 지점의 구룡령 계곡의 바위에서 솟아 나온다. 물에 철, 칼슘, 마그네슘, 망간 등의 성분을 함유하고 있으며, 특히 철의 함량이 높아 위장병과 빈혈에 좋다고 한다. 오색약수와 비슷하고, 오래 전부터 진부의 방아다리 약수와 함께 명성이 높다. 56번 국도변에서 약 2㎞ 떨어져 있어 약 30분 정도 걸어서 들어가야 한다. 가을철 구룡령 단풍이 좋아서, 걸어갈 만하다.",양양군
1,공수전계곡,강원특별자치도 양양군 서면 용소길 35,128.5578247,38.0360958,http://tong.visitkorea.or.kr/cms/resource/50/175450_image2_1.jpg,"용소골 계곡은 서린천의 굽이를 감돌아 흐르는 심산유곡으로 울창한 송림과 맑은 물, 하얀 자갈밭과 모래밭이 어우러진 비경이다. 송림을 벗어나면 용이 승천했다는 전설이 어려 있는 용소와 폭포가 있다. 그 아래에 물 떨어지는 소리가 마치, 끓는 물소리처럼 들린다는 탕소도 있다. 이곳은 조선시대 때 출장을 떠나는 관리들이 출장비를 지급받는 '공수전' 이라는 기관이 있었던 곳이라 하여 공수전 계곡으로도 불린다. 계곡에는 통나무로 지어진 용소골 휴게소가 있어 운치를 더한다.",양양군
2,공수전리 마을관리휴양지,강원특별자치도 양양군 서면 구룡령로 2829-7,128.5594245,38.03684574,http://tong.visitkorea.or.kr/cms/resource/96/1583296_image2_1.jpg,"조선시대 때 관청에서 정해놓고 경작하던 공수전(公須田)이 있었던 연유로 유래되었다. 공수전 및 용소계곡이 유명하다.
총 면적은 91.4ha이고 경지면적은 밭 20.0ha 논 25.2ha 임야 12.4㎢이다.",양양군
3,광진해수욕장,강원특별자치도 양양군 현남면 광진리 234-5,128.7646637,37.96498585,http://tong.visitkorea.or.kr/cms/resource/29/2738629_image2_1.jpg,"강원도 양양군 현남면 광진리에 있는 해수욕장이다. 7번 국도변을 따라 인구해수욕장과 갯마을해수욕장 사이에 위치한다. 광진해수욕장은 수질이 깨끗해 바다 밑이 훤히 들여다보일 정도다. 스노클링으로 바닷속 절경을 즐기려는 사람들을 흔히 볼 수 있다. 해변 암초 사이에 성게가 많이 서식한다고 알려졌고, 바다 조개를 채취할 수도 있다. 수심이 얕아 아이들이 물놀이하기에도 좋다. 걸어서 10분 거리에 양양의 관광 명소 휴휴암이 있다. 양양군에서 가장 남쪽에 있는 석호, 포매호 일대는 백로와 왜가리 번식지로 천연기념물이다.",양양군
4,국립 미천골자연휴양림,강원특별자치도 양양군 서면 미천골길 168-16,128.5120426,37.94899947,http://tong.visitkorea.or.kr/cms/resource/35/2739135_image2_1.jpg,"강원도 양양군과 홍천군 사이의 구룡령 자락에 자리한 휴양림으로, 미천골 계곡을 따라 조성되어 있다. 약 12km에 달하는 미천골 계곡은 휴양림 곳곳에 크고 작은 폭포를 만들며 흐른다. 주 계곡 양편에는 박달·물푸레·고로쇠·층층나무 등 다양한 수종이 자란다. 휴양림에는 산림문화휴양관·야영장·오토캠핑장 등의 숙박 시설 외에도 신라 시대 유적인 선림원지가 있어 생태 체험은 물론, 역사 유적지를 함께 둘러볼 수 있다. 선림원은 통일신라 시대에 지어진 선종의 승려 수련원으로, 보물로 지정된 양양 선림원지 삼층석탑 등이 남아 있다. 휴양림은 다채로운 숲 체험 프로그램을 운영한다. 숲속을 거닐며 자연생태를 관찰할 수 있는 ‘숲교육, 숲해설’, 소외 계층에게 자연과 교감할 기회를 제공하는 ‘찾아가는 미행(美行)’ 등이 그 예다. 휴양림 내에 왕복 6.2km의 등산로가 있으며, 숲속의집 제3지구부터 불바라기약수터까지 왕복 약 12km의 임도가 있어 삼림욕과 더불어 트레킹을 즐길 수 있다.[주요시설&부대시설]숙박시설, 야영장[체험 프로그램]선림의 문화를 찾아서, 숲교육, 숲해설, 나무수첩 만들기, 목걸이 만들기, 찻상 만들기, 나무시계만들기",양양군
5,기사문해수욕장,강원특별자치도 양양군 현북면 기사문길 8,128.7307155,38.00594988,http://tong.visitkorea.or.kr/cms/resource/90/2745290_image2_1.jpg,"강원도 양양군 현북면 기사문리에 위치한 해수욕장이다. 하조대해수욕장과 잔교리해수욕장 사이에 있다. 분단의 상징인 38선이 지나는 38휴게소가 이곳에 있어, 38해수욕장이란 이름으로 더 알려졌다. 해변은 사계절 개방되고, 7번 국도변이라 접근성이 좋다. 백사장이 아담해 해수욕객보다는 서핑족이 주로 찾는다. 서핑하기 좋은 파도가 치는 것으로 유명하다. 윈드 파인더 기준, 최대 3m까지 라이딩이 가능한 파도가 치지만, 바람이 센 날은 조류가 심해져 초보 서퍼는 입수를 피한다. 해안가로 서핑 강습과 보드 렌탈을 하는 서핑숍이 있고, 카페와 민박 등 편의시설이 다양하다. 기사문 야영장이 있어 여름철 피서객이 많이 찾는다. 5분 거리에 있는 기사문항에서는 신선한 해산물을 맛볼 수 있고, 어촌체험과 선상낚시, 방파제 낚시 등도 즐길 수 있다. 인근에 가볼 만한 관광지로는 기사문마을, 하조대 무인 등대, 죽도정 등이 있다.[주요시설&부대시설]해수욕장[체험프로그램]서핑",양양군
6,낙산 해수욕장,강원특별자치도 양양군 강현면 해맞이길 59,128.6336291,38.11775444,http://tong.visitkorea.or.kr/cms/resource/31/2745231_image2_1.jpg,"강원도 양양군 양양읍 조선리에 있는 양양 대표 해수욕장이다. 1963년 개장한 이래 해마다 전국 각지에서 약 100만 명 이상의 관광객이 다녀간다. 동해안에 있는 해수욕장을 통틀어 경포대해수욕장과 함께 가장 유명한 해수욕장으로 꼽힌다. 울창한 소나무 숲 앞으로 4km에 달하는 넓은 모래사장이 펼쳐진 모습이 인상적이다. 수심은 1.5m 내외로 비교적 깊지 않아 해수욕을 즐기기 좋다. 해수욕장 끝에는 낙산항이 있고, 그 뒤로 낙산사가 있는 낙산이 굽어본다. 반대편 쪽으로는 설악산에서 흘러내린 남대천이 하구에서 호수를 이루고 있다. 해변 주변에 카페, 편의점, 맛집 등이 들어서 있어 편리하게 이용할 수 있다. 해수욕장 주변으로 민박, 콘도, 호텔 등 숙박시설도 잘 갖춰져 있다. 겨울에는 해돋이를 보기 위해 많은 사람이 방문하는데, 새해에는 해맞이 축제가 열려 소원을 염원하는 명소가 되기도 한다.[주요시설&부대시설]낙산해변[체험프로그램]해변 산책, 물놀이 ",양양군
7,낙산도립공원,강원특별자치도 양양군 강현면 일출로 42,128.6313822,38.11610181,http://tong.visitkorea.or.kr/cms/resource/55/763455_image2_1.jpg,"강원도 양양군의 연장 24km 해안선 주변을 낙산도립공원이라 부른다. 산사와 낙산해수욕장을 중심으로 오산, 동호, 하조대 해수욕장까지의 해안이 전부 포함되며 곳곳에 호수와 단구가 발달하여 볼거리가 많다. 불교문화의 진수를 맛볼 수 있는 낙산사와 경내에 산재되어 있는 각종 문화재가 있으며, 기암괴석과 노송으로 이루어진 해안절벽이 장관이다. 여름 한창 성수기에 몰리는 관광객을 모두 수용하기엔 시설이 모자라는 형편이나 숙박 및 놀이, 편의시설이 비교적 잘 되어 있으며, 최근에는 지속적으로 관광을 위한 편의시설이 개발되고 있다.",양양군
8,낙산사,강원특별자치도 양양군 강현면 낙산사로 100,128.6273545,38.12485627,http://tong.visitkorea.or.kr/cms/resource/56/2739156_image2_1.jpg,"신라 문무왕 11년(671)에 의상대사가 창건한 고찰이다. 낙산사는 강원도 양양을 대표하는 관광명소이자 역사적 가치가 큰 명승지다. 강화 보문사, 남해 보리암과 더불어 한국 3대 관음성지로 꼽힌다. 동해가 한눈에 내려다보이는 천혜의 풍광이 아름다운 사찰은 관동팔경(강원도 영동의 여덟 군데 명승지) 중 한 곳으로, 예로부터 수많은 고전과 시문에 그 아름다움이 전해지고 있다. 낙산사는 여러 번 중건과 복원을 거친 역사적 사찰로 여러 문화재를 보유한다. 16m 높이의 해수관음상, 해안 절벽 위에 지은 정자이자 동해안 일출 명소인 의상대, 바다를 굽어보는 암자인 홍련암, 조선 시대에 지었으나 고려 시대 양식을 이어받은 양양 낙산사 칠층석탑(보물), 부처의 진신사리를 비롯한 사리장엄구가 발견된 양양 낙산사 해수관음공중사리탑·비 및 사리장엄구 일괄(보물) 등이 잘 알려져 있다. 2005년에 큰 산불이 나 보물로 지정되어 있던 동종을 비롯해 20여 채의 전각이 소실된 바 있다. 낙산사 홈페이지를 통해 템플스테이를 신청할 수 있다.",양양군
9,낙산사 의상대,강원특별자치도 양양군 강현면 낙산사로 100,128.6307431,38.12537017,http://tong.visitkorea.or.kr/cms/resource/15/2739115_image2_1.jpg,"강원도 양양 낙산사에서 홍련암의 관음굴로 가는 바닷가 절벽 위에 자리한 정자다. 의상대의 ‘대’란 주변 경치를 감상하기 위해 지은 집을 말한다. 의상대에서 바라보는 동해와 해안 절경이 빼어나 양양8경에 이름을 올렸고, 낙산사에서 반드시 들려야 할 곳으로 손꼽힌다. 송강 정철의 <관동별곡>에서 소개한 관동팔경(강원도 영동의 여덟 군데 명승지) 중 하나로, 동해안 일출이 유명한 곳이기도 하다. 「양양 낙산사 의상대와 홍련암」이라는 이름으로 명승에 지정되어 있다. 낙산사 의상대는 의상대사의 업적을 기리기 위해 1925년에 지은 정자다. 의상대사는 신라 문무왕 11년(671)에 낙산사를 창건한 고승으로, 절 곳곳에 그와 관련한 전설이 전해진다. 중국 당나라에서 돌아온 의상대사가 낙산사를 지을 때 지금 의상대가 있는 자리에서 산세를 살피고 좌선 수행을 했다고 알려져 있다. 현재의 의상대는 1995년에 육각정으로 복원된 모습이다.[주요시설&부대시설]의상대, 낙산사[체험 프로그램]일출관람, 관광",양양군
10,남대천,강원특별자치도 양양군 양양읍 월리 553,128.6128188,38.06536013,http://tong.visitkorea.or.kr/cms/resource/49/2746849_image2_1.jpg,"양양8경 중 1경으로 꼽히는 하천이다. 강원도 평창군 오대산(1,563m)에서 발원한 강은 양양을 가로질러 동해로 흘러든다. 구간별로 최상류부터 부연계곡, 법수치리계곡, 어성전천, 남대천으로 나눌 수 있다. 양양 남대천은 한국에서 제일가는 연어 회귀 하천이다. 한국으로 돌아오는 연어의 70% 이상이 이곳으로 회귀하여 ‘연어의 모천(母川)’이라 불린다. 양양 남대천에서 태어난 어린연어는 북태평양 베링해나 오호츠크해에서 3~5년가량 성장한 후 동해를 거슬러 되돌아와 알을 낳고 생을 마감한다. 연어의 회귀는 가을, 특히 10월 중순부터 11월에 절정에 이르며, 10월 중순 무렵 남대천 일대에서는 양양연어축제가 열린다. 그밖에 4~5월에는 황어, 7~8월에는 은어 떼를 관찰할 수 있다. 양양 남대천은 강원도 영동 지역 하천 중에서 가장 맑고 길다고 알려져 있다. 동해안의 다른 하천들이 20㎢ 내외인 데 비해 양양 남대천은 54㎢에 이르며 비교적 많은 지류로 이루어져 있다. 강 상류에 법수치리 계곡, 하류 인근에 낙산해변 등의 관광지가 있고, 강 하구에 조성된 남대천 생태관찰로는 가을에 은빛으로 물드는 갈대숲이 아름답다.",양양군
11,남대천 생태관찰로,강원특별자치도 양양군 양양읍 조산리 86-4,128.6397264,38.09841514,http://tong.visitkorea.or.kr/cms/resource/29/2739129_image2_1.jpg,"‘연어의 모천’이라 불리는 양양 남대천의 자연을 관찰할 수 있는 생태 여행지다. 낙산대교 근처, 남대천 물길이 동해로 흘러 들어가는 하류에 조성되어 있다. 남대천 생태관찰로는 광활한 갈대숲으로 유명하다. 길게 뻗은 덱 탐방로를 따라 금빛 갈대숲을 산책할 수 있고, 주변에 시야를 가리는 건물이 없어 탁 트인 풍광을 만끽할 수 있다. 관찰로 곳곳의 전망대는 강변으로 돌출되어 있어 갈대 군락과 강이 어우러진 풍경을 조망하기에 좋은 포인트다. 대체로 한적한 분위기이지만, 가을이면 갈대숲을 배경으로 사진을 찍으러 관광객이 많이 찾아온다. 덱 탐방로는 경사가 없이 평탄해 남녀노소 누구나 걷기 편하다. 밤에는 낙산대교의 조명, 남대천 제방 도로의 가로등이 어우러져 낭만적인 야경을 선사한다. 남대천 생태관찰로 인근의 남대천연어생태공원도 함께 들러볼 만하다. 7만 6,447㎡ 부지에 조성된 공원에는 약 660m 길이의 덱과 6개의 전망대가 자리한다. 덱을 따라 갈대, 물억새, 달뿌리풀 군락 등 수변에 자라는 다양한 수생식물을 관찰할 수 있다.[주요시설&부대시설]데크길[체험 프로그램]데크길 걷기, 남대천생태관찰",양양군
12,남대천연어생태공원,강원특별자치도 양양군 양양읍 조산리 86-7,128.6398403,38.09818184,http://tong.visitkorea.or.kr/cms/resource/81/2793281_image2_1.jpg,"남대천 연어생태공원에는 생태환경을 관찰할 수 있는 데크로드와 전망대가 조성되어 있다. 생태 관찰로 엔 길이 칠백 미터 정도 데크가 뻗어 있고, 6개의 전망대도 있어 사계절 내내 산책하기 좋다. 이 길에선 갈대와 물억새와 같은 남대천의 생태환경을 관찰할 수도 있다. 1996년 연어 낚시 대회로 시작한 연어 축제는, 9월에 열리는 송이 축제와 함께 양양군을 대표하는 큰 축제가 되었다. 매년 10월 말~11월 초에 남대천 둔치와 그 일대에서 열리는데, 축제장에선 연어 맨손 잡이 체험, 연어와 함께 달리기, 연어 사생대회, 연어 특선요리, 연어 춤 공연 등 각종 체험과 문화행사를 경험할 수 있다.",양양군
13,남애1리해수욕장,강원특별자치도 양양군 현남면 남애리,128.7786271,37.94005568,http://tong.visitkorea.or.kr/cms/resource/96/2915996_image2_1.JPG,"양양을 대표하는 항구가 남애항이다. 이를 중심으로 위쪽이 3리 해변, 전망대와 항구가 있는 곳이 2리, 항구방파제 남쪽 해변이 1리 해변이다. 1리 해변은 2, 3리와 달리 특별한 유흥시설이나 레저시설이 없어 아주 조용하고 작은 어촌의 풍경을 보여준다. 여기서부터 아래쪽으로 원포해변과 지경해수욕장, 주문진해수욕장까지 길게 해변이 이어진다. 여름에는 해당화가 해변 가득 피어 볼거리를 주고, 해변 중간에는 차박을 할 수 있는 야영장도 마련되어 있다.",양양군
14,남애3리해수욕장,강원특별자치도 양양군 현남면 매바위길 167,128.7845708,37.94570792,http://tong.visitkorea.or.kr/cms/resource/09/1584009_image2_1.jpg,"아름다운 석호인 매호를 끼고 있는 남애리에는 세 곳의 해변이 있다. 그중 맨 북쪽에 위치한 남애해변이 가장 규모가 크다. 백사장은 길이 2km에 폭 100m쯤 되며, 평균 수심 1~2m로 경사가 완만하고 모래질도 좋은 편이고 바다로 흘러드는 매호의 물길 양쪽에는 광활한 갈대밭이 펼쳐져 있어 가을철이면 햇살 아래 금빛으로 일렁이는 갈대밭의 풍경이 그림처럼 아름답다. 남애3리 해변은 길이 1.3km에 폭 100m 가량 되는데, 남애항과 가까워서 싱싱한 해산물을 손쉽게 맛볼 수 있다. 남애항은 동해시 추암해변, 양양 낙산 해변과 함께 동해안의 일출 명소로도 이름 나 있다. 가장 남쪽의 남애1리해변은 길이 0.6km의 아담한 해변이다. 매호 부근에는 천연기념물로 지정된 백로·왜가리 번식지가 있다.",양양군
15,남애어촌체험마을,강원특별자치도 양양군 현남면 매바위길 127,128.7861179,37.9445803,http://tong.visitkorea.or.kr/cms/resource/09/1583309_image2_1.jpg,강원 3대 미항의 하나인 남애항을 둘러싸고 옹기종기 모여 사는 아담한 어촌마을이다. 7번 국도와 연접하여 수산물 직거래 수송이 원활하여 수산물 생산 중심지로 발돋움하고 있다. 예부터 산과 바다가 함께 어우러지는 곳으로 동해의 일출이 아름다워 수많은 관광 피서객이 모이는 곳이다.,양양군
16,남애항,강원특별자치도 양양군 현남면 매바위길 138,128.7871623,37.94494694,http://tong.visitkorea.or.kr/cms/resource/15/2746915_image2_1.jpg,"강원도 양양에서 가장 큰 규모의 항구로 양양8경 중 하나다. 강릉 심곡항, 삼척 초곡항과 함께 강원도 3대 미항으로 꼽힌다. 그 명성에 걸맞게 어선이 정박한 항구, 빨갛고 흰 등대, 방파제가 아름다운 어촌의 정취를 자아낸다. 항구를 배경으로 뜨는 해가 아름다워 해돋이 명소로도 유명하다. 남애항의 또 다른 볼거리는 남애항 스카이워크 전망대다. 방파제 입구 쪽에 자리한 스카이워크에 오르면 남애항 일대와 동해의 시원스러운 풍광을 한눈에 담을 수 있다. 스카이워크가 들어선 곳은 조선 시대에 양야도라는 섬으로 불렸고, 섬의 봉수대가 있던 자리에 스카이워크를 설치했다. 남애항의 포구 마을인 남애어촌체험마을은 관광객을 위해 낚싯배 체험을 연중 운영한다. 이 외에 맨손 물고기 잡기, 갯바위 게 잡기, 오징어순대 만들기 등 다양한 체험을 즐길 수 있다. 남애항에서 주로 잡히는 어종은 오징어, 가자미, 광어 등이다. 항구를 따라 횟집이 모여 있어 동해에서 잡은 싱싱한 생선회를 맛볼 수 있다.",양양군
17,남애항 스카이워크 전망대,강원특별자치도 양양군 현남면 매바위길 138,128.7868845,37.94511914,http://tong.visitkorea.or.kr/cms/resource/50/2922150_image2_1.jpg,수산물의 집산지 역할을 톡톡히 해내며 강원도 3대 미항으로 불리는 남애항에 있는 스카이워크 전망대,양양군
18,내수면 생명 자원센터,강원특별자치도 양양군 손양면 동명로 119,128.6388993,38.08101437,http://tong.visitkorea.or.kr/cms/resource/51/2739151_image2_1.jpg,"한국수산자원관리공단 동해본부 산하의 내수면생명자원센터는 동해안의 주요 회귀 어종인 연어를 보존하기 위해 종자 배양·육성·방류 및 연어자연산란장 조성사업 등을 진행한다. 한국 연어의 70% 이상이 센터가 위치한 양양 남대천에서 태어나 북태평양에서 3~4년간 성장한 뒤 산란을 위해 남대천으로 돌아온다. 하지만 하천 파괴에 따라 회귀하는 연어 수가 줄어들고 있기에 센터는 직접 인공 수정을 진행, 부화한 어린연어를 약 5개월간 키운 뒤 남대천에 방류한다. 센터 내에 마련된 연어생태체험관은 연어의 부화와 성장 과정, 회귀 경로 등 연어 관련 정보를 상세히 소개한다. 연어 사육동에서는 인공 수정으로 부화한 어린연어가 먹이를 먹고 성장하는 모습을 견학할 수 있다. 센터는 10~11월경에 어미연어 맞이, 2~3월경에 어린연어 보내기 생태체험 프로그램을 운영한다. 고향으로 돌아온 연어를 만져보거나 물통에 담긴 어린연어를 수로에 놓아주며 연어의 생태를 가까이에서 관찰할 수 있는 기회다. 체험 프로그램은 한국수산자원관리공단 홈페이지(www.fira.or.kr)를 통해 신청할 수 있다.[주요시설&부대시설]전시관[체험 프로그램]3D 애니메이션 시청, 어린 연어 남대천 보내기, 가공품 전시, 먹이주기 체험, 미니 거울 만들기 등",양양군
19,대청봉,강원특별자치도 양양군 서면 오색리,128.4588238,38.08495487,http://tong.visitkorea.or.kr/cms/resource/61/2746861_image2_1.jpg,"높이 1,708m의 대청봉은 설악산의 최고봉이자 대한민국에서 한라산(1,950m), 지리산(1,915m)에 이어 세 번째로 높다. 면적이 400㎢에 달하는 설악산국립공원의 주봉으로 내설악·외설악의 분기점이 된다. 대청봉을 기준으로 서쪽 인제 방향의 내설악, 동쪽 속초·고성 방향의 외설악이 구분된다. 천불동계곡, 가야동계곡 등 설악산에 있는 대부분의 계곡의 발원지이기도 하다. 대청봉 정상은 기상 변화가 심하고 기온이 낮아 10월 중순부터 다음 해 늦봄까지 눈으로 덮여 있다.
대청봉 능선에는 눈잣나무·털진달래·사스래나무 등이 군락을 이루고 아고산대 식생이 발달해 고산 생물 연구에 중요한 역할을 한다. 설악산국립공원의 등산로 중 오색 방면, 백담 방면, 설악동 방면, 오색령(한계령) 방면, 총 네 개의 탐방로를 통해 대청봉에 오를 수 있다. 최단 탐방로는 5km의 오색 방면(오색-설악폭포-대청봉) 코스로 4시간가량이 소요된다.",양양군
20,동명서원,강원특별자치도 양양군 양양읍 서원길 44-9,128.6297408,38.11100238,http://tong.visitkorea.or.kr/cms/resource/17/2765117_image2_1.jpg,"1628년(인조 6) 본부사(本府使) 조위한(趙緯韓) 등을 중심으로 한 지방유림의 공의로 조인벽(趙仁璧)의 학문과 덕행을 추모하기 위해 충현사(忠賢祠)를 설립하여 위패를 모시고 동명서원이라 하였다. 선현배향과 지방교육의 일익을 담당하여오던 중, 전란으로 전소되어 1787년(정조 11) 경상북도 봉화(奉化)로 옮겨서 복원하였다. 그뒤 흥선대원군의 서원철폐령으로 1871년(고종 8) 훼철되었으며, 1898년 강원도관찰사 조종필(趙鍾弼)이 양양 조산리의 서원유지에 유허비(遺墟碑)를 세웠다. 1974년부터 서원복원추진위원회가 구성되어 복원을 추진, 1982년에 완공하였다. 경내의 건물로는 3칸의 충현사, 6칸의 재실, 신문(神門), 동·서 협문 등이 있으며, 사우인 충현사에는 조인벽의 위패가 봉안되어 있다. 재실은 원내의 여러 행사와 유림의 회합, 제향(祭享) 때 제관들의 숙소 등으로 사용되고 있다.",양양군
21,동산포해변,강원특별자치도 양양군 현남면 동산리,128.7570277,37.98215593,http://tong.visitkorea.or.kr/cms/resource/66/175466_image2_1.jpg,"동산항에서 고개를 하나 넘어 북쪽에 위치한다. 청정수역 해변이라 물속에 들어가 발로 비비면 조개를 캘 수 있다. 동산 해변은 20m 정도 바다로 나가도 무릎이나 허벅지까지 밖에 물이 차지 않을 정도로 수심이 얕다. 해변 모래사장은 고운 떡모래로 부드럽고 깨끗하다. 동산리 마을에서 운영하는 이 해변은 바로 앞에 전통 어촌 부락이 위치하고 있어 싱싱한 횟감도 쉽게 구할 수 있으며, 바다낚시도 즐길 수 있다. 모래사장 길이는 800m, 폭 50m 정도이며, 백사장에서 야영도 할 수 있다. 별도의 야영장에는 텐트 300동 정도 칠 수 있으며, 주차장도 3,000평 정도 확보되어 있다. 해변 인근에는 해안 바위가 있어 스킨스쿠버 명소로도 손꼽힌다.",양양군
22,동산포해수욕장,강원특별자치도 양양군 현남면 동산큰길 39,128.759972,37.97915633,http://tong.visitkorea.or.kr/cms/resource/91/2738591_image2_1.jpg,"강원도 양양군 현남면 동산리에 위치한 해수욕장이다. 동산항에서 언덕 넘어 북쪽에 있는데, 7번 국도변에 위치해 접근이 용이하다. 길이 290m, 폭 57m로 펼쳐진 모래사장은 부드럽고 깨끗하다. 해변에서 바다로 약 15m까지 나가도 수심이 무릎 높이 정도여서 어린이가 놀기에도 좋다. 최근에는 경관을 정비해 휴게시설이 깨끗하고, 답답해 보였던 해안 철조망을 걷어내고 탁 트인 바다를 조망할 수 있도록 재단장했다. 해변에서 바로 보이는 조도는 일출 시 드라마틱한 모습을 연출한다. 청정수역이라 바닷속이 투명하게 비춰 보일 정도로 맑다. 주변으로 해안 바위가 있어 스킨스쿠버 명소로도 소문났다. 조개가 지천에 있어 쉽게 잡을 수 있다. 백사장에서 야영도 가능하고, 별도의 야영장이 있다. 해변 바로 앞에 전통 어촌 부락이 있어 활어회를 맛볼 수 있고, 바다낚시도 즐길 수 있다.",양양군
