,title,addr1,mapx,mapy,firstimage,overview,addr2
19,태종대(횡성),강원특별자치도 횡성군 강림면 태종로 287,128.1100941,37.35123327,http://tong.visitkorea.or.kr/cms/resource/33/2026233_image2_1.jpg,"태종대는 강림면 치악산 국립공원 매표소 바로 위에 위치한 곳으로 태종 이방원과 스승이었던 운곡 원천석에 대한 이야기가 전해오고 있다. 고려 말 4처사의 한 사람이었던 운곡 원천석은 조선조 태조인 이방원의 스승이었다. 운곡은 태조가 고려를 전복시키고 조선을 세우고 또한 그의 아들들의 피비린내 나는 왕권 다툼에 실망과 분노를 느낀 나머지 모든 관직을 거부하고 개성을 떠나 이곳 강림리에 은거하고 있었다. 험한 산골이었던 이곳에 방원이 임금으로 등극하기 전인 1415년 옛 스승인 운곡을 찾아 다시 관직에 앉히고 정사를 의논하고자 이곳을 찾았다. 그러나 강직하고 절개가 곧았던 운곡은 방원과의 만남을 꺼려 일부러 치악산 골짜기로 몸을 숨겨 만나 주지 않았다.

방원이 자기를 찾아다니는 것을 안 운곡은 개울가에서 빨래를 하는 노파에게 자신을 찾는 사람이 오거든 횡지암 쪽으로 자신이 갔다고 일러 주라고 신신당부를 하고는 운곡은 반대 방향으로 피신했다. 방원은 노파가 가르쳐 주는 곳으로 스승인 운곡을 찾았으나 끝내 운곡을 찾지 못하고 돌아갔다. 그 당시 방원이 머물던 곳을 ‘주필대’라고 불러오다가 나중 방원이 태종으로 등극하자 ‘태종대’로 부르게 되었다. 나중에 태종이 임금이 되어 다시 운곡을 부르자 차마 어명을 어길 수 없던 그는 상주 차림으로 옷을 갈아입고는 대궐에 들어가 태종의 형제간 살육의 비인도적인 처사에 대해 무언의 시위를 벌이기도 했다. 또한 임금인 줄 모르고 거짓을 아뢰었다가 나중에 그분이 지엄하신 임금이라는 사실을 알게 된 노파는 죄책감에 자신이 빨래하던 바위 아래 소에 몸을 던져 스스로 목숨을 끊었다. 그 후 이 노파가 빠져 죽은 소를 사람들은 ‘노고소’라 불렀으며 이곳 마을에서는 매년 이 노파에 대한 제를 올렸다고 한다. 부근에는 방원이 만나지 못한 스승을 향해 돌아가면서 예를 갖춰 절을 했다는 ‘배향산’이 있고 임금님의 수레가 넘었다는 ‘수레넘이’ 고개가 부근에 있다. 그리고 치악산 기슭에는 운곡이 머물렀던 ‘변암’이 그 당시 대쪽같던 운곡의 굳은 절개를 오늘의 우리들에게 이야기해 주고 있다.",횡성군
20,한국통나무학교,강원특별자치도 횡성군 강림면 월안길 88,128.1785711,37.35644228,http://tong.visitkorea.or.kr/cms/resource/15/1583915_image2_1.jpg,"통나무학교 내에는 모든 건물, 심지어 개집까지 통나무로 되어 있어 다양한 통나무집 전시장을 둘러보는 것보다 훨씬 생동감 있는 견학을 할 수 있다. 도시락을 준비해서 가족 나들이를 해도 좋고, 원한다면 전문가와 교육 및 건축에 대한 상담도 가능하다. 단, 교육이 실시되고 있을 때에는 교육에 지장이 있어 견학이 곤란하므로 미리 전화로 방문일자를 확인하는 것이 좋다. 통나무 체험과정은 10명 이상의 단체만 가능하며, 구성원의 특성에 따라 교육내용도 변경 될 수 있다. 식사는 자체해결하되, 숙소는 기숙사를 이용하며, 침구는 준비해야 한다.",횡성군
21,홀로세 생태학교,강원특별자치도 횡성군 갑천면 갑천로690번길 156,128.150077,37.52567497,http://tong.visitkorea.or.kr/cms/resource/97/1583897_image2_1.jpg,"'홀로세'란 신생대 제4기 플라이스토세 다음으로 약 10,000년 전부터 현재까지의 기간 (지질시대)을 말하며, 충적세(沖積世) 또는 현세라고도 부른다. 이시기는 인류가 경작과 유목 활동을 시작하면서 본격적으로 모든 생태계를 위협하기 시작한?시기이기도 하다.?이 시기에 인류에 의해서 대부분의 생물이 멸종하게 되었는데 이를 ‘홀로세 멸종’ 이라고 하며 파괴적인 인간에 의한 제6의 멸종이 생태계의 근심거리가 되고 있다. 이에 따라 현재의 생태학적 위기를 알리고 자연과 생명에 대해 깊이 생각해 볼 수 있는 계기를 마련하고자 ‘홀로세’ 라는 이름을 지은 '홀로세 생태보존연구소'는 환경부 지정 '서식지외보전기관', '생물다양성관리기관'으로 멸종위기종 증식 및 복원뿐만 아니라 곤충 종 자체 보존이나 곤충자원의 분류, 생태 등 기초연구로 생물 다양성 유지를 통한 환경 보존의 실천적 모범 사례를 만들고 있다.",횡성군
22,횡성 밤두둑마을,강원특별자치도 횡성군 횡성읍 반곡3길 6,127.9614597,37.4666727,http://tong.visitkorea.or.kr/cms/resource/55/2495455_image2_1.jpg,"밤두둑마을은 특별한 먹거리가 많은 마을이다.첫째는 각종 매스컴을 많이 탔던 국수호박요리다. 처음 들었을 때 사람들은 이 요리가 국수에 호박 같은 걸 넣고 끓여낸 국수종류로 안다. 그러나 국수호박요리는  국수호박이란 특별한 호박을 겉껍질만 벗겨낸 후 끓는 물에 그냥 끓이면 마치 면발을 삶은 것처럼 된다.여기에 늙은 호박 무침하듯이 양념을 해서 먹으면 된다. 여기에 밥을 비벼 먹으면 아삭아삭 하면서도 신선한 맛이 난다.두 번째는 자연방사 닭과 계란 요리다. 이 마을에는 그냥 뜰에다 닭을 놓아기르는 양계장이 많은데 이렇게 방사해서 기른 닭은 흑돼지가 더 맛있듯이 일반 닭보다 맛있고 계란은 더욱 고소하다.회다지 등 각종 문화행사 풍부먹거리도 많지만 사실 볼거리도 많은 곳이 이 마을이다. 문화재청에서 영구  보존하기 위해 촬영까지 한 회다지(일종의 장례저라로서 묘지의 땅 다지기) 구전 문화가 있고 정월 대보름에는 지신밟기, 삼신제 등 문화 축제가 열리며 9월에는 허수아비 축제가 개최된다.먹거리와 볼거리만 많다면 며칠인들 심심하겠는가? 한마디로 재미 있는 마을이다.",횡성군
23,횡성 산채마을,강원특별자치도 횡성군 둔내면 삽교로 386,128.263344,37.54496654,http://tong.visitkorea.or.kr/cms/resource/04/1928404_image2_1.jpg,"마을이름에서 알 수 있듯 다양한 산나물을 맛 볼 수 있는 곳이다. 산과 들에 산나물이 지천으로 자라며 5천여 평에 취나물, 곰취 등 산나물을 재배하여 신선한 나물을 직접 수확해 볼 수 있다. 또한 수확한 산나물로 가마솥에 불을 지펴 밥을 지어 먹는 체험은 도시에서는 해볼 수 없는 특별한 추억이 될 것이다.",횡성군
24,횡성 풍수원천주교회(풍수원성당),강원특별자치도 횡성군 서원면 경강로유현1길 30,127.8186624,37.52921281,http://tong.visitkorea.or.kr/cms/resource/77/1583977_image2_1.jpg,"1800년대 초 박해를 피하여 경기도 용인의 신태보(베드로)를 중심으로 한 40여 명의 신자들이 피난처를 찾아 정착한 곳이 풍수원이다. 약 80여 년간 성직자 없이 신앙을 영위해오다가 1887년 한불수호통상조약으로 신앙의 자유를 얻고 1888년 본당을 설립하여 초대 주임신부로 프랑스 르 메르(Le Merre) 신부가 부임하였고, 1896년 2대 주임신부로 한국인 정규하(아우구스띠노)신부가 부임하여 중국인 기술자 진 베드로의 도움으로 1905년에 착공, 1907년 준공, 1909년 낙성식을 가진 역사를 가진 성당이다.초기 박해를 피하던 신자들은 눈을 피하기에 알맞은 이곳에 정착하여, 화전과 토기점으로 생계를 유지하였으며,  성당을 짓기 위하여 산에 올라 나무를 자르고 가마에서 벽돌을 굽는 등 땀과 정성을 봉헌하였다. 풍수원 성당은 한국에서 네 번째로 지어진 성당이자 한국인 신부가 처음 지은 성당으로 그 보존적 가치가 높아 1982년에 지방문화재로 지정되어 관리되고 있다. 1907년 신자들의 손에 의해 직접 지어진 본 성당은 110여 년이 지난 지금에도 여전히 아름다운  모습으로 건재하며, 1920년 이래 거의 매년 성체현양대회가 열렸으며  MBC 미니시리즈 16부작 ‘러브레터’가 촬영되어 젊은 남녀들의 데이트 코스로도 관심을 받기 시작했다.",횡성군
25,횡성 휴선체험원,강원특별자치도 횡성군 횡성읍 태기로개전4길 14-16,128.0148122,37.49979764,http://tong.visitkorea.or.kr/cms/resource/67/2374867_image2_1.jpg,"휴선은 몸과 마음을 모두 쉬면서 자연과 일체화하는 것으로, 신개념의 한국형 휴양문화이다.휴선의 3가지 테마인 기다림,선울림,담채로 자연자원과 천연기능성 물질들을 유익하게 접목시켜 휴선 컨텐츠 및 프로그램을 체험할 수 있다.",횡성군
26,횡성자연휴양림,강원특별자치도 횡성군 갑천면 정포로430번길 113,128.1118745,37.5390977,http://tong.visitkorea.or.kr/cms/resource/66/1842066_image2_1.jpg,"횡성자연휴양림 저고리골은 신라시대 왕실의 휴양소로 소개되고 있으며 지금도 신라 불교 전래 초기의 3층 석탑이 안치되어 있다. 또한 삼한 시대의 유적으로 추정되는 제단과 석인상 및 곳곳의 성터, 남방형 고인돌로 보이는 단지는 옛날 작은 부족국가의 터전을 추측하게 하고 휴양림 내 곳곳의 광활한 논, 밭터와 집터, 꽤 큰 사찰 등은 1970년대 초까지 수십세대의 화전민들이 대대로 살던 터전이기도 한 곳이며 그들이 자활을 위하여 조성한 산나물 단지, 두릅단지, 곳곳의 샘터. 야생화 군락지 등이 좋은 체험장이 되고 계곡을 따라 원시림과 조림 소목 사이로 이루어진 3개의 산책로, 등산로 등과 약수터 등은 삼림욕과 함께 도시의 찌든 피로를 말끔히 씻기에 충분하다.

몸에도 좋고 피부에도 좋은 각종 광물질 함유량이 아주 높은 일급 천연 암반수 물맛이 자랑이며 계곡과 숲 사이로는 30여 동의 캐빈과 방갈로 휴게소 등의 편의 숙박시설과 어린이 놀이터, 오토캠프장, 물놀이터 등을 개설하여 가족 단위, 동호인 단위, 직장인 단위의 조용한 휴식처로 이용할 수 있게 하였다. 수도권 지역에서 2시간여 거리에 위치하고 있고, 오는 길은 최고의 드라이브 코스이며 특히 ‘휴양여행벨트’를 이루고 있다고 말할 수 있을 만큼 온천, 숯가마 찜질방, 스키장, 골프장, 사격장 등이 인근에 함께 자리하고 있다.",횡성군
27,횡성향교,강원특별자치도 횡성군 횡성읍 향교로 12,127.9933785,37.48635713,http://tong.visitkorea.or.kr/cms/resource/25/187325_image2_1.jpg,"조선 태조 때에 현유(賢儒)의 위패를 봉안, 배향하고, 지방민의 교육과 교화를 위하여 창건되었다. 1647년(인조 25)에 대성전을 상량하였고, 1727년(영조 3)에 대성전을 중수하였으며, 1769년에 대대적인 보수를 하였다. 1950년 6·25동란 때 소실되었다가 전교(典校) 한명수(韓明洙)가 1954년에 동재(東齋)와 서재(西齋)를 중건하였고, 1960년에 명륜당을 중건하였다. 1971년 전교 한병수(韓秉洙)가 대성전을 재건하였고, 1978년에 전교 김태진(金台鎭) 등이 대성전·원장(垣墻 : 담)을 개축하였다. 현존하는 건물로는 대성전·명륜당·동무(東?)·서무(西?)·동재·서재 등이 있다. 대성전에는 5성(五聖), 우리 나라 18현(十八賢)의 위패가 봉안되어 있다. 조선시대에는 국가로부터 토지와 전적·노비 등을 지급받아 교관이 교생을 가르쳤으나, 갑오개혁이후 신학제 실시에 따라 교육적 기능은 없어지고 봄·가을에 석전(釋奠)을 봉행(奉行)하며 초하루·보름에 분향을 하고 있다. 이 향교는 강원도 문화재자료 제100호로 지정되어 있으며, 현재 향교의 운영은 전교 1명과 장의(掌議) 수명이 담당하고 있다.",횡성군
28,횡성호,강원특별자치도 횡성군 갑천면 중금리,128.0676671,37.5489985,http://tong.visitkorea.or.kr/cms/resource/83/2604883_image2_1.jpg,"댐으로 계곡을 막아 생성된 횡성호는 분명 횡성군 발전의 규모와 정도를 가늠할 수 있게 만든다. 더불어 발전하는 논리에 고향을 양보해야 했던 수몰민들의 잃어버린 삶을 반추하는 공간이기도 하다. 횡성읍에서 출발해 유유히 흐르는 섬강 줄기를 따라 도착한 횡성댐. 지역 주민들이 휴식공간이기도 한 자그마한 수림공원을 지나 댐을 굽어볼 수 있는 널따란 광장에 이르면 정면으로 횡성댐만의 자랑인 물 홍보관이 자리하고 있다.

* 물 홍보관 
물의 소중함을 일깨우는 ‘주제관’과 물의  물리적인 성질을 재밌게 배울 수 있는 ‘체험관’을 둘러보며 색다른 물의 세계를 경험할 수 있다. 좀 더 생생하고, 다양한 체험을 하고 싶다면 15분가량 상영하는 물 홍보 영화를 감상하는 것도 좋을 듯싶다. 횡성읍에서 댐까지 가는 길도 좋지만 자연경관을 따라 각종 산장이나 전망 좋은 찻집 등이 어우러진 댐 주변도 드라이브하기에 좋다. 특히, 댐 상류 쪽에 위치한 수몰민들의 마음의 고향인 망향의 동산은 횡성댐을 찾는 이들이면 한 번쯤 꼭 들르는 매력적인 관광 명소이다.

* 횡성다목적댐  
정부가 남한강 지류인 섬강의 중하류 지역의 갈수기 용수 부족과 매년 되풀이되는 홍수 피해 문제를 해결코자 수자원 종합개발계획의 일환으로 건설되었다. 현재 원주시를 비롯한 댐 하류 중소도시에 연간 111.6백만㎥의 홍수조절 용량을 갖추게 되어, 댐 하류에 매년 발행하는 홍수 피해를 절감할 수 있을 뿐만 아니라 연간 104Gwh의 전력을 생산 공급하게 되었다.",횡성군
