,title,addr1,mapx,mapy,firstimage,overview,addr2
0,가령폭포,강원특별자치도 홍천군 내촌면 와야리,128.1601919,37.83289511,http://tong.visitkorea.or.kr/cms/resource/55/1842055_image2_1.jpg,"가령폭포는 자연속에 숨겨진 오지의 백암산(1,099m) 서남쪽 기슭에 숨어 있으며 개령폭포라고도 불리운다. 가령폭포는 최근 생태체험 등산 동호인들이 찾으면서 알려지기 시작한 백암산과 더불어 우렁찬 굉음을 토하며 수십미터(50여m)의 낭떠러지를 뒤흔들며 내려꽃는 자태가 웅장하다. 주위에는 수많은 종류의 산나물과 약초, 야생화가 자생하고 있어 산새들의 낙원이기도 하다. 해발 950m 어사리덕 작은 산골샘(약용샘물이 나오는 샘)에서 솟은 청정수가  400리 홍천강으로 발원하는 비레올 계곡의 무명담소와 가령 폭포가 시원함을 더해준다. 가령폭포는 숲에 가려 좀처럼 모습을 드러내지 않는 폭포로 알려져 있다. 폭포 주변에는 인적이 드물어, 아직도 깨끗한 폭포수와 자연스런 멋을 간직하고 있는 폭포 중의 하나이다.",홍천군
1,가리산(홍천),강원특별자치도 홍천군 두촌면 가리산길 260-9,127.9566453,37.87165899,http://tong.visitkorea.or.kr/cms/resource/86/609386_image2_1.jpg,"해발 1,050.9m의 고산으로 춘천시와 홍천군의 경계지역에 위치하며, 산 정상에 서면 탁트인 시야와 발 아래로 펼쳐진 소양호의 풍경이 등산객들의 발을 묶는 곳이다. 산자락 밑에 위치한 조그마한 폭포의 물소리가 사람들의 마음을 포근히 감싸주며, 이 곳에서부터 계곡과 능선을 따라 등산이 시작된다. 이 산은 우거진 숲과 노송들이 등산객들을 맞아주고 정상을 오르게 되면, 1봉 남쪽에는 홍천강으로 발원하는 사시사철 끓이지 않는 석청수 작은 샘물이 등산객을 기다리고 있는 곳이기도 하다. 소양호 쪽으로 하산길을 택하면 배를 타고 피로를 풀 수 있는 등 각 코스마다의 즐거움이 기다리고 있는 아름다운 산이다. 이 일대를 홍천군에서 자연 휴양림 지역으로 조성, 1995년 7월 홍천군이 개장한 가리산 자연휴양림이 있어 통나무집, 야영장, 체육시설을 이용하는 가족휴양지로 각광을 받고 있다.* 면적 305ha",홍천군
2,가리산자연휴양림,강원특별자치도 홍천군 두촌면 가리산길 426,127.9795073,37.86561567,http://tong.visitkorea.or.kr/cms/resource/94/609394_image2_1.jpg,"두촌면 천현리 가리산(해발 1,051m) 기슭의 우거진 숲과 노송들이 기암괴석과  조화를 이루는 곳에 위치한 자연휴양림이다. 이곳에는 다목적광장, 놀이시설, 체육시설 등 70여가지의 다양한 시설이 갖추어져 있으며 텐트장, 취사장 등도 있어 단체야영지로 적당하다. 또한 피톤치드성분이 함유된 통나무집과 산림욕장, 산책로 등이 잘 갖춰져 있어 심신휴양지로도 안성맞춤이다.",홍천군
3,계방산(홍천),강원특별자치도 홍천군 내면 대한동길 363-8,128.4209455,37.75888922,http://tong.visitkorea.or.kr/cms/resource/66/1822266_image2_1.jpg,"계방산(1579.1 m)은 한라산, 지리산, 설악산, 덕유산에 이어 남한에서 다섯 번째로 높은 산이다. 태백산맥의 한 줄기이며, 남한에서 자동차로 넘는 고개 중 제일 높은 운두령(해발 1,089m)이 산자락을 휘감고 있고 주목, 철쭉이 군락을 이루며 특히 겨울에는 눈덮인 소나무 숲이 절경을 이루고 있다. 산세가 설악산 대청봉과 비슷하며, 최근 들어 이 일대가 생태계 보호지역으로 지정될만큼 환경이 잘 보호되어 있는 곳이다.능선길 주변에는 참나무 일색으로 된 단풍으로 황홀하다. 눈이 쌓여 있을 때를 제외하고는 정상까지 3시간이면 오를 수 있으며 산은 높으나 유순한 산세로 산행에 부담이 없고 특히 겨울철에는 적설량이 많아 눈길산행에 등산인들의 많은 사랑을 받고 있다. 이 산에는 각종 약재, 야생화 등이 많이 서식하고 있으며, 산삼이 자주 발견되어 더욱 유명하다. 평창군 용평면 인근에 이승복 생가와 방아다리 약수가 있어 연계관광이 가능한 곳이다.",홍천군
4,공작산,강원특별자치도 홍천군 동면,128.0100618,37.71570588,http://tong.visitkorea.or.kr/cms/resource/30/2609730_image2_1.jpg,"공작산은 높이 887.4 m로 꼭대기에서부터 뻗어나간 능선이 마치 공작의 날개처럼 펼쳐져 있다 하여 공작산이라는 이름이 붙었다.  정상에서 바라보면 홍천군 일원이 한눈에 들어오며, 풍치가 아름답고 깎아 세운 듯한 암벽이 장관을 이루는 곳이다.  정상에서 서남쪽 능선 약 6km 아래에 있는 수타사와 노천리까지 이어지는 약 8km의 수타계곡은 갖가지 멋진 바위들과 아름다운 풍경이 비할 데 없다.산 정상에서 바라보면 홍천군 일원이 한눈에 들어오며, 봄에는 철쭉, 가을철에는 노송과 함께 깎아 지른 듯한 바위의 모습, 그리고 단풍이 보는 이의 마음을 사로잡는다. 눈덮인 겨울산 역시 등산객들을 매료시키는 곳이기도 하다.",홍천군
5,국립 삼봉자연휴양림,강원특별자치도 홍천군 내면 삼봉휴양길 276,128.4608697,37.85213473,http://tong.visitkorea.or.kr/cms/resource/70/608470_image2_1.jpg,"오대산 국립공원 인근의 천연림으로서 아름드리 전나무, 분비나무, 주목 등 침엽수와 거제수나무, 박달나무 등 활엽수가 조화를 이룬 울창한 숲속에 위치하고 있다.깊은 계곡의 맑은 물에는 1급수에서만 자생하는 천연기념물인  열목어가 서식하며 주봉인 가칠봉(1,240m)을 중심으로 좌봉은 응복산(1,155m), 우봉은 사삼봉(1,107m) 등 3개의 봉우리로 둘러싸여 있어 삼봉이라 불리우며, 삼봉의 중심지에는 삼봉약수터가 있는데 이 약수는 위장병에 효험이 있다고 전국적으로 알려져 있어 많은 사람들이 찾고 있다. 약수터 앞 산장과 숲 속의 집(통나무집)을 운영하고 있어 이용객이 이용할 수 있는 숙박시설을  갖추고 있다. 입구에는 돌탑에서 약수터까지는 약 4km(비포장)로  자연경치를 마음껏 즐길 수 있고 가을에는 오색으로 물들은 단풍이 아름다워 많은 이용객이 찾고 있으며, 동해안이 차량을 이용 40-50분 정도 소요되어 여름철 산과 바다를 함께 즐길 수 있는 지리적 이점도 가지고 있는 휴양림이다.",홍천군
6,금학산관광농원,강원특별자치도 홍천군 팔봉산로 2050-112,127.7745108,37.71983988,http://tong.visitkorea.or.kr/cms/resource/97/2494197_image2_1.jpg,"홍천군 북방면, 홍천강과 인접한 자연림 속에 깊숙이 들어앉은 농원이다. 방목 형태의 염소 사육장과 토끼 사육장, 토종닭 방사장 등이 4만여 평 자연 속에 펼쳐져 목가적인 분위기가 물씬 풍기는  별천지를 이룬다. 또 주인 가족이 직접 차려내는 흑염소와 토종닭 요리도 별미로 꼽힌다. 공해가 전혀 없는 산에서 자란 목축과 푸성귀들은 물론, 사람들까지도 전혀 오염되지 않은 모습을 보여준다. 숙박시설 또한 이용 가능하다.",홍천군
7,기미만세공원,강원특별자치도 홍천군 내촌면 물걸리,128.1463918,37.78452546,http://tong.visitkorea.or.kr/cms/resource/03/2494203_image2_1.jpg,"홍천군은 강원도 중서부에 위치, 영동과 영서를 이어주는 교통의 요지이다. 동부와 북부에는 1천m 이상의 고봉들이 솟아 있고 홍천강, 내촌천, 덕치천 등이 군의 가운데를 지난다.홍천은 동학농민군 최후의 항전지이면서 일제강점기에는 만세운동도 치열하게 벌였다. 기미만세공원도 그런 숭고한 뜻을 되새겨주는 명소이다. 1919년 4월 1일 일제 탄압에 항거, 만세운동을 하다 이곳에서 순직한 8열사를 추모하기 위하여 1963년 관과민이 합동하여 팔렬각을 건립하였다. 이후 세월이 흐르면서 팔렬각이 노후되자 당시 만세운동에 참여했던 모든 선열들의 뜻을 기리고자 1990년 2월 28일에 기미만세공원 추진위원회를 구성했다. 군민의 성금과 독지가의 도움, 군비를  투자하여 약 5,700㎡의 부지에 기미만세상을 세우고 부대시설을 하는 등 공원을 조성했다. 8열사를 비롯한 선현들의 애국충절의 높은 뜻을 후세에 길이 전하고자 이룩한 곳이다.",홍천군
8,남노일 강변,강원특별자치도 홍천군 남면 남노일로,127.7598191,37.67261731,http://tong.visitkorea.or.kr/cms/resource/51/1842051_image2_1.jpg,"맑고 깨끗한 물, 넓은 백사장이 펼쳐져 있는 남노일리 강변은 견지 낚시터로 유명하며 낚시도 가능해 여름철 가족단위 피서지로 적합하다. 주변에는 고드레미 관광농원이 있어 매운탕 등 향토음식을 맛볼 수도 있으며, 인근에 복숭아, 포도, 사과, 배 등 대단위 과수원이 있어 관광객의 색다른 관심을 끌고 있다.",홍천군
9,노동서원,강원특별자치도 홍천군 서면 팔봉산로 1198-2,127.690052,37.71570268,http://tong.visitkorea.or.kr/cms/resource/29/2494229_image2_1.jpg,"노동서원(魯東書院)은 우리나라 사학(私學)의 원조인 최충(崔?)의 영정(影幀)과 위패(位牌), 그리고 그의 아들인 최유선(崔惟善)을 봉안(奉安)하고 있다. 최충의 12대 손인 최변이 이곳에 낙향하여 자손들이 번창하자 선생의 영정을 모신 영당을 지었다가 후에 노동서원이라 개칭되었다. 서원에 봉안된 두 분의 영정은 1628년 (영조 24)의 거작(巨作)으로서, 1984년 6월 27일 강원도 일반 동산문화재(江原道 一般 動産文化財)로 각각 등록되었으며 그 외 제기(祭器) 일체가 또한 문화재로 등록, 현재 서원(書院)에 보관되어 있다. 대지 1500평에 건평 20평의 정전(正殿)과 14평 의 동재(東齋), 서재(西齋)가 있으며 내삼문(內三門)과 외삼문(外三門)이 각각 2棟씩 있다. 정전(正殿)에는 문헌(文憲), 문화(文和) 두 분의 영정과 위패가 모셔져 있으며 동재와 서재는 유인(儒人)들이 체류하며 학문을 토론하고 강론하는 곳이다. 또 유교적 전통문화 계승과 발전 을 위한 행사의 장으로도 쓰이며 특히 인근 초,중,고 학생들의 유적순례지로서 좋은 장소가 되고 있다. 본 서원은 원래 홍천군 북방면 노일리에 있던 것을 수호(守護)의 어려움으로 인 하여 1932년 5월에 이곳으로 옮겼으며 6.25동란에 소실된 동재(東齋)와 서재(西齋) 일부를 개축(改築)하고 수차에 걸쳐 중수(重修)하였다. 또한 정례행사인 제향을 유림행사(儒林行事)로서 받들며 년 1회 봉제사를 올린다.",홍천군
10,마곡유원지,강원특별자치도 홍천군 서면 마곡리,127.5904858,37.72245283,http://tong.visitkorea.or.kr/cms/resource/87/2494387_image2_1.jpg,"북한강을 따라 거슬러 올라 가면 거기에 장장 143km를 흐르며 한반도 중허리를 적셔 내리는 홍천강이 있다.홍천군 서석면 생곡리 미약골산에서 발원, 내촌천 (乃村川)으로 흐르는 이 물은 장남천, 야시대천, 풍천천, 덕치천을 합한 후 홍천읍 지나 오안천, 성동천, 어룡천, 중방천과 합류, 비로소 큰 물줄기를 이룬 다음 경기도 가평군 설악면과 춘천시 남면 관천리 경계에서 북한강으로 흘러든다. 홍천강이 북한강과 만나기 전 홍천군 서면 마곡리에 빚어 놓은 강변이 마곡유원지이다. 맑은 강물과 강변으로 드넓게 펼쳐진 백사장, 백사장 주변을 둘러싸고 있는 나무 그늘이 어우러져 있다. 이곳에는 수심이 깊어 윈드서핑이나 모터보트, 수상스키를 즐기기에 적합하며, 강가에서 직접 낚시로 물고기를 잡는 인파들도 많아 매운탕의 진미를 만끽할 수 있는 곳이기도 하다. 모래 사장도 널찍하고 강변에서는 쉬엄쉬엄 낚시도 드리우며 하루를 즐길 수 있는 곳이다.",홍천군
11,모곡밤벌유원지,강원특별자치도 홍천군 서면 모곡리,127.6068877,37.70312482,http://tong.visitkorea.or.kr/cms/resource/08/219508_image2_1.jpg,"북한강 따라 거슬러 올라가면 거기 장장 143km로 서류(西流)하며 한반도 중허리를 적셔 내리는 홍천강이 있다. 홍천군 서석면 생곡리 미약골산에서 발원, 내촌천(乃村川)으로 흐르는 이 물은 장남천, 야시대천, 풍천천, 덕치천을 합한 후 홍천읍을 지나 오안천, 성동천, 어룡천, 중방천과 합류 비로소 큰 물줄기를 이룬 다음 경기도 가평군 설악면과 춘천시 남면 관천리 경계에서 북한강으로 흘러든다. 홍천강은 물이 차지 않아 물놀이터로 각광받는 곳이지만 수심이 깊어지는 곳이 있어 위험하다. 일명 홍천강 유원지로 널리 알려진 밤벌유원지는 여름철 피서객들이 많이 찾는 곳이다. 모곡명사십리라고도 부르며, 유난히 모래가 곱고,  빛깔이 깨끗하다. 기나긴 여정을 한 홍천강은 이 곳 모곡유원지에 이르러 비로소 큰강의 형체를 이루게 되며, 맑은 강물과 넓게 펼쳐진 백사장, 백사장 주변을 둘러싸고 우뚝 서 있는 밤나무와  미류나무숲이 피서객들의 더위를 식혀주기에 충분한 곳이다. 오토캠핑장과 물놀이 하기 좋은 강가로 잘 알려진 모곡 유원지는 약1km에 달하는 강변이 밤톨만한 자갈과 은모래로 덮혀 있고 아름드리 밤나무와 미루나무 숲이 피서객들의 더위를 식혀준다. 수심이 얕아 물 깊이가 어른 종아리 정도로 아이들이 튜브 없이도 물 속에 앉아 놀 수 있을 정도다.메기, 피라미, 쉬리 등 어족 자원이 풍부해 투망이나 견짓대 같은 간단한 낚시도구로도 물고기를 잡는 재미를 맛 볼수 있다. 견짓대나 생필품은 강변 상점에서 쉽게 구입이 가능하다. 이곳은 민물고기 매운탕이 별미이며 강가에서 직접 낚시를 하는 인파들도 자주 목격된다. 유원지에는 음수대와 수세식 화장실을 갖추고 있어 편리하고, 다만 여름철 성수기에는 밤늦게까지 소란해 아늑한 캠핑과는 거리가 멀다. 그러나 얕은 강변에서 견지 낚시를 비롯해 튜브, 보트만 있으면 어린아이가 있는 가족 물놀이 장소로 제격이다. 이 주변에는 한서 남궁억 선생이 세우신 한서초교와 한서 선생의 묘소가 말끔히 단장되어 있으며, 무궁화 묘목을 길러 학생들에게 나눠주었던 모곡학교, 남궁억기념관과 묘소, 무궁화동산 등이 있어 피서객들이 종종 찾고 있는 곳이며 이 일대는 보리울 마을로도 널리 알려진 곳이기도 하다. ",홍천군
12,모둘자리 힐링체험마을,강원특별자치도 홍천군 서석면 검산길 147-19,128.2305364,37.71191603,http://tong.visitkorea.or.kr/cms/resource/31/2598431_image2_1.bmp,"모둘자리 힐링체험마을은 홍천 아미산 자락의 계곡이 흐르는 분지에 자리한다. 사전 예약제로 운영되는곳으로 언제나 여유롭고 쾌적하게 프라이빗한 시간을 보낼수 있으며, 하룻밤 머무는 여행객은 다양한 자연속 힐링체험을 무료로 마음껏 이용할수 있기에 가족단위여행부터 회사워크샵까지 다양한 연령층이 선호하는 여행지이다. 4계절 내내 다양한 계절별 액티비티와 더불어 지역로컬푸드로 차려지는 정성가득한 식사. 그리고 한국식정원으로 가꿔진 전통한옥에서의 하룻밤까지. 지친일상을 벗어나 자연속에서의 짧지만 알찬 휴가를 꿈꾼다면 안성맞춤인 곳이다.",홍천군
13,무궁화수목원,강원특별자치도 홍천군 북방면 영서로 2937-12,127.8350192,37.72129639,http://tong.visitkorea.or.kr/cms/resource/65/2774065_image2_1.jpg,"홍천에 자리한 무궁화수목원은 국내 최초의 무궁화 테마 수목원이다. 우리나라 국화인 무궁화를 보존하고, 평생 무궁화를 아꼈던 독립운동가 한서 남궁억(1863~1939) 선생의 업적을 기리는 공간으로 지난 2017년 처음 문을 열었다. 수목원 내에는 무궁화 조형물과 무궁화 미로원을 비롯해 억새원, 배나무원 등 16개 주제원과 숲속 산책로인 무궁 누리길, 어린이 놀이터 등 다양한 즐길 거리가 방문객들을 맞아준다. 무궁화수목원에서 이어지는 등산로 '힐링 숲길'도 가리산을 한눈에 담을 수 있는 숨은 비경으로 꼽힌다. 무궁화에 얽힌 흥미로운 이야기를 들을 수 있는 해설프로그램도 운영 중이며, 무궁화 꺾꽂이 체험과 무궁화 열쇠고리 만들기 등 체험프로그램도 알차다.",홍천군
14,삼봉약수,강원특별자치도 홍천군 내면 월둔길 63-2,128.4644994,37.86714972,http://tong.visitkorea.or.kr/cms/resource/86/1732286_image2_1.jpg,"원도 홍천군 내면 광원리 실론골에 위치한 약수터로 조선 시대에 실론약수, 실룬약수라 불렸다. 강주봉인 가칠봉을 중심으로 좌봉은 응복산, 우봉은 사삼봉 등 3개의 봉우리로 둘러싸여 있어 삼봉이라 불리우며, 삼봉의 중심지에는 삼봉약수터가 있는데 세 봉우리 가칠봉, 응복산, 사삼봉의 정기를 받은 약수에는 철분 불소, 탄산이온, 망간 등이 들어있어 위장병, 피부병, 신장병, 신경쇠약 등에 효험이 있다고 널리 알려져 있어 전국에서 많은 사람들이 찾아오는 천연기념물 약수이다.",홍천군
15,서봉사계곡 마을관리휴양지,강원특별자치도 홍천군 서석면 구룡령로 2838,128.2174656,37.70496937,http://tong.visitkorea.or.kr/cms/resource/28/1583728_image2_1.jpg,"홍천 응봉산 남쪽 기슭을 흐르는 비경의 골짜기가 서봉사 계곡이다.
기암괴석 사이를 감도는 푸른 물과 짙은 숲, 웅장한 암벽이 어우러져 심산유곡을 이룬다. 봄부터 가을까지 가족끼리 찾기에 알맞은 공간이다.",홍천군
16,소노벨 비발디파크 오션월드,강원특별자치도 홍천군 서면 팔봉리,127.6857793,37.64825765,http://tong.visitkorea.or.kr/cms/resource/19/1583719_image2_1.jpg,"강원 지역의 능선이 굽이치는 청정 수풀림 속에 상상을 초월하는 바다를 옮겨 놓은 듯한 착각을 불러일으키고자 세워진 오션월드는 이집트를 쏙 빼닮았다. 이글거리는 태양의 햇살이 작열하는, 지중해와 아프리카 대륙이 맞닿아 있는 이집트에는 인류의 삶에 축복을 주는 오아시스와 고대 이집트의 화려한 문화유산이 고스란히 담겨있는 신비로운 나라로 세계 각국의 관광객들에게 꾸준히 사랑받고 있다. 피라미드, 스핑크스, 파라오 등 이집트의 숨결을 느낄 수 있는 다양한 조형물들은 오션월드를 더욱 매력적인 곳으로 빛나게 한다.오션월드는 자연환경의 훼손을 최대한 억제한 친환경 워터파크이며, 모든 연령이 편안한 휴식과 짜릿한 즐거움을 동시에 누릴 수 있다. 전체 규모는 실내존 43,291㎡, 익스트림존 25,787㎡, 파도풀존 19,284㎡, 다이나믹존 31,242㎡, 메가슬라이드존 7,041㎡로 총 126,645㎡이며, 이는 축구장 14배 넓이로 동시 수용 가능 인원은 2만 3천 명이다.오션월드는 크게 실내존, 익스트림존, 다이나믹존, 메가슬라이드존으로 구분되며, 이중 실내존은 파도풀, 유수풀, 튜브/바디슬라이드, 바데풀, 유아/어린이용 워터플렉스, 찜질방, 야외 노천탕 등 다양한 연령층이 함께 이용할 수 있어 가족의 정을 더욱 돈독하게 한다.EXTREME ZONE익스트림존은 그 이름에 걸맞게 국내 유일의 8피트 V파도를 자랑하는 서핑마운트와 연속되는 파도의 스릴감을 맛보실 수 있는 익스트림리버 등 젊은이들에게 각광받고 있다.DYNAMIC ZONE다이나믹존에는 300m 세계 최장 몬스터 블라스터, 6인승 슈퍼 부메랑고, 초대형 자이언트 워터플렉스 등 스릴감 넘치는 테마 물놀이 시설로 가득 차 짜릿한 즐거움을 선사할 것이다.MEGA SLIDE ZONE2011년 새롭게 탄생한 메가슬라이드존은 세계최초로 운영되는 슈퍼 S라이드, 국내 최초/최다 8인승 카이로레이싱, 고공낙하 하이스피드 슬라이드, 가족형 패밀리 레프트 슬라이드 등 다양한 스릴을 만끽할 수 있다.",홍천군
17,수타사,강원특별자치도 홍천군 영귀미면 수타사로 473,127.9592114,37.69872356,http://tong.visitkorea.or.kr/cms/resource/91/1583691_image2_1.jpg,"공작산은 해발 887m로 산 정상에서 바라보면 홍천군 일대가 한눈에 들어오며, 산세가 공작이 날개를 펼친 모습과 같다하여 붙여진 이름이다. 또한, 홍천읍에서 바라보면 거인이 하늘을 향해 누워있는 형상을 하고 있는 모습이다. 봄에는 철쭉, 가을에는 단풍이 매우 아름다우며 기암절벽과 분재모양의 노송군락, 눈 덮인겨울산도 일품이다. 수타사에서 동면 노천리까지 약12km에 이르는 수타사 계곡에는 넓은 암반과 큼직큼직한 소(沼)들이 비경을 이루고 있고,  계곡 양쪽으로는 기암절벽과 빽빽이 우거진 숲이 호위하고 있어 이곳에서 잠시 휴식을 취하다보면 비경삼매에 빠져들기 일쑤이다. 또한, 한국 100대 명산 공작산 끝자락에 자리한 천년 고찰 수타사는  신라 33대 성덕왕 7년(서기 708년)원효대사에 의해 창건되었다고 전해지며 대적광전 팔작지붕과 1364년 만든 동종, 3층석탑이 보존되어 있고 월인석보(보물)를 비롯한 대적광전, 범종, 후불탱화,홍우당부도 등 수많은 문화재를 소장하고 있는 영서내륙 최고 고찰이다.",홍천군
18,수타사계곡,강원특별자치도 홍천군 동면 수타사로 473,127.9565338,37.6993651,http://tong.visitkorea.or.kr/cms/resource/08/2032608_image2_1.jpg,"홍천읍에서 동쪽으로 10km쯤 떨어진 곳에 있는 공작산(887m)에서 부터 내려오는 덕지천의 상류가 계곡을 이루고 있는데, 계곡 안에 수타사가 있어 수타사계곡이라 불린다.  수타사에서 동면 노천리까지 약 12km에 이르는 수타사계곡에는 넓은 암반과 큼직큼직한 소(沼)들이 비경을 이루고 있어 휴식을 취하며 주변경관을 감상할 수 있다. 계곡 양쪽으로는 기암 절벽과 빽빽히 우거진 숲이 호위하고 있다.",홍천군
19,용소계곡,강원특별자치도 홍천군 내촌면 광암리,128.1294964,37.86763772,http://tong.visitkorea.or.kr/cms/resource/12/219512_image2_1.jpg,"내촌면 광암리에서 발원하여 두촌면 괘석리를 거쳐 천현리에 이르는 10여km의 계곡으로 맑은 물과 기암괴석이 조화롭게 펼쳐져 있는 곳이다. 우거진 숲과 곳곳에 펼쳐지는 소와 너래바위들이 어우러져 비경을 자랑하는 곳으로 내설악에 버금가는 아름다운 계곡이다. 봄에는 철쭉이 가을에는 아름다운 단풍이 갈대와 어우러지고, 여름철에는 시원함을 주는 이 계곡에는 옛날 절터와 삼층석탑이 아직 남아 있으며, 이 삼층석탑을 옮기려 할 때 호랑이가 나타나는 바람에 옮기지 못했다는 전설이 전해 내려오고 있다. 이 계곡은 가족단위의 등산이나 산림욕 코스로 적당하며 당일 산행으로 알맞은 곳이다.",홍천군
20,팔봉산(홍천),강원특별자치도 홍천군 서면 한치골길 1124,127.6951741,37.70307368,http://tong.visitkorea.or.kr/cms/resource/37/1842037_image2_1.jpg,"팔봉산(328.2m)은 흔히 두 번 놀라게 하는 산으로 알려져 있다. 낮은 산이지만, 산세가 아름다워 놀라고, 일단 산에 올라보면 암릉이 줄지어 있어 산행이 만만치 않아 두 번 놀란다는 것이다. 주능선이 마치 병풍을 펼친 듯한 산세로 예부터 ""소금강"" 이라 불리워질 만큼 아름답다. 게다가 주능선 좌우로 홍천강이 흐르고 있어 정상에 올라서 바라보는 전망이 더 없이 좋으며 산행 후 물놀이도 겸할 수 있는 곳이다. 관광지 내에 풋살경기장이 있어 단체관광객의 체육행사를 할 수 있으며, 야외공연장을 설치 공연활동도 가능하다.",홍천군
21,팔봉산관광지,강원특별자치도 홍천군 서면 한치골길 1124,127.695113,37.70305424,http://tong.visitkorea.or.kr/cms/resource/14/1583714_image2_1.jpg,"해발 302m의 나지막한 산으로 여덟개의 봉우리로 이루어진 산이어서 팔봉산이라 하며, 봄/가을은 등산객들이, 여름철은 피서객들이 많이 찾는 곳으로, 여덟 봉우리마다의 비경과 기암괴석이 산허리를 감싸고 흐르는 맑고 깨끗한 홍천강 물이 넓게 펼쳐진 백사장과 어우려져 한폭의 그림 같은 절경을 간직한 곳이다.",홍천군
