,title,addr1,mapx,mapy,firstimage,overview,addr2
17,미리내 성지,경기도 안성시 양성면 미리내성지로 420,127.258638,37.14618854,http://tong.visitkorea.or.kr/cms/resource/23/1589723_image2_1.jpg,"경기도 안성에서 북쪽으로 40리쯤 떨어져 은하수라는 뜻의 아름다운 우리말로 불리우고 있는 미리내는 한국 최초의 사제 김대건 신부의 묘소와 그의 어머니 우르술라, 김신부에게 사제품을 준 조선 교구 제3대 교구장 페레올 주교 그리고 김 신부의 시신을 이곳에 안장했던  이민식 빈첸시오의 묘가 나란히 자리잡고 있는 곳이다. 성지에 들어서면 고요하면서도  편안함이 가슴에 와 닿는다. 비록 신자가 아니더라도 성지를 둘러보면 가슴이 깨끗해짐은 느낄 수  있다. 이곳이 미리내로 불리게 된 것은 천주교신자들이 신유박해(1801년)와 기해박해(1839년)를 피해 이곳으로 숨어 들어와 교우촌을 형성하면서 밤이면 집집에서 흘러나오는 불빛이  달빛 아래 비치는 냇물과 어우러져 마치 은하수처럼 보였다고 하여 붙여졌다.본래 미리내는 경기도 광주, 시흥, 용인, 양평, 화성, 안성 일대 등 초기 천주교 선교지역을 이루었던 곳의 하나이다. 따라서 김 신부가 미리내에 묻힌 지 50년 후인 1896년 비로소 본당이 설정됐을 때 이곳에는 이미 1천6백여명의 신자가 있었다. 26세의 나이에 처형당한 김대건 신부는 조정에서 장례마저 치루지 못하게 하여 처형당한 지 40일이 지난 다음에야 이민식 빈체시오가 간신히 시신을 빼내어 남의 눈을 피하며 일주일을 등에 지고 이곳 미리내로 옮겨와 안장할 수 있었다. 미리내는 1972년부터 본격적인 성역화 작업이 시작되고 1989년에 웅장한 103위 성인 기념 대성전이 완성되었다. 성지에 들어서면 제일 먼저 눈에 들어어는 것은 성지 한 가운데 웅장하게 서있는 기념성당이다. 이 성당은 천주교 103위의 시성을 기념하기 위해 세운 것이고 기념성당 뒤쪽으로 난  십자가의 길에는 예수가 로마병사에게 붙잡혀 십자가에 매달려 고통받고, 죽으시고  무덤에 묻히기까지의 과정이 담겨져 있는 청동조각 15점이 서 있다. 김대건 신부의 무덤과 하악골(아래턱뼈)이 모셔져 있는 미리내성당, 김신부의 동상, 성모성당, 게쎄마니 동산(여기저기 나뒹구는 바위를 자연 그대로 이용한 동산)등을 돌아보는데 2~3시간이 소요된다.* 김대건 1822~1846(순조22 ~ 헌종12)우리 나라의 최초의 신부, 천주교 성인. 교명 앙드레. 본관 김해. 충청 남도 내포에서 독실한 천주교도 부모사이에서 태어났다. 천주교의 탄압을 피하여 경기도 용인의 골배마을로 이사와서 살았다. 어려서부터 할머니와 부모님에게서 천주교의 교리를 익혔다. 1836년(헌종 2) 프랑스 신부 모방한테 영세를 받고 신학생으로 선발되어 최양업, 최방제 등과 함께 중국의 마카오에  건너가, 파리 외방 전교회의 칼레리 신부로부터 신학을 비롯한 서양학문과 프랑스어. 라틴어 등 을 배웠다. 그 후 마카오에서 민란이 일어나자 1839년에 필리핀의 마닐라에 가서  공부하여 6개국어를 익히었다. 1842년(헌종 8) 프랑스 군함 제독 세실의 통역관으로 있다가 몇차례의 실패 끝에 1845년(헌종 11) 고국을 떠난 지 9년만에 돌아왔다. 사람들의 눈을 피해서  포교에 힘쓰다가 페레올 신부를 데려오기 위하여 쪽배를 타고 중국 상하이에 건너갔다.  거기서 탁덕으로 승품되어 24세의 젊은 나이에 한국 최초의 신부가 되었다.그 후 페레올.다블뤼 두 신부를 데리고 충청남도 강경을 거쳐서 귀국하였다. 그는 지방전도에 나서 10년 만에 고향에서 어머니를 만났으나, 아버지는 순교한 뒤였다.1846년 최양업과 다른 신부의 입국을 위하여 비밀 항구를 찾다가 체포되었는데, 서울로 끌려와 40회에  걸친 문초를 받고 9월 새남터에서 순교(당시 26세)하였는데 당시의 상황으로 보아 참수하여 군문 효수할 것인데 헌종이 편법을 써서 효수하지 않고 매장하게 하였는데 매장 40일 후에  양성면 미리내에 사는 이민식 씨에 의하여 밤으로 7일에 걸쳐 운구하여 현재 미리내묘지에 안장하였으며, 1925년 7월 5일 로마교황 비오 XI세로부터 복자위에 올림을 받았고1984년 5월  6일 교황 요한 바오로 2세가 우리 나라에 와서 직접 거행한 시성식에서 카톨릭의 성인 자리에 올랐다.",안성시
18,미산저수지,경기도 안성시 양성면 미산리,127.258269,37.13080143,http://tong.visitkorea.or.kr/cms/resource/97/2750497_image2_1.png,경기도 안성에 있는 저수지이다. 수려한 풍경을 품고 있는 호수의 전경과 걷기 좋은 산책로는 일상에서 지친 심신을 치유해 준다. 저수지 주변에 예쁜 카페가 많아 데이트 장소로 많이 찾는다. 저수지 둘레길인 솔뫼길을 걷다 보면 미리내 성지도 만날 수 있는데 이곳에서는 우리나라 천주교 역사를 살펴볼 수 있다.,안성시
19,바우덕이 묘,경기도 안성시 서운면 청용리,127.2783676,36.91612378,http://tong.visitkorea.or.kr/cms/resource/57/738557_image2_1.jpg,"바우덕이는 안성 청룡사 옆 골짜기인 불당골에서 지냈다고 한다. 혹은 청룡사에서 숙식했다는 주장도 있다.  ""안성 청룡 바우덕이…""로 시작하는 바우덕이 속요에도 나와 있지만 바우덕이와 안성 청룡사는 뗄래야 뗄수 없는 관계를 갖고 있다. 당시 전국의 사찰들은 재정에 많은 어려움이 있었는데, 청룡사에서는 사당패를 보호하는 역할을 하였고, 바우덕이패는 공연을 하면서 먹거리며 현금을 조달해 주었기 때문에 자연스럽게 상호 공생관계를 형성하게 되었다. 그러므로 바우덕이를 이해하기 위해서는 안성 청룡사를 찾아보아야 한다. 청룡사는 큰 사찰은 아니지만 매우 아름다운 대웅전으로 유명하다.",안성시
20,바우덕이사당,경기도 안성시 서운면 청룡길 128-29,127.2918609,36.91326879,http://tong.visitkorea.or.kr/cms/resource/52/2481252_image2_1.jpg,"바우덕이는 안성 남사당의 전설적인 인물이면서 한국 남사당 역사에서 유일무이하게 여성 꼭두쇠로 알려진 인물이다.구전에 의하면 5살 때 머슴으로 살던 아버지가 병으로 사망하자 남사당패에 맡겨져 성장하면서 재주를 익혀 염불, 소고춤, 줄타기 등 남사당의 모든 기예를 익혔다고 한다. 15살 때 당시 안성 남사당패를 이끌던 윤치덕(꼭두쇠)이 사망하자 남사당패의 관례를 깨고 여성의 몸인 바우덕이를 우두머리인 꼭두쇠로 선출했다고 한다.  그리고 바우덕이는 여성 꼭두쇠라는 특성과 탁월한 기예로 안성 남사당패를 최고의 인기패로 육성했다.전해오는 이야기에 의하면 1865년(고종2)년 경복궁 중건 공사 때 인부들을 위로하고자 전국의 남사당패를 불러들였는데 이때 안성에 거주하던 이승지의 후원으로 바우덕이 패와 안성 돌우물 패가 최고의 인기를 얻어 흥선대원군으로부터 옥관자기를 하사받았다고 한다. 바우덕이가 살던 곳은 청룡사가 위치한 불당골인데 이 곳은 예로부터 남사당패가 겨울을 나던 장소이다. 이 곳 남사당패는 청룡사의 신표를 받아 봄부터 가을까지 전국을 누비고 겨울에는 이곳에 와서 월동을 했다고 한다. 바우덕이는 23세 때 폐병으로 사망했다고 전해지고 마지막에 그를 돌보던 이경화가 망인의 유지에 따라 청룡골 입구 개울가 양지 바른 곳에 매장했다고 알려져 있다.",안성시
21,박두진 시비,경기도 안성시 보개면 종합운동장로 205,127.3231164,37.01555201,http://tong.visitkorea.or.kr/cms/resource/55/2480355_image2_1.jpg,"지난 1998년 박두진 시인의 시비가 시인이 어린 시절 뛰어놀던 보개면 안성시립 보개 도서관 입구에 건립되었다. 시비에는 고향 전문이 실려있고, 해의 소재가 되었다는 백운산이 시비를 마주하고 있다. 금광면 오흥리에는 시인의 숨결이 고스란히 남아있는 박두진 문학 연구소가 있으며 1982년 시인이 손수 썼다는 친필 현판은 오는 이의 발길을 머물게 한다. 시인의 묘소는 보개면 기좌리에 있다.",안성시
22,서운산성,경기도 안성시 서운면 산평리,127.2668267,36.92874434,http://tong.visitkorea.or.kr/cms/resource/60/2736260_image2_1.jpg,"이 성은 북산리성지라고도 불리는데 차령산맥의 주봉인 서운산의 지봉에 축성된 테뫼식의 토축산성이다. 산성이 있는 곳은 평균 고도가 해발 490m쯤 되는 고지이며 심한 경사를 이루고 있다. 산성은 봉우리 2개를 연결하여 마치 말안장 모양을 하고 있는데, 남벽의 일부를 제외하고는 비교적 성벽이 잘 남아있다. 토축은 능선을 따라 소토법으로 축조하였으며 내황(內隍)을 만들었다. 성은 가파른 자연지형을 이용하고, 부분적으로 토축을 쌓아 보완하였는데 성의 전체 둘레 중 자연지형을 이용한 부분이 620m이고 축성한 부분은 450m에 달한다. 성내에는 장대(將臺)로 사용되던 장수바위가 있는데, 현재는 헬기장으로 이용되고 있다. 성안에 문지가 3곳 있는데 북쪽에 2개, 남쪽에 하나가 있다.그중 남문이 서의 주된 통로였을 것으로 생각된다. 남문 터 근처에는 평탄한 대지가 있으며 성의 북동부에는 5∼6m 정도 높이의 흙 계단이 있다. 5곳의 우물 터가 발견되어 비교적 물이 풍부함을 알 수 있다. 이 성의 축성 연대는 정확히 알 수 없으나, 구전에 의하면 임진왜란 당시 이 지역의 의병장으로 활약한 홍계남 장군이 북상하는 왜적을 막기 위해 선조 25(1592) 년에 축성하였다고 하나 그전부터 있던 것을 임란 때 개축하여 사용했던 것으로 보인다.* 규모 - 둘레 1070m, 높이 6∼8m, 폭2∼4m ",안성시
23,서운산자연휴양림,경기도 안성시 금광면 배티로 185-39,127.313772,36.94243527,http://tong.visitkorea.or.kr/cms/resource/57/2750557_image2_1.png,경기도 안성시 금광면에 위치한 휴양림이다. 청룡이 상스러운 구름을 타고 내려왔다고 하여 이름 붙여진 서운산 자락에 있다. 도심지에서는 느낄 수 없는 산속의 맑은 공기와  나무 등 자연환경이 좋다. 잔디광장에서는 아이들이 맘껏 뛰놀 수 있어 가족 단위 나들이 장소로 좋다. 드라마 '도깨비' 촬영지로 유명한 석남사로 이어진 산책로와 서운산 등산로가 조성되어 있어 가벼운 걷기를 하면서 자연의 품속에서 몸과 마음 모두 힐링할 수 있다.,안성시
24,석남사(안성),경기도 안성시 금광면 상촌새말길 3-120,127.3064867,36.93993543,http://tong.visitkorea.or.kr/cms/resource/24/1221924_image2_1.jpg,"안성시에서 12킬로미터 떨어진 서운산 동쪽 기슭에 있다. 서운산 북쪽의 석남사는 조그마한 사찰이지만 절 입구에서 대웅전까지 오르는 돌계단의 경관이 볼 만하다. 고려 광종이 아들 혜거국사가 크게 중건하는 등 이름 높은 스님들이 석남사를 거쳐갔다. 석남사는 당시 수백인의 참선승이 머물렀던 수행도량으로 알려졌다. 정면 3칸, 측면 3칸의 대웅전은 겹쳐마 맞배지붕으로 단촐하면서도 당당해 보인다. 대웅전 바로 아래 학이 나는 듯한 팔작지붕집이 영산전과 조화를 이루며, 옹기종기 터를 다스린 석남사 경내는 서운산의 풍취에 푹 빠져들게 하는 매력이 풍겨난다. 영산전은 정면 3칸, 측면 2칸의 다포계 공포를 갖춘 팔작지붕집이다. 날렵한 지붕 끝이 숲속에 살포시 가려있어 단아한 운치를 더한다. 이 건물은 공포의 짜임새가 조선 초기와 중기 사이의 특징을 갖고 있다는 점에서 건축사적 의의가 크다. 신라 문무왕 20년에 고승 담화덕사가 창건했으며 이후 고려시대 혜거국사가 크게 중수했다. 경내에는 16나한이 모셔진 영산전을 비롯해 대웅전, 마애석불 등의 도지정문화재와 석탑, 부도 등 향토유적이 있다. ",안성시
25,석남사계곡,경기도 안성시 상촌새말길 3-120 석남사,127.3070755,36.93924107,http://tong.visitkorea.or.kr/cms/resource/13/2740213_image2_1.jpg,"석남사계곡은 안성 서운산 자락에 위치한 석남사 위쪽에서 흐르고 있는 계곡이다. 석남사는 통일신라 고승 석선이 세웠다. 대웅전과 영산전 두 불전을 중심으로 요사채, 누각, 탑, 부도, 마애불이 있다. 최근 드라마 <도깨비> 촬영지로 알려져 있어 많은 사람들이 방문한다. 특히 한 여름에 산에서 흐르는 석남사계곡에서 피서를 즐기기 좋다.",안성시
26,선비마을,경기도 안성시 양성면 덕봉길 45,127.1875889,37.0447351,http://tong.visitkorea.or.kr/cms/resource/12/2632712_image2_1.bmp,"마을의 안녕과 풍요를 기원하며 500년 동안 단 한 해도 거르지 않고 지내온 '산신제' 500년의 역사 동안 해주오씨를 명가로 만들었던 훌륭하신 선대 조상님들의 흔적.훌륭한 분들의 정신을 존경하고 계승하기 위해 매년 올리는 재례가 있다. 마을 뒤 고성산 아래 풍수지리의 삼수혈을 따라 자연스럽게 만들어진 풍수지리의 마을이며, 선대 어르신을 공경하는 후손의 마을이 가득 담긴 19개의 크고 작은 묘역들과 선비 정신으로 충, 효, 예를 지키며 살아온 마을의 전통 관습 등 옛 모습 그대로 잘 보존된 마을이다. 예전부터 해주오씨가 모여 살던 해주오씨 집성촌으로, 관련 문화·역사 자원을 비롯해 빼어난 자연, 생태 자원 및 인적 자원을 보유하고 있다. 또 3·1운동의 본거지로 근대사에서 아주 중요한 역할을 했던 마을이며, 안성선비마을은 선비정신과 문화, 역사를 소중히 간직하고 지키며 살고 있다. 그 중심에 해주오씨 문증의 '조상과 가족을 위하는 마음'이 있는 곳이다.",안성시
27,선유동마애불사존불상,경기도 안성시 일죽면 선유동길,127.4649033,37.12422536,http://tong.visitkorea.or.kr/cms/resource/97/2481397_image2_1.jpg,"고려시대 안성의 절경인 신흥리 선유동 선유암 상봉(上峯)에 있는 화강암질의 큰 암벽에 각기 독립적으로 얕게 음각선해 놓은 작품으로 추정되는 4존불상이다.첫번째의 마애불은 동북향을 하고 있으며, 소발(素髮)의 머리 위에 육계가 있고, 양미안(兩眉眼), 비량(鼻梁), 구순(口脣)이 정제되었으며, 양 귀는 밑으로 길게 흘러 내렸고 원형의 상호(相好)는 원만하며, 목에는 삼도(三道)가 희미하게 엿보이고, 몸체는 마멸되어 식별하기 어렵지만 자연석의 대좌가 있음을 알 수 있으며, 전체 높이는 230cm이다. 두번째 마애불의 상호는 밑으로 흐르고, 양 귀는 길게 늘어졌으며, 법의의 의문이 희미하게 보이나 마멸이 심하고 전체 높이는 290cm이다. 세번째 마애불은 소발(素髮)의 머리에 육계가 보이고, 통견의 법의는 의문이 희미하지만 마멸이 심하고 전체 높이는 290cm이다. 네번째 마애불은 좌상(座像)으로 추정되고, 상호(相好:얼굴)가 방형(方形)에 가까우며, 귀는 짧은 편이고 목에는 삼도가 있으며, 법의는 통견으로 원호의 의문이 보이지만 마멸이 심하고, 전체 높이는 340cm이다. ",안성시
28,솔밭공원,경기도 안성시 안성맞춤대로 1143,127.2692935,37.01553993,http://tong.visitkorea.or.kr/cms/resource/80/757280_image2_1.jpg,"경기도 안성시 금산동에 위치한 솔밭공원은 17,000㎡ 규모에 흑백 자갈, 흑호박돌, 잡석으로 맨발 산책로를 만들어 놓고 그?주변에는 국화를 심어놓아 은은한 꽃 향기를 맡으며 발마사지 할 수 있다. 뿐만 아니라 이 공원은 자연 친화적으로 꾸며져 있어 시민들의 건강 증진에도 큰 도움을 주고 있다. 2008년 말쯤 안성 시립 중앙도서관이 솔밭공원 부지로 이전하면서 도서관과 공원이 공존하며 안청중학교 진입로 앞까지 약 100M 남짓한 지압 길이 이어져 있다.",안성시
29,스포츠몬스터 안성,경기도 안성시 공도읍 서동대로 3930-39,127.1473106,36.99474015,http://tong.visitkorea.or.kr/cms/resource/61/2675961_image2_1.bmp,"스포츠몬스터는 놀이와 스포츠가 융합된 체험시설로, 세상에 없던 신개념 스포츠 놀이 문화공간이다. 동에 소질이 없어도, 개인의 복장과 장비를 갖추지 않아도 누구나 자유롭게 즐길 수 있도록 마련된 공간으로 다이내믹한 입체 공간에서 다양한 스포츠 콘텐츠를 만나 볼 수 있다.",안성시
30,쌍미륵사와 기솔리석불입상,경기도 안성시 삼죽면 텃골길 105,127.3433187,37.06766025,http://tong.visitkorea.or.kr/cms/resource/24/1593224_image2_1.jpg,"쌍미륵사에 들어서면 절 입구에서부터 눈에 먼저 띄는 것은 머리에 갓을 쓴 미륵불 2구이다. 부처님 정수리에 솟은 상투모양의 혹에 넓고 둥근 자연석을 다듬어 보석으로 꾸민 관으로 씌워 놓은 것이다. 기솔리 석불입상은 남자 미륵불이라 불리는 키 5.4m의 미륵과 여자 미륵불이라 불리는 5m 높이의 미륵,  이렇게 나란히 함께 서 있기 때문에  쌍미륵불이라고도 불린다. 기솔리 석불입상이 서 있는 곳은 안성 보개면과 삼죽면에 걸쳐 있는 국사봉 산 중턱이다.미륵불을 정면으로 보고 섰을 때, 왼쪽에 있는  남미륵불이 좀 더 크고 몸이 좋다. 커다랗고 갸름한 얼굴이 주는 편안함은 우리 가까이에서 쉽게  만나는 사람들 얼굴에서 느꼈던 낯익음일 것이다.  송편처럼 둥그런 눈썹이며 길쪽한 코, 두툼하게 복스럽게 생긴 입술이 그렇다. 목까지 늘어진 귓볼이 후덕함을 더해준다. 등에 거뭇거뭇하게 피어 있는 이끼들이 미륵이  세워진 시간을 말해주고 있다.얼굴 생김새에 비하면 미륵불의 손과 옷의 주름 등은 세밀하게 조각하지 않았다. 미륵불이 입고 있는 법의는 부드러운 주름을 여러번 지으면서 목 아래부터  발끝까지 만들어져 있다. 미륵불 두 분 모두 손의 위치나 모양이 자연스럽게 보이지는 않는다. 미륵불을 만든 사람이 조각을 전문적으로 하는 사람이 아니었다는 것을 짐작하게 한다. 왼편에 있는 미륵불은 목도 굵직하고, 어깨도 각이 진 모습이다. 이에 비해 오른편에 있는 미륵불은 옷 주름도 훨씬 둥글고 부드러울 뿐만 아니라, 목도 어깨 넓이에 비해 가는 편이다. 얼굴 생김새도 조금 더 또렷한 인상을 준다. 두 미륵불이 있는 자리에 서면, 기솔리의 전경이 그대로 한자락에 펼쳐진다. 고려시대에 만들어진 것으로 짐작된다.",안성시
31,아양동 석불입상,경기도 안성시 내혜홀3길 7-1,127.2634776,37.00546043,http://tong.visitkorea.or.kr/cms/resource/97/2481497_image2_1.jpg,"안성시 아양주공아파트 107동 바로 뒤에 미륵 두 기가 모셔져 있다. 본래 아양동은 아롱개마을이었으나 현재는 아양동으로 부른다. 왼쪽 불상은 상체만 보이고 오른쪽 불상은  전신에 가깝게 노출되어 있다. 보이지 않는 하체는 땅속에 묻혀 있다.왼쪽 불상은 상체의 키가 훌쩍 크고 꽃무늬가 선명한 보관을 썼으며, 어깨가  곧고 당당하다. 긴 목에 윤곽이 뚜렷한데 마치 화장을 막 끝낸 도시 미인처럼 화려하다.  하얀  자갈로 눈동자를 삼은 것도 특이하며, 반면에 오른쪽 불상은 기다란 관모를 쓴  것처럼  장식 없이 소박하고, 목이 짧아 어깨가 붙어버렸다. 옷도 법의가 아닌 관복처럼 주름이 적다. 얼굴의 윤곽도 생전 다듬어본 일 없는 시골 할아버지의 형상이다. 그래서 이 마을  사람들은 두기의 보살상을 두고 왼쪽 불상은 할머니, 오른쪽 불상을 할아버지 미륵으로 부른다. 안성 미륵에서 새로운 점은 미륵이 마을로 내려오고 민간신앙화되면서 기존의 형식이  무시되고 있다는 것이다. 법의와 관복이 혼용된 모습이고 수인의 개념이 깨지고 있다. 마을 사람들은 매년 정월 보름이 되면 아양동 미륵님께 치성을 드린다고 하는데  남자들은 풍물을 치고 여자들이 제를 주관한다고 한다. ",안성시
32,아쿠아필드 안성,경기도 안성시 공도읍 서동대로 3930-39,127.1472662,36.9946846,http://tong.visitkorea.or.kr/cms/resource/23/2717623_image2_1.jpg,"소금방, 릴렉스룸, 황토방 등 기존 찜질스파 시설에 새롭게 선보이는 고급 찜질 공간인 파동석룸과 한국 전통 찜질방식에 핀란드식 증기욕이 결합된 로울리 불가마까지 취향별로 즐기는 다양한 테마가 더해져 다채로운 찜질스파를 경험할 수 있다. 또한, 국내 워터파크 최초로 선보이는 피쉬풀에서 열대해수어를 감상하며 즐기고, 아이들의 창의적인 놀이활동에 차원을 높이는 미디어 샌드풀, 웻바운스, 버블플레이 등 일상에서 한걸음 떨어진 아쿠아필드 안성에서 모든 것이 준비된 넉넉한 휴식의 마침표를 경험할 수 있다.",안성시
33,안성 구메농사마을,경기도 안성시 죽산면 임꺽정길 51-7,127.4082307,37.02445529,http://tong.visitkorea.or.kr/cms/resource/28/604528_image2_1.jpg,"* 복을 나눠주는 구메농사마을 *칠현산 칠장사 바로 앞에는 고즈넉한 농촌 마을이 둥지를 틀고 있으니 이곳이 바로 '복조리마을'로 알려진 구메농사마을이다. '구메'란 구멍을 뜻하는 옛말이니 '구메농사'라 하면 작은 지역의 조그마한 농사를 뜻하는 말이다. 행정구역으로는 안성시 죽산면 칠장리, 부락이름으로는 신대마을로도 통한다. 일곱 명의 도적 이야기가 전해지는 칠현산 자락에 위치한 구메농사마을은 복조리마을로 더 많이 알려진 곳이다. 대부분의 마을 주민들이 복조리를 만들어 높은 소득을 올리고 있고 복조리 만드는 체험 프로그램도 운영 중이다. 정초에 복조리를 주고받음으로써 복을 기원했던 우리의 미풍양속이 이 마을에선 일상이 되고 있다. 청정마을, 생태마을을 자랑하는 구메농사마을에서는 올해 마을 이미지에 맞는 새로운 프로그램도 대거 준비했는데 전통 약차 만들기가 대표적이다. 마을에 조성된 연못에서 나온 백련을 이용해 만드는 연잎차 만들기부터 시작해서 쑥차 만들기, 뽕잎차 만들기, 댓닢차 만들기, 감잎차 만들기 등이 가능하다. 마을 곳곳에는 독립형 숙박시설이 있어서 하루 묵으며 조용히 쉬어가기도 좋다. 구메농사마을은 주체험관 앞에 펼쳐진 생태연못과 수로가 인상적이다. 이곳은 다양한 생태 체험 활동과 물고기 잡기의 주무대이기도 한다. 특히 미꾸라지 잡기는 관광객들, 그 중에서도 어린이들이 선호하는 농촌체험 프로그램이다. 단체 관광객들의 성향과 취향에 맞추어 미꾸라지 잡기 외에 다른 민물고기 잡기 체험도 가능하다.구메농사마을이란 이름보다 '복조리마을'이라는 이름이 더 친숙할 정도로 복조리 만들기는 이 마을의 대표적인 체험 프로그램이다. 마을 주민들이 복조리를 만드는 과정은 마을 산에서 신호대를 베어오는 작업부터 시작된다. 10월 무렵부터 4월까지가 대나무를 채취하기 가장 좋은 때인데 베어온 대나무는 4~5일 가량 말려서 3시간 정도 물에 축인다. 그래야 부드러워지고 부러지지 않는다. 관광객들은 그 이후 과정부터 체험 활동으로 참여하게 된다. 관광객들이 만들게 될 복조리는 주로 인기가 높은 미니어처와 주방에서 많이 쓰는 보통형 크기이다. 마을 주민들이 기본 작업을 도와주기 때문에 관광객들이 복조리를 완성시키는 데에는 1시간이면 될 정도로 그다지 어렵지는 않다. 이렇게 만든 복조리는 복을 불러오고 액을 막아준다는 의미까지 담겨 있어 훌륭한 기념품이 된다. 대나무를 이용한 체험거리로는 복조리 만들기 외에 죽봉 만들기가 있다. 죽봉 만들기는 체험내용이 더 간단한데 가지런히 정돈된 대나무를 튼튼하게 묶기만 하면 완성된다. 혼자서도 등이나 몸의 일부를 두들기며 지압과 안마의 효과를 얻을 수 있다.",안성시
