,title,addr1,mapx,mapy,firstimage,overview,addr2
0,가학동지석묘,경기도 광명시 가학동,126.8568365,37.40854264,http://tong.visitkorea.or.kr/cms/resource/67/734367_image2_1.jpg,거석숭배 신앙의 흔적을 나타내고 있는 청동기 시대의 묘제 또는 제천단으로서 벌말마을의 산 정상부에 위치하고 있다.지석묘는 총6기로 서쪽 끝에 탁자식 지석묘가 있고 동쪽으로 5기의 지석묘가 거의 동서방향으로 놓여져 있다.,광명시
1,광명 영회원(민회빈),경기도 광명시 노은사동,126.8619047,37.43970578,http://tong.visitkorea.or.kr/cms/resource/70/734370_image2_1.jpg,"이 묘소는 조선조 제16대 인조의 원자인 소현세자의 부인 민회빈 강씨(민회빈)가 잠든 농원이다. 세자빈 강씨는 우의정을 지낸 문정공 강석기의 딸로 인조5년(1627년) 에 세자빈이 되었으나 병자호란의 여파로 소현세자와 함께 청나라 심양에 볼모로 가서 많은 고생을 하고 귀국하였다. 심양에서의 볼모생활 동안 소현세자를 도와 조정을 대표하여 진취적인 태도로 조선 백성의 구제 및 양국간의 관계 조정에 노력을 기울였다.그러나 귀국 후 두달만에 소현세자가 세상을 떠나자 봉림대군이 세자가 되어 귁국하게 되었다. 이 후 평소 민희빈과 사이가 좋지 않았던 인조의 후궁 조씨 등이 민회빈이 소현세자를 독살 하였고 왕실을 저주 한다고 무고하여 인조23년(1645년)에 폐빈되고 그 다음해 사약을 받고 죽임을 당하였다. 그 뒤 숙종 44년(1718년)에 세자빈 강씨의 결백함이 밝혀져 민회빈으로 복위되고 고종7년에는 이 묘를 영회원이라 개칭하였다. 현재 능원의 봉분앞에는 혼유석, 장명등이 있고 봉분의 좌우에는 문인석, 망주석, 석양, 석마, 석호등이 남아 있다.",광명시
2,광명동굴,경기도 광명시 가학로85번길 142,126.8634438,37.4247381,http://tong.visitkorea.or.kr/cms/resource/73/2649973_image2_1.jpg,1912년 일제가 자원수탈을 목적으로 개발을 시작한 광명동굴(구.시흥광산)은 일제강점기 징용과 수탈의 현장이자 해방 후 근대화ㆍ산업화의 흔적을 고스란히 간직한 산업유산이다. 1972년 폐광된 후 40여 년간 새우젓 창고로 쓰이며 잠들어 있던 광명동굴을 2011년 광명시가 매입하여 역사ㆍ문화 관광명소로 탈바꿈시켰다. 광명동굴은 산업유산으로서의 가치와 문화적 가치가 결합된 대한민국 최고의 동굴테마파크라는 평가를 받고 있으며 연간 100만 명 이상의 관광객이 찾는 세계가 놀란 폐광의 기적을 이루었다.<출처 : 광명동굴>,광명시
3,구름산 산림욕장(구름산 도시자연공원),경기도 광명시 오리로619번길 27,126.8760613,37.45372385,http://tong.visitkorea.or.kr/cms/resource/14/2774014_image2_1.jpg,"구름산 내에 위치한 산림욕장은 높이 20m가량의 나무숲으로 울창하게 조성되어 있다. 주요시설로는 종합놀이시설, 시냇물 건너기, 평상, 벤치 등을 갖추고 있으며 경기도 내 13개 산림욕장 중 피톤치드 농도가 가장 높다. 전나무 356그루를 식재하고 184m 황톳길이 조성되어 있어, 등산로를 맨발로 체험할 수 있는 등 시민과 관광객의 휴식을 돕는 힐링 공간으로 각광받고 있다. 특히 산림욕장 구석구석을 잇는 숲속 길 대부분에 우드 칩을 깔아놓아 걷기가 편하다.",광명시
4,도덕산공원,경기도 광명시 도덕로 79,126.8577237,37.46824962,http://tong.visitkorea.or.kr/cms/resource/16/2774016_image2_1.gif,"광명시의 북쪽 중심에 있는 도덕산 자연공원은 도심과 접근이 용이하다. 도덕산 지형을 바탕으로 삼아 만든 공원으로. 오르막 내리막길이 이어지지만, 공원과 연결된 등산로를 따라 올라가다 보면 어느새 정상으로 시민들에게 편안한 휴식처를 제공한다. 공원 일대에는 인공폭포, 벽천, 광장 등 쉼터를 조성하여 사람들이 즐겨 찾고 있다. 이곳에선 시기에 따라 시민들을 위한 다채로운 행사가 진행되기도 한다.",광명시
5,밤일마을,경기 광명시 하안1동,126.8691588,37.46518073,http://tong.visitkorea.or.kr/cms/resource/97/2773997_image2_1.jpg,"밤일마을은 도덕산 남단과 구름산 사이에 위치해 있으며 쾌적하고 아늑한 주거환경으로 살기 좋은 마을이다. 예로부터 밤나무가 많아 밤일이라는 이름으로 불리게 되었다. 밤일마을의 음식문화거리는 남은 음식 재사용 안 하기 등 음식문화개선에 힘쓰고 있다. 이에 대한 자율실천 정착과 함께 올바른 식생활 개선을 유도하는 한편, 친절하고 위생적인 분위기 조성 및 식량자원 낭비방지를 위한 친환경 음식문화를 조성하고 있다. 2013년 3월 26일 광명시 최초로 경기도 음식문화개선 특화거리로 지정되었다. 부천, 안양, 시흥 등 도심과 인접하고 교통이 편리하여 많은 이용객들이 방문한다.",광명시
6,안터생태공원,경기도 광명시 안재로1번길 27,126.8698367,37.45937586,http://tong.visitkorea.or.kr/cms/resource/75/2773975_image2_1.jpg,"안터생태공원은 환경부의 생태계 보전 협력금 사업으로 금개구리의 서식처를 보호하기 위해 복원된 도심 속의 내륙 습지이다. 생태적 수질정화시스템을 통해 점 비점오염원을 처리하여 수질환경을 개선하고, 건강한 생태계로 유도한다. 안터생태공원에는 금개구리를 포함해 7종의 양서파충류가 서식하고 있고, 애기부들 등 식물66종, 버들붕어 등 어류 6종, 쇠물닭 등 조류 27종을 비롯해 각종 동식물이 풍부하게 서식하고 있다. 주변에는 자생초 화원이 조성되어 있으며, 우리 곁에 살고 있는 다양한 생물의 소중함을 직접 몸으로 느끼고 체험할 수 있는 다양한 생태교육프로그램을 운영하고 있다.",광명시
7,충현역사공원,경기도 광명시 소하동,126.8788144,37.4322514,http://tong.visitkorea.or.kr/cms/resource/25/2830825_image2_1.JPG,"'충현역사공원'은 경기도 광명시 소하 2동에 있는 근린공원이다. 광명동굴 동쪽 주차장, 소하 2동 주민센터 인근에 있다. 조선시대 정승을 지낸 오리 이원익 선생의 역사기록을 테마로 하는 주제공원으로 4,600m²(약 1,400여 평) 크기다. 이원익 선생의 정치가로서의 사상과 철학을 공원 곳곳에서 살펴볼 수 있다. 50m 떨어진 곳에 오리 이원익선생 유적지가 있고, 5분 거리에 충현박물관과 충현서원이 있다. 또한, 공원 안에 지역주민을 위한 휴식 공간과 운동 기구들도 있다. 공원 뒤편은 가학산으로 광명동굴과 가깝고, 공원과 연계된 문화유적 산책로(선비의 길)도 있어 역사 체험장으로 이용할 수도 있다.",광명시
