,title,addr1,mapx,mapy,firstimage,overview,addr2
34,안성 구포동성당,경기도 안성시 혜산로 33,127.2745459,37.0108739,http://tong.visitkorea.or.kr/cms/resource/44/2481544_image2_1.jpg,"안성 구포동 성당은 경기도 기념물 제82호로 지정된 문화재이다. 1901년, 프랑스 공베르 신부에 의해 처음 건립되었는데, 동서양의 건축양식을 동시에 갖춘 형태로 정면에서 볼 때는 뾰족한 탑과 둥근 아치형 입구 등이 중세 유럽의 전형적 건축양식을 닮아있지만, 측면에서 보면 전통 한옥 양식이 그대로 묻어난다. 공베르 신부는 미사용 포도주 제조를 위해 성당 마당에 포도를 심었는데, 이것이 바로 안성포도의 기원이다.",안성시
35,안성 미리내마을,경기도 안성시 양성면 미산1길 2,127.2586715,37.13845611,http://tong.visitkorea.or.kr/cms/resource/17/2481517_image2_1.jpg,"짚공예 체험하고 쌍령산 등산에 허브향기 목욕까지 미리내성지 입구에 위치한 마을로, 쌍령산(502m)의 깊은 골짜기에 자리잡고 있다. 신유박해와 기해박해때 천주교 신자들이 모진 종교탄압 속에서도 신앙심을 지키기 위해 이곳으로 모여들면서 교우촌이 형성됐다. 그들은 밭을 일구고 그릇을 구워 팔며 살았다. 그 때 천주교 신자들이 피운 불빛이 깊은 밤중에 보면 은하수처럼 보인다고 해서  마을이름이 미리내 마을이다.100년의 역사를 가진 성당 등 천주교의 역사를 찾아볼 수 있는  성지가 마을 안에 있고 주민의 95%가 천주교 신자이다. 체험 프로그램이 다양할 뿐더러 마을 앞에는 저수지가 있어 붕어, 잉어, 향어 등을 낚시하면서 명상하기에 좋다. 아담한 쌍령산도 등산하기에 알맞다. 허브의일종인 라벤더를 키우는 라벤더온실에 들어가면 그윽한 향에 도취된다.",안성시
36,안성 유별난마을,경기도 안성시 대덕면 장수정길 12-24,127.2335265,37.041178,http://tong.visitkorea.or.kr/cms/resource/18/2481518_image2_1.jpg,"마을뒤에 있는 해발 227.8m의 낮은 구릉성 산지로 내곡마을 주민들의 생활과 밀접한 연관이 있는 산으로 예전에 망월산에서 망월놀이를 했던전통이 있고, 연도가 밝혀지지 않은 옛 절터가 있으며, 장수바위의 전설이 내려오고 있다. 또한 석굴, 토굴을 하였던 금광과 약수터가 3군데가 있으며 마을사람들의 산책로로도 이용이 되고 있다.수령 300년 이상 된 쌍자형의 향나무가 마을 중심에 위치하고 있으며, 나무 아래로는 대동 우물이 자리하고 있다. 전해지는 이야기에 의하면 이 우물물을 마시는 사람은 득남을 하며, 무병장수 한다고 알려져 있다.",안성시
37,안성 정무공 오정방 고택,경기도 안성시 양성면 덕봉길 66,127.1858446,37.0458516,http://tong.visitkorea.or.kr/cms/resource/34/2481534_image2_1.jpg,"이 한옥 민가는 안채와 사랑채를 붙여서 한 채로 건립한 것으로 형태는 곱은 자형에 1고주 5량 집이다. 사랑채 뒤에는 2칸 사당이 있고, 본래의 사랑채는 없어졌다고 한다. 건립 연대는 약 2백 년 전까지로 올라갈 수 있으나 그동안 수차례에 걸쳐 전면적인 보수가 있었던 것으로 보이며 현재는 안채만이 비교적 원형을 유지하고 있다. 본래 이 집은 중종 5년(1510)에 처음 세운 이후 정무공 오정방(1588~1634) 천파고오상에서 충정공 오두인(1624~1689)에 이르기까지 해주 오 씨 명인들을 배출한  유서 깊은 곳으로 전해내려온다. 특히 충정공은 이 집에서 성장하여 나라에 크게 공훈을 떨친 바 있어  우암 송시열이 편액을 써서 보내오기도 했다고 한다. 당초에는 덕봉리 252번지에 세워졌던 것이나 효종 1년(1650)에 현 위치로 이전해 왔다고 하며 건물은 1935년에 중수한 것이다. 현재의 건물은  대지 740.49m²(224평)에 사당 18.57m²(5.62평), 안채 102.87m²(31.12평), 사랑 102.87m²(6.52평) 규모의 3동이 자리 잡고 있다. 전체적으로 볼 때, 치목수법, 건물의 배치 및 구성 수법이 우수하여 조선 중·후기의 주택 면모를 잘 보여주고 있다.",안성시
38,안성객사,경기도 안성시 보개면 종합운동장로 203,127.3240552,37.01417718,http://tong.visitkorea.or.kr/cms/resource/77/1954577_image2_1.jpg,"객사란 고려시대, 조선시대에 각 고을에 설치하였던 관사 또는 객관이라고 한다. 사신이 내왕할 때 묵던 숙소였는데 조선시대에 와서는 그 형태가 표준화되어 전국에 360여 개의 객사를 두었고 구조는 중앙에 정청을 중심으로 동익사와 서익사를 두었고 누각을 두는 것이 일반적이었다. 안성의 객사는 고려시대 건축인 주심포 양식의 객사(客舍) 건물을 주건물 좌우에 붙어 뻗어 나온 부속건물로 구성되어 있다. 주된 건물이 중앙에 있고 양옆으로 부속사가 있는 날개 집으로 주건물인 중앙에 3間, 양쪽에 익실이 각 2間, 측면이 3間으로 이루어진 주심포 양식의 배흘림이 약간 있는 건물로서, 수덕사 대웅전(1308년 국보)과 강릉객사문(고려 말 국보)과 같은 주심포 양식을 띄고 있다고 밝혔다. 전형적인 객사의 외형을 하고 있는 이 건물의 지붕에서 「와장승인묘안 숭정후육십팔년 을해(瓦匠僧人妙案 崇禎後 六十八年乙亥)」 라는 명문 암막새가 발견돼 1635년, 즉 17세기 초에 중수되었음이 밝혀져 이 건물의 축조 연대는 14세기로 추정된다고 한다.

* 규모 - 정면 4칸, 측면 1칸
* 연대 - 조선시대
* 재질 - 통나무 / 기와",안성시
39,안성대농리석불입상,경기도 안성시 대덕면 대농리,127.2719251,37.06627857,http://tong.visitkorea.or.kr/cms/resource/91/190891_image2_1.jpg,"안성시내에서 용인 방향으로 작은 고갯길을 넘으면 야트막한 산밑 동네 대농리로 들어선다. 대농리 마을회관을 끼고 오른쪽 농로로 진입하면 150m 지점에 작은 소나무 숲이 보인다. 그 옆에 오랜 세월 마을사람의 애환을 달래주는 미륵불 1기가 서 있다. 미륵불은 사시사철 풍화에도 잘 견뎌낸 듯 보존상태가 좋다. 사람의 손만 타지 않는다면 돌도  세월의  무게를 곱게 전할 수 있으련만. 대농리 석불입상은 한 마디로 둥그스런 외모에 후덕한 인상이 특징이다. 마치 달관한 노인처럼 푸근하고 넉넉하다. 벙거지형 모자에는 보개가 얹혀 있고, 귀가 어깨에 닿는다. 왼손으로 약병을 잡고 오른손을 아래서 받쳐든 모습이 가지런하다. 아양동미륵과 태평미륵처럼 이곳 대농리 석불입상도 아랫부분이 완전히 땅속에 묻혀 있다. 그 옆에 문인석이 미륵불의 바지춤을 잡고 있는 것처럼 함께 놓여 있는 것이 익살스럽다. ",안성시
40,안성도기동삼층석탑,경기도 안성시 도기동 184,127.2641055,37.00060267,http://tong.visitkorea.or.kr/cms/resource/93/190893_image2_1.jpg,"도기동어구 왼쪽 작은 동산에 세워져 있는 석탑이다. 기단(基壇)·탑신(塔身)·옥개(屋蓋) 등 각 부재(部材) 모두 화강암으로 조성, 중적(重積) 되었으며 석탑의 형태는 일반형을 이루고 있다. 수매의 장대석(長大石)으로 지대석을 마련하고, 현재 기단(基壇)에 해당하는 부분과  초층(初層)은 수매의 판석(板石)으로 조립되었으며 양우주(兩隅柱)가 있다.1매석으로 된 갑석(甲石)에는 부연(副椽)이 있고 그 위의 석재들은 탑신부재 또는 기단부재등으로 조립되었다. 옥개 받침이 있는 옥개석은 없으며, 현재 2층에 해당하는 옥개석만 하부에  2단의  받침을 두었을 뿐이다.  옥개는 평박(平薄)하고 추녀는 수평이며 전체적으로 둔중(鈍重)한 느낌을 준다. 현재의 위치가 원위치로 생각되나 법당지(法堂址)등은 상상하기 어렵다. 전체적인 양식으로 보아 고려시대 후기에 조성된 것으로 추정된다.* 연대 - 고려시대 * 규격 - 총높이 3.49m* 재질 - 화강암 ",안성시
41,안성맞춤가족공원,경기도 안성시 공도읍 대림동산길 36,127.2029689,37.01388338,http://tong.visitkorea.or.kr/cms/resource/74/757274_image2_1.jpg,"안성시는 경기도 서부 평야지대와 내륙 산지를 연결하는 교통의 요지이다. 또 위치 상으로 볼 때 경기도 최남단에 자리잡고 있어 동쪽은 이천시와 충청북도 음성군, 서쪽은 평택시, 남쪽은 충청북도 진천군, 북쪽은 용인시와 접하고 있다. 안성은 옛날부터 특산물이 많기로 소문난 곳이었는데 안성 쌀과 포도를 비롯하여 안성 유기 외에도 배, 한우, 인삼 등이 안성의 6대 특산물이다. 뿐만 아니라 '안성맞춤'이라는 말도 안성 유기에서 비롯된 것이다. 안성맞춤가족공원은 전원 주택 단지 조성을 목적으로 전망 좋은 1,089,000㎡(33만평)의 구릉 지대에 쾌적하게 즐길 수 있는 여러가지 문화 시설을 완비하였으며, 중앙공원에는 분수대와 어린이 놀이터, 농구장, 배구장, 족구장 등의 시설이 갖춰져 있어 가족 단위 휴양지로도 적합하다. 이 밖에 중앙 송림 속에 죽마루와 야로정 두 정자가 있고 맑고 푸른 하천이 있으며 그 옆으로는 축구장도 마련되어 있다.",안성시
42,안성죽산리삼층석탑,경기도 안성시 죽산면 죽산리,127.4309881,37.0828573,http://tong.visitkorea.or.kr/cms/resource/25/738625_image2_1.jpg,"이 석탑은 5층 석탑과 그 앞의 당간지주와 같은 위치에 있는 것으로 보아 아마도 고려 때 이 곳에 사찰이 있었으며 같은 경내에 설치되었던것으로 추정된다. 지대석의 크기는 가로 227m, 세로 22m이며, 석탑의 모형은 단층기단위에 세워진 방형의 3층 석탑으로, 중대석은 각면 1식으로 우주형(隅柱形)이 조식(彫飾)되었다. 갑석은 1판석에 2단으로 표현되어 상단에는 복연문이 조식되었고 갑석부연도 있다. 1층 옥신은 기단중석보다도 높이가 약간 낮고 높이에 비해 폭은 좁고 우주형이 얕게 모각(模刻)되었다.그리고 2층 이상의 옥신은 1층에 비해 체감률이 급격히 줄고 위층으로 갈수록 심한 체감비례를 보이고 있다. 옥신에는 자체의 폭에 비해 좁은 우주형이 있을 뿐이다. 옥개는 평평한 편으로 옥석받침은 각층 4단이고 낙수면의 경사는 완만하며 전각의 반전은 약간 심한편이다. 옥정에 옥신을 받기위한 괴임이 각출되었다. 상륜부는 전실되어 남은 것이 없다. 이상과 같이 석탑의 전체적인 구성은 둔중한 느낌을 주고 있으며, 탑신부의 체감비율 도 건실하지 못하다. 또한 조각수법으로 보아 죽산리 5층석탑보다 시대가 좀 떨어지는 고려후기로 추정된다.",안성시
43,안성천문대,경기도 안성시 미양면 천문대길 60,127.2337928,36.9556962,http://tong.visitkorea.or.kr/cms/resource/86/1589686_image2_1.jpg,"안성천문대는 국내 최초 사설천문대로, 첨단 관측시설을 갖추고 1996년에 개관되었다. 서울에서 1시간 30분 거리에 위치한 안성천문대는 우수한  관측장비를 갖추고 좋은 환경과 확 트인 시야, 교통이 편리한 지리적 이점을 이용해서 천체관측을 위한 활용 공간, 천문과 우주에 대한 청소년들의 교육공간, 일반 천문 동호회나 과학 담당 선생님들의 모임공간으로 되었다. ",안성시
44,안성향교,경기도 안성시 낙원길 22,127.2700714,37.00552999,http://tong.visitkorea.or.kr/cms/resource/74/1592074_image2_1.jpg,"1533년(중종 28)에 현유(賢儒)의 위패를 봉안, 배향하고 지방민의 교육과 교화를 위하여 창건되었다. 임진왜란 때 소실되었다가 그 뒤 중건하였으며, 1969년에 보수하였다. 현존하는 건물로는 대성전·명륜당·동재(東齋)·서재(西齋)·내삼문(內三門)·외삼문(外三門)·풍화루(風化樓) 등이 있으며, 대성전에는 5성(五聖), 10철(十哲), 송조6현(宋朝六賢), 우리 나라 18현(十八賢)의 위패가 봉안되어 있다. 조선시대에는 국가로부터 토지와 전적·노비 등을 지급받아 교관(敎官) 1명이 정원 50명의 교생(校生)을 가르쳤으나, 갑오경장 이후 신학제 실시에 따라 교육적 기능은 없어지고 봄·가을에 석전(釋奠)을 봉행(奉行)하며 초하루·보름에 분향을 하고 있다. 이 향교는 현재 경기도 문화재자료로 지정되어 있으며, 전교(典校) 1명과 장의(掌議) 수명이 운영을 담당하고 있다.",안성시
45,안성허브마을,경기도 안성시 삼죽면 국사봉로 641-14,127.3596061,37.06544691,http://tong.visitkorea.or.kr/cms/resource/16/1589716_image2_1.jpg,안성허브마을은 웰빙 문화에 발맞춰 기존 허브농장의 모습과 달리 허브에 관련되어 더욱 깊이 ?체험할 수 있는 실속형 허브마을이다. 자연스러운 먹거리와 정신적인 만족과 심신의 건강을 찾는다면 안성 허브마을을 찾아 체험을 해보는 것도 좋을 것이다.,안성시
46,양성 석조여래입상,경기도 안성시 양성면 구장리,127.2002097,37.05462307,http://tong.visitkorea.or.kr/cms/resource/22/2480422_image2_1.jpg,"양성면 구장리 마을 입구에 수백년된 느티나무 옆에는 미륵불로 신봉되고 있는 '석조여래입상'이 자리하고 있다. 이것은 고려시대에 이 마을이 형성되면서 남녀 한 쌍의 미륵불이 홍수로 떠내려 가 덕봉1리 입구에 묻혀 있으며 현재는 남자 미륵만이 이 곳에 있다고 전해 오는데 풍화도(風化度)나 미륵의 도상(圖像)으로 볼 때 근대에 새로 모신 불상으로 추측된다고 한다. 양성면 석조여래입상은 화강암 판석을 다듬어 주형광배(柱形光背)를 갖춘 여래입상으로서 고부조(高浮彫)로 조각한 것으로 큰 눈과 납작한 코와 튀어나온 일자 입술, 짧은 턱, 늘어진 귀를 갖춘 다소 갸름한 얼굴에 소발(素髮)의 육계를 보이고 있다. 목에는 삼도가 뚜렷하고 각이 진 어깨와 더불어 신체에 비해 팔과 손이 유난히 가늘고 작아 왜소한 느낌을 주고 있다. 또 수인(手印)은 오른 손으로 시무외인(施無畏印)을 짓고 왼 손으로는 여원인(黎元印)을 짓고 있는데 본래 신체보다 앞으로 나와야 할 수인 자체를 신체와 붙여서 부조로 조각하여 어색해 보인다. 불신(佛身)에 결쳐진 통견의 법의는 양팔에서 계단식 주름을 형성하고 복부에서는 U자형 의문을 형성하고 있다.",안성시
47,양성향교,경기도 안성시 양성면 교동길 33-4,127.1971541,37.06804369,http://tong.visitkorea.or.kr/cms/resource/90/1592090_image2_1.jpg,"조선 숙종 때 현유(賢儒)의 위패를 봉안, 배향하고 지방민의 교육과 교화를 위하여 창건되었다. 창건연대 및 자세한 연혁은 미상이다. 현존하는 건물로는 정면 3칸, 측면 2칸의 맞배지붕으로 된 대성전, 명륜당·내삼문·외삼문 등이 있다. 대성전에는 5성(五聖), 송조4현(宋朝四賢), 우리 나라 18현(十八賢)의 위패를 봉안하고 있다. 조선시대에는 국가로부터 토지와 전적·노비 등을 지급받아 교관이 정원 30명의 교생을 가르쳤으나, 갑오개혁 이후 신학제 실시에 따라 교육적 기능은 없어지고 봄·가을에 석전(釋奠)을 봉행하며 초하루·보름에 분향을 하고 있다. 이 향교는 경기도 문화재자료로 지정되어 있으며, 전교(典校) 1명과 장의(掌議) 수명이 운영을 담당하고 있다.",안성시
48,영창대군묘,경기도 안성시 일죽면 고은리,127.4399636,37.1355486,http://tong.visitkorea.or.kr/cms/resource/34/2943534_image2_1.jpg,"조선 선조의 14명 아들 중 유일하게 정비인 인목왕후가 낳은 아들로 선조의 특별한 총애를 받았던 영창대군의 묘이다. 유영경등 소북파의 지지로 이미 세자로 책봉된 광해군 대신에 세차에 책봉될 가능성도 있었으나 선조의 갑작스런 죽음으로 실현되지 못하였다. 광해군 즉위 후 이이첨 등 대북파에 의해 왕위에 위협을 주는 인물로 미움을 받았다.  박응서 등 7명의 서출들이 역모를 꾸몄다는 ‘7서의 옥’이 일어났는데, 이들로 하여금 영창대군 추대 음모를 거짓 진술케 하였다. 이 결과 영창대군은 서인으로 강등되어 강화도에 유배되었다가 강화부사가 방안에 가두고 장작불을 지펴 그 열기로 죽게 하였다. 1623년 광해군을 몰아낸 인조반정으로 관작이 복구되었다.조선 시대 왕실의 무덤은 능, 원, 묘로 구별되는데 묘란 일반적인 무덤을 가리키는 말로 왕의 자손이나 후궁, 왕의 아버지인 대원군 등의 무덤을 뜻한다. 영창대군 묘소는 원래 광주군 남한선성 아래에  있었는데 성남시 개발계획에 따라 1971년 8월에 현 위치로 이장되었다.",안성시
49,용화사(안성),경기도 안성시 미양면 법전길 260-31,127.2083231,36.94580799,http://tong.visitkorea.or.kr/cms/resource/19/738619_image2_1.jpg,"용화사는 서쪽에 위치한 해발 92.8m의 薇陽山을 主山으로 삼아 동남향을 하고 있다. 대한불교조계종 제2교구 본사인 용주사(龍珠寺)의 말사이다. 절의 이름에서 보이듯이 용화세계(龍華世界)를 주관하는 미륵부처님과 인연을 맺은 사찰로 이곳의 땅 속에서 솟아난 미륵불이라고 여겨지는 석조여래 입상을 모시고 있다. 나지막하고 완만한 경사를 이룬 산 사이로 좁은 들이 펼쳐지는 이곳의 지형 특성에 따라 배치된 용화사는 산사(山寺)라기보다는 한적한 시골마을의 사찰이라 할 수 있다. 절의 창건은 1902년 지소현(池素玄) 스님에 의해 이루어지는데, 그 인연에는 스님의 꿈과 연관된 일화가 있다.불학(佛學)을 공부하고 포교를 위해 고향으로 돌아온 스님은 그 첫날밤에 종산(宗山)에서 용이 하늘로 오르는 꿈을 꾸었다고 한다. 그런데 용은 하늘로 오르면서 무슨 미련이 있는지 자꾸 자신이 솟아오른 땅을 내려다보는 것이었다. 이에 스님은 꿈속에서 보았던 터전에 지금의 용화사를 창건하였다고 한다. 또 이곳에서는 미륵 두 분이 솟아났다고 한다. 용화전(龍華殿)은 정면 3칸, 측면 2칸의 39.6m²(12평)짜리 팔작 지붕으로 법당 내 오른쪽에 석조여래입상과 작은 바위가 세워져 있는데, 이 불상과 바위에 관해서는 남녀 미륵불이 땅 속에서 솟아날 때, 지나가는 행인이 여미륵 위에 소변을 누는 바람에 미륵불이 못되었다는 전설이 내려오고 있어 임신하지 못하는 많은 사람들이 기도처로 활용하고 있다.현재 용화사에 전하고 있는 석조여래입상과 그 옆에 모셔진 자연석 형태의 바위가 그것으로 이곳에서는 남미륵과 여미륵으로 칭하고 있다. 이것은 용화사라는 절 이름과 연관된 전설로 이곳이 미륵도량임을 역설하고 있다. 절의 역사가 짧고 터전도 좁아 용화사는 규모가 아주 작으며, 건물의 수도 적다. 1990년대 초반에 지어진 법당이 있었으나 2004년에 화재가 발생하여 소실되고 말았다. 현재는 옛 법당 뒤 한 단 높은 대지 위에 임시로 법당을 지어 香火를 잇고 있다. 이밖에 용화사에는 불보살을 모신 전각은 없고 요사 몇 채가 있을 뿐이다.",안성시
50,운수암,경기도 안성시 양성면 성하길 80-63,127.1697685,37.03657461,http://tong.visitkorea.or.kr/cms/resource/10/1592110_image2_1.jpg,"높이 298m인 고성산은 만세고개 창진휴게소 뒤편에서 운수암에 이르는 등 산코스가 제법 운치가 있다. 안성시 양성면 방신리 쪽에서 오르면 운수암을 먼저 만날 수 있다. 방신리 입구에서 서북쪽을 향해가면 낙엽송과 송림사이로 운수암의 정취가 눈에 잡히며, 청아한 목탁소리가 숲길에 먼저 배웅나오는 운수암은 경기도 문화재자료 25호로 지정되어  있으며, 고려시대 조성한 비로자나 불상이 있다. 운수암은 조선 영조 26년에 창건된 사찰이며, 전설에 따르면 한 보살이  평생  부처님을 모시고 살아갈 것을 결심하고 처음에는 무한성아래에 터를 닦고 있는데 하루는 꿈에  성 안에 절을 지으라는 부처님의 계시를 받고 성안으로 들어가 꿈에 나타난 곳을 찾아가 옛날 절터를 발견하고 그 자리에 절을 세웠다고 한다.  훗날 이 보살이 죽자 잡초가 무성한 이 절을 대원군이 중건하고 국태민안을  기원하면서 친필로 운수암이라고 쓴 친필현판을 내려 유명해진 절이다. 그러나 돌보는 사람이  없어 무너지기 직전인 것을 현암스님이보수하고 대웅전을 불사해 오늘에 이르고 있다.",안성시
51,이해룡고가,경기도 안성시 서운면 청룡길 109-11,127.2870281,36.911705,http://tong.visitkorea.or.kr/cms/resource/06/2482306_image2_1.jpg,"경기도의 제일 남쪽 끝인 차령산맥 줄기의 산간 마을에 자리 잡고 있는 조선 후기 주택이다. 마을은 서운산의 남쪽 계곡에 계곡물을 앞에 두고 약간 경사진 곳에 작은 규모로 이루어져 있으며 마을의 제일 뒤쪽 약간 높은 곳에 집이 놓여 있고 집 뒤로는 경사진 언덕이 시작된다. 집은 ‘ㄱ’자형의 안채와 사랑채, 행랑채로 구성되어 소위 튼 ‘ㅁ’자를 이루고 있으며 사랑채 앞으로 약간의 빈터가 있고 집 뒤 한 단 높은 대지에는 전에 후원을 꾸민 흔적이 남아 있다. 안채 마루 도리에 적힌 상량문에 가경(嘉慶) 2년 즉 정조 21(1797) 년에 집을 지었다는 기록이 남아있는데 안채나 사랑채는 처음 지어진 원래의 모습을 그대로 유지하고 있다.안채는 2칸의 대청을 중심으로 우측에 안방 2칸이 옆으로 이어지고 그 앞으로 부엌 2칸이 이어져 소위 곱은자집을 이루며 대청 좌측에는 건넌방 1칸이 있다. 건넌방 앞의 툇마루는 대청보다 한 단 높게 꾸미고 그 아래로 방에 불을 지필 수 있는 아궁이를 내었다. 사랑채는 건넌방과 이어져 있으며 정면 3칸, 측면 1칸 반의 ㅡ자형을 이룬다. 우측으로 2칸은 방이고 나머지 끝에 1칸이 마루가 되어 이 마루에서 뒤로 한 채 건넌방이 연결되며 앞에는 툇마루가 방과 마루를 이어준다. 방의 창문은 머름을 댄 띠살창으로 가공이 정교하다. 사랑채 우측으로 중문이 옆으로 이어지면서 행랑채가 되어 집의 앞쪽을 감싸도록 되어 있으나 행랑채 부분은 근래 벽돌 조로 개조되었다. 집 뒤 언덕의 후원에는 자연석이 군데군데 놓이고 약간의 평지를 이루어 자연스러운 맛을 남기고 있다. 2000년에 멸실되었으나, 2006년 11월에 복원하였다.* 李海龍 (이해룡)조선 중기 서예가. 자는 해수, 호는 북악(嶽). 본관은 경주(慶州). 1588년(선조 21) 사자관(寫字官)으로 통신사 황윤길(黃允吉)을 따라 일본으로 건너가 많은 필적(筆蹟)을 남겼다. 임진왜란 때는 역관(譯官)으로 일본과의 화의 교섭에 힘썼다. 95년 동지중추부사, 1602년 사섬시 주부(司贍寺主簿)에 이르렀고 경천군(慶川君)에 봉해졌다. 해서(楷書)에 뛰어났으며, 당시의 대가들로부터 한석봉(韓石峰)에 필적하는 명필이라는 격찬을 받았다. 금석문으로 사현(沙峴)의 양호 묘비(楊鎬墓碑)를 썼다.",안성시
