,title,addr1,mapx,mapy,firstimage,overview,addr2
0,고강선사유적공원,경기도 부천시 고리울로8번길 92,126.8184535,37.52446739,http://tong.visitkorea.or.kr/cms/resource/40/2736540_image2_1.jpg,"청동기에서 초기 철기시대(기원전 6세기~3세기)에 걸치는 마을 유적이다. 부천시 고강동에서 발굴 된 기원전 1,300여 년 전(3,300 년전)의 유적으로, 1996년부터 2005년까지 7차에 걸친 발굴조사를 통해 발견된 청동기시대의 집단취락지로, 한강유역 초기국가단계의 문화를 엿볼 수 있는 유적지다. 희귀한 제사 유적으로 보이는 적석환구가 작동 쪽 산꼭대기에서 발굴되었고, 청동기시대의 유물로는 갈아서 만든 반달돌칼, 돌칼, 돌도끼, 돌화살촉, 구멍 뚫린 토기, 점토띠토기, 제기형토기 등이 발견되었다. 공원 내 재현 모형과 체험시설이 많다. 부천문화둘레길 내 코스라 가볍게 가족과 함께 둘러 볼만한 관광지이다.",부천시
1,까치울 먹거리촌 (작동 먹거리촌),경기도 부천시 작동,126.813582,37.51482675,http://tong.visitkorea.or.kr/cms/resource/80/2480780_image2_1.jpg,"까치울은 작동산,지향산 등이 마치 병풍을 쳐놓은 듯 마을을 품에 안은 전원마을이다. 옛부터 까치가 유난히 많은 작고 아름다운 마을이라하여 까치울이라는 이름이 붙었으며, 성종의 다섯째 딸인 경숙옹주의 묘와 영조의 열번째 옹주인 화유옹주의 묘가 안장되어 있는 유서깊은 마을로 20여개의 음식점이 다양한 메뉴로 성업을 이루고 있다. 특히 오리를 이용한 보양식집이 주를 이루며, 경기도 지정 음식문화거리로 지정되며 시민들이 안심하고 믿고 즐겁게 외식할 수 있는 음식 안전지대, 마을가꾸기 특화사업(꽃밭,꽃길 조성 등).까치울 음악회 개최 등을 통해 아름다운 청정 농촌마을에서 온가족이 기쁨을 만끽할 수 있는 힐링공간 제공과, 행복한 밥상을 선보이기 위해 지속적으로 노력하고 있다.",부천시
2,나눔농장,경기도 부천시 대장로 111,126.7883474,37.54099271,http://tong.visitkorea.or.kr/cms/resource/35/2742435_image2_1.jpg,"서울 근교에 있어 접근성이 좋으며 동물들에 직접 먹이를 줄 수 있는 체험활동이 가능한 동물 친화적인 농장이다. 직접 부화하는 병아리를  관찰할 수도 있으며 강아지는 물론, 양, 염소, 칠면조, 닭, 오리 등 다양한 동물들을 직접 만날 수 있고, 먹이 주기, 젖 먹이기 등의 다양한 체험을 통해 자연학습을 경험할 수 있다.",부천시
3,남부수자원생태공원,경기도 부천시 연동로 89,126.8274069,37.47032106,http://tong.visitkorea.or.kr/cms/resource/69/2736469_image2_1.jpg,"서울 서남부 거점지역인 부천 옥길지구의 바로 옆에 있는 남부수자원생태공원은 넓은 잔디마당과 피라미드 수로, 풋살경기장, 농구장, 인라인스케이트장, 정원, 실개천과 자전거 도로 등 다양한 체육시설과 쉴 수 있는 공간으로 꾸며져있다. 역곡 배수구역과 오류3 배수분구에서 유입되는 하수를 2급수 수질로 처리하는 시설을 친환경적인 친수공간으로 조성하였다.  아이들이 물장구치며 놀 수 있는 물놀이장도 있다.",부천시
4,도당공원,경기도 부천시 소사로593번길 124,126.789962,37.51227941,http://tong.visitkorea.or.kr/cms/resource/46/759946_image2_1.jpg,"6월 초여름이면 도당산 백만송이 장미원은 장미내음이 짙어진다. 6만6천㎡에 20만여본의 장미가 빽빽히 식재되어 있으니 당연한 일일 것이다. 일단 장미원이 있는 도당공원까지 가면 중앙의 분수대를 중심으로 왼편으로‘부천향토역사관’이 눈에 들어온다. 아담한 크기의 건물이지만 안으로 들어가면 선사사대부터 현재까지 부천의 모든 역사가 각종 유물과 사진, 문서자료를 통해 고스란히 담겨 있다. 도당공원에 들어서서 분수를 중심으로 왼쪽길로 접어들면 장미가 양쪽에 심어진 좁은 소롯길을 만날 수 있다. 여기가 바로 장미원의 입구. 좁은 소롯길에 실망하며 장미원에 접어들면 실망은 곧 환호성으로 바뀐다. 도당산 북측 능선전체가 여러 가지 색깔의 장미꽃으로 가득 뒤덮혀 있는 모습은 실로 장관이다.",부천시
5,무릉도원수목원,경기도 부천시 춘의동,126.8182152,37.50335317,http://tong.visitkorea.or.kr/cms/resource/00/2782000_image2_1.jpg,"2012년 10월 개원하였으며, 총면적은 210,298㎡에 1,334종의 수목을 보유하고 있다. 수목원 입구에 있는 오리연못에는 무릉도원 수목원의 상징인 절리석의 기암절벽과 폭포가 있다. 수목원 중앙을 흐르는 계류에서는 꽃창포 등 다양한 수생식물을 관찰할 수 있으며, 좀 더 상류 쪽으로 가면 산부추, 단양쑥부쟁이, 도라지 등 600여 종의 숙근초 등이 있는 숙근초 화원을 볼 수 있다.",부천시
6,백만송이장미원,경기도 부천시 성곡로63번길 99,126.7932088,37.51710113,http://tong.visitkorea.or.kr/cms/resource/02/2736602_image2_1.jpg,"단일 장미공원으로는 국내 최대 규모로 면적 14,270㎡에 161종의 다양한 품종의 장미들이 아름다운 자태로 뽐내고 있는 곳이다. 보통 장미 개화 기간은 5월 말부터 6월 초까지다. 장미원은 상시 무료 개방으로 도당 근린공원 내에 위치하고 있다. 7호선 까치울역에 내려 마을버스 013-3 번을 타면 장미공원에 갈 수 있다. 공원 입구에 들어서면 도당근린공원의 안내도가 있고, 근린공원 내에 백만송이장미원이 자리해 있다.",부천시
7,볼베어파크,경기도 부천시 조마루로 2,126.7442498,37.50002169,http://tong.visitkorea.or.kr/cms/resource/59/2767659_image2_1.jpeg,"볼 베어 파크는 경기도 부천시에 있는 국내 최대의 테마파크이다. 어린이들이 좋아하며 가족들과 함께 즐기기에 좋은 다양한 체험 프로그램과 놀이 기구가 있다. 스포츠존, 챌린저존, 디지털존, 영유아존으로 구성되어 있으며 주말 및 공휴일에만 운영되는 볼 베어 파크 톨앤핏이 있다. 스포츠존은 스포츠 테마파크로 온 가족이 함께 즐길 수 있는 스포츠 활동으로 구성되어 있으며, 챌린저존, 디지털존은 대형 볼풀장, 카레이싱뿐만 아니라 디지털 AR, VR 등을 즐길 수 있다. 수도권에서 멀지 않으며 경기도 부천뿐만 아니라 서울에도 있어 나들이 장소로 좋다.",부천시
8,부천 동물테마파크 하이주,경기도 부천시 원미구 길주로 105,126.7537932,37.506435,http://tong.visitkorea.or.kr/cms/resource/06/2002706_image2_1.jpeg,"우리나라에 이색적인 동물원이 있다. 아직은 낯선 행동 자율형 동물원 하이주는 아이들의 정서지능 향상과 동물과 인간의 공존을 위해 진짜 교감을 느낄 수 있도록  푸른마음 정서지능연구소와 함께 신발을 벗고 맨발로 걷는 동물원을 만들어 냈다. 선진국의 Micro Zoo를 기반으로 대형 동물원과는 달리 부천 상동역 7~8번출구 앞 세이브존 백화점 실내에 350여평 규모로 운영되는 실내 동물원으로,  동선을 따라 전시된 동물을 관람하는 것이 아니라 동물들 앞에 아이들이 마주 앉거나 눕고, 뒹굴며 다양한 행동 속에서 동물을 접할 수 있도록 설계하여 반려동물을 키우는 가정의 아이들이 하고 있는 다양한 행동을 똑 같이 체험되도록 시도 한 것이다. 익히 알고 있듯 아이들의 정서지능 발달에 좋다는 동물과의 교감은 기존 대형 동물원의 전시와 체험형 동물원의 반짝 체험으로 이루어지는 것이 아니라 아이들이 반려동물과 함께 자라며 이루어지는 부모들의 조언과 다양한 행위 속에서 시작되게 된다. 하이주는 이러한 행동자율형 동물원이라는 개념을 탄생시키며 아이들은 물론 부모들까지 기존 동물원의 관람방식을 진짜 교감을 시도 할 수 있는 관람 문화로 이끌어가고 있는 동물원이다. 선진국의 Micro Zoo의 개념대로 도시 밀착형을 위해 커피숍 카페 형태로 개발된 하이주 김해점과 함께 다양한 모델을 확장시키고 있다.",부천시
9,부천 원미공원,경기도 부천시 원미구 소사로 456,126.7978866,37.49754515,http://tong.visitkorea.or.kr/cms/resource/38/2705838_image2_1.jpg," 원미공원은 주변에 중앙도서관이 있으며 축구장, 테니스장, 농구장, 현충탑 등이 있다. 등산코스도 가꿔져 있고 삼림욕장도 있어 가벼운 마음으로 산에 오르기가 좋고 곳곳의 약수터도 인기를 끈다. 이처럼 부천 원미공원은 시민들의 휴식처와 어린이들의 교육장으로 인기가 높다. 원미산 아래 왕복 6차선 멀뫼길 옆에 자리잡은 이 공원은 휴식과 스포츠를 동시에 즐길 수 있는 곳으로 23,800여평의 부지에 조성돼 있다. 원미공원 내 현충탑에서 곧바로 올라가면 원미산 등산로와 연결된다. 정상까지의 거리는 4km로 부담없는 산책 코스라 하겠다.어린이 교통공원도 화제거리이다. 이 어린이 교통공원은 평일에는 부천과 인근 유치원생들이 찾아와 교통질서 의식과 법규를 배우고 개별적으로 찾아도 10명 이상이면 교통질서 비디오를 상영해 준다.",부천시
10,부천 중앙공원,경기도 부천시 소향로 162,126.7636925,37.50059141,http://tong.visitkorea.or.kr/cms/resource/39/760139_image2_1.jpg,"부천시 원미구 중동에 위치하고 있는 중앙공원은 근린 1호 공원으로서 시청, 부명중학교 등과 가까우며 중앙에 큰 연못과 분수가 있어 주변 경관이 좋고 변영로시비,  황명(복동)시비가 있는 시비공원이다. 또한, 야외음악당, 부천시상징탑, 게이트볼장 등이 있어 스포츠와 여가를 즐길 수 있다. 오래된 나무들이 많아서 수목공원이라는 인상이 강하게 든다. 정중앙에는 특이한 모양의 부천시 상징탑이 서 있고 그 주변은 광장 역할을 하는 공간이 펼쳐져 있으며 그 광장 한 켠에 둥근 연녹색 지붕을 얹은 야외음악당이 자리한다.각종 행사나  공연이 이 무대를 통해 연중 펼쳐진다.중앙공원 서편에는 복숭아기념동산이 있다. 부천과 자매결연 도시이며, 동시에 일본에서 복숭아 명산지로 알려진 오카야마시에서 기증한 복숭아들이 심어져 있다. 중앙공원 서편의 주제가 나무와 풀이라면 동편의 주제는 물이다. 여기저기 기묘한 물길들도 그렇고 징검다리가 놓인 시골의 개울, 대형분수, 인공연못 가운데 홀로 떠 있는 인공섬 등이 물의 세계로 안내한다.",부천시
11,부천식물원,경기도 부천시 길주로 660,126.8165653,37.5048113,http://tong.visitkorea.or.kr/cms/resource/90/2537290_image2_1.jpg,"부천시 원미구 춘의동에 총면적 27.127㎡ 지하 2층, 지상 2층 규모의 온갖 희귀한 식물들을 볼 수 있는 식물들의 낙원이다. 식물원은 부천시의 상징인 복사꽃 모양을 형상화하여 유리온실로 건축하였으며 재미있는 식물관, 수생 식물관, 아열대 식물관, 다육 식물관, 자생 식물관 등 5개의 테마식물관과 중앙정원에 총310종 9,975본이 식재되어 있다. 주위의 숲과 어우러져 시민들에게 살아 숨쉬는 자연학습의 장 및 인근 자연생태박물관, 어린이동물원과 함께 다양한 문화 휴식공간을 제공하고 있다.",부천시
12,석왕사(경기),경기도 부천시 소사로 367,126.7932206,37.49112081,http://tong.visitkorea.or.kr/cms/resource/17/2687617_image2_1.jpg,"석왕사는 경기도 부천시 원미구 보운산에 자리한 대한불교 조계종 직할사찰이다. “바른 불교, 실천불교”를 표방하며 짧은 역사에 비해 도심 속의 포교 사찰로 다양한 활동을 펼치고 있다. 1976년 전 총무원장 고산 스님이 천막법회를 시작으로 창건한 석왕사는 20여 년 만에 등록 신도가 1만 5,000세대에 이르는 수도권의 대표적인 도심 포교당으로 성장했다. 그러나 석왕사가 주목받는 것은 단지 이런 규모만이 아니라 어린이집, 유치원, 경로잔치, 문화행사, 출판 등 지역 사회와 밀접한 관련을 맺으려는 다양한 시도를 해 왔기 때문이다. ‘석왕사보’를 발행, 사실상 현대불교 최초의 문서 포교를 전개했고, 유치원과 어린이집을 중심으로 한 어린이 포교, 생활협동조합 설립 운영, 부천시민신문 발행, 부천외국인 노동자의 집 설립 운영 등의 활동을 통해 불교의 지역사회 운동 및 사회민주화 운동에 신기원을 이룩했다.특히 1980년대 석왕사는 민주화 및 노동운동가의 단골 집회소로, 부천의 민주화 성지로 알려지기도 했다. 석왕사는 일주문과 법당, 팔각구층탑, 범종각 등이 사찰이라는 것을 말해줄 뿐 여느 사찰과는 분위기부터 다르다. 생활협동조합, 아름다운가게, 무료진료소, 룸비니 수영장, 어린이집, 유치원, 왕생극락전(장례식장), 안락정토(납골당) 등이 있고, 생협과 아름다운가게에 물품을 실은 트럭이 오가는가 하면 저 아래쪽 어린이집에서는 한 무리의 아이들이 재잘댄다. 또한 장례식장과 명부전에는 검은 상복 차림의 유족들이 침통한 표정으로 서성거리기도 한다.",부천시
13,성주산체육공원,경기도 부천시 호현로387번길 41,126.7899241,37.47391998,http://tong.visitkorea.or.kr/cms/resource/97/2736497_image2_1.jpg,"부천에서 가장 높은 성주산(217m) 자락에 지역주민의 여가 및 체육공간으로 사용되는 성주산체육공원이 있다.소사역(1호선,7호선)과 소새울역(서해선) 등 대중교통접근이 용이하며 5만 4396㎡의 규모로 재개장을 했다. 자연과 함께 하는 공원에는 배드민턴전용구장, 족구장, 게이트볼장, 테니스장, 축구장, 농구장 등 다양한 체육시설이 있어 주민들에게 건강한 여가활동의 기회를 제공하고 있다. 또한 주민들에게 쉼을 주는 힐링공간이다.		
자전거 보관소도 있어서 자전거를 이용권장.  재개장 하면서 주차장이 넓어지고 신설 주차장의 지형단차를 해소하고자 콘크리트가 아닌 산벽석을 쌓았다고 한다. 산새공원에는 총 세 군데의 주차장이 있어 좀 더 넓고 쾌적하게 이용가능.",부천시
14,수주근린공원,경기도 부천시 고강동,126.8125233,37.53008052,http://tong.visitkorea.or.kr/cms/resource/23/2869023_image2_1.jpg,"부천시 고강동에 있는 공원으로 총 9,837㎡의 규모를 갖췄다. 산책로 주변으로 쉴 수 있는 시설과 화장실 등 편의 시설이 잘되어있다. 여름엔 물놀이터로도 이용되는 놀이터와 운동시설 등도 갖추어져 있다. 주요 시설로는 녹지 공간, 산책로, 농구장, 배드민턴장, 편의시설 등이 있다. 또 무장애 산책로, 경계석 모서리 가공 처리 강화, 보안등 확충을 통한 범죄 예방 등 사회적 약자를 위해 세심한 노력을 기울였다.
 다양한 운동기구들이 있어 산책과 운동이 가능하다. 태양광 스마트 벤치와 조명시설이 설치되어 있어 편리하다. 이는 항공기소음 피해 지역 주민의 편의 제공을 위해 한국공항공사에서 사업비를 지원받아 2020년에 건립한 시설이다. 벤치에 무선 충전이 가능하게 되어 있다. 금연 공원이며, 반려동물을 동반할 수 있다. 반려동물 동반 시 배변 봉투를 지참하고 배설물을 수거해야 하며, 목줄 착용해야 한다. 어른과 아이들이 함께 어울릴 수 있는 복합공간으로 사람들이 많이 찾는다.
 ※반려동물 동반 가능 (단, 개목줄 착용, 배설물 처리를 위한 비닐봉지 등을 구비한 이용객에 한하여 허용)",부천시
15,슈퍼팜,경기도 부천시 오정로 312,126.7916612,37.53305758,http://tong.visitkorea.or.kr/cms/resource/80/2783080_image2_1.jpg,"슈퍼 팜은 5000여㎡(1500여 평) 규모에 최신식 재배 시설을 갖춘 체험농장이다.
밭에서 기르는 전통 방식이 아니라 수경재배를 통해 딸기를 키운다.
레일처럼 생긴 긴 베드(이랑에 해당하는 시설)에 상토를 채워서 모종을 심고 양액(비료를 물에 녹인 것) 공급 장치로 17가지 영양소를 공급하며 재배한다. 12월 초부터 5월 말까지 운영되고 있으며 개장 기간 중에는 휴무 없이 운영한다. 자녀와 딸기 수확 체험과 아이스크림 만들기, 케이크 만들기 체험을 즐길 수 있다.",부천시
16,오정대공원,경기도 부천시 상오정로 183,126.7961692,37.52994969,http://tong.visitkorea.or.kr/cms/resource/20/2736620_image2_1.jpg,"""오정구청사 뒤 49,400㎡에 정규규격의 인조잔디 축구장과 주변에 산책로와 연결된 실개천, 분수대, 야외무대 등이 조성되었다. 자전거문화센터와 오정레포츠센터가 조성되어 있는 부천오정지역을 대표하는 공원이다. 자전거 문화센터는 자전거에 관심이 있는 일반 시민들의 자전거에 대한 이해와 관심을 바탕으로 구상되어 2009년 4월 19일에 개관하였다. 자전거를 대여할 수도 있고 오정공원에는 자전거 연습코스와 자전거 둘레길도 있다.
자전거 대여시 반드시 운동화를 신어야 하고. 샌들, 슬리퍼, 구두는 안전 문제로 금하고 있다.",부천시
17,웅진플레이도시,경기도 부천시 조마루로 2,126.7442498,37.50002169,http://tong.visitkorea.or.kr/cms/resource/88/2431888_image2_1.jpg,"서울 도심에서 30분 거리에 위치한 웅진플레이도시는 도심형 종합 레저스포츠 테마파크이다. 워터파크, 스파로 구성된 워터도시, 사계절 내내 눈을 즐길 수 있는 실내 스키?썰매 시설 스노우도시, 총 200타석과 최장거리 360야드를 자랑하는 프리미엄 급 골프 연습장인 골프도시, 명랑운동회 등 각종 프로그램을 제공하는 신개념 체육 연수센터 신기도시 등으로 구성되어 있다.
가족 구성원 모두가 즐길 수 있는 다양한 시설과 더불어 밝고 상냥한 캐스트들이 제공하는 놀라운 서비스’를 체험할 수 있는 가족형 테마파크이다. 워터파크, 스파 시설로 구성되어 있는 워터도시는 총 7가지의 워터슬라이드는 물론 파도풀, 바데풀, 이색 스파탕과 어린이들을 위한 키즈존까지 다양하게 갖추어져 있다.스포츠와 레저를 즐길 수 있으며 매 시즌별 특별 테마를 바탕으로 다양한 이벤트와 고객우대 프로그램을 진행하고 있다.",부천시
18,천화사,경기도 부천시 계남로301번길 5,126.7816102,37.50413021,http://tong.visitkorea.or.kr/cms/resource/61/2767661_image2_1.jpeg,"천화사는 경기도 부천시 계남로에 있는 대한불교 천태종 소속 사찰이다. 1981년 창립되었으며 1993년 승려 마갈에 의해 설립되었다. 매해 부천시에서 열리고 있는 '부처님 오신 날' 행사에도 참여하고 있으며 지장회, 합창단 등 다양한 활동을 하고 있다. 천화사는 사회활동에도 관심이 많아 김장김치를 담가 독거노인, 소년소녀가장, 장애인 등 소외계층의 이웃들에게 전달하는 활동을 하기도 한다. 천화사는 부천 시내의 5층 건물에 있으며, 맨 위층에 법당인 관음전이 있다.",부천시
